Sheet: Результаты поиска
A1: Reversed left context | B1: Reversed center | C1: Left context | D1: Num | E1: AdjCase | F1: word 2 | G1: Right context | H1: word 3 | I1: Title | J1: Author | K1: Birthday | L1: Header | M1: Created | N1: Sphere | O1: Type | P1: Topic | Q1: Publication | R1: Publ_year | S1: Medium | T1: Ambiguity | U1: Full context | V1: 1 | W1: =RAND() -> 1.8578433247634085E-2
A2: олыб ежад янем У | B2: евд | C2: У меня даже было | D2: две | E2: gen | G2: медицинских карточки: обычная в районной | H2: f | I2: Александр Городницкий. Я был как два разных человека – крамольный поэт и благонравный советский инженер (2015) | J2: Александр Городницкий | K2: 1933 | L2: Я был как два разных человека – крамольный поэт и благонравный советский инженер | M2: 2015 | N2: публицистика, нехудожественная | O2: интервью | P2: частная жизнь, искусство и культура | S2: книга | T2: омонимия не снята | U2: У меня даже было две медицинских карточки: обычная в районной поликлинике ― такая, что хоть в гроб клади, а вторая ― хоть в космос посылай! [Александр Городницкий. Я был как два разных человека – крамольный поэт и благонравный советский инженер (2015)] [омонимия не снята] | V2: 1 | W2: =RAND() -> 0.92118511164482964
A3: илыб иинежяропсар хи В | B3: евд | C3: В их распоряжении были | D3: две | E3: gen | G3: ванных комнаты, облицованные розовым и | H3: f | I3: Вацлав Михальский. Река времен. Ave Maria // Октябрь, 2010 | J3: Вацлав Михальский | K3: 1938 | L3: Река времен. Ave Maria | M3: 2010 | N3: художественная | O3: роман | Q3: Октябрь | R3: 2010 | S3: журнал | T3: омонимия не снята | U3: В их распоряжении были две ванных комнаты, облицованные розовым и голубоватым мрамором соответственно. [Вацлав Михальский. Река времен. Ave Maria // Октябрь, 2010] [омонимия не снята] | V3: 1 | W3: =RAND() -> 6.381186426926122E-2
B4: евД | D4: Две | E4: gen | G4: косых черточки означают 0, 125 | H4: f | I4: В. Поляков. Заочная школа радиоэлектроники. Усилитель для Нового года // Юный техник, 2010 | J4: В. Поляков | L4: Заочная школа радиоэлектроники. Усилитель для Нового года | M4: 2010 | N4: публицистика, нехудожественная | O4: инструкция | P4: техника | Q4: Юный техник | R4: 2010 | S4: журнал | T4: омонимия не снята | U4: Две косых черточки означают 0, 125 Вт, одна косая ― 0, 25 Вт, продольная ― 0, 5 Вт, поперечная ― 1 Вт. [В. Поляков. Заочная школа радиоэлектроники. Усилитель для Нового года // Юный техник, 2010] [омонимия не снята] | V4: 1 | W4: =RAND() -> 0.6087188919542823
A5: ястееми икуан вокиротси идерС | B5: евд | C5: Среди историков науки имеется | D5: две | E5: gen | G5: крупных партии. | H5: f | I5: Георгий Любарский. Теоретики и ремесленники // «Эксперт», 2013 | J5: Георгий Любарский | L5: Теоретики и ремесленники | M5: 2013 | N5: публицистика, нехудожественная | O5: рецензия | P5: наука и технологии, история | Q5: «Эксперт» | R5: 2013 | S5: журнал | T5: омонимия не снята | U5: Среди историков науки имеется две крупных партии. [Георгий Любарский. Теоретики и ремесленники // «Эксперт», 2013] [омонимия не снята] | V5: 1 | W5: =RAND() -> 0.78258590026351993
A6: кат еоннедиву линсяъбо йыроток афисоИ | B6: ьмес | C6: Иосифа, который объяснил увиденное так: | D6: семь | E6: gen | G6: тучных коров означают семь плодородных | H6: f | I6: Андрей Ворскла. Съедение человека не считалось большим преступлением... // «Криминальный отдел», 2012 | J6: Андрей Ворскла | L6: Съедение человека не считалось большим преступлением... | M6: 2012 | N6: публицистика, нехудожественная | O6: статья | P6: история, криминал | Q6: «Криминальный отдел» | R6: 2012 | S6: журнал | T6: омонимия не снята | U6: Сделать это не удалось никому, кроме еврея Иосифа, который объяснил увиденное так: семь тучных коров означают семь плодородных для страны лет, а семь тощих коров ― семь лет засухи и голода. [Андрей Ворскла. Съедение человека не считалось большим преступлением... // «Криминальный отдел», 2012] [омонимия не снята] | V6: 1 | W6: =RAND() -> 0.19934192278635798
A7: и ясхищяортс ирт тядохереп адовазногавларУ | B7: ирт | C7: Уралвагонзавода переходят три строящихся и | D7: три | E7: gen | G7: действующих шахты, обогатительная фабрика, рудоремонтный | H7: f | I7: Андрей Горбунов. Уралвагонзавод добудет уголь // «Эксперт», 2013 | J7: Андрей Горбунов | L7: Уралвагонзавод добудет уголь | M7: 2013 | N7: публицистика, нехудожественная | O7: заметка | P7: производство, машиностроение, бизнес, коммерция, экономика, финансы | Q7: «Эксперт» | R7: 2013 | S7: журнал | T7: омонимия не снята | U7: Под контроль «дочки» Уралвагонзавода переходят три строящихся и три действующих шахты, обогатительная фабрика, рудоремонтный завод в Кемеровской области, угольный терминал Baltic Coal Terminal в латышском Вентспилсе, трейдер CCZ Trade S.A. Также Уралвагонзавод приобретает в той же Кемеровской области Юргинский машиностроительный завод, специализирующийся на производстве горно-шахтного, металлургического и подъемно-транспортного оборудования. [Андрей Горбунов. Уралвагонзавод добудет уголь // «Эксперт», 2013] [омонимия не снята] | V7: 1 | W7: =RAND() -> 0.11726420564814011
A8: ьтинидеъбо юьлец ясладаз оньлетанзос мывреп | B8: ирт | C8: первым сознательно задался целью объединить | D8: три | E8: gen | G8: важнейших области физических явлений ― гравитационные | H8: f | I8: Владимир Смолицкий. Вознагражденное упрямство // «Знание-сила», 2013 | J8: Владимир Смолицкий | L8: Вознагражденное упрямство | M8: 2013 | N8: публицистика, нехудожественная | O8: статья | P8: наука и технологии, физика, астрономия | Q8: «Знание-сила» | R8: 2013 | S8: журнал | T8: омонимия не снята | U8: Причина такого глубокого воздействия состоит, прежде всего, в том, что в своих работах Бекенштейн едва ли не первым сознательно задался целью объединить три важнейших области физических явлений ― гравитационные, тепловые и квантовые ― и с тех пор эта попытка создания «единой теории всего» составляет главную цель всей современной теоретической физики. [Владимир Смолицкий. Вознагражденное упрямство // «Знание-сила», 2013] [омонимия не снята] | V8: 1 | W8: =RAND() -> 6.0019128838278202E-2
A9: илетелдоп ущилиж оге к йетсонжомзов | B9: ирт | C9: возможностей), к его жилищу подлетели « | D9: три | E9: gen | G9: неидентифицированных камеры» (ха-ха-ха). | H9: f | I9: Виктор Пелевин. S.N.U.F.F (2011) | J9: Виктор Пелевин | K9: 1962 | L9: S.N.U.F.F | M9: 2011 | N9: художественная | O9: роман | Q9: В. Пелевин. S.N.U.F.F | R9: 2012 | S9: книга | T9: омонимия не снята | U9: Дело было так ― поздно вечером, когда Дюрекс сидел на балконе своего открытого дуплекса в нижней части офшара (высшая степень доступной глобальному урку роскоши независимо от его финансовых возможностей), к его жилищу подлетели «три неидентифицированных камеры» (ха-ха-ха). [Виктор Пелевин. S.N.U.F.F (2011)] [омонимия не снята] | V9: 1 | W9: =RAND() -> 0.50646519994842698
A10: и хытолоз ирТ | B10: ирт | C10: Три золотых и | D10: три | E10: gen | G10: серебряных медали на Паралимпийских играх | H10: f | I10: Вера Михайлова, Мария Цырулева. Лучший спортсмен 2014 года // «Русский репортер», 2014 | J10: Вера Михайлова, Мария Цырулева | L10: Лучший спортсмен 2014 года | M10: 2014 | N10: публицистика, нехудожественная | O10: заметка | P10: спорт | Q10: «Русский репортер» | R10: 2014 | S10: журнал | T10: омонимия не снята | U10: Три золотых и три серебряных медали на Паралимпийских играх. [Вера Михайлова, Мария Цырулева. Лучший спортсмен 2014 года // «Русский репортер», 2014] [омонимия не снята] | V10: 1 | W10: =RAND() -> 0.32772926471980368
A11: олыб ачивоноеЛ алиахиМ у отсем | B11: ирт | C11: место, у Михаила Леоновича было | D11: три | E11: gen | G11: основных области занятий: теория стиха | H11: f | I11: Вадим Баевский и др. Штрихи к портрету // «Знамя», 2012 | J11: Вадим Баевский, Вадим Баевский, Вадим Баевский, Вадим Баевский, Вадим Баевский, Вадим Баевский | K11: 1929, 1929, 1929, 1929, 1929, 1929 | L11: Штрихи к портрету, Штрихи к портрету, Штрихи к портрету, Штрихи к портрету, Штрихи к портрету, Штрихи к портрету | M11: 2012, 2012, 2012, 2012, 2012, 2012 | N11: публицистика , нехудожественная, публицистика , нехудожественная, публицистика , нехудожественная, публицистика , нехудожественная, публицистика , нехудожественная, публицистика , нехудожественная | O11: мемуары, мемуары, мемуары, мемуары, мемуары, мемуары | P11: частная жизнь, частная жизнь, частная жизнь, частная жизнь, частная жизнь, частная жизнь | Q11: «Знамя», «Знамя», «Знамя», «Знамя», «Знамя», «Знамя» | R11: 2012, 2012, 2012, 2012, 2012, 2012 | S11: журнал, журнал, журнал, журнал, журнал, журнал | T11: омонимия не снята | U11: . Кроме разных побочных интересов, занимавших в его деятельности явно второстепенное место, у Михаила Леоновича было три основных области занятий: теория стиха, классическая филология, перевод. [Вадим Баевский и др. Штрихи к портрету // «Знамя», 2012] [омонимия не снята] | V11: 1 | W11: =RAND() -> 0.3126606859950507
A12: отэ авокобаН ялД | B12: ирт | C12: Для Набокова это | D12: три | E12: gen | G12: неприемлемых философии, потому что они | H12: f | I12: Анастасия Козакевич, Борис Аверин. Бабочки и смерть Владимира Набокова // «Эксперт Северо-Запад», 2015 | J12: Анастасия Козакевич, Борис Аверин | K12: 1942 | L12: Бабочки и смерть Владимира Набокова | M12: 2015 | N12: публицистика, нехудожественная | O12: интервью | P12: искусство и культура, филология | Q12: «Эксперт Северо-Запад» | R12: 2015 | S12: журнал | T12: омонимия не снята | U12: Для Набокова это три неприемлемых философии, потому что они материалистичны. [Анастасия Козакевич, Борис Аверин. Бабочки и смерть Владимира Набокова // «Эксперт Северо-Запад», 2015] [омонимия не снята] | V12: 1 | W12: =RAND() -> 0.73680595819983685
A13: теувтсещус ьнед йиншяндогес аН | B13: ирт | C13: На сегодняшний день существует | D13: три | E13: gen | G13: основных техники нанесения рисунка на | H13: f | I13: Антон Булохов. Вензеля на капоте // «Зеркало мира», 2012 | J13: Антон Булохов | L13: Вензеля на капоте | M13: 2012 | N13: публицистика, нехудожественная | O13: статья | P13: техника, искусство и культура | Q13: «Зеркало мира» | R13: 2012 | S13: журнал | T13: омонимия не снята | U13: На сегодняшний день существует три основных техники нанесения рисунка на поверхность автомобиля: традиционная, цифровая, а также плёночная, или виниловая. [Антон Булохов. Вензеля на капоте // «Зеркало мира», 2012] [омонимия не снята] | V13: 1 | W13: =RAND() -> 0.83849441809468916
A14: огоксдаваЗ В иифаргопит в евеиК | B14: ирт | C14: Киеве в типографии В. Завадского | D14: три | E14: gen | G14: небольших книжки «Анна», «Маринка», «Няня | H14: f | I14: Виктор Елисеев. Профессор Граве // «Знание-сила», 2013 | J14: Виктор Елисеев | L14: Профессор Граве | M14: 2013 | N14: публицистика, нехудожественная | O14: статья | P14: история | Q14: «Знание-сила» | R14: 2013 | S14: журнал | T14: омонимия не снята | U14: Еще до замужества она издала в Киеве в типографии В. Завадского три небольших книжки «Анна», «Маринка», «Няня» ― это были рассказы для детей. [Виктор Елисеев. Профессор Граве // «Знание-сила», 2013] [омонимия не снята] | V14: 1 | W14: =RAND() -> 0.22244229107362756
A15: атарБ ирТ тяотс йоксничавА зи | B15: ирт | C15: из Авачинской стоят Три Брата ― | D15: три | E15: gen | G15: каменных глыбы, торчащих над водой | H15: f | I15: Александр Инвентаж. В краю вулканов и гейзеров // «Зеркало мира», 2012 | J15: Александр Инвентаж | L15: В краю вулканов и гейзеров | M15: 2012 | N15: публицистика, нехудожественная | O15: статья | P15: путешествия, природа | Q15: «Зеркало мира» | R15: 2012 | S15: журнал | T15: омонимия не снята | U15: На выходе из Авачинской стоят Три Брата ― три каменных глыбы, торчащих над водой на 20 м. [Александр Инвентаж. В краю вулканов и гейзеров // «Зеркало мира», 2012] [омонимия не снята] | V15: 1 | W15: =RAND() -> 0.73858585289760281
A16: ан вонабараб хиксечирднилиц хиовс имяинавонсо | B16: ерытеч | C16: основаниями своих цилиндрических барабанов на | D16: четыре | E16: gen | G16: восточных колонны. | H16: f | I16: Андрей Флиер. В круге главном // «Наука и религия», 2011 | J16: Андрей Флиер | L16: В круге главном | M16: 2011 | N16: публицистика, нехудожественная | O16: статья | P16: история, строительство и архитектура | Q16: «Наука и религия» | R16: 2011 | S16: журнал | T16: омонимия не снята | U16: В восточных приалтарных частях новых базилик стали сооружать небольшие купола, опирающиеся основаниями своих цилиндрических барабанов на четыре восточных колонны. [Андрей Флиер. В круге главном // «Наука и религия», 2011] [омонимия не снята] | V16: 1 | W16: =RAND() -> 0.29188896618739324
A17: ежкат а незуагсниллеБ и яаксверазаловоН | B17: ьтяп | C17: Новолазаревская и Беллинсгаузен, а также | D17: пять | E17: gen | G17: сезонных полевых баз. | H17: f | I17: Алексей Торгашев. Машина времени, недорого // «Русский репортер», № 45 (173), 18 ноября 2010, 2010 | J17: Алексей Торгашев | L17: Машина времени, недорого | M17: 2010 | N17: публицистика , нехудожественная | O17: статья | P17: природа, бизнес, коммерция, экономика, финансы | Q17: «Русский репортер», № 45 (173), 18 ноября 2010 | R17: 2010 | S17: журнал | T17: омонимия не снята | U17: Сегодня у нас действуют пять круглогодичных антарктических станций: Мирный, Восток, Прогресс, Новолазаревская и Беллинсгаузен, а также пять сезонных полевых баз. [Алексей Торгашев. Машина времени, недорого // «Русский репортер», № 45 (173), 18 ноября 2010, 2010] [омонимия не снята] | V17: 1 | W17: =RAND() -> 0.26185771151446857
A18: автсдерс еынневтсбос ан лидяранс ежад | B18: авд | C18: даже снарядил на собственные средства | D18: два | E18: gen | F18: =MID(RC[1],FIND(" ",RC[1],1),20) -> поезда. | G18: санитарных поезда. | H18: m | I18: Екатерина Зайцева. Владимир Московское Солнышко // «Родина», 2010 | J18: Екатерина Зайцева | L18: Владимир Московское Солнышко | M18: 2010 | N18: публицистика , нехудожественная | O18: заметка | P18: искусство и культура, история, политика и общественная жизнь | Q18: «Родина» | R18: 2010 | S18: журнал | T18: омонимия не снята | U18: В то время он занялся устройством госпиталей и даже снарядил на собственные средства два санитарных поезда. [Екатерина Зайцева. Владимир Московское Солнышко // «Родина», 2010] [омонимия не снята] | V18: 1 | W18: =RAND() -> 0.91431183689724349
A19: узарС | B19: авд | C19: Сразу | D19: два | E19: gen | G19: лирических образа сплетаются между собой | H19: m | I19: Евгения Пищикова. Рыцари и скульпторы // «Русская жизнь», 2012 | J19: Евгения Пищикова | L19: Рыцари и скульпторы | M19: 2012 | N19: публицистика , нехудожественная | O19: заметка | P19: политика и общественная жизнь, искусство и культура | Q19: «Русская жизнь» | R19: 2012 | S19: журнал | T19: омонимия не снята | U19: Сразу два лирических образа сплетаются между собой: мясник ― рыцарь, и он же ― скульптор, отсекающий все лишнее, ― впрочем, скорее отсекающий все нужное. [Евгения Пищикова. Рыцари и скульпторы // «Русская жизнь», 2012] [омонимия не снята] | V19: 1 | W19: =RAND() -> 5.9231030929484785E-2
A20: олидохорп дорог зереч адгот сач | B20: авд | C20: час, тогда через город проходило | D20: два | E20: gen | G20: часовых пояса. | H20: m | I20: Василий Белоусов. Сибирский гигант // «Зеркало мира», 2012 | J20: Василий Белоусов | L20: Сибирский гигант | M20: 2012 | N20: публицистика, нехудожественная | O20: статья | P20: строительство и архитектура, производство, история | Q20: «Зеркало мира» | R20: 2012 | S20: журнал | T20: омонимия не снята | U20: А когда-то время на разных берегах Оби различалось на час, тогда через город проходило два часовых пояса. [Василий Белоусов. Сибирский гигант // «Зеркало мира», 2012] [омонимия не снята] | V20: 1 | W20: =RAND() -> 0.34441233058612453
A21: йен в актанмок яакьнелам анежорогыв | B21: авд | C21: выгорожена маленькая комнатка: в ней | D21: два | E21: gen | G21: молодых человека сидят на пуфиках | H21: m | I21: Екатерина Белоусова, Анастасия Матвеева. Живая обертка // «Эксперт», 2014 | J21: Екатерина Белоусова, Анастасия Матвеева | L21: Живая обертка | M21: 2014 | N21: публицистика, нехудожественная | O21: статья | P21: бизнес, коммерция, экономика, финансы | Q21: «Эксперт» | R21: 2014 | S21: журнал | T21: омонимия не снята | U21: Рядом выгорожена маленькая комнатка: в ней два молодых человека сидят на пуфиках и увлеченно о чем-то беседуют: «Такие у нас переговорные. [Екатерина Белоусова, Анастасия Матвеева. Живая обертка // «Эксперт», 2014] [омонимия не снята] | V21: 1 | W21: =RAND() -> 0.96678814862097873
A22: еще иледис йонм ос модяР | B22: авд | C22: Рядом со мной сидели еще | D22: два | E22: gen | G22: неразлучных друга ― Петр Трофимович, интеллигентный | H22: m | I22: Е. Кучеренко. О Богородице, дурочке Машке и простой человеческой жизни (2015.09.21) | J22: Е. Кучеренко | L22: О Богородице, дурочке Машке и простой человеческой жизни | M22: 2015.09.21 | N22: публицистика , нехудожественная | O22: статья | P22: религия, частная жизнь | Q22: Православие и мир (pravmir.ru) | R22: 2015 | S22: электронный текст | T22: омонимия не снята | U22: Рядом со мной сидели еще два неразлучных друга ― Петр Трофимович, интеллигентный пожилой директор одной из местных школ, и молодой мужчина по имени Марк. [Е. Кучеренко. О Богородице, дурочке Машке и простой человеческой жизни (2015.09.21)] [омонимия не снята] | V22: 1 | W22: =RAND() -> 0.2486853171900173
A23: ецясем молшорп В | B23: авд | C23: В прошлом месяце | D23: два | E23: gen | G23: часкоровских обозревателя беседовали о власти | H23: m | I23: Дмитрий Бавильский, Игорь Манцов. У каждого ума свой телескоп // «Частный корреспондент», 2010 | J23: Дмитрий Бавильский, Игорь Манцов | K23: 1969, 1966 | L23: У каждого ума свой телескоп | M23: 2010 | N23: публицистика , нехудожественная | O23: статья | P23: политика и общественная жизнь | Q23: «Частный корреспондент» | R23: 2010 | S23: электронное издание | T23: омонимия не снята | U23: В прошлом месяце два часкоровских обозревателя беседовали о власти. [Дмитрий Бавильский, Игорь Манцов. У каждого ума свой телескоп // «Частный корреспондент», 2010] [омонимия не снята] | V23: 1 | W23: =RAND() -> 0.65821984396456146
A24: в хытсуг илсораз алабиго апорт | B24: авд | C24: тропа огибала заросли густых в | D24: два | E24: gen | G24: Колькиных роста мохнатых стлаников ― Поваренок | H24: m | I24: Виктор Ремизов. Воля вольная // «Новый мир», 2013 | J24: Виктор Ремизов | K24: 1958 | L24: Воля вольная | M24: 2013 | N24: художественная | O24: роман | Q24: «Новый мир» | R24: 2013 | S24: журнал | T24: омонимия не снята | U24: Местами тропа огибала заросли густых в два Колькиных роста мохнатых стлаников ― Поваренок невольно сбавлял шаг, щупал ружейный ремень на плече. [Виктор Ремизов. Воля вольная // «Новый мир», 2013] [омонимия не снята] | V24: 1 | W24: =RAND() -> 0.23108939028205955
A25: в теди хареским в обил | B25: авд | C25: либо в миксерах ― идет в | D25: два | E25: gen | G25: конвертерных цеха, где с помощью | H25: m | I25: Александр Попов. Без мартеновских печей // «Эксперт», 2014 | J25: Александр Попов | L25: Без мартеновских печей | M25: 2014 | N25: публицистика, нехудожественная | O25: статья | P25: производство, металлургия, бизнес, коммерция, экономика, финансы | Q25: «Эксперт» | R25: 2014 | S25: журнал | T25: омонимия не снята | U25: Основная масса чугуна ― либо в ковшах, либо в миксерах ― идет в два конвертерных цеха, где с помощью кислорода конвертируется в сталь. [Александр Попов. Без мартеновских печей // «Эксперт», 2014] [омонимия не снята] | V25: 1 | W25: =RAND() -> 0.48964655513631428
A26: исубаб у илиж тов еикат | B26: авд | C26: такие вот «жили у бабуси | D26: два | E26: gen | G26: веселых гуся». | H26: m | I26: Дина Рубина. Окна (2011) | J26: Дина Рубина | K26: 1953 | L26: Окна | M26: 2011 | N26: художественная | O26: рассказ | Q26: Дина Рубина. Окна | R26: 2012 | S26: книга | T26: омонимия не снята | U26: Да, вот такие песенки на темы общеизвестных библейских историй разучивают здесь малыши в детском саду, такие вот «жили у бабуси два веселых гуся». [Дина Рубина. Окна (2011)] [омонимия не снята] | V26: 1 | W26: =RAND() -> 0.66342021101847626
A27: йывреп леваП и нимоФ | B27: авд | C27: Фомин и Павел первый ― | D27: два | E27: gen | G27: русских гения, два непонятых и | H27: m | I27: Борис Евсеев. Евстигней // «Октябрь», 2010 | J27: Борис Евсеев | K27: 1951 | L27: Евстигней | M27: 2010 | N27: художественная | O27: роман | Q27: «Октябрь» | R27: 2010 | S27: журнал | T27: омонимия не снята | U27: Фомин и Павел первый ― два русских гения, два непонятых и два пересеченных русских пути. [Борис Евсеев. Евстигней // «Октябрь», 2010] [омонимия не снята] | V27: 1 | W27: =RAND() -> 0.70737100917269624
A28: ежот акбурт и арагиС | B28: авд | C28: Сигара и трубка ― тоже | D28: два | E28: gen | G28: разных образа. | H28: m | I28: Дарья Ефремова. Игры В сторону! // «Психология на каждый день», 2010 | J28: Дарья Ефремова | L28: Игры В сторону! | M28: 2010 | N28: публицистика, нехудожественная | O28: статья | P28: техника, психология | Q28: «Психология на каждый день» | R28: 2010 | S28: журнал | T28: омонимия не снята | U28: Сигара и трубка ― тоже два разных образа. [Дарья Ефремова. Игры В сторону! // «Психология на каждый день», 2010] [омонимия не снята] | V28: 1 | W28: =RAND() -> 0.48684414231989936
A29: окьлот отсуп мат а мидохаз | B29: авд | C29: заходим, а там пусто, только | D29: два | E29: gen | G29: патрульных милиционера на стульях сидят | H29: m | I29: Алексей Моторов. Преступление доктора Паровозова (2013) | J29: Алексей Моторов | K29: 1963 | L29: Преступление доктора Паровозова | M29: 2013 | N29: художественная | O29: роман | Q29: Алексей Моторов. Преступление доктора Паровозова | R29: 2014 | S29: книга | T29: омонимия не снята | U29: Мы с Танькой в контору заходим, а там пусто, только два патрульных милиционера на стульях сидят в коридоре. [Алексей Моторов. Преступление доктора Паровозова (2013)] [омонимия не снята] | V29: 1 | W29: =RAND() -> 0.58077024963621293
A30: от-адук туде яипелокилев огенмиз оготэ | B30: авд | C30: этого зимнего великолепия едут куда-то | D30: два | E30: gen | G30: усатых хлопца с чернявыми спутницами | H30: m | I30: Бахтияр Эхмедханов, Наталья Львова. Эх, рассказать бы Гоголю... // «Однако», 2010 | J30: Бахтияр Эхмедханов, Наталья Львова | L30: Эх, рассказать бы Гоголю... | M30: 2010 | N30: публицистика, нехудожественная | O30: статья | P30: администрация и управление, политика и общественная жизнь | Q30: «Однако» | R30: 2010 | S30: журнал | T30: омонимия не снята | U30: На полотне ― солнечный морозный день, веселые, крытые соломой хаты, деревья под снежными шапками, а на дороге ― запряженные конем сани, в которых мимо всего этого зимнего великолепия едут куда-то два усатых хлопца с чернявыми спутницами. [Бахтияр Эхмедханов, Наталья Львова. Эх, рассказать бы Гоголю... // «Однако», 2010] [омонимия не снята] | V30: 1 | W30: =RAND() -> 0.82421708260048909
A31: тюувтсещуС | B31: авд | C31: Существуют | D31: два | E31: gen | G31: основных типа химических связей ― ионные | H31: m | I31: В. Ацюковский. Полигон. Что такое лептонная пена? // Юный техник, 2012 | J31: В. Ацюковский | L31: Полигон. Что такое лептонная пена? | M31: 2012 | N31: публицистика, нехудожественная | O31: статья | P31: наука и технологии | Q31: Юный техник | R31: 2012 | S31: журнал | T31: омонимия не снята | U31: Существуют два основных типа химических связей ― ионные и ковалентные. [В. Ацюковский. Полигон. Что такое лептонная пена? // Юный техник, 2012] [омонимия не снята] | V31: 1 | W31: =RAND() -> 0.77056296443601291
A32: лаледс ацйибу увотемхА | B32: авд | C32: Ахметову убийца сделал | D32: два | E32: gen | G32: контрольных выстрела в голову (возможно | H32: m | I32: Вероника Кочина. За кулисами гламура // «Криминальный отдел», 2010 | J32: Вероника Кочина | L32: За кулисами гламура | M32: 2010 | N32: публицистика, нехудожественная | O32: статья | P32: криминал | Q32: «Криминальный отдел» | R32: 2010 | S32: журнал | T32: омонимия не снята | U32: Ахметову убийца сделал два контрольных выстрела в голову (возможно, именно его и «заказали»). [Вероника Кочина. За кулисами гламура // «Криминальный отдел», 2010] [омонимия не снята] | V32: 1 | W32: =RAND() -> 0.96730620712772331
A33: ирибиС в сачйеС | B33: авд | C33: ― Сейчас в Сибири | D33: два | E33: gen | G33: новых лидера по добыче нефти | H33: m | I33: Александр Ивантер, Валерий Крюков. Вызов возвращения государства // «Эксперт», 2014 | J33: Александр Ивантер, Валерий Крюков | K33: 1966 | L33: Вызов возвращения государства | M33: 2014 | N33: публицистика, нехудожественная | O33: интервью | P33: энергетика, администрация и управление, бизнес, коммерция, экономика, финансы | Q33: «Эксперт» | R33: 2014 | S33: журнал | T33: омонимия не снята | U33: ― Сейчас в Сибири два новых лидера по добыче нефти ― Красноярский край и Иркутская область, в Томской области объемы добычи падают. [Александр Ивантер, Валерий Крюков. Вызов возвращения государства // «Эксперт», 2014] [омонимия не снята] | V33: 1 | W33: =RAND() -> 0.68212823618492024
A34: аЗ | B34: авд | C34: За | D34: два | E34: gen | G34: последних года компания привлекла через | H34: m | I34: Андрей Котов. E.ON избавится от неключевых активов на 15 млрд евро (2010.11.11) // http://www.rbcdaily.ru/2010/11/11/world/526214.shtml, 2010 | J34: Андрей Котов | L34: E.ON избавится от неключевых активов на 15 млрд евро | M34: 2010.11.11 | N34: публицистика , нехудожественная | O34: заметка | P34: бизнес, коммерция, экономика, финансы | Q34: http://www.rbcdaily.ru/2010/11/11/world/526214.shtml | R34: 2010 | S34: газета | T34: омонимия не снята | U34: За два последних года компания привлекла через реализацию непрофильного бизнеса 13 млрд евро. [Андрей Котов. E.ON избавится от неключевых активов на 15 млрд евро (2010.11.11) // http://www.rbcdaily.ru/2010/11/11/world/526214.shtml, 2010] [омонимия не снята] | V34: 1 | W34: =RAND() -> 0.66895949644045605
A35: йороток в етезаг йоксвоксом йондо | B35: авд | C35: одной московской газете, в которой | D35: два | E35: gen | G35: активных участника исторического процесса эпохи | H35: m | I35: Александр Милитарев. России верные пасынки // «Знание - сила», 2010 | J35: Александр Милитарев | L35: России верные пасынки | M35: 2010 | N35: публицистика , нехудожественная | O35: статья | P35: администрация и управление, политика и общественная жизнь, история | Q35: «Знание - сила» | R35: 2010 | S35: журнал | T35: омонимия не снята | U35: Самым ярким примером этого, пожалуй, стала достопамятная статья Юрия Лужкова и Гавриила Попова в одной московской газете, в которой два активных участника исторического процесса эпохи перемен возложили на покойника, как раз на сороковой день по его смерти, все мыслимые ответственности за неудачи и потери нашего многострадального отечества с 1991 года до наших дней и далее. [Александр Милитарев. России верные пасынки // «Знание - сила», 2010] [омонимия не снята] | V35: 1 | W35: =RAND() -> 0.9123004536569419
A36: илитесоп ИТФМ | B36: авд | C36: МФТИ посетили | D36: два | E36: gen | G36: нобелевских лауреата и рекордсмен мира | H36: m | I36: Алексей Тимошенко, Валерий Фокин. ФизтехБио и не только // «За науку», 2014 | J36: Алексей Тимошенко, Валерий Фокин | K36: 1971 | L36: ФизтехБио и не только | M36: 2014 | N36: публицистика, нехудожественная | O36: интервью | P36: наука и технологии, биология, физика, здоровье и медицина | Q36: «За науку» | R36: 2014 | S36: журнал | T36: омонимия не снята | U36: МФТИ посетили два нобелевских лауреата и рекордсмен мира по продолжительности космических полётов. [Алексей Тимошенко, Валерий Фокин. ФизтехБио и не только // «За науку», 2014] [омонимия не снята] | V36: 1 | W36: =RAND() -> 0.84329065931959812
A37: екпек в киратс лешодоП | B37: авд | C37: Подошел старик в кепке, | D37: два | E37: gen | G37: худеньких мальчика, ровесники Кирилла, какие-то | H37: m | I37: Д. В. Бавильский. Чужое солнце (2012) | J37: Д. В. Бавильский | K37: 1969 | L37: Чужое солнце | M37: 2012 | N37: публицистика , нехудожественная | O37: очерк | P37: путешествия | Q37: Д. В. Бавильский. Чужое солнце | R37: 2012 | S37: книга | T37: омонимия не снята | U37: Подошел старик в кепке, два худеньких мальчика, ровесники Кирилла, какие-то тетки с авоськами, возвращавшиеся из невидимых магазинов, мужики с сильными, жилистыми руками. [Д. В. Бавильский. Чужое солнце (2012)] [омонимия не снята] | V37: 1 | W37: =RAND() -> 0.32386969689541489
B38: авД | D38: Два | E38: gen | G38: главных кредитора «ТНС энерго»: ВТБ | H38: m | I38: Евгений Огородников. Как заработать, когда не платят // «Эксперт», 2015 | J38: Евгений Огородников | L38: Как заработать, когда не платят | M38: 2015 | N38: публицистика, нехудожественная | O38: статья | P38: энергетика, бизнес, коммерция, экономика, финансы | Q38: «Эксперт» | R38: 2015 | S38: журнал | T38: омонимия не снята | U38: Два главных кредитора «ТНС энерго»: ВТБ и Альфа-банк ― недавно вошли в капитал компании. [Евгений Огородников. Как заработать, когда не платят // «Эксперт», 2015] [омонимия не снята] | V38: 1 | W38: =RAND() -> 0.44706159306927584
A39: нидо утертроп умотэ ьтавовтстевтоос тудуб | B39: авд | C39: будут соответствовать этому портрету один- | D39: два | E39: gen | G39: костромских музыканта-рок-н-ролльщика | H39: m | I39: Александр Зябликов. Провинциальная столица // «Сибирские огни», 2013 | J39: Александр Зябликов | K39: 1963 | L39: Провинциальная столица | M39: 2013 | N39: публицистика, нехудожественная | O39: очерк | P39: частная жизнь | Q39: «Сибирские огни» | R39: 2013 | S39: журнал | T39: омонимия не снята | U39: Что ж, пожалуй, будут соответствовать этому портрету один-два костромских музыканта-рок-н-ролльщика, пара-тройка художников, кое-кто из поэтической братии. [Александр Зябликов. Провинциальная столица // «Сибирские огни», 2013] [омонимия не снята] | V39: 1 | W39: =RAND() -> 8.8686050110852843E-2
A40: тувиж янем У янрап огончитнамор | B40: авд | C40: романтичного парня У меня живут | D40: два | E40: gen | G40: редких персонажа. Вполне себе человеческие | H40: m | I40: Алена Долецкая. Сучка по вызову // «Русская жизнь», 2012 | J40: Алена Долецкая | K40: 1955 | L40: Сучка по вызову | M40: 2012 | N40: публицистика , нехудожественная | O40: статья | P40: природа | Q40: «Русская жизнь» | R40: 2012 | S40: журнал | T40: омонимия не снята | U40: Безопасное приключение для романтичного парня У меня живут два редких персонажа. Вполне себе человеческие типы. [Алена Долецкая. Сучка по вызову // «Русская жизнь», 2012] [омонимия не снята] | V40: 1 | W40: =RAND() -> 0.61685508408111078
A41: ьсилазако иинежяропсар мёом В | B41: авд | C41: В моём распоряжении оказались | D41: два | E41: gen | G41: здоровых вола, которые были так | H41: m | I41: А. Г. Колмогоров. Мне доставшееся: Семейные хроники Надежды Лухмановой (2012) | J41: А. Г. Колмогоров | K41: 1945 | L41: Мне доставшееся: Семейные хроники Надежды Лухмановой | M41: 2012 | N41: публицистика, нехудожественная | O41: биография, записные книжки | P41: история, религия, частная жизнь | Q41: Колмогоров Александр. Мне доставшееся: Семейные хроники Надежды Лухмановой. М.: Аграф, 2013 | R41: 2013 | S41: книга | T41: омонимия не снята | U41: В моём распоряжении оказались два здоровых вола, которые были так похожи, что первое время я их путал… [А. Г. Колмогоров. Мне доставшееся: Семейные хроники Надежды Лухмановой (2012)] [омонимия не снята] | V41: 1 | W41: =RAND() -> 0.39931996518312829
A42: ынелову илыб ыботч етеуберт ыв | B42: авд | C42: вы требуете, чтобы были уволены | D42: два | E42: gen | G42: реакционных профессора. | H42: m | I42: Вадим Баевский. Table-talk // «Знамя», 2011 | J42: Вадим Баевский | K42: 1929 | L42: Table-talk | M42: 2011 | N42: публицистика , нехудожественная | O42: заметка, цикл | P42: частная жизнь | Q42: «Знамя» | R42: 2011 | S42: журнал | T42: омонимия не снята | U42: Далее вы требуете, чтобы были уволены два реакционных профессора. [Вадим Баевский. Table-talk // «Знамя», 2011] [омонимия не снята] | V42: 1 | W42: =RAND() -> 0.12979213293646874
A43: илыб яинелварпан оготэ имялетавонсО | B43: авд | C43: Основателями этого направления были | D43: два | E43: gen | G43: великих ученых, основоположники генетики в | H43: m | I43: Евгений Пчелов. В поисках гениальности: евгеническое движение в советской России // «Знание-сила», 2013 | J43: Евгений Пчелов | L43: В поисках гениальности: евгеническое движение в советской России | M43: 2013 | N43: публицистика, нехудожественная | O43: статья | P43: история, наука и технологии, биология, психология | Q43: «Знание-сила» | R43: 2013 | S43: журнал | T43: омонимия не снята | U43: Основателями этого направления были два великих ученых, основоположники генетики в отечественной науке ― Николай Константинович Кольцов (1872-1940) в Москве и Юрий Александрович Филипченко (1882-1930) в Петрограде. [Евгений Пчелов. В поисках гениальности: евгеническое движение в советской России // «Знание-сила», 2013] [омонимия не снята] | V43: 1 | W43: =RAND() -> 0.86329966218919318
A44: иледалв ыдог еынзар в юЕ | B44: авд | C44: Ею в разные годы владели | D44: два | E44: gen | G44: Константинопольских Патриарха: оба они кончили | H44: m | I44: Б. Поликарпов. Чтение. Память об Афоне // Журнал Московской Патриархии № 1, 2010, 2010 | J44: Б. Поликарпов | L44: Чтение. Память об Афоне | M44: 2010 | N44: публицистика , нехудожественная | O44: анонс | P44: религия, история | Q44: Журнал Московской Патриархии № 1, 2010 | R44: 2010 | S44: журнал | T44: омонимия не снята | U44: Ею в разные годы владели два Константинопольских Патриарха: оба они кончили свой жизненный путь в России, причем в одном и том же монастыре ― в Лубнах. [Б. Поликарпов. Чтение. Память об Афоне // Журнал Московской Патриархии № 1, 2010, 2010] [омонимия не снята] | V44: 1 | W44: =RAND() -> 0.86363469508719737
A45: оп муминим как олыб адог | B45: авд | C45: года, было как минимум по | D45: два | E45: gen | G45: природных православных. | H45: m | I45: Владимир Антипин. Уфа замедленного действия // «Русский репортер», № 28 (156), 22-29 июля 2010, 2010 | J45: Владимир Антипин | L45: Уфа замедленного действия | M45: 2010 | N45: публицистика , нехудожественная | O45: статья | P45: политика и общественная жизнь, администрация и управление, право, криминал, армия и вооруженные конфликты | Q45: «Русский репортер», № 28 (156), 22-29 июля 2010 | R45: 2010 | S45: журнал | T45: омонимия не снята | U45: А в каждой ваххабитской бандгруппе, обезвреженной в регионе за последние три года, было как минимум по два природных православных. [Владимир Антипин. Уфа замедленного действия // «Русский репортер», № 28 (156), 22-29 июля 2010, 2010] [омонимия не снята] | V45: 1 | W45: =RAND() -> 0.74907961807322532
A46: ястюялварпто ьнед йыджак уфУ в | B46: авд | C46: в Уфу каждый день отправляются | D46: два | E46: gen | G46: прямых поезда. | H46: m | I46: Артем Русакович. Уфа // «Русский репортер», № 15 (143), 22-29 апреля 2010, 2010 | J46: Артем Русакович | L46: Уфа | M46: 2010 | N46: бытовая , нехудожественная | O46: статья | P46: путешествия, досуг, зрелища и развлечения | Q46: «Русский репортер», № 15 (143), 22-29 апреля 2010 | R46: 2010 | S46: журнал | T46: омонимия не снята | U46: С Казанского вокзала Москвы в Уфу каждый день отправляются два прямых поезда. [Артем Русакович. Уфа // «Русский репортер», № 15 (143), 22-29 апреля 2010, 2010] [омонимия не снята] | V46: 1 | W46: =RAND() -> 0.23338867601417224
A47: и ождорбмА йинесрА ьнед йищюуделс | B47: авд | C47: следующий день Арсений, Амброджо и | D47: два | E47: gen | G47: бранденбургских паломника гуляли по крепости | H47: m | I47: Евгений Водолазкин. Лавр (2012) | J47: Евгений Водолазкин | K47: 1964 | L47: Лавр | M47: 2012 | N47: художественная | O47: роман | Q47: Евгений Водолазкин. Лавр | R47: 2012 | S47: книга | T47: омонимия не снята | U47: На следующий день Арсений, Амброджо и два бранденбургских паломника гуляли по крепости города Зары. [Евгений Водолазкин. Лавр (2012)] [омонимия не снята] | V47: 1 | W47: =RAND() -> 0.25175215900572046
A48: аципаК Л П иимерп йоксвелебоН | B48: авд | C48: Нобелевской премии (П.Л. Капица), | D48: два | E48: gen | G48: действительных члена АН СССР (А | H48: m | I48: Вадим Жотиков, Александр Максимычев. Петр Капица: малоизвестные страницы из жизни // «За науку», 2014 | J48: Вадим Жотиков, Александр Максимычев | L48: Петр Капица: малоизвестные страницы из жизни | M48: 2014 | N48: публицистика, нехудожественная | O48: статья | P48: история, наука и технологии, физика, политика и общественная жизнь | Q48: «За науку» | R48: 2014 | S48: журнал | T48: омонимия не снята | U48: Заметим, что этот состав кафедры ОФ ФТФ МГУ дал весьма неплохие «всходы»: один лауреат Нобелевской премии (П.Л. Капица), два действительных члена АН СССР (А.И. Шальников, Ю.В. Шарвин), три члена-корреспондента АН СССР (С.М. Рытов, В.Р. Регель, М.С. Хайкин) и один академик Грузинской ССР (Э.Л. Андроникашвили). [Вадим Жотиков, Александр Максимычев. Петр Капица: малоизвестные страницы из жизни // «За науку», 2014] [омонимия не снята] | V48: 1 | W48: =RAND() -> 0.77760945173382368
A49: итэ оннемИ | B49: ирт | C49: Именно эти | D49: три | E49: gen | G49: исторических героя, не считая Минина | H49: m | I49: Андрей Кузнецов. Воззвание Минина // «Знание-сила», 2013 | J49: Андрей Кузнецов | L49: Воззвание Минина | M49: 2013 | N49: публицистика, нехудожественная | O49: статья | P49: история, искусство и культура, армия и вооруженные конфликты, администрация и управление, политика и общественная жизнь | Q49: «Знание-сила» | R49: 2013 | S49: журнал | T49: омонимия не снята | U49: Именно эти три исторических героя, не считая Минина, олицетворяют три важных события, связанных с созданием ополчения: чтение Феодосием грамоты Гермогена ― крестный ход Саввы Евфимьева ― речь Минина ― сбор средств. [Андрей Кузнецов. Воззвание Минина // «Знание-сила», 2013] [омонимия не снята] | V49: 1 | W49: =RAND() -> 0.96749177790317331
B50: ирТ | D50: Три | E50: gen | G50: неурожайных года подряд могут поставить | H50: m | I50: Виталий Правдивцев. Поле битвы — ионосфера // «Наука и религия», 2010 | J50: Виталий Правдивцев | L50: Поле битвы — ионосфера | M50: 2010 | N50: публицистика, нехудожественная | O50: статья | P50: география, природа, техника | Q50: «Наука и религия» | R50: 2010 | S50: журнал | T50: омонимия не снята | U50: Три неурожайных года подряд могут поставить на колени практически любое государство. [Виталий Правдивцев. Поле битвы — ионосфера // «Наука и религия», 2010] [омонимия не снята] | V50: 1 | W50: =RAND() -> 0.94213422059164631
A51: ан йечарв ытенибак хачолем хесв | B51: ирт | C51: всех мелочах: кабинеты врачей на | D51: три | E51: gen | G51: квадратных метра больше стандартных, чтобы | H51: m | I51: Анастасия Матвеева. Сто лет совершенства // «Эксперт», 2014 | J51: Анастасия Матвеева | L51: Сто лет совершенства | M51: 2014 | N51: публицистика, нехудожественная | O51: статья | P51: здоровье и медицина, бизнес, коммерция, экономика, финансы | Q51: «Эксперт» | R51: 2014 | S51: журнал | T51: омонимия не снята | U51: И так во всех мелочах: кабинеты врачей на три квадратных метра больше стандартных, чтобы можно было поставить для пациентов не стулья, а диваны; данные ЭКГ появляются в электронной карте пациента через пять минут после обследования, тогда как в других лечебницах они становятся доступны врачу только к концу дня; по запросу пациентов, жалующихся на шум, проводится мониторинг уровня громкости в больничных помещениях и потом специальным образом монтируются тележки для подачи еды, чтобы те не тарахтели в коридорах. [Анастасия Матвеева. Сто лет совершенства // «Эксперт», 2014] [омонимия не снята] | V51: 1 | W51: =RAND() -> 0.41585445904638108
A52: аз иьмес доход йищбо теашыверп | B52: ирт | C52: превышает общий доход семьи за | D52: три | E52: gen | G52: последних года. | H52: m | I52: Евгений Козичев. Законы вступили в права // «Огонек», 2013 | J52: Евгений Козичев | L52: Законы вступили в права | M52: 2013 | N52: публицистика, нехудожественная | O52: статья | P52: право, политика и общественная жизнь | Q52: «Огонек» | R52: 2013 | S52: журнал | T52: омонимия не снята | U52: Сведения нужно будет предоставлять по каждой сделке, если ее сумма превышает общий доход семьи за три последних года. [Евгений Козичев. Законы вступили в права // «Огонек», 2013] [омонимия не снята] | V52: 1 | W52: =RAND() -> 0.39753484220899382
A53: ебес агифин анелеХ тировог уаВ | B53: ирТ | C53: Вау, ― говорит Хелена, ― нифига себе! | D53: Три | E53: gen | G53: полных мешка! ― Пойдем, ― говорит Жанна | H53: m | I53: Александра Тайц. Хэллоуин // «Сибирские огни», 2012 | J53: Александра Тайц | K53: 1970 | L53: Хэллоуин | M53: 2012 | N53: художественная | O53: рассказ | Q53: «Сибирские огни» | R53: 2012 | S53: журнал | T53: омонимия не снята | U53: *** ― Вау, ― говорит Хелена, ― нифига себе! Три полных мешка! ― Пойдем, ― говорит Жанна. [Александра Тайц. Хэллоуин // «Сибирские огни», 2012] [омонимия не снята] | V53: 1 | W53: =RAND() -> 0.54761551353371496
A54: в огесв йонищлот имадорткелэ имишйачнот | B54: ирт | C54: тончайшими электродами толщиной всего в | D54: три | E54: gen | G54: человеческих волоса, дискомфорта не испытывали | H54: m | I54: Екатерина Люльчак. Кожа вместо проводов (2010.03.16) // http://www.rbcdaily.ru/2010/03/16/cnews/464668.shtml, 2010 | J54: Екатерина Люльчак | L54: Кожа вместо проводов | M54: 2010.03.16 | N54: публицистика , нехудожественная | O54: заметка | P54: техника | Q54: http://www.rbcdaily.ru/2010/03/16/cnews/464668.shtml | R54: 2010 | S54: газета | T54: омонимия не снята | U54: Во всяком случае добровольцы, в течение недели ходившие с прикрепленными к их коже тончайшими электродами толщиной всего в три человеческих волоса, дискомфорта не испытывали. [Екатерина Люльчак. Кожа вместо проводов (2010.03.16) // http://www.rbcdaily.ru/2010/03/16/cnews/464668.shtml, 2010] [омонимия не снята] | V54: 1 | W54: =RAND() -> 0.99369253226709331
A55: корос юьдащолп йещбо ьмес ьтацдавд | B55: ирт | C55: двадцать семь, общей площадью сорок | D55: три | E55: gen | G55: квадратных метра, на шестом этаже | H55: m | I55: Александр Володарский. ЖЗЛ (Жизнеописание занимательных личностей) // «Сибирские огни», 2012 | J55: Александр Володарский | K55: 1954 | L55: ЖЗЛ (Жизнеописание занимательных личностей) | M55: 2012 | N55: художественная | O55: повесть | Q55: «Сибирские огни» | R55: 2012 | S55: журнал | T55: омонимия не снята | U55: ― Моя теща проживает в столице Украины, по адресу Киев, улица Саксаганского, девяносто, квартира сто двадцать семь, общей площадью сорок три квадратных метра, на шестом этаже, вход со двора, налево от арки. [Александр Володарский. ЖЗЛ (Жизнеописание занимательных личностей) // «Сибирские огни», 2012] [омонимия не снята] | V55: 1 | W55: =RAND() -> 0.15188990343637176
A56: олыб сан у а меатобар | B56: ирт | C56: работаем, а у нас было | D56: три | E56: gen | G56: главных конкурента, поставляющих такие же | H56: m | I56: Вера Краснова. Вам не придется экономить // «Эксперт», 2014 | J56: Вера Краснова | L56: Вам не придется экономить | M56: 2014 | N56: публицистика, нехудожественная | O56: статья | P56: бизнес, коммерция, экономика, финансы | Q56: «Эксперт» | R56: 2014 | S56: журнал | T56: омонимия не снята | U56: ― И когда я снова позвонил тому клиенту и спросил, как мы работаем, а у нас было три главных конкурента, поставляющих такие же насосы, он сказал: вы будете получать заказы». [Вера Краснова. Вам не придется экономить // «Эксперт», 2014] [омонимия не снята] | V56: 1 | W56: =RAND() -> 0.42281138454988954
A57: оннемИ | B57: ирт | C57: Именно | D57: три | E57: gen | G57: последних типа исследований позволили проделать | H57: m | I57: Валерий Ледяев. Изучение власти в городских сообществах: основные этапы и модели исследования // «Неприкосновенный запас», 2010 | J57: Валерий Ледяев | K57: 1955 | L57: Изучение власти в городских сообществах: основные этапы и модели исследования | M57: 2010 | N57: публицистика , нехудожественная | O57: статья | P57: наука и технологии, социология | Q57: «Неприкосновенный запас» | R57: 2010 | S57: журнал | T57: омонимия не снята | U57: Именно три последних типа исследований позволили проделать обстоятельный анализ факторов, обусловливающих диверсификацию властных отношений в городских сообществах. [Валерий Ледяев. Изучение власти в городских сообществах: основные этапы и модели исследования // «Неприкосновенный запас», 2010] [омонимия не снята] | V57: 1 | W57: =RAND() -> 3.8694970113395177E-2
A58: ан яслункилкто доран йикссур йынмузарен | B58: ерытеч | C58: неразумный русский народ откликнулся на | D58: четыре | E58: gen | G58: благополучных года нэпа. | H58: m | I58: Дмитрий Орешкин. Век на месте // «Огонек», 2013 | J58: Дмитрий Орешкин | K58: 1953 | L58: Век на месте | M58: 2013 | N58: публицистика, нехудожественная | O58: статья | P58: история, политика и общественная жизнь | Q58: «Огонек» | R58: 2013 | S58: журнал | T58: омонимия не снята | U58: Все это на фоне, напомним, падения производства хлеба и всплеска деторождений, которым неразумный русский народ откликнулся на четыре благополучных года нэпа. [Дмитрий Орешкин. Век на месте // «Огонек», 2013] [омонимия не снята] | V58: 1 | W58: =RAND() -> 0.48532468596688194
A59: личулоп но юуроток аз енйов | B59: ерытеч | C59: войне, за которую он получил | D59: четыре | E59: gen | G59: боевых ордена. | H59: m | I59: Андрей Ганин. Пустить в расход Николая Карловича // «Родина», 2010 | J59: Андрей Ганин | K59: 1981 | L59: Пустить в расход Николая Карловича | M59: 2010 | N59: публицистика , нехудожественная | O59: статья | P59: история, политика и общественная жизнь, армия и вооруженные конфликты | Q59: «Родина» | R59: 2010 | S59: журнал | T59: омонимия не снята | U59: Сразу после академии последовало серьёзное испытание ― командировка в распоряжение императорского наместника на Дальнем Востоке и участие в Русско-японской войне, за которую он получил четыре боевых ордена. [Андрей Ганин. Пустить в расход Николая Карловича // «Родина», 2010] [омонимия не снята] | V59: 1 | W59: =RAND() -> 9.2560982458278596E-2
A60: ынаворимрофС яинечу еывеоб ишан илатс | B60: ерытеч | C60: стали наши боевые учения. Сформированы | D60: четыре | E60: gen | G60: военных округа вместо шести. В | H60: m | I60: Дмитрий Медведев. Послание Президента РФ Федеральному Собранию Российской Федерации // «Российская газета», 2010 | J60: Дмитрий Медведев | K60: 1965 | L60: Послание Президента РФ Федеральному Собранию Российской Федерации | M60: 2010 | N60: публицистика , нехудожественная | O60: послание | P60: политика и общественная жизнь | Q60: «Российская газета» | R60: 2010 | S60: электронное издание | T60: омонимия не снята | U60: Вновь регулярными и, что немаловажно, масштабными стали наши боевые учения. Сформированы четыре военных округа вместо шести. В рамках Госпрограммы вооружения до 20-го года войска оснащаются современной техникой. [Дмитрий Медведев. Послание Президента РФ Федеральному Собранию Российской Федерации // «Российская газета», 2010] [омонимия не снята] | V60: 1 | W60: =RAND() -> 0.98839585536596886
A61: онавонсо олыб екев IIIVX в | B61: ерытеч | C61: в XVIII веке было основано | D61: четыре | E61: gen | G61: кадетских корпуса, в XIX веке | H61: m | I61: Г. Г. Мартынов. От составителя (2012) | J61: Г. Г. Мартынов | L61: От составителя | M61: 2012 | N61: публицистика, нехудожественная | O61: предисловие, послесловие | P61: история | Q61: Kадеты, гардемарины, юнкера. Мемуары воспитанников военных училищ XIX века. / Сост. Г. Г. Мартынов. | R61: 2012 | S61: книга | T61: омонимия не снята | U61: Всего в России в XVIII веке было основано четыре кадетских корпуса, в XIX веке еще двадцать два. [Г. Г. Мартынов. От составителя (2012)] [омонимия не снята] | V61: 1 | W61: =RAND() -> 0.3366020960217011
A62: иличулоп рим аз юимерп ремирпан | B62: ерытеч | C62: например, премию за мир получили | D62: четыре | E62: gen | G62: швейцарских студента, которые определили с | H62: m | I62: Год женщин // «Знание - сила», 2010 | L62: Год женщин | M62: 2010 | N62: публицистика , нехудожественная | O62: статья | P62: наука и технологии, биология, социология | Q62: «Знание - сила» | R62: 2010 | S62: журнал | T62: омонимия не снята | U62: Как уже повелось, одновременно с присуждением Нобелевских премий состоялось присуждение Игнобелевских премий (Ig-Noble, по-английски), и это дало много поводов для веселья, потому что тут, например, премию за мир получили четыре швейцарских студента, которые определили с помощью эксперимента, что лучше ― получить по голове полной бутылкой пива или пустой. [Год женщин // «Знание - сила», 2010] [омонимия не снята] | V62: 1 | W62: =RAND() -> 0.18020468433446357
B63: ерытеЧ | D63: Четыре | E63: gen | G63: долгих года участники плавания испытывали | H63: m | I63: Валентин Мирошников. Вокруг света на фрегате // «Знание-сила», 2013 | J63: Валентин Мирошников | L63: Вокруг света на фрегате | M63: 2013 | N63: публицистика, нехудожественная | O63: статья | P63: путешествия, история | Q63: «Знание-сила» | R63: 2013 | S63: журнал | T63: омонимия не снята | U63: Четыре долгих года участники плавания испытывали смертельно опасные, жестокие штормы, в которых гибли суда и люди, болели смертельной цингой и вели героические боевые действия на Камчатке против превосходящей англо-французской эскадры. [Валентин Мирошников. Вокруг света на фрегате // «Знание-сила», 2013] [омонимия не снята] | V63: 1 | W63: =RAND() -> 0.16312753584610695
A64: емроф в арытшок ирт и | B64: ьтсеш | C64: и три коштыра в форме ― | D64: шесть | E64: gen | G64: свинцовых кулаков, шесть злых глаз | H64: m | I64: Евгений Чижов. Перевод с подстрочника (2012) | J64: Евгений Чижов | K64: 1966 | L64: Перевод с подстрочника | M64: 2012 | N64: художественная | O64: роман | Q64: Евгений Чижов. Перевод с подстрочника | R64: 2013 | S64: книга | T64: омонимия не снята | U64: Били его недолго и, возможно, даже не слишком сильно, но Печигину казалось, что это длится бесконечно и три коштыра в форме ― шесть свинцовых кулаков, шесть злых глаз, три накачанных деловитой яростью, пляшущих вокруг него лица ― решили его попросту убить. [Евгений Чижов. Перевод с подстрочника (2012)] [омонимия не снята] | V64: 1 | W64: =RAND() -> 0.60147507032061642
B65: ьтсеШ | C65: « | D65: Шесть | E65: gen | G65: итальянских сейсмологов и чиновник признаны | H65: m | I65: Александр Тимофеевский. Правосудие // «Русская жизнь», 2012 | J65: Александр Тимофеевский | K65: 1933 | L65: Правосудие | M65: 2012 | N65: публицистика , нехудожественная | O65: заметка | P65: право, администрация и управление, наука и технологии | Q65: «Русская жизнь» | R65: 2012 | S65: журнал | T65: омонимия не снята | U65: «Шесть итальянских сейсмологов и чиновник признаны виновными в непредумышленном убийстве людей, которые погибли во время землетрясения в городе Аквила. [Александр Тимофеевский. Правосудие // «Русская жизнь», 2012] [омонимия не снята] | V65: 1 | W65: =RAND() -> 0.56300888119132086
A66: илатобар ямерв еж от в | B66: авд | C66: в то же время работали | D66: два | E66: gen | G66: великих русских живописца ― Феофан Грек | H66: m | I66: Валерий Фадеев. На твердой почве // «Эксперт», 2014 | J66: Валерий Фадеев | K66: 1960 | L66: На твердой почве | M66: 2014 | N66: публицистика, нехудожественная | O66: статья | P66: история, политика и общественная жизнь, искусство и культура | Q66: «Эксперт» | R66: 2014 | S66: журнал | T66: омонимия не снята | U66: Примерно в то же время работали два великих русских живописца ― Феофан Грек и Андрей Рублев. [Валерий Фадеев. На твердой почве // «Эксперт», 2014] [омонимия не снята] | V66: 1 | W66: =RAND() -> 0.66909902025222645
A67: ичарв тюажзеирп отч умотоП | B67: авд | C67: Потому что приезжают врачи ― | D67: два | E67: gen | G67: веселых толстых доктора с мягкими | H67: m | I67: Дина Сабитова. Где нет зимы (2011) | J67: Дина Сабитова | K67: 1969 | L67: Где нет зимы | M67: 2011 | N67: художественная | O67: повесть | Q67: Д. Р. Сабитова. Цирк в шкатулке | R67: 2007 | S67: книга | T67: омонимия не снята | U67: Потому что приезжают врачи ― два веселых толстых доктора с мягкими руками. [Дина Сабитова. Где нет зимы (2011)] [омонимия не снята] | V67: 1 | W67: =RAND() -> 0.4674452126774219
B68: авД | D68: Два | E68: gen | G68: нынешних главных драйвера рынка ― кроссоверы | H68: m | I68: Алексей Грамматчиков. Не стагнация, а стабилизация // «Эксперт», 2013 | J68: Алексей Грамматчиков | L68: Не стагнация, а стабилизация | M68: 2013 | N68: публицистика, нехудожественная | O68: статья | P68: транспорт, бизнес, коммерция, экономика, финансы | Q68: «Эксперт» | R68: 2013 | S68: журнал | T68: омонимия не снята | U68: Два нынешних главных драйвера рынка ― кроссоверы и бюджетные автомобили размерного класса B. Согласно данным компании «Рольф», за 2012 год доля кроссоверов на российском рынке увеличилась на 8, 4%, до 28, 4%. [Алексей Грамматчиков. Не стагнация, а стабилизация // «Эксперт», 2013] [омонимия не снята] | V68: 1 | W68: =RAND() -> 0.67128003496778776
A69: ьтсЕ | B69: авд | C69: Есть | D69: два | E69: gen | G69: противоположных направления: либо разрушить опасное | H69: n | I69: Алексей Вырский, Лидия Рыхлова. Астероидно-кометная опасность: грозит ли нам Армагеддон? // «Знание-сила», 2013 | J69: Алексей Вырский, Лидия Рыхлова | L69: Астероидно-кометная опасность: грозит ли нам Армагеддон? | M69: 2013 | N69: публицистика, нехудожественная | O69: интервью | P69: наука и технологии, астрономия | Q69: «Знание-сила» | R69: 2013 | S69: журнал | T69: омонимия не снята | U69: Есть два противоположных направления: либо разрушить опасное тело, либо изменить его траекторию на безопасную для Земли. [Алексей Вырский, Лидия Рыхлова. Астероидно-кометная опасность: грозит ли нам Армагеддон? // «Знание-сила», 2013] [омонимия не снята] | V69: 1 | W69: =RAND() -> 0.23416844631483613
A70: екнаб в театобар тсирю енм | B70: авд | C70: мне ― юрист, работает в банке, | D70: два | E70: gen | G70: высших образования. | H70: n | I70: Евгения Долгинова. Девушка с косой // «Русская жизнь», 2012 | J70: Евгения Долгинова | L70: Девушка с косой | M70: 2012 | N70: публицистика , нехудожественная | O70: статья | P70: криминал, частная жизнь | Q70: «Русская жизнь» | R70: 2012 | S70: журнал | T70: омонимия не снята | U70: ― Она сказала мне ― юрист, работает в банке, два высших образования. [Евгения Долгинова. Девушка с косой // «Русская жизнь», 2012] [омонимия не снята] | V70: 1 | W70: =RAND() -> 0.22377771916539568
A71: илаксупод лаворизилана хи отк есв | B71: авд | C71: все, кто их анализировал, допускали | D71: два | E71: gen | G71: неверных утверждения. | H71: n | I71: Вадим Эрлихман. Утро Апокалипсиса // «Огонек», 2013 | J71: Вадим Эрлихман | L71: Утро Апокалипсиса | M71: 2013 | N71: публицистика, нехудожественная | O71: статья | P71: история, политика и общественная жизнь | Q71: «Огонек» | R71: 2013 | S71: журнал | T71: омонимия не снята | U71: Правда, едва ли не все, кто их анализировал, допускали два неверных утверждения. [Вадим Эрлихман. Утро Апокалипсиса // «Огонек», 2013] [омонимия не снята] | V71: 1 | W71: =RAND() -> 0.90611605199291567
A72: ястюуритад модог м 4181 огот | B72: авд | C72: того, 1814-м годом датируются | D72: два | E72: gen | G72: ранних стихотворения Рылеева, в которых | H72: n | I72: Анастасия Готовцева. Кондратий Рылеев // «Знание - сила», 2011 | J72: Анастасия Готовцева | L72: Кондратий Рылеев | M72: 2011 | N72: публицистика , нехудожественная | O72: статья | P72: политика и общественная жизнь, армия и вооруженные конфликты, администрация и управление, искусство и культура | Q72: «Знание - сила» | R72: 2011 | S72: журнал | T72: омонимия не снята | U72: Кроме того, 1814-м годом датируются два ранних стихотворения Рылеева, в которых упоминается Эмилия, ― «Бой» и «Утес». [Анастасия Готовцева. Кондратий Рылеев // «Знание - сила», 2011] [омонимия не снята] | V72: 1 | W72: =RAND() -> 1.5550923769872216E-2
A73: илитропси йе еинеортсан еж умот | B73: авд | C73: тому же настроение ей испортили | D73: два | E73: gen | G73: недавних происшествия. | H73: n | I73: Антон Мясников. Преступление — загадка // «Криминальный отдел», 2011 | J73: Антон Мясников | L73: Преступление — загадка | M73: 2011 | N73: публицистика, нехудожественная | O73: статья | P73: история, криминал | Q73: «Криминальный отдел» | R73: 2011 | S73: журнал | T73: омонимия не снята | U73: К тому же настроение ей испортили два недавних происшествия. [Антон Мясников. Преступление — загадка // «Криминальный отдел», 2011] [омонимия не снята] | V73: 1 | W73: =RAND() -> 0.94161283655723138
A74: в арезал чул теялварпан яароток | B74: авд | C74: которая направляет луч лазера в | D74: два | E74: gen | G74: разных места: на модуль для | H74: n | I74: Алексей Тимошенко. «Иволга» следит за метаном // «За науку», 2014 | J74: Алексей Тимошенко | L74: «Иволга» следит за метаном | M74: 2014 | N74: публицистика, нехудожественная | O74: заметка | P74: наука и технологии, физика, техника, электроника | Q74: «За науку» | R74: 2014 | S74: журнал | T74: омонимия не снята | U74: Физики воспользовались оптической системой, которая направляет луч лазера в два разных места: на модуль для смешивания с пропущенным через атмосферу солнечным светом (анализируемым сигналом) и на кювету с чистым образцом того газа, который требуется выявить. [Алексей Тимошенко. «Иволга» следит за метаном // «За науку», 2014] [омонимия не снята] | V74: 1 | W74: =RAND() -> 0.49601596717372742
A75: тееми йовосусиИ йовтилом еиненжарпУ тешип | B75: авд | C75: пишет: «Упражнение молитвой Иисусовой имеет | D75: два | E75: gen | G75: главнейших подразделения или периода, оканчивающиеся | H75: n | I75: А. И. Осипов. Учение о молитве Иисусовой святителя Игнатия (Брянчанинова) (1992-2012) // , | J75: А. И. Осипов | K75: 1938 | L75: Учение о молитве Иисусовой святителя Игнатия (Брянчанинова) | M75: 1992-2012 | N75: церковно-богословская, нехудожественная | O75: статья | P75: религия | S75: электронное издание | T75: омонимия не снята | U75: Святитель Игнатий пишет: «Упражнение молитвой Иисусовой имеет два главнейших подразделения или периода, оканчивающиеся чистой молитвою… [А. И. Осипов. Учение о молитве Иисусовой святителя Игнатия (Брянчанинова) (1992-2012) // , ] [омонимия не снята] | V75: 1 | W75: =RAND() -> 0.21040273636799312
A76: окьлот сан у итсоньлаер В | B76: авд | C76: В реальности у нас только | D76: два | E76: gen | G76: муниципальных образования ― Кострома и Волгореченск | H76: n | I76: Евгения Обухова. На плаву продержатся, но взлететь не смогут // «Эксперт», 2015 | J76: Евгения Обухова | L76: На плаву продержатся, но взлететь не смогут | M76: 2015 | N76: публицистика, нехудожественная | O76: статья | P76: администрация и управление, бизнес, коммерция, экономика, финансы | Q76: «Эксперт» | R76: 2015 | S76: журнал | T76: омонимия не снята | U76: «В реальности у нас только два муниципальных образования ― Кострома и Волгореченск ― себя обслуживают, а остальные все убыточны и не имеют необходимого количества доходов, для того чтобы реализовать свои полномочия, ― рассказывает губернатор Костромской области Сергей Ситников. [Евгения Обухова. На плаву продержатся, но взлететь не смогут // «Эксперт», 2015] [омонимия не снята] | V76: 1 | W76: =RAND() -> 0.37588155725230432
A77: теувтсещуС | B77: авд | C77: Существует | D77: два | E77: gen | G77: основных развития событий ― полное поглощение | H77: n | I77: Виктор Мадьяров. Каннибализм галактик // «Зеркало мира», 2012 | J77: Виктор Мадьяров | L77: Каннибализм галактик | M77: 2012 | N77: публицистика, нехудожественная | O77: статья | P77: наука и технологии, астрономия | Q77: «Зеркало мира» | R77: 2012 | S77: журнал | T77: омонимия не снята | U77: Существует два основных развития событий ― полное поглощение спутника или его частичный пролёт сквозь диск. [Виктор Мадьяров. Каннибализм галактик // «Зеркало мира», 2012] [омонимия не снята] | V77: 1 | W77: =RAND() -> 0.98943728238012307
A78: ан ынитселаП аледзар налп и | B78: авд | C78: и план раздела Палестины на | D78: два | E78: gen | G78: самостоятельных государства ― еврейское и арабское | H78: n | I78: Борис Явелов. Календарь «3-С»: ноябрь // «Знание-сила», 2012 | J78: Борис Явелов | L78: Календарь «3-С»: ноябрь | M78: 2012 | N78: публицистика, нехудожественная | O78: информационное сообщение | P78: история | Q78: «Знание-сила» | R78: 2012 | S78: журнал | T78: омонимия не снята | U78: 65 лет назад, 29 ноября 1947 года Генеральная Ассамблея ООН большинством в 33 голоса против 13 одобрила ― при энергичной поддержке СССР ― резолюцию о прекращении с 1948 года британского мандата над Палестиной и план раздела Палестины на два самостоятельных государства ― еврейское и арабское с выделением Иерусалима в нейтральную зону, находящуюся под международным контролем. [Борис Явелов. Календарь «3-С»: ноябрь // «Знание-сила», 2012] [омонимия не снята] | V78: 1 | W78: =RAND() -> 0.21192094356139002
A79: хищюаминаз вокиндуртос 55 skroW rebiL | B79: авд | C79: Liber Works 55 сотрудников, занимающих | D79: два | E79: gen | G79: душных помещения средних размеров. | H79: n | I79: Анна Старобинец. Мечтают ли андроиды о летнем отпуске // «Русский репортер», 2012 | J79: Анна Старобинец | L79: Мечтают ли андроиды о летнем отпуске | M79: 2012 | N79: публицистика, нехудожественная | O79: статья | P79: администрация и управление, культурология | Q79: «Русский репортер» | R79: 2012 | S79: журнал | T79: омонимия не снята | U79: В Liber Works 55 сотрудников, занимающих два душных помещения средних размеров. [Анна Старобинец. Мечтают ли андроиды о летнем отпуске // «Русский репортер», 2012] [омонимия не снята] | V79: 1 | W79: =RAND() -> 0.45128055870271377
A80: орп лашылс мас и онжомзов | B80: авд | C80: возможно, и сам слышал про | D80: два | E80: gen | G80: погребальных братства, Ходынское и Трубное | H80: n | I80: Владимир Шаров. Ходынцы и Трубные // «Русская жизнь», 2012 | J80: Владимир Шаров | K80: 1952 | L80: Ходынцы и Трубные | M80: 2012 | N80: художественная | O80: роман, отрывок | Q80: «Русская жизнь» | R80: 2012 | S80: журнал | T80: омонимия не снята | U80: Ты, возможно, и сам слышал про два погребальных братства, Ходынское и Трубное. [Владимир Шаров. Ходынцы и Трубные // «Русская жизнь», 2012] [омонимия не снята] | V80: 1 | W80: =RAND() -> 0.99702942283063956
A81: аз еищяотсогород еымас яинаводелсси хин | B81: авд | C81: них исследования — самые дорогостоящие за | D81: два | E81: gen | G81: прошедших десятилетия. | H81: n | I81: А. А. Гурьянов. Новые миры, новые горизонты: приоритетные направления астрономических исследований // Химия и жизнь, 2010 | J81: А. А. Гурьянов | L81: Новые миры, новые горизонты: приоритетные направления астрономических исследований | M81: 2010 | N81: учебно-научная, нехудожественная | O81: статья | P81: наука и технологии, астрономия | Q81: Химия и жизнь | R81: 2010 | S81: журнал | T81: омонимия не снята | U81: Созданные в ее рамках приборы и выполненные на них исследования — самые дорогостоящие за два прошедших десятилетия. [А. А. Гурьянов. Новые миры, новые горизонты: приоритетные направления астрономических исследований // Химия и жизнь, 2010] [омонимия не снята] | V81: 1 | W81: =RAND() -> 0.12270035438568749
A82: ан яртомсен яом амаМ | B82: авд | C82: Мама моя, несмотря на | D82: два | E82: gen | G82: высших образования, очень мало уделяла | H82: n | I82: Галина Волчек. «Верю во взаимность во всем, не только в любви» // «Огонек», 2013 | J82: Галина Волчек | K82: 1933 | L82: «Верю во взаимность во всем, не только в любви» | M82: 2013 | N82: публицистика, нехудожественная | O82: статья | P82: искусство и культура | Q82: «Огонек» | R82: 2013 | S82: журнал | T82: омонимия не снята | U82: Мама моя, несмотря на два высших образования, очень мало уделяла внимания моему, скажем так, духовному развитию. [Галина Волчек. «Верю во взаимность во всем, не только в любви» // «Огонек», 2013] [омонимия не снята] | V82: 1 | W82: =RAND() -> 0.53802938513199339
A83: ондО | B83: авд | C83: ” ― “Одно- | D83: два | E83: gen | G83: сальных пятна на шляпе ― случайность | H83: n | I83: Григорий Тарасевич. Размазать лампочку по стенке // «Русский репортер», № 45 (223), 17 ноября 2011, 2011 | J83: Григорий Тарасевич | L83: Размазать лампочку по стенке | M83: 2011 | N83: бытовая , нехудожественная | O83: статья | P83: техника, бизнес, коммерция, экономика, финансы | Q83: «Русский репортер», № 45 (223), 17 ноября 2011 | R83: 2011 | S83: журнал | T83: омонимия не снята | U83: ” ― “Одно-два сальных пятна на шляпе ― случайность. [Григорий Тарасевич. Размазать лампочку по стенке // «Русский репортер», № 45 (223), 17 ноября 2011, 2011] [омонимия не снята] | V83: 1 | W83: =RAND() -> 0.80278520097439687
A84: муминим как алавытичу яигевроН енегребципШ | B84: авд | C84: Шпицбергене, Норвегия учитывала как минимум | D84: два | E84: gen | G84: важных обстоятельства. | H84: n | I84: Алексей Комаров. Шпицбергенский вопрос в советской внешней политике // «Знание-сила», 2012 | J84: Алексей Комаров | L84: Шпицбергенский вопрос в советской внешней политике | M84: 2012 | N84: публицистика, нехудожественная | O84: статья | P84: политика и общественная жизнь, природа | Q84: «Знание-сила» | R84: 2012 | S84: журнал | T84: омонимия не снята | U84: Формулируя свою позицию по вопросу о Шпицбергене, Норвегия учитывала как минимум два важных обстоятельства. [Алексей Комаров. Шпицбергенский вопрос в советской внешней политике // «Знание-сила», 2012] [омонимия не снята] | V84: 1 | W84: =RAND() -> 0.43406223847806913
A85: ettepuohC у яндогеС | B85: авд | C85: Сегодня у Choupette | D85: два | E85: gen | G85: собственных производства ― в Тверской области | H85: n | I85: Вера Кузьмина. Вытютюкивание на экспорт // «Эксперт», 2015 | J85: Вера Кузьмина | L85: Вытютюкивание на экспорт | M85: 2015 | N85: публицистика, нехудожественная | O85: статья | P85: производство, легкая и пищевая промышленность, бизнес, коммерция, экономика, финансы | Q85: «Эксперт» | R85: 2015 | S85: журнал | T85: омонимия не снята | U85: Сегодня у Choupette два собственных производства ― в Тверской области и Чебоксарах, еще около полутора десятков на контракте. [Вера Кузьмина. Вытютюкивание на экспорт // «Эксперт», 2015] [омонимия не снята] | V85: 1 | W85: =RAND() -> 2.7003113387500499E-2
A86: окьлот ледялгзар иинещевсо моксда в | B86: авд | C86: в адском освещении разглядел только | D86: два | E86: gen | G86: темных пятна. | H86: n | I86: Денис Тихий. Умляуты // «Сибирские огни», 2013 | J86: Денис Тихий | K86: 1974 | L86: Умляуты | M86: 2013 | N86: художественная | O86: рассказ | Q86: «Сибирские огни» | R86: 2013 | S86: журнал | T86: омонимия не снята | U86: ― Ага, ― сказал я, хотя в адском освещении разглядел только два темных пятна. [Денис Тихий. Умляуты // «Сибирские огни», 2013] [омонимия не снята] | V86: 1 | W86: =RAND() -> 0.51548824447097708
A87: онеджубзов олыб огоксьлезурЯ виторП | B87: авд | C87: Против Ярузельского было возбуждено | D87: два | E87: gen | G87: судебных преследования по делам о | H87: n | I87: Борис Филиппов. Генерал // «Русский репортер», 2014 | J87: Борис Филиппов | L87: Генерал | M87: 2014 | N87: публицистика, нехудожественная | O87: статья | P87: политика и общественная жизнь, администрация и управление | Q87: «Русский репортер» | R87: 2014 | S87: журнал | T87: омонимия не снята | U87: Против Ярузельского было возбуждено два судебных преследования по делам о жертвах событий декабря 1970-го и 1981 года. [Борис Филиппов. Генерал // «Русский репортер», 2014] [омонимия не снята] | V87: 1 | W87: =RAND() -> 0.85443045918312599
A88: выркто ьшил онжом дапаз-оревес онишуТ | B88: авд | C88: Тушино, северо-запад) можно, лишь открыв | D88: два | E88: gen | G88: новых окна. | H88: n | I88: Дина Юсупова. Воздушная тревога // «Огонек», 2015 | J88: Дина Юсупова | L88: Воздушная тревога | M88: 2015 | N88: публицистика, нехудожественная | O88: статья | P88: природа, администрация и управление, производство | Q88: «Огонек» | R88: 2015 | S88: журнал | T88: омонимия не снята | U88: Сравнить же столбики оксидов азота на Чаянова (центр Москвы) и, скажем, на Туристской улице (район Тушино, северо-запад) можно, лишь открыв два новых окна. [Дина Юсупова. Воздушная тревога // «Огонек», 2015] [омонимия не снята] | V88: 1 | W88: =RAND() -> 0.62934422292814329
A89: ястюачулоп еачулс монвиторп В | B89: авд | C89: В противном случае получаются | D89: два | E89: gen | G89: разных общества. | H89: n | I89: Андрей Молодых. В поисках позитива // «Русский репортер», 2014 | J89: Андрей Молодых | L89: В поисках позитива | M89: 2014 | N89: публицистика, нехудожественная | O89: репортаж | P89: администрация и управление, социология | Q89: «Русский репортер» | R89: 2014 | S89: журнал | T89: омонимия не снята | U89: В противном случае получаются два разных общества. [Андрей Молодых. В поисках позитива // «Русский репортер», 2014] [омонимия не снята] | V89: 1 | W89: =RAND() -> 0.34335478467007097
A90: илялватсдерп ямерв от в акинремакос | B90: авд | C90: сокамерника в то время представляли | D90: два | E90: gen | G90: противоположных крыла социал-демократии: Вышинский был | H90: n | I90: Дмитрий Митюрин. Прокуроры от дьявола // «Криминальный отдел», 2012 | J90: Дмитрий Митюрин | L90: Прокуроры от дьявола | M90: 2012 | N90: публицистика, нехудожественная | O90: статья | P90: история, криминал | Q90: «Криминальный отдел» | R90: 2012 | S90: журнал | T90: омонимия не снята | U90: Оба сокамерника в то время представляли два противоположных крыла социал-демократии: Вышинский был меньшевиком, а его будущий хозяин ― большевиком-ленинцем. [Дмитрий Митюрин. Прокуроры от дьявола // «Криминальный отдел», 2012] [омонимия не снята] | V90: 1 | W90: =RAND() -> 0.21591446959864635
A91: и ьнед ылокоторп ан йынняретоп | B91: авд | C91: потерянный на протоколы день и | D91: два | E91: gen | G91: смятых крыла. | H91: n | I91: Дмитрий Губин. Жизнь в противотоке // «Огонек», 2013 | J91: Дмитрий Губин | K91: 1964 | L91: Жизнь в противотоке | M91: 2013 | N91: публицистика, нехудожественная | O91: статья | P91: право, администрация и управление | Q91: «Огонек» | R91: 2013 | S91: журнал | T91: омонимия не снята | U91: Потому как долгое ожидание полиции, потерянный на протоколы день и два смятых крыла. [Дмитрий Губин. Жизнь в противотоке // «Огонек», 2013] [омонимия не снята] | V91: 1 | W91: =RAND() -> 0.52721089487977635
A92: ястядохан оннемервондо ялетаводелс еж огот | B92: авд | C92: того же следователя одновременно находятся | D92: два | E92: gen | G92: уголовных дела: по одному Елена | H92: n | I92: Бахтияр Ахмедханов. Пресечение без меры // «Однако», 2010 | J92: Бахтияр Ахмедханов | L92: Пресечение без меры | M92: 2010 | N92: публицистика, нехудожественная | O92: заметка | P92: криминал | Q92: «Однако» | R92: 2010 | S92: журнал | T92: омонимия не снята | U92: Таким образом, в производстве одного и того же следователя одновременно находятся два уголовных дела: по одному Елена Гофман проходит как подозреваемая, а Диких в качестве потерпевшего, по другому ― с точностью до наоборот. [Бахтияр Ахмедханов. Пресечение без меры // «Однако», 2010] [омонимия не снята] | V92: 1 | W92: =RAND() -> 0.82807260142953998
A93: еще ьтиледыв онжом епорвЕ В | B93: ирт | C93: В Европе можно выделить еще | D93: три | E93: gen | G93: крупных государства, способных тогда влиять | H93: n | I93: Виктор Безотосный. Россия и Франция в Европе перед войной 1812 года // «Знание - сила», 2010 | J93: Виктор Безотосный | L93: Россия и Франция в Европе перед войной 1812 года | M93: 2010 | N93: публицистика , нехудожественная | O93: статья | P93: история, политика и общественная жизнь, администрация и управление, армия и вооруженные конфликты | Q93: «Знание - сила» | R93: 2010 | S93: журнал | T93: омонимия не снята | U93: В Европе можно выделить еще три крупных государства, способных тогда влиять на расстановку сил, ― Россию, Австрию и Пруссию. [Виктор Безотосный. Россия и Франция в Европе перед войной 1812 года // «Знание - сила», 2010] [омонимия не снята] | V93: 1 | W93: =RAND() -> 0.87152032196058171
A94: муминим ьтавзан онжом сачйес ежу | B94: ирт | C94: уже сейчас можно назвать минимум | D94: три | E94: gen | G94: дополнительных направления для диалога с | H94: n | I94: Дмитрий Евстафьев. Стратегия неудобного партнерства // «Эксперт», 2014 | J94: Дмитрий Евстафьев | L94: Стратегия неудобного партнерства | M94: 2014 | N94: публицистика, нехудожественная | O94: статья | P94: политика и общественная жизнь | Q94: «Эксперт» | R94: 2014 | S94: журнал | T94: омонимия не снята | U94: В частности, уже сейчас можно назвать минимум три дополнительных направления для диалога с США. [Дмитрий Евстафьев. Стратегия неудобного партнерства // «Эксперт», 2014] [омонимия не снята] | V94: 1 | W94: =RAND() -> 0.58286495803696381
A95: ынелвонатсу хин ан аробан ялД | B95: ирт | C95: Для набора на них установлены | D95: три | E95: gen | G95: вступительных испытания: либо математика, физика | H95: n | I95: Артём Воронов, Алексей Паевский. Поступательное движение // «За науку», 2014 | J95: Артём Воронов, Алексей Паевский | L95: Поступательное движение | M95: 2014 | N95: публицистика, нехудожественная | O95: интервью | P95: образование, администрация и управление | Q95: «За науку» | R95: 2014 | S95: журнал | T95: омонимия не снята | U95: Для набора на них установлены три вступительных испытания: либо математика, физика и русский язык, либо математика, информатика и русский язык. [Артём Воронов, Алексей Паевский. Поступательное движение // «За науку», 2014] [омонимия не снята] | V95: 1 | W95: =RAND() -> 0.80544838088609205
A96: илашарку ьвокрец волопук хынноицидарт отсемВ | B96: ирт | C96: Вместо традиционных куполов церковь украшали | D96: три | E96: gen | G96: изящных пятиглавия. | H96: n | I96: Валерия Дараган. Жемчужина русской архитектуры // «Наука и религия», 2010 | J96: Валерия Дараган | L96: Жемчужина русской архитектуры | M96: 2010 | N96: публицистика, нехудожественная | O96: статья | P96: история, строительство и архитектура, религия | Q96: «Наука и религия» | R96: 2010 | S96: журнал | T96: омонимия не снята | U96: Вместо традиционных куполов церковь украшали три изящных пятиглавия. [Валерия Дараган. Жемчужина русской архитектуры // «Наука и религия», 2010] [омонимия не снята] | V96: 1 | W96: =RAND() -> 0.44879482122398817
B97: ирТ | D97: Три | E97: gen | G97: альтернативных человечества развивались бок о | H97: n | I97: Андрей Константинов. Предок из пальца // «Русский репортер», № 34 (212), 1 сентября 2011, 2011 | J97: Андрей Константинов | L97: Предок из пальца | M97: 2011 | N97: публицистика , нехудожественная | O97: репортаж | P97: наука и технологии, биология, природа, история | Q97: «Русский репортер», № 34 (212), 1 сентября 2011 | R97: 2011 | S97: журнал | T97: омонимия не снята | U97: Три альтернативных человечества развивались бок о бок. [Андрей Константинов. Предок из пальца // «Русский репортер», № 34 (212), 1 сентября 2011, 2011] [омонимия не снята] | V97: 1 | W97: =RAND() -> 0.39917233347167957
A98: итэ есВ | B98: ирт | C98: Все эти | D98: три | E98: gen | G98: древних существа, хотя и непохожие | H98: n | I98: Борис Стариков. Восхождение к предкам // «Знание-сила», 2013 | J98: Борис Стариков | L98: Восхождение к предкам | M98: 2013 | N98: публицистика, нехудожественная | O98: статья | P98: наука и технологии, биология, история | Q98: «Знание-сила» | R98: 2013 | S98: журнал | T98: омонимия не снята | U98: Все эти три древних существа, хотя и непохожие друг на друга, имеют то общее, что они более или менее «человекоподобны» в плане отмеченных выше трех признаков и все они относятся к тому времени, которое очень близко к моменту расхождения эволюционных ветвей шимпанзе и гомининов. [Борис Стариков. Восхождение к предкам // «Знание-сила», 2013] [омонимия не снята] | V98: 1 | W98: =RAND() -> 0.63897972971532846
A99: елакол в тевиж отк имет | B99: ирт | C99: теми, кто живет в «локале» ― | D99: три | E99: gen | G99: основных здания по типу общежитий | H99: n | I99: Валерий Калныш. Министр в отсидке // «Огонек», 2013 | J99: Валерий Калныш | L99: Министр в отсидке | M99: 2013 | N99: публицистика, нехудожественная | O99: статья | P99: политика и общественная жизнь | Q99: «Огонек» | R99: 2013 | S99: журнал | T99: омонимия не снята | U99: Его и еще несколько человек отселили в специальный барак (раньше здесь был ШИЗО), и поэтому он не видит и не общается с теми, кто живет в «локале» ― три основных здания по типу общежитий, где содержится более полутысячи заключенных колонии № 91. [Валерий Калныш. Министр в отсидке // «Огонек», 2013] [омонимия не снята] | V99: 1 | W99: =RAND() -> 0.37914795774136023
B100: ирТ | D100: Три | E100: gen | G100: двенадцатиэтажных здания, обнесенных двухметровым забором | H100: n | I100: Андрей Раскин, Юлия Шуляк. Где вино и женщины? // «Русский репортер», 2014 | J100: Андрей Раскин, Юлия Шуляк | L100: Где вино и женщины? | M100: 2014 | N100: публицистика, нехудожественная | O100: статья | P100: спорт, администрация и управление | Q100: «Русский репортер» | R100: 2014 | S100: журнал | T100: омонимия не снята | U100: Три двенадцатиэтажных здания, обнесенных двухметровым забором по периметру, три охранника, три раздавленных мандарина у проходной и три спящих дворняжки в центре двора. [Андрей Раскин, Юлия Шуляк. Где вино и женщины? // «Русский репортер», 2014] [омонимия не снята] | V100: 1 | W100: =RAND() -> 0.27065034986201064
A101: огесв туТ ьтатобар одан отсем | B101: ерытеч | C101: место: надо работать. Тут всего | D101: четыре | E101: gen | G101: простых правила: ― возникла идея, задание | H101: n | I101: Александр Левинтов, Ольга Балла. В культуре свободных мест нет // «Знание - сила», 2010 | J101: Александр Левинтов, Ольга Балла | L101: В культуре свободных мест нет | M101: 2010 | N101: публицистика , нехудожественная | O101: интервью | P101: искусство и культура, философия, частная жизнь | Q101: «Знание - сила» | R101: 2010 | S101: журнал | T101: омонимия не снята | U101: Менее всего надо стремиться занять какое-то место: надо работать. Тут всего четыре простых правила: ― возникла идея, задание, заказ ― выполняй сразу, не откладывая; [Александр Левинтов, Ольга Балла. В культуре свободных мест нет // «Знание - сила», 2010] [омонимия не снята] | V101: 1 | W101: =RAND() -> 0.42291368706424082
A102: яинерзодоп огешйелам ин И | B102: ирТ | C102: И ни малейшего подозрения… | D102: Три | E102: gen | G102: несчастных черепахи-гоголя, проснувшихся, может | I102: Вероника Капустина. Я не люблю музыку // «Звезда», 2012 | J102: Вероника Капустина | K102: 1962 | L102: Я не люблю музыку | M102: 2012 | N102: художественная | O102: рассказ | Q102: «Звезда» | R102: 2012 | S102: журнал | T102: омонимия не снята | U102: И ни малейшего подозрения… Три несчастных черепахи-гоголя, проснувшихся, может быть, под землей или откопанных еще каким-нибудь зубастым видом и съеденных заживо. [Вероника Капустина. Я не люблю музыку // «Звезда», 2012] [омонимия не снята] | V102: 1 | W102: =RAND() -> 0.27245022602700131