Sheet: Результаты поиска
A1: оп епатэ мещюуделс аН | B1: евд | C1: На следующем этапе по | D1: две | F1: лучшие команды из подгрупп образовали | G1: Леонид Бекасов. Добыли серебро посредством футзала (2002) // «Весть» (Калуга), 2002.12.18 | H1: Леонид Бекасов | J1: Добыли серебро посредством футзала | K1: 2002 | L1: публицистика , нехудожественная | M1: заметка | N1: спорт | O1: «Весть» (Калуга) | P1: 2002.12.18 | Q1: газета | R1: омонимия не снята | S1: На следующем этапе по две лучшие команды из подгрупп образовали финальную «шестерку», которая, в свою очередь, была разбита на две «тройки». [Леонид Бекасов. Добыли серебро посредством футзала (2002) // «Весть» (Калуга), 2002.12.18] [омонимия не снята] | T1: 1 | U1: =RAND() -> 0.34745276654367441
B2: ирТ | D2: Три | F2: вышеназванные победительницы полностью согласились с | G2: Людмила Данилкина. Кузница кадров (2013.05.21) // «Новгородские ведомости», 2013 | H2: Людмила Данилкина | J2: Кузница кадров | K2: 2013.05.21 | L2: публицистика , нехудожественная | M2: статья | N2: образование | O2: «Новгородские ведомости» | P2: 2013 | Q2: газета | R2: омонимия не снята | S2: Три вышеназванные победительницы полностью согласились с руководителем школы. [Людмила Данилкина. Кузница кадров (2013.05.21) // «Новгородские ведомости», 2013] [омонимия не снята] | T2: 1 | U2: =RAND() -> 0.89385429062235278
A3: итэ анамсйеВ атребоР маволс оП | B3: ирт | C3: По словам Роберта Вейсмана, «эти | D3: три | F3: отдельные компании будут разрабатывать свою | G3: Владимир Гендлин. Разделение концерна Dun & Bradstreet (1996) // «Коммерсантъ-Daily», 1996.01.24 | H3: Владимир Гендлин | J3: Разделение концерна Dun & Bradstreet | K3: 1996 | L3: публицистика , нехудожественная | M3: статья | N3: бизнес, коммерция, экономика, финансы | O3: «Коммерсантъ-Daily» | P3: 1996.01.24 | Q3: газета | R3: омонимия не снята | S3: По словам Роберта Вейсмана, «эти три отдельные компании будут разрабатывать свою стратегию в соответствии с уникальными требованиями их рынков, определять инвестиции, структуру капитала и политику, которые усилят их глобальные возможности. [Владимир Гендлин. Разделение концерна Dun & Bradstreet (1996) // «Коммерсантъ-Daily», 1996.01.24] [омонимия не снята] | T3: 1 | U3: =RAND() -> 0.70129296926886986
A4: оп и асуску огоннив или | B4: евд | C4: или винного уксуса и по | D4: две | F4: столовые ложки измельченных свежих трав | G4: И. Сокольский. «Кислое вино» // «Наука и жизнь», 2006 | H4: И. Сокольский | J4: «Кислое вино» | K4: 2006 | L4: публицистика , нехудожественная | M4: статья | N4: дом и домашнее хозяйство | O4: «Наука и жизнь» | P4: 2006 | Q4: журнал | R4: омонимия не снята | S4: Для приготовления в домашних условиях облагороженного «уксуса четырех разбойников» по старинной технологии нужно взять 1 л натурального яблочного или винного уксуса и по две столовые ложки измельченных свежих трав лаванды, розмарина, шалфея, полыни, руты и мяты. [И. Сокольский. «Кислое вино» // «Наука и жизнь», 2006] [омонимия не снята] | T4: 1 | U4: =RAND() -> 0.42959067677267715
A5: итэ имындерв и имындзарп имьдюл | B5: ирт | C5: людьми праздными и вредными; эти | D5: три | F5: несчастные существа стали на моей | G5: Г. И. Успенский. Новые времена (1873) | H5: Г. И. Успенский | I5: 1843 | J5: Новые времена | K5: 1873 | L5: художественная | M5: очерк, цикл | O5: Успенский Г. И. Собрание сочинений в девяти томах. Том 3 | P5: 1956 | Q5: книга | R5: омонимия не снята | S5: Я видел, что, повинуясь движению собственного сердца и покидая ребят, я с минуты отъезда из деревни делаю сразу трех человек, могущих быть честными людьми, людьми праздными и вредными; эти три несчастные существа стали на моей дороге, загородили мне путь, и я должен бы был спихнуть их, отогнать от себя, чтобы открыть себе путь туда, куда мне надо… [Г. И. Успенский. Новые времена (1873)] [омонимия не снята] | T5: 1 | U5: =RAND() -> 0.41516262393292358
A6: ан ясьтадапсар теаничан ымад йовокиП | B6: ирт | C6: Пиковой дамы» начинает распадаться на | D6: три | F6: субъектные сферы [Виноградов 1980: 208 | G6: Е. В. Падучева. В. В. Виноградов и наука о языке художественной прозы (1995) | H6: Е. В. Падучева | I6: 1935 | J6: В. В. Виноградов и наука о языке художественной прозы | K6: 1995 | L6: учебно-научная , нехудожественная | M6: статья | N6: наука и технологии, филология | O6: Е. В. Падучева. Статьи разных лет | P6: 2009 | Q6: книга | R6: омонимия не снята | S6: Виноградов говорит о том, что мир «Пиковой дамы» начинает распадаться на три субъектные сферы [Виноградов 1980: 208] (соответствующие языковым сознаниям трех субъектов — старой графини, Лизы и Германна), но это распадение предотвращается четвертым сознанием — повествователем. [Е. В. Падучева. В. В. Виноградов и наука о языке художественной прозы (1995)] [омонимия не снята] | T6: 1 | U6: =RAND() -> 0.10080070469102154
A7: ьтаксупыв тюатичопдерп илетидовзиорп еынневтсечетО | B7: ирт | C7: Отечественные производители предпочитают выпускать | D7: три | F7: основные категории майонеза: провансаль, оливковый | G7: Игорь Сокольский. Услада гурманов и «спаситель» домохозяек // «Наука и жизнь», 2009 | H7: Игорь Сокольский | J7: Услада гурманов и «спаситель» домохозяек | K7: 2009 | L7: производственно-техническая , нехудожественная | M7: статья | N7: производство, легкая и пищевая промышленность | O7: «Наука и жизнь» | P7: 2009 | Q7: журнал | R7: омонимия не снята | S7: Отечественные производители предпочитают выпускать три основные категории майонеза: провансаль, оливковый и лёгкий. [Игорь Сокольский. Услада гурманов и «спаситель» домохозяек // «Наука и жизнь», 2009] [омонимия не снята] | T7: 1 | U7: =RAND() -> 0.85163974437995837
A8: олиледыв ынбуД адорог ытищазцос еинелварпУ | B8: евд | C8: Управление соцзащиты города Дубны выделило | D8: две | F8: бесплатные путевки «Мать и дитя | G8: Людмила Пирогова. Пресс-служба сообщает (2003) // «Встреча» (Дубна), 2003.06.25 | H8: Людмила Пирогова | J8: Пресс-служба сообщает | K8: 2003 | L8: публицистика , нехудожественная | M8: статья | N8: политика и общественная жизнь | O8: «Встреча» (Дубна) | P8: 2003.06.25 | Q8: газета | R8: омонимия не снята | S8: Управление соцзащиты города Дубны выделило две бесплатные путевки «Мать и дитя» в одну из подмосковных здравниц семьям из малообеспеченных семей. [Людмила Пирогова. Пресс-служба сообщает (2003) // «Встреча» (Дубна), 2003.06.25] [омонимия не снята] | T8: 1 | U8: =RAND() -> 0.4814890744941005
A9: яндогес отч ясляедан я он | B9: евд | C9: но я надеялся, что сегодня | D9: две | F9: золотые награды выиграют наши ребята | G9: Андрей Митьков. Триумф методиста. Впечатления от выступления российской команды на чемпионате мира по греко-римской борьбе (2002) // «Известия», 2002.09.22 | H9: Андрей Митьков | J9: Триумф методиста. Впечатления от выступления российской команды на чемпионате мира по греко-римской борьбе | K9: 2002 | L9: публицистика , нехудожественная | M9: статья | N9: спорт | O9: «Известия» | P9: 2002.09.22 | Q9: газета | R9: омонимия не снята | S9: «Пусть шведы не обижаются, но я надеялся, что сегодня две золотые награды выиграют наши ребята, ― признался Карелин. [Андрей Митьков. Триумф методиста. Впечатления от выступления российской команды на чемпионате мира по греко-римской борьбе (2002) // «Известия», 2002.09.22] [омонимия не снята] | T9: 1 | U9: =RAND() -> 0.27695459046456539
A10: есв отч ьтаджревту йинавонсо ончотатсод | B10: ирт | C10: достаточно оснований утверждать, что все | D10: три | F10: великие державы Евразии, формируя свою | G10: А. Яковлев. Треугольнику Россия ― Китай ― Индия нужна стратегия дальних рубежей (2002) // «Проблемы Дальнего Востока», 2002.10.28 | H10: А. Яковлев | J10: Треугольнику Россия ― Китай ― Индия нужна стратегия дальних рубежей | K10: 2002 | L10: учебно-научная , нехудожественная | M10: статья | N10: политика и общественная жизнь | O10: «Проблемы Дальнего Востока» | P10: 2002.10.28 | Q10: журнал | R10: омонимия не снята | S10: И есть достаточно оснований утверждать, что все три великие державы Евразии, формируя свою внешнеполитическую стратегию, ныне все еще ориентируются не столько на жесткие долгосрочные политические и военные вызовы глобализации, сколько на потенциальные возможности, которые она пока открывает для ускорения темпов и повышения качественного содержания их экономического развития. [А. Яковлев. Треугольнику Россия ― Китай ― Индия нужна стратегия дальних рубежей (2002) // «Проблемы Дальнего Востока», 2002.10.28] [омонимия не снята] | T10: 1 | U10: =RAND() -> 0.19354108631492339
A11: дазан тядохто атигрет ог 8 | B11: евд | C11: 8-го тергита отходят назад | D11: две | F11: нечеткие, темные полоски, которые иногда | G11: Л. Жильцова. Веснянки (plecoptera). Группа euholognatha (2003) | H11: Л. Жильцова | J11: Веснянки (plecoptera). Группа euholognatha | K11: 2003 | L11: учебно-научная , нехудожественная | M11: монография | N11: наука и технологии, биология | O11: Л. Жильцова. Веснянки (plecoptera). Группа euholognatha | P11: 2003 | Q11: книга | R11: омонимия не снята | S11: От склеротизованных переднебоковых частей 8-го тергита отходят назад две нечеткие, темные полоски, которые иногда бывают более четкими, а иногда отсутствуют. [Л. Жильцова. Веснянки (plecoptera). Группа euholognatha (2003)] [омонимия не снята] | T11: 1 | U11: =RAND() -> 0.41243552375414971
A12: лиледыв дороГ | B12: ирт | C12: Город выделил | D12: три | F12: государственные структуры в качестве учредителей | G12: Дмитрий Соколов-Митрич. Рынок с пробкой (2002) // «Известия», 2002.10.28 | H12: Дмитрий Соколов-Митрич | J12: Рынок с пробкой | K12: 2002 | L12: публицистика , нехудожественная | M12: статья | N12: бизнес, коммерция, экономика, финансы | O12: «Известия» | P12: 2002.10.28 | Q12: газета | R12: омонимия не снята | S12: Город выделил три государственные структуры в качестве учредителей. [Дмитрий Соколов-Митрич. Рынок с пробкой (2002) // «Известия», 2002.10.28] [омонимия не снята] | T12: 1 | U12: =RAND() -> 0.97642741209562356
A13: тсор ьсев ов иляотс ихрик | B13: евд | C13: кирхи стояли во весь рост | D13: две | F13: гипсовые фигуры святых: святой Петр | G13: Георгий Жженов. Прожитое (2002) | H13: Георгий Жженов | I13: 1915 | J13: Прожитое | K13: 2002 | L13: публицистика , нехудожественная | M13: мемуары | O13: Георгий Жженов. Прожитое | P13: 2002 | Q13: книга | R13: омонимия не снята | S13: В нишах на фасадной стене кирхи стояли во весь рост две гипсовые фигуры святых: святой Петр и святой Павел. [Георгий Жженов. Прожитое (2002)] [омонимия не снята] | T13: 1 | U13: =RAND() -> 0.46424692328196948
B14: евД | D14: Две | F14: американские мечты и другие Игорь | G14: Игорь Сирин. Две американские мечты и другие (2004) // «Бизнес-журнал», 2004.01.22 | H14: Игорь Сирин | J14: Две американские мечты и другие | K14: 2004 | L14: публицистика , нехудожественная | M14: отчет | N14: техника | O14: «Бизнес-журнал» | P14: 2004.01.22 | Q14: журнал | R14: омонимия не снята | S14: Две американские мечты и другие Игорь Сирин [Игорь Сирин. Две американские мечты и другие (2004) // «Бизнес-журнал», 2004.01.22] [омонимия не снята] | T14: 1 | U14: =RAND() -> 0.12293154405828055
A15: ьсилянс артсекро и йечер хынзепмоп | B15: ирт | C15: помпезных речей и оркестра, снялись | D15: три | F15: фотонные ракеты типа «Хиус» и | G15: Аркадий Стругацкий, Борис Стругацкий. Страна багровых туч (1952-1957) | H15: Аркадий Стругацкий, Борис Стругацкий | I15: 1925, 1933 | J15: Страна багровых туч | K15: 1952-1957 | L15: художественная | M15: роман | P15: 2004 | Q15: книга | R15: омонимия не снята | S15: Восемнадцать месяцев назад, примерно в те дни, когда ты отдувался на экзаменах, с межпланетной базы «Циолковский» по приказу Краюхина, без помпезных речей и оркестра, снялись три фотонные ракеты типа «Хиус» и с интервалом в полтора часа одна за другой ринулись в розовое марево венерианской атмосферы. [Аркадий Стругацкий, Борис Стругацкий. Страна багровых туч (1952-1957)] [омонимия не снята] | T15: 1 | U15: =RAND() -> 0.13252945860311827
B16: ирТ | D16: Три | F16: крохотные крупинки шоколадной стружки выглядят | G16: Катя Метелица. Капуччино капут (1997) // «Столица», 1997.11.24 | H16: Катя Метелица | J16: Капуччино капут | K16: 1997 | L16: публицистика , нехудожественная | M16: заметка | N16: политика и общественная жизнь | O16: «Столица» | P16: 1997.11.24 | Q16: журнал | R16: омонимия не снята | S16: Три крохотные крупинки шоколадной стружки выглядят на этом белоснежном фоне почти греховно. [Катя Метелица. Капуччино капут (1997) // «Столица», 1997.11.24] [омонимия не снята] | T16: 1 | U16: =RAND() -> 0.31656985794768655
A17: лешан я йедюл яадюлбаН | B17: ирт | C17: Наблюдая людей я нашел | D17: три | F17: различные рода отношения к религиозным | G17: Л. Н. Толстой. О значении христианской религии (1875-1876) | H17: Л. Н. Толстой | I17: 1828 | J17: О значении христианской религии | K17: 1875-1876 | L17: публицистика , нехудожественная | M17: статья | N17: религия | O17: Л. Н. Толстой. Полное собрание сочинений в 90 томах, том 17 | P17: 1956 | Q17: книга | R17: омонимия не снята | S17: Наблюдая людей я нашел три различные рода отношения к религиозным вопросам. [Л. Н. Толстой. О значении христианской религии (1875-1876)] [омонимия не снята] | T17: 1 | U17: =RAND() -> 0.67931879152655483
A18: иляотс еньлапс в а иицнарФ | B18: евд | C18: Франции, а в спальне стояли | D18: две | F18: никелированные кровати супругов, тоже французские | G18: Лидия Вертинская. Синяя птица любви (2004) | H18: Лидия Вертинская | I18: 1923 | J18: Синяя птица любви | K18: 2004 | L18: публицистика , нехудожественная | M18: мемуары | O18: Лидия Вертинская. Синяя птица любви | P18: 2004 | Q18: книга | R18: омонимия не снята | S18: Помню также, что на кухне Игнатьевых было много медной посуды, привезенной из Франции, а в спальне стояли две никелированные кровати супругов, тоже французские. [Лидия Вертинская. Синяя птица любви (2004)] [омонимия не снята] | T18: 1 | U18: =RAND() -> 0.17850594359156391
A19: еж ет есв улгу мовел | B19: ирт | C19: левом углу все те же | D19: три | F19: загадочные буквы «Р.В.С | G19: А. П. Гайдар. Р. В. С (1925) | H19: А. П. Гайдар | I19: 1904 | J19: Р. В. С | K19: 1925 | L19: художественная | M19: рассказ | O19: А. Гайдар. Собр. соч.: В 3 т. Том 1 | P19: 1986 | Q19: книга | R19: омонимия не снята | S19: Дежурный посмотрел на Жигана, развернул записку и, заметив в левом углу все те же три загадочные буквы «Р.В.С.» [А. П. Гайдар. Р. В. С (1925)] [омонимия не снята] | T19: 1 | U19: =RAND() -> 0.87669432770752653
B20: ирТ | D20: Три | F20: маленькие стрижки выстроились чинно в | G20: Л. А. Чарская. Приютки (1907) | H20: Л. А. Чарская | I20: 1875 | J20: Приютки | K20: 1907 | L20: художественная | M20: повесть | O20: Лидия Чарская. Полное собрание сочинений. Т. 21 | P20: 2007 | Q20: книга | R20: омонимия не снята | S20: Три маленькие стрижки выстроились чинно в ряд. [Л. А. Чарская. Приютки (1907)] [омонимия не снята] | T20: 1 | U20: =RAND() -> 0.47451781022410389
A21: удог 4102 в яинежитсоД | B21: евД | C21: Достижения в 2014 году | D21: Две | F21: золотые медали Олимпийских игр. Александр | G21: Вера Михайлова, Мария Цырулева. Лучший спортсмен 2014 года // «Русский репортер», 2014 | H21: Вера Михайлова, Мария Цырулева | J21: Лучший спортсмен 2014 года | K21: 2014 | L21: публицистика, нехудожественная | M21: заметка | N21: спорт | O21: «Русский репортер» | P21: 2014 | Q21: журнал | R21: омонимия не снята | S21: Достижения в 2014 году Две золотые медали Олимпийских игр. Александр Зубков и Алексей Воевода [Вера Михайлова, Мария Цырулева. Лучший спортсмен 2014 года // «Русский репортер», 2014] [омонимия не снята] | T21: 1 | U21: =RAND() -> 6.7790468950848171E-2
A22: а ешьнар как евд ен | B22: ерытеч | C22: не две, как раньше, а | D22: четыре | F22: горизонтальные просечки белого цвета. | G22: Дмитрий Гронский. Ваши шесть соток (2002) // «Автопилот», 2002.10.15 | H22: Дмитрий Гронский | J22: Ваши шесть соток | K22: 2002 | L22: публицистика , нехудожественная | M22: статья | N22: техника | O22: «Автопилот» | P22: 2002.10.15 | Q22: журнал | R22: омонимия не снята | S22: Задние фонари из красного стекла получили не две, как раньше, а четыре горизонтальные просечки белого цвета. [Дмитрий Гронский. Ваши шесть соток (2002) // «Автопилот», 2002.10.15] [омонимия не снята] | T22: 1 | U22: =RAND() -> 0.60634761710223728
A23: олыб и ирт в ьсалитарверп | B23: ирт | C23: превратилась в три, и было | D23: три | F23: голубые коробки и три чужие | G23: Константин Воробьев. Крик (1962) | H23: Константин Воробьев | I23: 1919 | J23: Крик | K23: 1962 | L23: художественная | M23: повесть | O23: Константин Воробьев. Это мы, Господи!. | P23: 2005 | Q23: книга | R23: омонимия не снята | S23: Там были две сигареты, и я ухватил одну, и в моих пальцах она превратилась в три, и было три голубые коробки и три чужие руки, – глаза заплакали сами без меня. [Константин Воробьев. Крик (1962)] [омонимия не снята] | T23: 1 | U23: =RAND() -> 0.48112172950708487
A24: есв сензиб йыньлибом йиксйиссор шан | B24: ирт | C24: наш российский мобильный бизнес, все | D24: три | F24: крупные компании и «Теле-2 | G24: Евгения Обухова, Евгений Огородников. Пермский артефакт // «Эксперт», 2013 | H24: Евгения Обухова, Евгений Огородников | J24: Пермский артефакт | K24: 2013 | L24: публицистика, нехудожественная | M24: статья | N24: техника, электроника, бизнес, коммерция, экономика, финансы | O24: «Эксперт» | P24: 2013 | Q24: журнал | R24: омонимия не снята | S24: Больше того, если говорить о компетенции, о профессиональном уровне, то наш российский мобильный бизнес, все три крупные компании и «Теле-2», ― очень качественный с маркетинговой, с рыночной, с производственной точки зрения. [Евгения Обухова, Евгений Огородников. Пермский артефакт // «Эксперт», 2013] [омонимия не снята] | T24: 1 | U24: =RAND() -> 0.23231065407437068
A25: илелодоерП | B25: ирт | C25: Преодолели | D25: три | F25: несложные шиверы и через час | G25: В. Митрофанов. Верховья Чулышмана (1975) | H25: В. Митрофанов | J25: Верховья Чулышмана | K25: 1975 | L25: публицистика , нехудожественная | M25: очерк | N25: природа, путешествия, спорт | O25: «Ветер странствий», Альманах, выпуск десятый | P25: 1975 | Q25: альманах | R25: омонимия не снята | S25: Преодолели три несложные шиверы и через час сплава подошли к высокой светлой стенке, началу длинного каньона перед поселком Язулу. [В. Митрофанов. Верховья Чулышмана (1975)] [омонимия не снята] | T25: 1 | U25: =RAND() -> 0.40702053629568025
A26: ыботч еж мот О | B26: евд | C26: О том же, чтобы | D26: две | E26: « | F26: регулярные» бригады попытались пробиться сами | G26: Армен Асриян. Театр, лобио и демократия (2003) // «Спецназ России», 2003.03.15 | H26: Армен Асриян | J26: Театр, лобио и демократия | K26: 2003 | L26: публицистика , нехудожественная | M26: статья | N26: частная жизнь | O26: «Спецназ России» | P26: 2003.03.15 | Q26: газета | R26: омонимия не снята | S26: О том же, чтобы две «регулярные» бригады попытались пробиться сами, и речи не заходило… [Армен Асриян. Театр, лобио и демократия (2003) // «Спецназ России», 2003.03.15] [омонимия не снята] | T26: 1 | U26: =RAND() -> 0.6280326185602072
A27: митемтО | B27: евд | C27: Отметим | D27: две | F27: важные вещи в этом анализе | G27: Артур Штильман. «Любите ли вы Вагнера?» (2003) // «Вестник США», 2003.09.03 | H27: Артур Штильман | J27: «Любите ли вы Вагнера?» | K27: 2003 | L27: публицистика , нехудожественная | M27: статья | N27: частная жизнь | O27: «Вестник США» | P27: 2003.09.03 | Q27: газета | R27: омонимия не снята | S27: Отметим две важные вещи в этом анализе творчества Вагнера. [Артур Штильман. «Любите ли вы Вагнера?» (2003) // «Вестник США», 2003.09.03] [омонимия не снята] | T27: 1 | U27: =RAND() -> 0.94179541857986582
A28: он онтяоревеН | B28: ирт | C28: Невероятно, но | D28: три | F28: разрозненные пешки показывают фантастическую силу | G28: В. Тихомирова. Не будем спешить! // «Работница», 1980 | H28: В. Тихомирова | J28: Не будем спешить! | K28: 1980 | L28: публицистика, нехудожественная | M28: статья | N28: спорт | O28: «Работница» | P28: 1980 | Q28: журнал | R28: омонимия не снята | S28: Невероятно, но три разрозненные пешки показывают фантастическую силу. [В. Тихомирова. Не будем спешить! // «Работница», 1980] [омонимия не снята] | T28: 1 | U28: =RAND() -> 3.8444889832632612E-2
A29: И уробыв умеовс оп нидо | B29: ирт | C29: один по своему выбору. И | D29: три | F29: п-пары носков. И учти | G29: Константин Симонов. Так называемая личная жизнь/ Мы не увидимся с тобой... (1978) | H29: Константин Симонов | I29: 1915 | J29: Так называемая личная жизнь/ Мы не увидимся с тобой... | K29: 1978 | L29: художественная | M29: повесть | O29: Симонов К. М. Собр. соч.: В 10 т. Т.7 | P29: 1982 | Q29: книга | R29: омонимия не снята | S29: ― Положи один по своему выбору. И три п-пары носков. И учти, что мне п-пора. [Константин Симонов. Так называемая личная жизнь/ Мы не увидимся с тобой... (1978)] [омонимия не снята] | T29: 1 | U29: =RAND() -> 0.82593109760169181
A30: алитявсоп яиссоР яакстевоС еж ат | B30: ирт | C30: та же «Советская Россия» посвятила | D30: три | F30: большие статьи разоблачению этого дельца | G30: Геннадий Трофимов. Правительственное поручение, или реквием по АНТу // «Огонек». № 5, 1991 | H30: Геннадий Трофимов | J30: Правительственное поручение, или реквием по АНТу | K30: 1991 | L30: публицистика , нехудожественная | M30: статья | N30: бизнес, коммерция, экономика, финансы, право, политика и общественная жизнь | O30: «Огонек». № 5 | P30: 1991 | Q30: журнал | R30: омонимия не снята | S30: После того, как в августе 1988 года та же «Советская Россия» посвятила три большие статьи разоблачению этого дельца? [Геннадий Трофимов. Правительственное поручение, или реквием по АНТу // «Огонек». № 5, 1991] [омонимия не снята] | T30: 1 | U30: =RAND() -> 0.44633775208028936
A31: тсадто и тежакс ларкУ | B31: евд | C31: «Украл», ― скажет и отдаст | D31: две | F31: пустые бутылки обратно. | G31: Валентин Распутин. Дочь Ивана, мать Ивана (2003) // «Наш современник», 2003.11.15 | H31: Валентин Распутин | I31: 1937 | J31: Дочь Ивана, мать Ивана | K31: 2003 | L31: художественная | M31: повесть | O31: «Наш современник» | P31: 2003.11.15 | Q31: журнал | R31: омонимия не снята | S31: «Украл», ― скажет и отдаст две пустые бутылки обратно. [Валентин Распутин. Дочь Ивана, мать Ивана (2003) // «Наш современник», 2003.11.15] [омонимия не снята] | T31: 1 | U31: =RAND() -> 0.15464487246824299
B32: евД | D32: Две | F32: открытые автостоянки на 300 автомобилей | G32: Алла Смирнова. Путешествие на родину Деда Мороза. Проект парка развлечений под Великим Устюгом (2002) // «Ландшафтный дизайн», 2002.01.15 | H32: Алла Смирнова | J32: Путешествие на родину Деда Мороза. Проект парка развлечений под Великим Устюгом | K32: 2002 | L32: учебно-научная , нехудожественная | M32: статья | N32: путешествия | O32: «Ландшафтный дизайн» | P32: 2002.01.15 | Q32: журнал | R32: омонимия не снята | S32: Две открытые автостоянки на 300 автомобилей и 10 автобусов вынесены за автомагистраль. [Алла Смирнова. Путешествие на родину Деда Мороза. Проект парка развлечений под Великим Устюгом (2002) // «Ландшафтный дизайн», 2002.01.15] [омонимия не снята] | T32: 1 | U32: =RAND() -> 0.88581928611796168
A33: итсеворп ямерв еешйажилб в ынереман | B33: ирт | C33: намерены в ближайшее время провести | D33: три | F33: крупные политические акции. | G33: Дмитрий Чернов. Левые не хотят колоться (2003) // «Время МН», 2003.05.26 | H33: Дмитрий Чернов | J33: Левые не хотят колоться | K33: 2003 | L33: публицистика , нехудожественная | M33: статья | N33: политика и общественная жизнь | O33: «Время МН» | P33: 2003.05.26 | Q33: газета | R33: омонимия не снята | S33: Коммунисты намерены в ближайшее время провести три крупные политические акции. [Дмитрий Чернов. Левые не хотят колоться (2003) // «Время МН», 2003.05.26] [омонимия не снята] | T33: 1 | U33: =RAND() -> 0.89158335397710498
A34: тюувтсещус екиткарп йоворим в ьнед | B34: евд | C34: день в мировой практике существуют | D34: две | F34: структурные модели реализации коммуникационной стратегии | G34: Александра Новикова. Государство должно иметь свой голос (2003) // «Независимая газета», 2003.04.28 | H34: Александра Новикова | J34: Государство должно иметь свой голос | K34: 2003 | L34: публицистика , нехудожественная | M34: интервью | N34: политика и общественная жизнь | O34: «Независимая газета» | P34: 2003.04.28 | Q34: газета | R34: омонимия не снята | S34: На сегодняшний день в мировой практике существуют две структурные модели реализации коммуникационной стратегии государства. [Александра Новикова. Государство должно иметь свой голос (2003) // «Независимая газета», 2003.04.28] [омонимия не снята] | T34: 1 | U34: =RAND() -> 0.77307013103781941
A35: 1 | B35: ирТ | C35: 1. | D35: Три | F35: эволюционные группы Parvovirinae. Представлен анализ | G35: В. В. Лукашов, J. Goudsmit. Роль стабилизирующего и расщепляющего отбора в эволюции вирусов семейств Parvoviridae и Astroviridae (2004) // «Вопросы вирусологии», 2004.01.05 | H35: В. В. Лукашов, J. Goudsmit | J35: Роль стабилизирующего и расщепляющего отбора в эволюции вирусов семейств Parvoviridae и Astroviridae | K35: 2004 | L35: учебно-научная , нехудожественная | M35: статья | N35: наука и технологии, здоровье и медицина | O35: «Вопросы вирусологии» | P35: 2004.01.05 | Q35: журнал | R35: омонимия не снята | S35: 1. Три эволюционные группы Parvovirinae. Представлен анализ полноразмерных геномов вирусов (р-дистанции), представляющих все индивидуальные виды вирусов подсемейства. [В. В. Лукашов, J. Goudsmit. Роль стабилизирующего и расщепляющего отбора в эволюции вирусов семейств Parvoviridae и Astroviridae (2004) // «Вопросы вирусологии», 2004.01.05] [омонимия не снята] | T35: 1 | U35: =RAND() -> 0.58719017612039703
A36: оп олыб ареноицилим акинтупс ее | B36: евд | C36: ее спутника-милиционера было по | D36: две | F36: маленькие звездочки на погонах. | G36: Даниил Корецкий. Менты не ангелы, но… (2011) | H36: Даниил Корецкий | I36: 1948 | J36: Менты не ангелы, но… | K36: 2011 | L36: художественная | M36: роман | O36: Д. А. Корецкий. Менты не ангелы но… | P36: 2012 | Q36: книга | R36: омонимия не снята | S36: А у ее спутника-милиционера было по две маленькие звездочки на погонах. [Даниил Корецкий. Менты не ангелы, но… (2011)] [омонимия не снята] | T36: 1 | U36: =RAND() -> 0.34066675701474924
A37: итЭ | B37: ирт | C37: Эти | D37: три | F37: знаменательные события произошли в один | G37: Г. С. Эфрон. Дневники. Т. 2 (1941-1943) | H37: Г. С. Эфрон | I37: 1925 | J37: Дневники. Т. 2 | K37: 1941-1943 | L37: бытовая , нехудожественная | M37: дневник, записные книжки | O37: Эфрон Г. Дневники в 2 т | P37: 2004 | Q37: книга | R37: омонимия не снята | S37: Эти три знаменательные события произошли в один и тот же день. [Г. С. Эфрон. Дневники. Т. 2 (1941-1943)] [омонимия не снята] | T37: 1 | U37: =RAND() -> 0.31333756172394356
A38: окьлот илерог онмет олыб ежу | B38: евд | C38: уже было темно, горели только | D38: две | F38: неяркие лампочки в баре. | G38: Анна Берсенева. Полет над разлукой (2003-2005) | H38: Анна Берсенева | J38: Полет над разлукой | K38: 2003-2005 | L38: художественная | M38: роман | O38: Анна Берсенева. Полет над разлукой | P38: 2005 | Q38: книга | R38: омонимия не снята | S38: В зале уже было темно, горели только две неяркие лампочки в баре. [Анна Берсенева. Полет над разлукой (2003-2005)] [омонимия не снята] | T38: 1 | U38: =RAND() -> 0.86999751673496117
A39: а ьвобюл яакилев ее ьтсе | B39: ирт | C39: есть ее великая любовь), а | D39: три | F39: чеховские сестры оказываются эротической фантазией | G39: Алексей Филиппов. Два классика и немного дзэна. Открыл сезон московский театр ОКОЛО (2002) // «Известия», 2002.09.22 | H39: Алексей Филиппов | J39: Два классика и немного дзэна. Открыл сезон московский театр ОКОЛО | K39: 2002 | L39: публицистика , нехудожественная | M39: статья | N39: искусство и культура | O39: «Известия» | P39: 2002.09.22 | Q39: газета | R39: омонимия не снята | S39: Он абсолютно свободен ― и мающаяся в ожидании пылкого друга провинциальная дева вышагивает по сцене, держа над головой огромный портрет Вампилова (можно вообразить, что это и есть ее великая любовь), а три чеховские сестры оказываются эротической фантазией вампиловского героя. [Алексей Филиппов. Два классика и немного дзэна. Открыл сезон московский театр ОКОЛО (2002) // «Известия», 2002.09.22] [омонимия не снята] | T39: 1 | U39: =RAND() -> 0.65039371664698109
A40: лотс ан лунрывш оншудокилев кищропарпдоП | B40: ирт | C40: Подпрапорщик великодушно швырнул на стол | D40: три | F40: серебряные монеты по гривеннику. | G40: А. И. Куприн. Свадьба (1908) | H40: А. И. Куприн | I40: 1870 | J40: Свадьба | K40: 1908 | L40: художественная | M40: рассказ | O40: А. И. Куприн. Собр. соч.: В 9 т. Том 5 | P40: 1972 | Q40: книга | R40: омонимия не снята | S40: Подпрапорщик великодушно швырнул на стол три серебряные монеты по гривеннику. [А. И. Куприн. Свадьба (1908)] [омонимия не снята] | T40: 1 | U40: =RAND() -> 0.75452426049649279
A41: есВ | B41: ирт | C41: Все | D41: три | F41: основные подсистемы социальной реальности тесно | G41: И. М. Савельева, А. В. Полетаев. Знание о прошлом: теория и история. Том 1: Конструирование прошлого (2003) | H41: И. М. Савельева, А. В. Полетаев | I41: 1940-1950 | J41: Знание о прошлом: теория и история. Том 1: Конструирование прошлого | K41: 2003 | L41: учебно-научная , нехудожественная | M41: монография | N41: наука и технологии, история | O41: Савельева И. М., Полетаев А. В. Знание о прошлом: теория и история. — Том 1: Конструирование прошлого. — СПб.: Наука, 2003 | P41: 2003 | Q41: книга | R41: омонимия не снята | S41: Все три основные подсистемы социальной реальности тесно связаны между собой, и речь идет скорее об аналитическом представлении отдельных компонентов, чем о фактическом их разграничении. [И. М. Савельева, А. В. Полетаев. Знание о прошлом: теория и история. Том 1: Конструирование прошлого (2003)] [омонимия не снята] | T41: 1 | U41: =RAND() -> 0.86777230210244083
A42: аЗ | B42: ирт | C42: За | D42: три | F42: протекшие года на цирковой арене | G42: А. В. Чаянов. История парикмахерской куклы, или Последняя любовь московского архитектора М (1918) | H42: А. В. Чаянов | I42: 1888 | J42: История парикмахерской куклы, или Последняя любовь московского архитектора М | K42: 1918 | L42: художественная | M42: повесть | Q42: книга | R42: омонимия не снята | S42: За три протекшие года на цирковой арене вообще не появлялось аналогичных №№, и многие полагали, что сестры в силу какого-либо неблагоприятного стечения обстоятельств потеряли солидных антрепренеров и были вынуждены выступать в третьеразрядных цирках и паноптикумах, не имеющих печатных афиш и не помещающих газетных публикаций. [А. В. Чаянов. История парикмахерской куклы, или Последняя любовь московского архитектора М (1918)] [омонимия не снята] | T42: 1 | U42: =RAND() -> 0.97337203007303241
B43: ирТ | D43: Три | F43: маленькие окна выходят во двор | G43: Л. Н. Андреев. Савва (Ignis sanat). Драма в четырех действиях (1906) | H43: Л. Н. Андреев | I43: 1871 | J43: Савва (Ignis sanat). Драма в четырех действиях | K43: 1906 | L43: художественная | M43: пьеса | O43: Драматические произведения в 2-х томах. Л.: Искусство, 1989, т. 1 | P43: 1989 | Q43: электронный текст | R43: омонимия не снята | S43: Три маленькие окна выходят во двор; видны навесы, телега, какая-то рухлядь. [Л. Н. Андреев. Савва (Ignis sanat). Драма в четырех действиях (1906)] [омонимия не снята] | T43: 1 | U43: =RAND() -> 0.49069357205029895
A44: ан оннемервондо иицидепскэ илмеЗ юиротси | B44: ирт | C44: историю Земли экспедиции одновременно на | D44: три | F44: звездные системы и впервые попытаемся | G44: И. А. Ефремов. Туманность Андромеды (1956) | H44: И. А. Ефремов | I44: 1908 | J44: Туманность Андромеды | K44: 1956 | L44: художественная | M44: роман | Q44: книга | R44: омонимия не снята | S44: Отправим впервые за всю историю Земли экспедиции одновременно на три звездные системы и впервые попытаемся достигнуть миров, находящихся на расстоянии семидесяти световых лет! [И. А. Ефремов. Туманность Андромеды (1956)] [омонимия не снята] | T44: 1 | U44: =RAND() -> 0.59977538425540988
A45: есв отч онтыпобюЛ | B45: ирт | C45: Любопытно, что все | D45: три | F45: острые речи произнесли сотрудники ФБОН | G45: Г. С. Померанц. Записки гадкого утёнка (1998) | H45: Г. С. Померанц | I45: 1918 | J45: Записки гадкого утёнка | K45: 1998 | L45: публицистика , нехудожественная | M45: мемуары | N45: политика и общественная жизнь | O45: Померанц Г. С. Записки гадкого утёнка | P45: 1998 | Q45: книга | R45: омонимия не снята | S45: Любопытно, что все три острые речи произнесли сотрудники ФБОН, библиографы, а не члены официального корпуса советской науки. [Г. С. Померанц. Записки гадкого утёнка (1998)] [омонимия не снята] | T45: 1 | U45: =RAND() -> 0.64634263556492333
A46: ьсилыркс онтарвзовзеб адук еж адут | B46: ирт | C46: туда же, куда безвозвратно скрылись | D46: три | F46: черные недели и регентство Бирона | G46: К. П. Масальский. Регентство Бирона (1834) | H46: К. П. Масальский | I46: 1802 | J46: Регентство Бирона | K46: 1834 | L46: художественная | M46: повесть | O46: Русская историческая повесть первой половины XIX века | P46: 1989 | Q46: книга | R46: омонимия не снята | S46: Старый год улетел туда же, куда безвозвратно скрылись три черные недели и регентство Бирона. [К. П. Масальский. Регентство Бирона (1834)] [омонимия не снята] | T46: 1 | U46: =RAND() -> 0.21952947110687093
A47: муминим как оге меъбо умотэоп | B47: ирт | C47: поэтому объем его ― как минимум | D47: три | F47: суточные нормы водопотребления. | G47: Борис Рудковский. Автономный комфорт (2002) // «Homes & Gardens», 2002.06.20 | H47: Борис Рудковский | J47: Автономный комфорт | K47: 2002 | L47: публицистика , нехудожественная | M47: статья | N47: дом и домашнее хозяйство | O47: «Homes & Gardens» | P47: 2002.06.20 | Q47: журнал | R47: омонимия не снята | S47: Продолжительность нахождения сточных вод в септике должна составлять не менее трех дней, поэтому объем его ― как минимум три суточные нормы водопотребления. [Борис Рудковский. Автономный комфорт (2002) // «Homes & Gardens», 2002.06.20] [омонимия не снята] | T47: 1 | U47: =RAND() -> 0.96671617165249568
A48: туреб от икраваз ливарп ястеасак | B48: евд | C48: касается правил заварки, то берут | D48: две | F48: чайные ложки сухой травы, из | G48: Герман Малиничев. Напиток от тридцати недугов // «Наука и религия», 2007 | H48: Герман Малиничев | J48: Напиток от тридцати недугов | K48: 2007 | L48: публицистика, нехудожественная | M48: заметка | N48: природа, здоровье и медицина | O48: «Наука и религия» | P48: 2007 | Q48: журнал | R48: омонимия не снята | S48: Что касается правил заварки, то берут две чайные ложки сухой травы, из расчета на один стакан воды, и заваривают в подогретом фарфоровом чайничке. [Герман Малиничев. Напиток от тридцати недугов // «Наука и религия», 2007] [омонимия не снята] | T48: 1 | U48: =RAND() -> 0.85358260068098191
A49: иляотс акжортсо огеншедз торов У | B49: евд | C49: У ворот здешнего острожка стояли | D49: две | F49: коренастые болгарки в нацодеждах с | G49: Афанасий Мамедов, Исаак Милькин. Морские рассказы // «Октябрь», 2003 | H49: Афанасий Мамедов, Исаак Милькин | J49: Морские рассказы | K49: 2003 | L49: художественная | M49: рассказ | O49: «Октябрь» | P49: 2003 | Q49: журнал | R49: омонимия не снята | S49: У ворот здешнего острожка стояли две коренастые болгарки в нацодеждах с преобладанием красного цвета и потчевали каждого входящего стаканом вина и куском лепешки. [Афанасий Мамедов, Исаак Милькин. Морские рассказы // «Октябрь», 2003] [омонимия не снята] | T49: 1 | U49: =RAND() -> 0.21158944214015118
B50: ирТ | D50: Три | F50: главные темы в жизни ― Церковь | G50: Борис Любимов. Три главные темы в жизни -- Церковь, литература и театр (2015) | H50: Борис Любимов | I50: 1947 | J50: Три главные темы в жизни -- Церковь, литература и театр | K50: 2015 | L50: публицистика, нехудожественная | M50: интервью | N50: религия, искусство и культура | Q50: книга | R50: омонимия не снята | S50: Три главные темы в жизни ― Церковь, литература и театр [Борис Любимов. Три главные темы в жизни -- Церковь, литература и театр (2015)] [омонимия не снята] | T50: 1 | U50: =RAND() -> 0.96272807069693123
A51: едг ьливедов йищукетоляв отэ ылубаф | B51: евд | C51: фабулы это вялотекущий водевиль, где | D51: две | F51: семейные парочки меняются мужьями, только | G51: Валерий Кичин. Европа наносит ответный удар. Берлинский фестиваль в клетке новых концепций (2002) // «Известия», 2002.02.13 | H51: Валерий Кичин | J51: Европа наносит ответный удар. Берлинский фестиваль в клетке новых концепций | K51: 2002 | L51: публицистика , нехудожественная | M51: статья | N51: искусство и культура | O51: «Известия» | P51: 2002.02.13 | Q51: газета | R51: омонимия не снята | S51: По типу фабулы это вялотекущий водевиль, где две семейные парочки меняются мужьями, только вместо песенок стоит ужасный рев ― режиссер сопрягает смешное с драматичным. [Валерий Кичин. Европа наносит ответный удар. Берлинский фестиваль в клетке новых концепций (2002) // «Известия», 2002.02.13] [омонимия не снята] | T51: 1 | U51: =RAND() -> 0.22003177813886143
A52: ындив октеч енаркэ ан и | B52: евд | C52: и на экране четко видны | D52: две | F52: независимые области попадания пролетевших частиц | G52: Василий Тарасов. Порционный микромир (2004) // «Вокруг света», 2004.07.15 | H52: Василий Тарасов | J52: Порционный микромир | K52: 2004 | L52: публицистика , нехудожественная | M52: статья | N52: наука и технологии | O52: «Вокруг света» | P52: 2004.07.15 | Q52: журнал | R52: омонимия не снята | S52: Когда на щели налетают классические частицы, то каждая проходит заведомо лишь через какую-то одну щель и на экране четко видны две независимые области попадания пролетевших частиц. [Василий Тарасов. Порционный микромир (2004) // «Вокруг света», 2004.07.15] [омонимия не снята] | T52: 1 | U52: =RAND() -> 0.54453176191416475
A53: жА ясьтаводар ен уме ыб | B53: евд | C53: бы ему не радоваться! Аж | D53: две | F53: золотые монетки он сэкономил! И | G53: Елена и Валерий Гордеевы. Не все мы умрем (2002) | H53: Елена и Валерий Гордеевы | J53: Не все мы умрем | K53: 2002 | L53: художественная | M53: роман | O53: Елена и Валерий Гордеевы. Не все мы умрем | P53: 2002 | Q53: книга | R53: омонимия не снята | S53: Еще бы ему не радоваться! Аж две золотые монетки он сэкономил! И охрана по Стране дураков обеспечена, чтобы серную кислоту Карабас Барабас не выпил. [Елена и Валерий Гордеевы. Не все мы умрем (2002)] [омонимия не снята] | T53: 1 | U53: =RAND() -> 0.74129093939402524
A54: ёще илыб мотоП | B54: ирт | C54: Потом были ещё | D54: три | F54: российские цивилизации советского периода. | G54: Денис Драгунский. Изобрази Россию мне! // «Частный корреспондент», 2010 | H54: Денис Драгунский | I54: 1950 | J54: Изобрази Россию мне! | K54: 2010 | L54: публицистика , нехудожественная | M54: статья | N54: политика и общественная жизнь | O54: «Частный корреспондент» | P54: 2010 | Q54: электронное издание | R54: омонимия не снята | S54: Потом были ещё три российские цивилизации советского периода. [Денис Драгунский. Изобрази Россию мне! // «Частный корреспондент», 2010] [омонимия не снята] | T54: 1 | U54: =RAND() -> 0.79257380936623711
A55: а отэ ен олизароп хесв | B55: ирт | C55: всех поразило не это, а | D55: три | F55: посеребренные чаши в форме черепов | G55: Дмитрий Емец. Таня Гроттер и колодец Посейдона (2004) | H55: Дмитрий Емец | I55: 1974 | J55: Таня Гроттер и колодец Посейдона | K55: 2004 | L55: художественная | M55: роман | O55: Дмитрий Емец. Таня Гроттер и колодец Посейдона | P55: 2004 | Q55: книга | R55: омонимия не снята | S55: Однако всех поразило не это, а три посеребренные чаши в форме черепов. [Дмитрий Емец. Таня Гроттер и колодец Посейдона (2004)] [омонимия не снята] | T55: 1 | U55: =RAND() -> 0.62877337216869655
A56: имяинедюлбан имиксечиткаф еыннёджревтдоп он вопицнирп | B56: ирт | C56: принципов, но подтверждённые фактическими наблюдениями | D56: три | F56: различные стрелы времени ― между ними | G56: В. Н. Комаров. Тайны пространства и времени (1995-2000) | H56: В. Н. Комаров | J56: Тайны пространства и времени | K56: 1995-2000 | L56: учебно-научная, нехудожественная | M56: монография | N56: наука и технологии, физика | O56: Комаров В.Н. Тайны пространства и времени | P56: 2000 | Q56: книга | R56: омонимия снята | S56: Однако рассуждения рассуждениями, а поскольку существуют хотя бы и не строго обоснованные на уровне всеобщих принципов, но подтверждённые фактическими наблюдениями три различные стрелы времени ― между ними должна существовать какая-то связь или хотя бы какая-то корреляция. [В. Н. Комаров. Тайны пространства и времени (1995-2000)] [омонимия снята] | T56: 1 | U56: =RAND() -> 7.8657535001440682E-2
A57: ьсилашывзов йогурд аз андО | B57: ирт | C57: Одна за другой возвышались | D57: три | F57: триумфальные арки из проволоки, украшенные | G57: Борис Родоман. Башкирия: начало пути // «Отечественные записки», 2003 | H57: Борис Родоман | J57: Башкирия: начало пути | K57: 2003 | L57: публицистика , нехудожественная | M57: очерк | N57: политика и общественная жизнь | O57: «Отечественные записки» | P57: 2003 | Q57: журнал | R57: омонимия не снята | S57: Одна за другой возвышались три триумфальные арки из проволоки, украшенные воздушными шарами. [Борис Родоман. Башкирия: начало пути // «Отечественные записки», 2003] [омонимия не снята] | T57: 1 | U57: =RAND() -> 0.94236888037947475
A58: ястюаминаз еммаргорп йотэ оП | B58: ирт | C58: По этой программе занимаются | D58: три | F58: учебные группы младших школьников. | G58: Елена Рябова. Школьный театр ― школа театра (2003) // «Театральная жизнь», 2003.05.26 | H58: Елена Рябова | J58: Школьный театр ― школа театра | K58: 2003 | L58: публицистика , нехудожественная | M58: статья | N58: искусство и культура | O58: «Театральная жизнь» | P58: 2003.05.26 | Q58: газета | R58: омонимия не снята | S58: По этой программе занимаются три учебные группы младших школьников. [Елена Рябова. Школьный театр ― школа театра (2003) // «Театральная жизнь», 2003.05.26] [омонимия не снята] | T58: 1 | U58: =RAND() -> 0.11352933825604827
A59: янем у сачйеС | B59: евд | C59: Сейчас у меня | D59: две | F59: маленькие внучки Маша и Даша | G59: Георгий Юдин. Поздравляем с юбилеем! Писателю и художнику Г. Юдину ― 50 лет // «Мурзилка», 2003 | H59: Георгий Юдин | J59: Поздравляем с юбилеем! Писателю и художнику Г. Юдину ― 50 лет | K59: 2003 | L59: публицистика , нехудожественная | M59: автобиография | N59: искусство и культура | O59: «Мурзилка» | P59: 2003 | Q59: журнал | R59: омонимия не снята | S59: Сейчас у меня две маленькие внучки Маша и Даша, а значит, ждут меня их новые вопросы, на которые придётся отвечать новыми книгами. [Георгий Юдин. Поздравляем с юбилеем! Писателю и художнику Г. Юдину ― 50 лет // «Мурзилка», 2003] [омонимия не снята] | T59: 1 | U59: =RAND() -> 0.66441598006438918
A60: д т и тнегиллетни ахурт | B60: ирТ | C60: труха интеллигент и т. д. | D60: Три | F60: основные категории писательские наметил. Листочки | G60: Д. А. Фурманов. Из дневников (1926) | H60: Д. А. Фурманов | I60: 1891 | J60: Из дневников | K60: 1926 | L60: публицистика , нехудожественная | M60: дневник, записные книжки | N60: политика и общественная жизнь, частная жизнь | O60: Фурманов Д. А. Рассказы. Повести. Заметки о литературе | P60: 1984 | Q60: книга | R60: омонимия не снята | S60: То же проделал с поэтами и критиками: поставил стержневые фигуры, наиболее характерные: сложившийся, начинающий, даровитый, бездарный, страстный, вялый, рабочий, старая труха интеллигент и т. д. Три основные категории писательские наметил. Листочки разложил в три груды: бел (летристы), поэты, критики. [Д. А. Фурманов. Из дневников (1926)] [омонимия не снята] | T60: 1 | U60: =RAND() -> 0.28741832543384316
A61: едг итсалбо йоксволдревС атнемалрап харобыв | B61: ирт | C61: выборах парламента Свердловской области, где | D61: три | F61: криминальные группировки пытались мочить друг | G61: Виталий Цепляев. В предвкушении схватки // «Аргументы и факты», 2003 | H61: Виталий Цепляев | J61: В предвкушении схватки | K61: 2003 | L61: публицистика , нехудожественная | M61: статья | N61: политика и общественная жизнь | O61: «Аргументы и факты» | P61: 2003 | Q61: газета | R61: омонимия не снята | S61: Как, например, на выборах парламента Свердловской области, где три криминальные группировки пытались мочить друг друга «по понятиям». [Виталий Цепляев. В предвкушении схватки // «Аргументы и факты», 2003] [омонимия не снята] | T61: 1 | U61: =RAND() -> 0.59503710030255297
A62: ьтиледыв онжом хяиволсу хикат В | B62: ирт | C62: В таких условиях можно выделить | D62: три | F62: основные группы предпосылок, определяющих качество | G62: Игорь Максимцев, Ольга Адамова. Наша «Alma Mater» — прекрасный современный образовательный «полигон» для получения качественных образовательных услуг // Coach, 2008 | H62: Игорь Максимцев, Ольга Адамова | J62: Наша «Alma Mater» — прекрасный современный образовательный «полигон» для получения качественных образовательных услуг | K62: 2008 | L62: публицистика, нехудожественная | M62: беседа | N62: образование, администрация и управление, бизнес, коммерция, экономика, финансы | O62: Coach | P62: 2008 | Q62: журнал | R62: омонимия не снята | S62: В таких условиях можно выделить три основные группы предпосылок, определяющих качество экономического образования: [Игорь Максимцев, Ольга Адамова. Наша «Alma Mater» — прекрасный современный образовательный «полигон» для получения качественных образовательных услуг // Coach, 2008] [омонимия не снята] | T62: 1 | U62: =RAND() -> 0.34289334460198884
A63: иланзирп ытрепскэ имынсапозеб еж еелобиаН | B63: евд | C63: Наиболее же безопасными эксперты признали | D63: две | F63: последние модели Volvo ― S60 и | G63: Владимир Салмин. Маленький ― не значит беззащитный. Рейтинг безопасности легковых автомобилей (2001) // «Известия», 2001.10.18 | H63: Владимир Салмин | J63: Маленький ― не значит беззащитный. Рейтинг безопасности легковых автомобилей | K63: 2001 | L63: публицистика , нехудожественная | M63: статья | N63: политика и общественная жизнь | O63: «Известия» | P63: 2001.10.18 | Q63: газета | R63: омонимия не снята | S63: Наиболее же безопасными эксперты признали две последние модели Volvo ― S60 и S80, которые получили максимальные оценки. [Владимир Салмин. Маленький ― не значит беззащитный. Рейтинг безопасности легковых автомобилей (2001) // «Известия», 2001.10.18] [омонимия не снята] | T63: 1 | U63: =RAND() -> 3.9681751298084489E-2
A64: олыб ЛМ у отсем еоннепетсоротв | B64: ирт | C64: второстепенное место, у МЛ было | D64: три | F64: основные области занятий: теория стиха | G64: Вадим Баевский. Сорок лет // «Знамя», 2007 | H64: Вадим Баевский | I64: 1929 | J64: Сорок лет | K64: 2007 | L64: публицистика , нехудожественная | M64: мемуары | N64: частная жизнь | O64: «Знамя» | P64: 2007 | Q64: журнал | R64: омонимия не снята | S64: * * * Кроме разных побочных интересов, занимавших в его деятельности явно второстепенное место, у МЛ было три основные области занятий: теория стиха, классическая филология, перевод. [Вадим Баевский. Сорок лет // «Знамя», 2007] [омонимия не снята] | T64: 1 | U64: =RAND() -> 0.10193162913477138
A65: ьтиледыв онжом юивтсешсиорп умонброксирп умотэ | B65: евд | C65: этому «прискорбному происшествию», можно выделить | D65: две | F65: возможные причины подобного республиканского бунта | G65: Иван Преображенский. Лоскутное одеяло «Единой России» (2003) // «ПОЛИТКОМ. РУ», 2003.05.21 | H65: Иван Преображенский | J65: Лоскутное одеяло «Единой России» | K65: 2003 | L65: публицистика , нехудожественная | M65: статья | N65: политика и общественная жизнь | O65: «ПОЛИТКОМ. РУ» | P65: 2003.05.21 | Q65: электронное издание | R65: омонимия не снята | S65: Опираясь на события, сопутствующие этому «прискорбному происшествию», можно выделить две возможные причины подобного республиканского бунта. [Иван Преображенский. Лоскутное одеяло «Единой России» (2003) // «ПОЛИТКОМ. РУ», 2003.05.21] [омонимия не снята] | T65: 1 | U65: =RAND() -> 0.47923488096246136
A66: итэ сачйес И | B66: ирт | C66: И сейчас эти | D66: три | F66: старые выдры могли видеть все | G66: Виктор Пелевин. Любовь к трем цукербринам (2014) | H66: Виктор Пелевин | I66: 1962 | J66: Любовь к трем цукербринам | K66: 2014 | L66: художественная | M66: роман | O66: Пелевин В. О. Любовь к трем цукербринам | P66: 2014 | Q66: книга | R66: омонимия не снята | S66: И сейчас эти три старые выдры могли видеть все его физиологические характеристики ― давление, потоотделение, температуру, пульс, эрекцию. [Виктор Пелевин. Любовь к трем цукербринам (2014)] [омонимия не снята] | T66: 1 | U66: =RAND() -> 1.5574174257531936E-2
A67: иламинс огокснодекаМ идюЛ | B67: ирт | C67: Люди Македонского снимали | D67: три | F67: роскошные виллы в пригороде Афин | G67: Вероника Кочина. За кулисами гламура // «Криминальный отдел», 2010 | H67: Вероника Кочина | J67: За кулисами гламура | K67: 2010 | L67: публицистика, нехудожественная | M67: статья | N67: криминал | O67: «Криминальный отдел» | P67: 2010 | Q67: журнал | R67: омонимия не снята | S67: Люди Македонского снимали три роскошные виллы в пригороде Афин Лангониси. [Вероника Кочина. За кулисами гламура // «Криминальный отдел», 2010] [омонимия не снята] | T67: 1 | U67: =RAND() -> 0.59907429641090015
A68: зереч асаЧ | B68: ирт | C68: Часа через | D68: три | F68: величественный простор Сан-Марко был | G68: Дина Рубина. Окна (2011) | H68: Дина Рубина | I68: 1953 | J68: Окна | K68: 2011 | L68: художественная | M68: рассказ | O68: Дина Рубина. Окна | P68: 2012 | Q68: книга | R68: омонимия не снята | S68: Часа через три величественный простор Сан-Марко был устлан белой молодой пеленой, а снег все летел и летел, заштриховывая собор и колокольню, выдувая с площади прохожих, выметая их из-за колонн и аркад. [Дина Рубина. Окна (2011)] [омонимия не снята] | T68: 1 | U68: =RAND() -> 0.52031065936441445
A69: отч онтяноп умокясВ | B69: ирт | C69: Всякому понятно, что | D69: три | F69: кавалерийские дивизии не могут заменить | G69: А. А. Брусилов. Воспоминания (1923) | H69: А. А. Брусилов | I69: 1853 | J69: Воспоминания | K69: 1923 | L69: публицистика , нехудожественная | M69: мемуары | N69: армия и вооруженные конфликты | O69: Брусилов А. А. Воспоминания | P69: 1963 | Q69: книга | R69: омонимия не снята | S69: Всякому понятно, что три кавалерийские дивизии не могут заменить собой четыре армейских корпуса, как бы эти дивизии не были геройски настроены. [А. А. Брусилов. Воспоминания (1923)] [омонимия не снята] | T69: 1 | U69: =RAND() -> 0.37914639426121144
A70: аклеб огонротпецер ылукелом толсиконима 053 | B70: ирт | C70: 350 аминокислот молекулы рецепторного белка | D70: три | F70: наружные петли соединяются с тремя | G70: В. Майоров. Восприятие запахов // «Наука и жизнь», 2007 | H70: В. Майоров | J70: Восприятие запахов | K70: 2007 | L70: учебно-научная , нехудожественная | M70: статья | N70: наука и технологии, биология | O70: «Наука и жизнь» | P70: 2007 | Q70: журнал | R70: омонимия не снята | S70: У содержащей 300-350 аминокислот молекулы рецепторного белка три наружные петли соединяются с тремя внутриклеточными петлями семью пересекающими мембрану трансмембранными участками. [В. Майоров. Восприятие запахов // «Наука и жизнь», 2007] [омонимия не снята] | T70: 1 | U70: =RAND() -> 0.37979357930737923
A71: ынаворидивкил илыб ешьнар имадог ямувД | B71: евд | C71: Двумя годами раньше были ликвидированы | D71: две | F71: головные фабрики Levi Strauss в | G71: Владимир Ляпоров. Контракт нерезидента (2004) // «Бизнес-журнал», 2004.03.03 | H71: Владимир Ляпоров | J71: Контракт нерезидента | K71: 2004 | L71: публицистика , нехудожественная | M71: статья | N71: бизнес, коммерция, экономика, финансы | O71: «Бизнес-журнал» | P71: 2004.03.03 | Q71: журнал | R71: омонимия не снята | S71: Двумя годами раньше были ликвидированы две головные фабрики Levi Strauss в Блу-Ридже (штат Джорджия) и Пауэлле (штат Теннесси). [Владимир Ляпоров. Контракт нерезидента (2004) // «Бизнес-журнал», 2004.03.03] [омонимия не снята] | T71: 1 | U71: =RAND() -> 0.93138364572830135
A72: илавовтсйед ьседз хадог 8061 7061 | B72: ирт | C72: 1607-1608 годах здесь действовали | D72: три | F72: старые кузницы и появилась одна | G72: И. Грачева. Твердость металла и нежность цветка // «Наука и жизнь», 2007 | H72: И. Грачева | J72: Твердость металла и нежность цветка | K72: 2007 | L72: публицистика , нехудожественная | M72: статья | N72: наука и технологии, история | O72: «Наука и жизнь» | P72: 2007 | Q72: журнал | R72: омонимия не снята | S72: Скупой язык документов повествует, как Павлово из земледельческого селения быстро превращалось в кустарное: в 1607-1608 годах здесь действовали три старые кузницы и появилась одна новая, к 1621 году их было уже 11, а к 1677-му ― 38. [И. Грачева. Твердость металла и нежность цветка // «Наука и жизнь», 2007] [омонимия не снята] | T72: 1 | U72: =RAND() -> 0.32479293364105288
A73: и еендолох еовдв итчоп олимолаз | B73: евд | C73: заломило почти вдвое холоднее, и | D73: две | F73: паяльные лампы никак не могли | G73: Андрей Коткин. А теперь — горбатая! (2013.04.12) // «Новгородские ведомости», 2013 | H73: Андрей Коткин | J73: А теперь — горбатая! | K73: 2013.04.12 | L73: публицистика , нехудожественная | M73: статья | N73: природа, администрация и управление | O73: «Новгородские ведомости» | P73: 2013 | Q73: газета | R73: омонимия не снята | S73: Как хочешь, так и думай, но вместо минус пятнадцати ночью заломило почти вдвое холоднее, и две паяльные лампы никак не могли исправить морозное воздействие на топливо в «Зубрёнке». [Андрей Коткин. А теперь — горбатая! (2013.04.12) // «Новгородские ведомости», 2013] [омонимия не снята] | T73: 1 | U73: =RAND() -> 0.369036440847613
B74: ирТ | D74: Три | F74: стеклянные двери вели из гостиной | G74: В. Ф. Ходасевич. Державин (1929-1931) | H74: В. Ф. Ходасевич | I74: 1886 | J74: Державин | K74: 1929-1931 | L74: публицистика , учебно-научная , нехудожественная | M74: биография | N74: искусство и культура | O74: Ходасевич В. Ф. Державин | P74: 1988 | Q74: книга | R74: омонимия не снята | S74: Три стеклянные двери вели из гостиной на широкую полукруглую лестницу, по которой спускались в сад, раскинутый позади всего дома. [В. Ф. Ходасевич. Державин (1929-1931)] [омонимия не снята] | T74: 1 | U74: =RAND() -> 0.11193852960204609
A75: теавиклатс но мымас мет ызатину | B75: евд | C75: унитазы, тем самым он сталкивает | D75: две | F75: социокультурные направляющие и провоцирует определенное | G75: Елена Квятковская. Филипп Старк ставит мыльную оперу (2004) // «Мир & Дом. City», 2004.07.15 | H75: Елена Квятковская | J75: Филипп Старк ставит мыльную оперу | K75: 2004 | L75: публицистика , нехудожественная | M75: статья | N75: строительство и архитектура | O75: «Мир & Дом. City» | P75: 2004.07.15 | Q75: журнал | R75: омонимия не снята | S75: И когда в 2004 году Филипп Старк сажает барочных певцов в парадных туалетах на унитазы, тем самым он сталкивает две социокультурные направляющие и провоцирует определенное раздражение. [Елена Квятковская. Филипп Старк ставит мыльную оперу (2004) // «Мир & Дом. City», 2004.07.15] [омонимия не снята] | T75: 1 | U75: =RAND() -> 1.0964457934772298E-3
A76: адгоК | B76: евд | C76: [Ирида, nick] Когда | D76: две | F76: светские дамы обсуждали образ жизни | G76: коллективный. Форум: Обсуждение фильма «Война и Мир» (2007-2011) | H76: коллективный | J76: Форум: Обсуждение фильма «Война и Мир» | K76: 2007-2011 | L76: электронная коммуникация , нехудожественная | M76: форум | N76: досуг, зрелища и развлечения, искусство и культура | O76: Интернет | Q76: электронный текст | R76: омонимия не снята | S76: [Ирида, nick] Когда две светские дамы обсуждали образ жизни Кирилла Безухова в молодости, одна из них сказала: «Как старик был хорош! [коллективный. Форум: Обсуждение фильма «Война и Мир» (2007-2011)] [омонимия не снята] | T76: 1 | U76: =RAND() -> 0.14735087019055393
B77: ирТ | D77: Три | F77: последние армии противостояли нашим ударным | G77: А. И. Деникин. Очерки русской смуты. Том I. Крушение власти и армии (1921) | H77: А. И. Деникин | I77: 1872 | J77: Очерки русской смуты. Том I. Крушение власти и армии | K77: 1921 | L77: публицистика , нехудожественная | M77: очерк, цикл | N77: армия и вооруженные конфликты | O77: А. И. Деникин. Очерки русской смуты | P77: 1921 | Q77: книга | R77: омонимия не снята | S77: Три последние армии противостояли нашим ударным корпусам. [А. И. Деникин. Очерки русской смуты. Том I. Крушение власти и армии (1921)] [омонимия не снята] | T77: 1 | U77: =RAND() -> 0.94366496239769559
A78: ьсилыркто мишан мазалг дорог в | B78: ирт | C78: в город глазам нашим открылись | D78: три | F78: странные массы гор, непохожих ни | G78: И. А. Гончаров. Фрегат «Паллада» (1855) | H78: И. А. Гончаров | I78: 1812 | J78: Фрегат «Паллада» | K78: 1855 | L78: художественная | M78: очерк, цикл | O78: И. А. Гончаров. Фрегат «Паллада» | P78: 1986 | Q78: книга | R78: омонимия не снята | S78: Задолго до въезда в город глазам нашим открылись три странные массы гор, непохожих ни на одну из виденных нами. [И. А. Гончаров. Фрегат «Паллада» (1855)] [омонимия не снята] | T78: 1 | U78: =RAND() -> 0.6621868097294259
A79: удив зи ьтаксупу теуделс ен | B79: евд | C79: не следует упускать из виду | D79: две | F79: важные точки зрения в этой | G79: Александр Малинкин. Освобождение труда, идея социализма и социал-демократия // «Отечественные записки», 2003 | H79: Александр Малинкин | J79: Освобождение труда, идея социализма и социал-демократия | K79: 2003 | L79: публицистика , нехудожественная | M79: статья | N79: политика и общественная жизнь | O79: «Отечественные записки» | P79: 2003 | Q79: журнал | R79: омонимия не снята | S79: Поэтому, думается мне, нам отнюдь не следует упускать из виду две важные точки зрения в этой борьбе. [Александр Малинкин. Освобождение труда, идея социализма и социал-демократия // «Отечественные записки», 2003] [омонимия не снята] | T79: 1 | U79: =RAND() -> 0.19118760495463616
A80: ым иледиваз адохорап олоко онняотсоп | B80: ирт | C80: постоянно около парохода, завидели мы | D80: три | F80: большие спины китов, бросавших фонтаны | G80: А. П. Боголюбов. Записки моряка-художника (1888) | H80: А. П. Боголюбов | I80: 1824 | J80: Записки моряка-художника | K80: 1888 | L80: публицистика , нехудожественная | M80: мемуары | N80: частная жизнь | O80: «Волга» | P80: 1996 | Q80: книга | R80: омонимия не снята | S80: Пройдя 46 суток, ловя крюком с бараниной акул и касаток, скакавших постоянно около парохода, завидели мы три большие спины китов, бросавших фонтаны. [А. П. Боголюбов. Записки моряка-художника (1888)] [омонимия не снята] | T80: 1 | U80: =RAND() -> 0.96458441675415418
A81: илыб ым илыВ | B81: ирт | C81: Выли мы, были | D81: три | F81: старшие девочки Конопацких, ― Люба, Катя | G81: В. В. Вересаев. Воспоминания (1925-1935) | H81: В. В. Вересаев | I81: 1867 | J81: Воспоминания | K81: 1925-1935 | L81: публицистика , нехудожественная | M81: мемуары | O81: В. В. Вересаев «Воспоминания». Госполитиздат, 1946 | P81: 1946 | Q81: книга | R81: омонимия не снята | S81: Выли мы, были три старшие девочки Конопацких, ― Люба, Катя и Наташа. [В. В. Вересаев. Воспоминания (1925-1935)] [омонимия не снята] | T81: 1 | U81: =RAND() -> 0.80136455002326246
A82: есв отч умотоп отсорпен олыб | B82: ирт | C82: было непросто, потому что все | D82: три | F82: одиночные камеры к тому времени | G82: Владимир Войнович. Жизнь и необычайные приключения солдата Ивана Чонкина (1969-1975) | H82: Владимир Войнович | I82: 1932 | J82: Жизнь и необычайные приключения солдата Ивана Чонкина | K82: 1969-1975 | L82: художественная | M82: роман | O82: Владимир Войнович. Жизнь и приключения солдата Чонкина | P82: 2000 | Q82: книга | R82: омонимия не снята | S82: Исполнить это приказание Курятникову было непросто, потому что все три одиночные камеры к тому времени были заняты: в одной помещалась каптерка, в другой Курятников держал собственную корову, третью он же за пятнадцать рублей в месяц сдавал вольнонаемному Тухватуллину с семьей из шести человек. [Владимир Войнович. Жизнь и необычайные приключения солдата Ивана Чонкина (1969-1975)] [омонимия не снята] | T82: 1 | U82: =RAND() -> 0.11017086758444727
A83: лачемто воримохиТ Л | B83: евд | C83: Л. Тихомиров отмечал | D83: две | F83: существенные особенности России, которые неблагоприятны | G83: Борис Ключников. Либеральная эпидемия и здоровый протекционизм (2004) // «Наш современник», 2004.10.15 | H83: Борис Ключников | J83: Либеральная эпидемия и здоровый протекционизм | K83: 2004 | L83: публицистика , нехудожественная | M83: статья | N83: бизнес, коммерция, экономика, финансы | O83: «Наш современник» | P83: 2004.10.15 | Q83: журнал | R83: омонимия не снята | S83: Л. Тихомиров отмечал две существенные особенности России, которые неблагоприятны для внешней торговли: удаленность от морских путей и суровый климат. [Борис Ключников. Либеральная эпидемия и здоровый протекционизм (2004) // «Наш современник», 2004.10.15] [омонимия не снята] | T83: 1 | U83: =RAND() -> 0.47342615872408111
A84: И | B84: евд | C84: И | D84: две | F84: школьные тетради со стихами собственного | G84: Герман Садулаев. Шалинский рейд (2009) // «Знамя», 2010 | H84: Герман Садулаев | I84: 1973 | J84: Шалинский рейд | K84: 2009 | L84: художественная | M84: роман | O84: «Знамя» | P84: 2010 | Q84: журнал | R84: омонимия не снята | S84: И две школьные тетради со стихами собственного сочинения. [Герман Садулаев. Шалинский рейд (2009) // «Знамя», 2010] [омонимия не снята] | T84: 1 | U84: =RAND() -> 0.55424124618482118
A85: йишваминаз авелоГ ледто йикьнелам и | B85: ирт | C85: и маленький отдел Голева, занимавший | D85: три | F85: сквозные комнаты на втором этаже | G85: Анна Матвеева. Голев и Кастро. Приключения гастарбайтера // «Звезда», 2002 | H85: Анна Матвеева | J85: Голев и Кастро. Приключения гастарбайтера | K85: 2002 | L85: художественная | M85: повесть | O85: «Звезда» | P85: 2002 | Q85: журнал | R85: омонимия не снята | S85: Собственно, института уже почти и не было ― только кабинет директора Колобуева и маленький отдел Голева, занимавший три сквозные комнаты на втором этаже. [Анна Матвеева. Голев и Кастро. Приключения гастарбайтера // «Звезда», 2002] [омонимия не снята] | T85: 1 | U85: =RAND() -> 0.73462481858020023
A86: и акинчотси ирТ еьтатс йонзоицнетерп | B86: ирт | C86: претенциозной статье «Три источника и | D86: три | F86: составные части либерализма» один просвещенный | G86: Денис Пирогов. Голодное брюхо к свободам глухо // «Независимая газета», 2003 | H86: Денис Пирогов | J86: Голодное брюхо к свободам глухо | K86: 2003 | L86: публицистика , нехудожественная | M86: статья | N86: политика и общественная жизнь | O86: «Независимая газета» | P86: 2003 | Q86: газета | R86: омонимия не снята | S86: На заре реформ в претенциозной статье «Три источника и три составные части либерализма» один просвещенный мегалозавр без затей отобразил образ мыслей наших реформаторов: «правительство берет на себя реализацию всяческих псевдоправ вроде социальной защиты. [Денис Пирогов. Голодное брюхо к свободам глухо // «Независимая газета», 2003] [омонимия не снята] | T86: 1 | U86: =RAND() -> 0.50281745378736731
B87: ирТ | D87: Три | F87: маленькие яхточки дрейфовали в тумане | G87: Виктор Конецкий. Начало конца комедии (1978) | H87: Виктор Конецкий | I87: 1929 | J87: Начало конца комедии | K87: 1978 | L87: художественная | M87: рассказ, цикл | O87: Конецкий В. Начало конца комедии | P87: 1978 | Q87: книга | R87: омонимия не снята | S87: Три маленькие яхточки дрейфовали в тумане, связанные тросом. [Виктор Конецкий. Начало конца комедии (1978)] [омонимия не снята] | T87: 1 | U87: =RAND() -> 0.93246595676270005
A88: ьтавиртамссар автсдовзиорподус огонвитартсинимда екдяроп в | B88: ерытеч | C88: в порядке административного судопроизводства рассматривать | D88: четыре | F88: основные группы дел. | G88: И. В. Панова. Административное судопроизводство ― вид судопроизводства в Российской Федерации (2003) // «Арбитражный и гражданский процессы», 2003.02.24 | H88: И. В. Панова | J88: Административное судопроизводство ― вид судопроизводства в Российской Федерации | K88: 2003 | L88: учебно-научная , нехудожественная | M88: статья | N88: наука и технологии, право | O88: «Арбитражный и гражданский процессы» | P88: 2003.02.24 | Q88: журнал | R88: омонимия не снята | S88: Ю.А. Тихомиров предлагает в порядке административного судопроизводства рассматривать четыре основные группы дел. [И. В. Панова. Административное судопроизводство ― вид судопроизводства в Российской Федерации (2003) // «Арбитражный и гражданский процессы», 2003.02.24] [омонимия не снята] | T88: 1 | U88: =RAND() -> 0.88634288617162316
A89: йынтсевзиен | B89: ирТ | C89: неизвестный. | D89: Три | F89: художественные выставки Московский союз советских | G89: Три художественные выставки (1951.05.08) // «Советское искусство», № 37 (1321), 1951 | J89: Три художественные выставки | K89: 1951.05.08 | L89: публицистика , нехудожественная | M89: информационное сообщение | N89: искусство и культура | O89: «Советское искусство», № 37 (1321) | P89: 1951 | Q89: газета | R89: омонимия не снята | S89: неизвестный. Три художественные выставки Московский союз советских художников открывает на-днях в Доме художника выставку работ московских художников-женщин. [Три художественные выставки (1951.05.08) // «Советское искусство», № 37 (1321), 1951] [омонимия не снята] | T89: 1 | U89: =RAND() -> 0.45310565833060612
A90: окьлот тюувтсещус имав с ым | B90: евд | C90: мы с вами, существуют только | D90: две | F90: наводящие ужас болезни: кариес и | G90: Вера Елгаева. А, B, C, D - гепатит (2002) // «100% здоровья», 2002.12.11 | H90: Вера Елгаева | J90: А, B, C, D - гепатит | K90: 2002 | L90: публицистика , нехудожественная | M90: статья | N90: здоровье и медицина | O90: «100% здоровья» | P90: 2002.12.11 | Q90: журнал | R90: омонимия не снята | S90: Известно, что для потребителей телевизионной рекламы, коими являемся мы с вами, существуют только две наводящие ужас болезни: кариес и СПИД. [Вера Елгаева. А, B, C, D - гепатит (2002) // «100% здоровья», 2002.12.11] [омонимия не снята] | T90: 1 | U90: =RAND() -> 0.94868908858204959
B91: евД | D91: Две | F91: следующие гонки прошли на очень | G91: Вадим Степанов. Семидесятые! (2001) // «Формула», 2001.12.15 | H91: Вадим Степанов | J91: Семидесятые! | K91: 2001 | L91: публицистика , нехудожественная | M91: статья | N91: спорт | O91: «Формула» | P91: 2001.12.15 | Q91: журнал | R91: омонимия не снята | S91: Две следующие гонки прошли на очень быстрых трассах. [Вадим Степанов. Семидесятые! (2001) // «Формула», 2001.12.15] [омонимия не снята] | T91: 1 | U91: =RAND() -> 0.31907577585392222
A92: илыб ежот яилотанА у монатипак | B92: ерытеч | C92: капитаном, у Анатолия тоже были | D92: четыре | F92: маленькие звездочки на погонах ― мастер | G92: Лев Корнешов. Газета (2000) | H92: Лев Корнешов | I92: 1924 | J92: Газета | K92: 2000 | L92: художественная | M92: роман | O92: Лев Корнешов. Газета | P92: 2000 | Q92: книга | R92: омонимия не снята | S92: Страхов был в прошлой своей службе майором, Юрий ― капитаном, у Анатолия тоже были четыре маленькие звездочки на погонах ― мастер восточных единоборств, выбивает 48 из 50 из пистолета на тридцать метров. [Лев Корнешов. Газета (2000)] [омонимия не снята] | T92: 1 | U92: =RAND() -> 0.36453488802260758
A93: иречод ецинссалкитясед лазамв как олшорп | B93: евд | C93: прошло, как вмазал десятикласснице дочери | D93: две | F93: размашистые пощечины за: «А я | G93: Александр Терехов. Каменный мост (1997-2008) | H93: Александр Терехов | I93: 1966 | J93: Каменный мост | K93: 1997-2008 | L93: художественная | M93: роман | O93: А. Терехов. Каменный мост | P93: 2009 | Q93: книга | R93: омонимия не снята | S93: И еще (предполагали все) он должен повестись на любовь ― любовь не признавал заслуживающей императорского внимания, «это для баб», но сталкивался с ней в самых неожиданных местах ― трех месяцев не прошло, как вмазал десятикласснице дочери две размашистые пощечины за: «А я люблю его!» [Александр Терехов. Каменный мост (1997-2008)] [омонимия не снята] | T93: 1 | U93: =RAND() -> 0.23912544850772233
B94: ирТ | D94: Три | F94: сборные команды СССР и две | G94: Г. Тиновицкий. Прошальный круг Москвина (1971) // «Советский спорт», 1971.06.10 | H94: Г. Тиновицкий | J94: Прошальный круг Москвина | K94: 1971 | L94: публицистика , нехудожественная | M94: статья | N94: спорт | O94: «Советский спорт» | P94: 1971.06.10 | Q94: газета | R94: омонимия не снята | S94: Три сборные команды СССР и две молодежные должны были показать свое умение. [Г. Тиновицкий. Прошальный круг Москвина (1971) // «Советский спорт», 1971.06.10] [омонимия не снята] | T94: 1 | U94: =RAND() -> 0.4988562240516905
A95: илыб отЭ ыноротс в ьсилателзар | B95: евд | C95: разлетались в стороны. Это были | D95: две | F95: разные философии жизни. Одни жили | G95: Виктор Ремизов. Воля вольная // «Новый мир», 2013 | H95: Виктор Ремизов | I95: 1958 | J95: Воля вольная | K95: 2013 | L95: художественная | M95: роман | O95: «Новый мир» | P95: 2013 | Q95: журнал | R95: омонимия не снята | S95: Они боялись даже там, где это не имело смысла: какая-нибудь некрупная самочка кижуча, защищая гнездо, смело бросалась на голодную стаю гольцов, и те разлетались в стороны. Это были две разные философии жизни. Одни жили и спасались по мелочи, другие жертвовали собой, и это делало их сильными. [Виктор Ремизов. Воля вольная // «Новый мир», 2013] [омонимия не снята] | T95: 1 | U95: =RAND() -> 0.33228409548243754
A96: ынелвонатсу и атетимокмихсоГ и МСКЛВ | B96: ирт | C96: ВЛКСМ и Госхимкомитета и установлены | D96: три | F96: денежные премии в размере 15 | G96: Г. Уваров. Комсомол, в поход за большую химию // «Техника - молодежи», 1959 | H96: Г. Уваров | J96: Комсомол, в поход за большую химию | K96: 1959 | L96: публицистика , нехудожественная | M96: статья | N96: производство | O96: «Техника - молодежи» | P96: 1959 | Q96: журнал | R96: омонимия не снята | S96: Для поощрения лучших коллективов учреждено переходящее Красное знамя ЦК ВЛКСМ и Госхимкомитета и установлены три денежные премии в размере 15, 10 и 5 тыс. руб. [Г. Уваров. Комсомол, в поход за большую химию // «Техника - молодежи», 1959] [омонимия не снята] | T96: 1 | U96: =RAND() -> 0.88684623700053877
A97: ливатсереп ламудоп мотоП | B97: евд | C97: Потом подумал, переставил | D97: две | F97: последние цифры местами, и получилось | G97: Владислав Быков, Ольга Деркач. Книга века (2000) | H97: Владислав Быков, Ольга Деркач | J97: Книга века | K97: 2000 | L97: публицистика , нехудожественная | M97: монография | N97: политика и общественная жизнь | O97: Быков В., Деркач В. В. Книга века | P97: 2001 | Q97: книга | R97: омонимия не снята | S97: Потом подумал, переставил две последние цифры местами, и получилось название «1984». [Владислав Быков, Ольга Деркач. Книга века (2000)] [омонимия не снята] | T97: 1 | U97: =RAND() -> 0.68031102774015828
A98: зобо ан отч огондрагреира то | B98: ирт | C98: от ариергардного, что на обоз | D98: три | F98: великие толпы делают нападение, а | G98: [И. И. Михельсон]. Военно-походный журнал командира карательного корпуса подполковника Михельсона И. И (1774) // , | H98: [И. И. Михельсон] | I98: 1740 | J98: Военно-походный журнал командира карательного корпуса подполковника Михельсона И. И | K98: 1774 | L98: официально-деловая , нехудожественная | M98: дневник, записные книжки | N98: армия и вооруженные конфликты | Q98: электронное издание | R98: омонимия не снята | S98: В самое то время, как получены от офицеров репорты: от ариергардного, что на обоз три великие толпы делают нападение, а от пехотнаго, что идет на него прямо толпа не менее тысячи. [[И. И. Михельсон]. Военно-походный журнал командира карательного корпуса подполковника Михельсона И. И (1774) // , ] [омонимия не снята] | T98: 1 | U98: =RAND() -> 0.41893491873359245
A99: еще ястюялвяоп акитэоП хакинробс в | B99: евд | C99: в сборниках «Поэтика» появляются еще | D99: две | F99: важные работы Гуковского, в которых | G99: В. М. Живов. XVIII век в работах Г. А. Гуковского, не загубленных советским хроносом (2000) | H99: В. М. Живов | I99: 1950 | J99: XVIII век в работах Г. А. Гуковского, не загубленных советским хроносом | K99: 2000 | L99: учебно-научная , нехудожественная | M99: статья | N99: наука и технологии, филология | O99: Гуковский Г. А. Ранние работы по истории русской поэзии ХVIII века | P99: 2001 | Q99: книга | R99: омонимия не снята | S99: После публикации «Русской поэзии XVIII века» в сборниках «Поэтика» появляются еще две важные работы Гуковского, в которых он старается определить характер русского классицизма. [В. М. Живов. XVIII век в работах Г. А. Гуковского, не загубленных советским хроносом (2000)] [омонимия не снята] | T99: 1 | U99: =RAND() -> 4.8202133138949055E-2
A100: как иклитсдоп еынняверед хи ьмезан | B100: ирт | C100: наземь их деревянные подстилки, как | D100: три | F100: громовые ракеты возвестили нечто новое | G100: В. П. Авенариус. Гоголь-гимназист (1897) | H100: В. П. Авенариус | I100: 1839 | J100: Гоголь-гимназист | K100: 1897 | L100: художественная | M100: повесть | Q100: электронный текст | R100: омонимия не снята | S100: И точно: едва потухли оба солнца и грохнули наземь их деревянные подстилки, как три громовые ракеты возвестили нечто новое. [В. П. Авенариус. Гоголь-гимназист (1897)] [омонимия не снята] | T100: 1 | U100: =RAND() -> 0.43438844999427517
A101: хыроток зи ырыд еылгурк ерытеч | B101: евд | C101: четыре круглые дыры, из которых | D101: две | F101: большие были рассчитаны на присоединение | G101: Д. Меркулов. Трудный день слухового аппарата // «Наука и жизнь», 2007 | H101: Д. Меркулов | J101: Трудный день слухового аппарата | K101: 2007 | L101: публицистика , нехудожественная | M101: статья | N101: здоровье и медицина, техника | O101: «Наука и жизнь» | P101: 2007 | Q101: журнал | R101: омонимия не снята | S101: Крышка стола в торце имела четыре круглые дыры, из которых две большие были рассчитаны на присоединение сужающихся гибких воздуховодов с наконечниками для ушей. [Д. Меркулов. Трудный день слухового аппарата // «Наука и жизнь», 2007] [омонимия не снята] | T101: 1 | U101: =RAND() -> 0.46493045510495867
A102: угенс оп витречорп алзечси ежу | B102: евд | C102: уже исчезла, прочертив по снегу | D102: две | F102: свежие черные борозды. | G102: Ирина Безладнова. Дина // «Звезда», 2003 | H102: Ирина Безладнова | J102: Дина | K102: 2003 | L102: художественная | M102: повесть | O102: «Звезда» | P102: 2003 | Q102: журнал | R102: омонимия не снята | S102: В драйвее весело поблескивала на солнце ледяной коркой ее «тойота», а машина Антона уже исчезла, прочертив по снегу две свежие черные борозды. [Ирина Безладнова. Дина // «Звезда», 2003] [омонимия не снята] | T102: 1 | U102: =RAND() -> 0.87308044764751802
A103: илшыв унецс ан юидолем юунжен | B103: евд | C103: нежную мелодию на сцену вышли | D103: две | F103: симпатичные молодые девушки в прозрачных | G103: Виктор Доценко. Тридцатого уничтожить! (2000) | H103: Виктор Доценко | I103: 1946 | J103: Тридцатого уничтожить! | K103: 2000 | L103: художественная | M103: роман | O103: Виктор Доценко. Тридцатого уничтожить! | P103: 2000 | Q103: книга | R103: омонимия не снята | S103: Под нежную мелодию на сцену вышли две симпатичные молодые девушки в прозрачных костюмах, стилизованных под мужские. [Виктор Доценко. Тридцатого уничтожить! (2000)] [омонимия не снята] | T103: 1 | U103: =RAND() -> 0.50163315391118113
B104: ерытеЧ | D104: Четыре | F104: вертикальные связки из разноцветных бумажных | G104: Леонид Зорин. Юдифь (2008) // «Знамя», 2009 | H104: Леонид Зорин | I104: 1924 | J104: Юдифь | K104: 2008 | L104: художественная | M104: повесть | O104: «Знамя» | P104: 2009 | Q104: журнал | R104: омонимия не снята | S104: Четыре вертикальные связки из разноцветных бумажных фонариков нас отделяют от прочих гостей. [Леонид Зорин. Юдифь (2008) // «Знамя», 2009] [омонимия не снята] | T104: 1 | U104: =RAND() -> 0.62320412671343983