Sheet: Результаты поиска
A1: окьлот ледялгзар иинещевсо моксда в | B1: авд | C1: в адском освещении разглядел только | D1: два | E1: gen | F1: темных пятна. | G1: n | H1: Денис Тихий. Умляуты // «Сибирские огни», 2013 | I1: Денис Тихий | J1: 1974 | K1: Умляуты | L1: 2013 | M1: художественная | N1: рассказ | P1: «Сибирские огни» | Q1: 2013 | R1: журнал | S1: омонимия не снята | T1: ― Ага, ― сказал я, хотя в адском освещении разглядел только два темных пятна. [Денис Тихий. Умляуты // «Сибирские огни», 2013] [омонимия не снята] | U1: 1 | V1: 0.8843514531105221
A2: ястюялварпто ьнед йыджак уфУ в | B2: авд | C2: в Уфу каждый день отправляются | D2: два | E2: gen | F2: прямых поезда. | G2: m | H2: Артем Русакович. Уфа // «Русский репортер», № 15 (143), 22-29 апреля 2010, 2010 | I2: Артем Русакович | K2: Уфа | L2: 2010 | M2: бытовая , нехудожественная | N2: статья | O2: путешествия, досуг, зрелища и развлечения | P2: «Русский репортер», № 15 (143), 22-29 апреля 2010 | Q2: 2010 | R2: журнал | S2: омонимия не снята | T2: С Казанского вокзала Москвы в Уфу каждый день отправляются два прямых поезда. [Артем Русакович. Уфа // «Русский репортер», № 15 (143), 22-29 апреля 2010, 2010] [омонимия не снята] | U2: 1 | V2: 0.92824710385315523
B3: авД | D3: Два | E3: gen | F3: нынешних главных драйвера рынка ― кроссоверы | G3: m | H3: Алексей Грамматчиков. Не стагнация, а стабилизация // «Эксперт», 2013 | I3: Алексей Грамматчиков | K3: Не стагнация, а стабилизация | L3: 2013 | M3: публицистика, нехудожественная | N3: статья | O3: транспорт, бизнес, коммерция, экономика, финансы | P3: «Эксперт» | Q3: 2013 | R3: журнал | S3: омонимия не снята | T3: Два нынешних главных драйвера рынка ― кроссоверы и бюджетные автомобили размерного класса B. Согласно данным компании «Рольф», за 2012 год доля кроссоверов на российском рынке увеличилась на 8, 4%, до 28, 4%. [Алексей Грамматчиков. Не стагнация, а стабилизация // «Эксперт», 2013] [омонимия не снята] | U3: 1 | V3: 0.960004914040125
A4: екпек в киратс лешодоП | B4: авд | C4: Подошел старик в кепке, | D4: два | E4: gen | F4: худеньких мальчика, ровесники Кирилла, какие-то | G4: m | H4: Д. В. Бавильский. Чужое солнце (2012) | I4: Д. В. Бавильский | J4: 1969 | K4: Чужое солнце | L4: 2012 | M4: публицистика , нехудожественная | N4: очерк | O4: путешествия | P4: Д. В. Бавильский. Чужое солнце | Q4: 2012 | R4: книга | S4: омонимия не снята | T4: Подошел старик в кепке, два худеньких мальчика, ровесники Кирилла, какие-то тетки с авоськами, возвращавшиеся из невидимых магазинов, мужики с сильными, жилистыми руками. [Д. В. Бавильский. Чужое солнце (2012)] [омонимия не снята] | U4: 1 | V4: 0.13280664453976443
A5: илялватсдерп ямерв от в акинремакос | B5: авд | C5: сокамерника в то время представляли | D5: два | E5: gen | F5: противоположных крыла социал-демократии: Вышинский был | G5: n | H5: Дмитрий Митюрин. Прокуроры от дьявола // «Криминальный отдел», 2012 | I5: Дмитрий Митюрин | K5: Прокуроры от дьявола | L5: 2012 | M5: публицистика, нехудожественная | N5: статья | O5: история, криминал | P5: «Криминальный отдел» | Q5: 2012 | R5: журнал | S5: омонимия не снята | T5: Оба сокамерника в то время представляли два противоположных крыла социал-демократии: Вышинский был меньшевиком, а его будущий хозяин ― большевиком-ленинцем. [Дмитрий Митюрин. Прокуроры от дьявола // «Криминальный отдел», 2012] [омонимия не снята] | U5: 1 | V5: 3.8827930846965231E-3
A6: ынелову илыб ыботч етеуберт ыв | B6: авд | C6: вы требуете, чтобы были уволены | D6: два | E6: gen | F6: реакционных профессора. | G6: m | H6: Вадим Баевский. Table-talk // «Знамя», 2011 | I6: Вадим Баевский | J6: 1929 | K6: Table-talk | L6: 2011 | M6: публицистика , нехудожественная | N6: заметка, цикл | O6: частная жизнь | P6: «Знамя» | Q6: 2011 | R6: журнал | S6: омонимия не снята | T6: Далее вы требуете, чтобы были уволены два реакционных профессора. [Вадим Баевский. Table-talk // «Знамя», 2011] [омонимия не снята] | U6: 1 | V6: 0.5295123629057148
A7: и ьнед ылокоторп ан йынняретоп | B7: авд | C7: потерянный на протоколы день и | D7: два | E7: gen | F7: смятых крыла. | G7: n | H7: Дмитрий Губин. Жизнь в противотоке // «Огонек», 2013 | I7: Дмитрий Губин | J7: 1964 | K7: Жизнь в противотоке | L7: 2013 | M7: публицистика, нехудожественная | N7: статья | O7: право, администрация и управление | P7: «Огонек» | Q7: 2013 | R7: журнал | S7: омонимия не снята | T7: Потому как долгое ожидание полиции, потерянный на протоколы день и два смятых крыла. [Дмитрий Губин. Жизнь в противотоке // «Огонек», 2013] [омонимия не снята] | U7: 1 | V7: 0.89939430785369989
A8: нидо утертроп умотэ ьтавовтстевтоос тудуб | B8: авд | C8: будут соответствовать этому портрету один- | D8: два | E8: gen | F8: костромских музыканта-рок-н-ролльщика | G8: m | H8: Александр Зябликов. Провинциальная столица // «Сибирские огни», 2013 | I8: Александр Зябликов | J8: 1963 | K8: Провинциальная столица | L8: 2013 | M8: публицистика, нехудожественная | N8: очерк | O8: частная жизнь | P8: «Сибирские огни» | Q8: 2013 | R8: журнал | S8: омонимия не снята | T8: Что ж, пожалуй, будут соответствовать этому портрету один-два костромских музыканта-рок-н-ролльщика, пара-тройка художников, кое-кто из поэтической братии. [Александр Зябликов. Провинциальная столица // «Сибирские огни», 2013] [омонимия не снята] | U8: 1 | V8: 0.41462089953268677
A9: илыб яинелварпан оготэ имялетавонсО | B9: авд | C9: Основателями этого направления были | D9: два | E9: gen | F9: великих ученых, основоположники генетики в | G9: m | H9: Евгений Пчелов. В поисках гениальности: евгеническое движение в советской России // «Знание-сила», 2013 | I9: Евгений Пчелов | K9: В поисках гениальности: евгеническое движение в советской России | L9: 2013 | M9: публицистика, нехудожественная | N9: статья | O9: история, наука и технологии, биология, психология | P9: «Знание-сила» | Q9: 2013 | R9: журнал | S9: омонимия не снята | T9: Основателями этого направления были два великих ученых, основоположники генетики в отечественной науке ― Николай Константинович Кольцов (1872-1940) в Москве и Юрий Александрович Филипченко (1882-1930) в Петрограде. [Евгений Пчелов. В поисках гениальности: евгеническое движение в советской России // «Знание-сила», 2013] [омонимия не снята] | U9: 1 | V9: 7.8744625277850089E-2
A10: ettepuohC у яндогеС | B10: авд | C10: Сегодня у Choupette | D10: два | E10: gen | F10: собственных производства ― в Тверской области | G10: n | H10: Вера Кузьмина. Вытютюкивание на экспорт // «Эксперт», 2015 | I10: Вера Кузьмина | K10: Вытютюкивание на экспорт | L10: 2015 | M10: публицистика, нехудожественная | N10: статья | O10: производство, легкая и пищевая промышленность, бизнес, коммерция, экономика, финансы | P10: «Эксперт» | Q10: 2015 | R10: журнал | S10: омонимия не снята | T10: Сегодня у Choupette два собственных производства ― в Тверской области и Чебоксарах, еще около полутора десятков на контракте. [Вера Кузьмина. Вытютюкивание на экспорт // «Эксперт», 2015] [омонимия не снята] | U10: 1 | V10: 0.45868406551964558
A11: аз еищяотсогород еымас яинаводелсси хин | B11: авд | C11: них исследования — самые дорогостоящие за | D11: два | E11: gen | F11: прошедших десятилетия. | G11: n | H11: А. А. Гурьянов. Новые миры, новые горизонты: приоритетные направления астрономических исследований // Химия и жизнь, 2010 | I11: А. А. Гурьянов | K11: Новые миры, новые горизонты: приоритетные направления астрономических исследований | L11: 2010 | M11: учебно-научная, нехудожественная | N11: статья | O11: наука и технологии, астрономия | P11: Химия и жизнь | Q11: 2010 | R11: журнал | S11: омонимия не снята | T11: Созданные в ее рамках приборы и выполненные на них исследования — самые дорогостоящие за два прошедших десятилетия. [А. А. Гурьянов. Новые миры, новые горизонты: приоритетные направления астрономических исследований // Химия и жизнь, 2010] [омонимия не снята] | U11: 1 | V11: 0.99847962050214889
A12: йывреп леваП и нимоФ | B12: авд | C12: Фомин и Павел первый ― | D12: два | E12: gen | F12: русских гения, два непонятых и | G12: m | H12: Борис Евсеев. Евстигней // «Октябрь», 2010 | I12: Борис Евсеев | J12: 1951 | K12: Евстигней | L12: 2010 | M12: художественная | N12: роман | P12: «Октябрь» | Q12: 2010 | R12: журнал | S12: омонимия не снята | T12: Фомин и Павел первый ― два русских гения, два непонятых и два пересеченных русских пути. [Борис Евсеев. Евстигней // «Октябрь», 2010] [омонимия не снята] | U12: 1 | V12: 0.38935284790422231
A13: оп муминим как олыб адог | B13: авд | C13: года, было как минимум по | D13: два | E13: gen | F13: природных православных. | G13: m | H13: Владимир Антипин. Уфа замедленного действия // «Русский репортер», № 28 (156), 22-29 июля 2010, 2010 | I13: Владимир Антипин | K13: Уфа замедленного действия | L13: 2010 | M13: публицистика , нехудожественная | N13: статья | O13: политика и общественная жизнь, администрация и управление, право, криминал, армия и вооруженные конфликты | P13: «Русский репортер», № 28 (156), 22-29 июля 2010 | Q13: 2010 | R13: журнал | S13: омонимия не снята | T13: А в каждой ваххабитской бандгруппе, обезвреженной в регионе за последние три года, было как минимум по два природных православных. [Владимир Антипин. Уфа замедленного действия // «Русский репортер», № 28 (156), 22-29 июля 2010, 2010] [омонимия не снята] | U13: 1 | V13: 0.25026168698060758
A14: муминим как алавытичу яигевроН енегребципШ | B14: авд | C14: Шпицбергене, Норвегия учитывала как минимум | D14: два | E14: gen | F14: важных обстоятельства. | G14: n | H14: Алексей Комаров. Шпицбергенский вопрос в советской внешней политике // «Знание-сила», 2012 | I14: Алексей Комаров | K14: Шпицбергенский вопрос в советской внешней политике | L14: 2012 | M14: публицистика, нехудожественная | N14: статья | O14: политика и общественная жизнь, природа | P14: «Знание-сила» | Q14: 2012 | R14: журнал | S14: омонимия не снята | T14: Формулируя свою позицию по вопросу о Шпицбергене, Норвегия учитывала как минимум два важных обстоятельства. [Алексей Комаров. Шпицбергенский вопрос в советской внешней политике // «Знание-сила», 2012] [омонимия не снята] | U14: 1 | V14: 0.17632671868941419
A15: онеджубзов олыб огоксьлезурЯ виторП | B15: авд | C15: Против Ярузельского было возбуждено | D15: два | E15: gen | F15: судебных преследования по делам о | G15: n | H15: Борис Филиппов. Генерал // «Русский репортер», 2014 | I15: Борис Филиппов | K15: Генерал | L15: 2014 | M15: публицистика, нехудожественная | N15: статья | O15: политика и общественная жизнь, администрация и управление | P15: «Русский репортер» | Q15: 2014 | R15: журнал | S15: омонимия не снята | T15: Против Ярузельского было возбуждено два судебных преследования по делам о жертвах событий декабря 1970-го и 1981 года. [Борис Филиппов. Генерал // «Русский репортер», 2014] [омонимия не снята] | U15: 1 | V15: 0.73986758150543097
A16: ежот акбурт и арагиС | B16: авд | C16: Сигара и трубка ― тоже | D16: два | E16: gen | F16: разных образа. | G16: m | H16: Дарья Ефремова. Игры В сторону! // «Психология на каждый день», 2010 | I16: Дарья Ефремова | K16: Игры В сторону! | L16: 2010 | M16: публицистика, нехудожественная | N16: статья | O16: техника, психология | P16: «Психология на каждый день» | Q16: 2010 | R16: журнал | S16: омонимия не снята | T16: Сигара и трубка ― тоже два разных образа. [Дарья Ефремова. Игры В сторону! // «Психология на каждый день», 2010] [омонимия не снята] | U16: 1 | V16: 0.13418749093367666
B17: авД | D17: Два | E17: gen | F17: главных кредитора «ТНС энерго»: ВТБ | G17: m | H17: Евгений Огородников. Как заработать, когда не платят // «Эксперт», 2015 | I17: Евгений Огородников | K17: Как заработать, когда не платят | L17: 2015 | M17: публицистика, нехудожественная | N17: статья | O17: энергетика, бизнес, коммерция, экономика, финансы | P17: «Эксперт» | Q17: 2015 | R17: журнал | S17: омонимия не снята | T17: Два главных кредитора «ТНС энерго»: ВТБ и Альфа-банк ― недавно вошли в капитал компании. [Евгений Огородников. Как заработать, когда не платят // «Эксперт», 2015] [омонимия не снята] | U17: 1 | V17: 0.63005389114006949
A18: ецясем молшорп В | B18: авд | C18: В прошлом месяце | D18: два | E18: gen | F18: часкоровских обозревателя беседовали о власти | G18: m | H18: Дмитрий Бавильский, Игорь Манцов. У каждого ума свой телескоп // «Частный корреспондент», 2010 | I18: Дмитрий Бавильский, Игорь Манцов | J18: 1969, 1966 | K18: У каждого ума свой телескоп | L18: 2010 | M18: публицистика , нехудожественная | N18: статья | O18: политика и общественная жизнь | P18: «Частный корреспондент» | Q18: 2010 | R18: электронное издание | S18: омонимия не снята | T18: В прошлом месяце два часкоровских обозревателя беседовали о власти. [Дмитрий Бавильский, Игорь Манцов. У каждого ума свой телескоп // «Частный корреспондент», 2010] [омонимия не снята] | U18: 1 | V18: 0.72220202454530025
A19: ан ынитселаП аледзар налп и | B19: авд | C19: и план раздела Палестины на | D19: два | E19: gen | F19: самостоятельных государства ― еврейское и арабское | G19: n | H19: Борис Явелов. Календарь «3-С»: ноябрь // «Знание-сила», 2012 | I19: Борис Явелов | K19: Календарь «3-С»: ноябрь | L19: 2012 | M19: публицистика, нехудожественная | N19: информационное сообщение | O19: история | P19: «Знание-сила» | Q19: 2012 | R19: журнал | S19: омонимия не снята | T19: 65 лет назад, 29 ноября 1947 года Генеральная Ассамблея ООН большинством в 33 голоса против 13 одобрила ― при энергичной поддержке СССР ― резолюцию о прекращении с 1948 года британского мандата над Палестиной и план раздела Палестины на два самостоятельных государства ― еврейское и арабское с выделением Иерусалима в нейтральную зону, находящуюся под международным контролем. [Борис Явелов. Календарь «3-С»: ноябрь // «Знание-сила», 2012] [омонимия не снята] | U19: 1 | V19: 0.64320170970957768
A20: ан яртомсен яом амаМ | B20: авд | C20: Мама моя, несмотря на | D20: два | E20: gen | F20: высших образования, очень мало уделяла | G20: n | H20: Галина Волчек. «Верю во взаимность во всем, не только в любви» // «Огонек», 2013 | I20: Галина Волчек | J20: 1933 | K20: «Верю во взаимность во всем, не только в любви» | L20: 2013 | M20: публицистика, нехудожественная | N20: статья | O20: искусство и культура | P20: «Огонек» | Q20: 2013 | R20: журнал | S20: омонимия не снята | T20: Мама моя, несмотря на два высших образования, очень мало уделяла внимания моему, скажем так, духовному развитию. [Галина Волчек. «Верю во взаимность во всем, не только в любви» // «Огонек», 2013] [омонимия не снята] | U20: 1 | V20: 3.6928998860985551E-2
A21: илитропси йе еинеортсан еж умот | B21: авд | C21: тому же настроение ей испортили | D21: два | E21: gen | F21: недавних происшествия. | G21: n | H21: Антон Мясников. Преступление — загадка // «Криминальный отдел», 2011 | I21: Антон Мясников | K21: Преступление — загадка | L21: 2011 | M21: публицистика, нехудожественная | N21: статья | O21: история, криминал | P21: «Криминальный отдел» | Q21: 2011 | R21: журнал | S21: омонимия не снята | T21: К тому же настроение ей испортили два недавних происшествия. [Антон Мясников. Преступление — загадка // «Криминальный отдел», 2011] [омонимия не снята] | U21: 1 | V21: 0.29345930617893701
A22: екнаб в театобар тсирю енм | B22: авд | C22: мне ― юрист, работает в банке, | D22: два | E22: gen | F22: высших образования. | G22: n | H22: Евгения Долгинова. Девушка с косой // «Русская жизнь», 2012 | I22: Евгения Долгинова | K22: Девушка с косой | L22: 2012 | M22: публицистика , нехудожественная | N22: статья | O22: криминал, частная жизнь | P22: «Русская жизнь» | Q22: 2012 | R22: журнал | S22: омонимия не снята | T22: ― Она сказала мне ― юрист, работает в банке, два высших образования. [Евгения Долгинова. Девушка с косой // «Русская жизнь», 2012] [омонимия не снята] | U22: 1 | V22: 0.15461983983734395
A23: узарС | B23: авд | C23: Сразу | D23: два | E23: gen | F23: лирических образа сплетаются между собой | G23: m | H23: Евгения Пищикова. Рыцари и скульпторы // «Русская жизнь», 2012 | I23: Евгения Пищикова | K23: Рыцари и скульпторы | L23: 2012 | M23: публицистика , нехудожественная | N23: заметка | O23: политика и общественная жизнь, искусство и культура | P23: «Русская жизнь» | Q23: 2012 | R23: журнал | S23: омонимия не снята | T23: Сразу два лирических образа сплетаются между собой: мясник ― рыцарь, и он же ― скульптор, отсекающий все лишнее, ― впрочем, скорее отсекающий все нужное. [Евгения Пищикова. Рыцари и скульпторы // «Русская жизнь», 2012] [омонимия не снята] | U23: 1 | V23: 0.15339354378112713
A24: тюувтсещуС | B24: авд | C24: Существуют | D24: два | E24: gen | F24: основных типа химических связей ― ионные | G24: m | H24: В. Ацюковский. Полигон. Что такое лептонная пена? // Юный техник, 2012 | I24: В. Ацюковский | K24: Полигон. Что такое лептонная пена? | L24: 2012 | M24: публицистика, нехудожественная | N24: статья | O24: наука и технологии | P24: Юный техник | Q24: 2012 | R24: журнал | S24: омонимия не снята | T24: Существуют два основных типа химических связей ― ионные и ковалентные. [В. Ацюковский. Полигон. Что такое лептонная пена? // Юный техник, 2012] [омонимия не снята] | U24: 1 | V24: 0.2188962444846636
A25: ичарв тюажзеирп отч умотоП | B25: авд | C25: Потому что приезжают врачи ― | D25: два | E25: gen | F25: веселых толстых доктора с мягкими | G25: m | H25: Дина Сабитова. Где нет зимы (2011) | I25: Дина Сабитова | J25: 1969 | K25: Где нет зимы | L25: 2011 | M25: художественная | N25: повесть | P25: Д. Р. Сабитова. Цирк в шкатулке | Q25: 2007 | R25: книга | S25: омонимия не снята | T25: Потому что приезжают врачи ― два веселых толстых доктора с мягкими руками. [Дина Сабитова. Где нет зимы (2011)] [омонимия не снята] | U25: 1 | V25: 0.19825449752375968
A26: выркто ьшил онжом дапаз-оревес онишуТ | B26: авд | C26: Тушино, северо-запад) можно, лишь открыв | D26: два | E26: gen | F26: новых окна. | G26: n | H26: Дина Юсупова. Воздушная тревога // «Огонек», 2015 | I26: Дина Юсупова | K26: Воздушная тревога | L26: 2015 | M26: публицистика, нехудожественная | N26: статья | O26: природа, администрация и управление, производство | P26: «Огонек» | Q26: 2015 | R26: журнал | S26: омонимия не снята | T26: Сравнить же столбики оксидов азота на Чаянова (центр Москвы) и, скажем, на Туристской улице (район Тушино, северо-запад) можно, лишь открыв два новых окна. [Дина Юсупова. Воздушная тревога // «Огонек», 2015] [омонимия не снята] | U26: 1 | V26: 0.75086544373493491
A27: илатобар ямерв еж от в | B27: авд | C27: в то же время работали | D27: два | E27: gen | F27: великих русских живописца ― Феофан Грек | G27: m | H27: Валерий Фадеев. На твердой почве // «Эксперт», 2014 | I27: Валерий Фадеев | J27: 1960 | K27: На твердой почве | L27: 2014 | M27: публицистика, нехудожественная | N27: статья | O27: история, политика и общественная жизнь, искусство и культура | P27: «Эксперт» | Q27: 2014 | R27: журнал | S27: омонимия не снята | T27: Примерно в то же время работали два великих русских живописца ― Феофан Грек и Андрей Рублев. [Валерий Фадеев. На твердой почве // «Эксперт», 2014] [омонимия не снята] | U27: 1 | V27: 0.98075197011494986
A28: ьтиледыв онжом юивтсешсиорп умонброксирп умотэ | B28: евд | C28: этому «прискорбному происшествию», можно выделить | D28: две | E28: nom | F28: возможные причины подобного республиканского бунта | G28: f | H28: Иван Преображенский. Лоскутное одеяло «Единой России» (2003) // «ПОЛИТКОМ. РУ», 2003.05.21 | I28: Иван Преображенский | K28: Лоскутное одеяло «Единой России» | L28: 2003 | M28: публицистика , нехудожественная | N28: статья | O28: политика и общественная жизнь | P28: «ПОЛИТКОМ. РУ» | Q28: 2003.05.21 | R28: электронное издание | S28: омонимия не снята | T28: Опираясь на события, сопутствующие этому «прискорбному происшествию», можно выделить две возможные причины подобного республиканского бунта. [Иван Преображенский. Лоскутное одеяло «Единой России» (2003) // «ПОЛИТКОМ. РУ», 2003.05.21] [омонимия не снята] | U28: 1 | V28: =RAND() -> 0.31826212760379247
A29: иланзирп ытрепскэ имынсапозеб еж еелобиаН | B29: евд | C29: Наиболее же безопасными эксперты признали | D29: две | E29: nom | F29: последние модели Volvo ― S60 и | G29: f | H29: Владимир Салмин. Маленький ― не значит беззащитный. Рейтинг безопасности легковых автомобилей (2001) // «Известия», 2001.10.18 | I29: Владимир Салмин | K29: Маленький ― не значит беззащитный. Рейтинг безопасности легковых автомобилей | L29: 2001 | M29: публицистика , нехудожественная | N29: статья | O29: политика и общественная жизнь | P29: «Известия» | Q29: 2001.10.18 | R29: газета | S29: омонимия не снята | T29: Наиболее же безопасными эксперты признали две последние модели Volvo ― S60 и S80, которые получили максимальные оценки. [Владимир Салмин. Маленький ― не значит беззащитный. Рейтинг безопасности легковых автомобилей (2001) // «Известия», 2001.10.18] [омонимия не снята] | U29: 1 | V29: =RAND() -> 0.76696705946369903
A30: ындив октеч енаркэ ан и | B30: евд | C30: и на экране четко видны | D30: две | E30: nom | F30: независимые области попадания пролетевших частиц | G30: f | H30: Василий Тарасов. Порционный микромир (2004) // «Вокруг света», 2004.07.15 | I30: Василий Тарасов | K30: Порционный микромир | L30: 2004 | M30: публицистика , нехудожественная | N30: статья | O30: наука и технологии | P30: «Вокруг света» | Q30: 2004.07.15 | R30: журнал | S30: омонимия не снята | T30: Когда на щели налетают классические частицы, то каждая проходит заведомо лишь через какую-то одну щель и на экране четко видны две независимые области попадания пролетевших частиц. [Василий Тарасов. Порционный микромир (2004) // «Вокруг света», 2004.07.15] [омонимия не снята] | U30: 1 | V30: =RAND() -> 0.56943124365351716
A31: удив зи ьтаксупу теуделс ен | B31: евд | C31: не следует упускать из виду | D31: две | E31: nom | F31: важные точки зрения в этой | G31: f | H31: Александр Малинкин. Освобождение труда, идея социализма и социал-демократия // «Отечественные записки», 2003 | I31: Александр Малинкин | K31: Освобождение труда, идея социализма и социал-демократия | L31: 2003 | M31: публицистика , нехудожественная | N31: статья | O31: политика и общественная жизнь | P31: «Отечественные записки» | Q31: 2003 | R31: журнал | S31: омонимия не снята | T31: Поэтому, думается мне, нам отнюдь не следует упускать из виду две важные точки зрения в этой борьбе. [Александр Малинкин. Освобождение труда, идея социализма и социал-демократия // «Отечественные записки», 2003] [омонимия не снята] | U31: 1 | V31: =RAND() -> 0.13880520663841089
A32: туреб от икраваз ливарп ястеасак | B32: евд | C32: касается правил заварки, то берут | D32: две | E32: nom | F32: чайные ложки сухой травы, из | G32: f | H32: Герман Малиничев. Напиток от тридцати недугов // «Наука и религия», 2007 | I32: Герман Малиничев | K32: Напиток от тридцати недугов | L32: 2007 | M32: публицистика, нехудожественная | N32: заметка | O32: природа, здоровье и медицина | P32: «Наука и религия» | Q32: 2007 | R32: журнал | S32: омонимия не снята | T32: Что касается правил заварки, то берут две чайные ложки сухой травы, из расчета на один стакан воды, и заваривают в подогретом фарфоровом чайничке. [Герман Малиничев. Напиток от тридцати недугов // «Наука и религия», 2007] [омонимия не снята] | U32: 1 | V32: =RAND() -> 0.93550491262422453
A33: едг ьливедов йищукетоляв отэ ылубаф | B33: евд | C33: фабулы это вялотекущий водевиль, где | D33: две | E33: nom | F33: семейные парочки меняются мужьями, только | G33: f | H33: Валерий Кичин. Европа наносит ответный удар. Берлинский фестиваль в клетке новых концепций (2002) // «Известия», 2002.02.13 | I33: Валерий Кичин | K33: Европа наносит ответный удар. Берлинский фестиваль в клетке новых концепций | L33: 2002 | M33: публицистика , нехудожественная | N33: статья | O33: искусство и культура | P33: «Известия» | Q33: 2002.02.13 | R33: газета | S33: омонимия не снята | T33: По типу фабулы это вялотекущий водевиль, где две семейные парочки меняются мужьями, только вместо песенок стоит ужасный рев ― режиссер сопрягает смешное с драматичным. [Валерий Кичин. Европа наносит ответный удар. Берлинский фестиваль в клетке новых концепций (2002) // «Известия», 2002.02.13] [омонимия не снята] | U33: 1 | V33: =RAND() -> 0.64323898938751634
A34: иречод ецинссалкитясед лазамв как олшорп | B34: евд | C34: прошло, как вмазал десятикласснице дочери | D34: две | E34: nom | F34: размашистые пощечины за: «А я | G34: f | H34: Александр Терехов. Каменный мост (1997-2008) | I34: Александр Терехов | J34: 1966 | K34: Каменный мост | L34: 1997-2008 | M34: художественная | N34: роман | P34: А. Терехов. Каменный мост | Q34: 2009 | R34: книга | S34: омонимия не снята | T34: И еще (предполагали все) он должен повестись на любовь ― любовь не признавал заслуживающей императорского внимания, «это для баб», но сталкивался с ней в самых неожиданных местах ― трех месяцев не прошло, как вмазал десятикласснице дочери две размашистые пощечины за: «А я люблю его!» [Александр Терехов. Каменный мост (1997-2008)] [омонимия не снята] | U34: 1 | V34: =RAND() -> 7.255228099859945E-2
A35: И | B35: евд | C35: И | D35: две | E35: nom | F35: школьные тетради со стихами собственного | G35: f | H35: Герман Садулаев. Шалинский рейд (2009) // «Знамя», 2010 | I35: Герман Садулаев | J35: 1973 | K35: Шалинский рейд | L35: 2009 | M35: художественная | N35: роман | P35: «Знамя» | Q35: 2010 | R35: журнал | S35: омонимия не снята | T35: И две школьные тетради со стихами собственного сочинения. [Герман Садулаев. Шалинский рейд (2009) // «Знамя», 2010] [омонимия не снята] | U35: 1 | V35: =RAND() -> 0.42204440140653166
A36: яндогес отч ясляедан я он | B36: евд | C36: но я надеялся, что сегодня | D36: две | E36: nom | F36: золотые награды выиграют наши ребята | G36: f | H36: Андрей Митьков. Триумф методиста. Впечатления от выступления российской команды на чемпионате мира по греко-римской борьбе (2002) // «Известия», 2002.09.22 | I36: Андрей Митьков | K36: Триумф методиста. Впечатления от выступления российской команды на чемпионате мира по греко-римской борьбе | L36: 2002 | M36: публицистика , нехудожественная | N36: статья | O36: спорт | P36: «Известия» | Q36: 2002.09.22 | R36: газета | S36: омонимия не снята | T36: «Пусть шведы не обижаются, но я надеялся, что сегодня две золотые награды выиграют наши ребята, ― признался Карелин. [Андрей Митьков. Триумф методиста. Впечатления от выступления российской команды на чемпионате мира по греко-римской борьбе (2002) // «Известия», 2002.09.22] [омонимия не снята] | U36: 1 | V36: =RAND() -> 0.87537767507429831
A37: оп епатэ мещюуделс аН | B37: евд | C37: На следующем этапе по | D37: две | E37: nom | F37: лучшие команды из подгрупп образовали | G37: f | H37: Леонид Бекасов. Добыли серебро посредством футзала (2002) // «Весть» (Калуга), 2002.12.18 | I37: Леонид Бекасов | K37: Добыли серебро посредством футзала | L37: 2002 | M37: публицистика , нехудожественная | N37: заметка | O37: спорт | P37: «Весть» (Калуга) | Q37: 2002.12.18 | R37: газета | S37: омонимия не снята | T37: На следующем этапе по две лучшие команды из подгрупп образовали финальную «шестерку», которая, в свою очередь, была разбита на две «тройки». [Леонид Бекасов. Добыли серебро посредством футзала (2002) // «Весть» (Калуга), 2002.12.18] [омонимия не снята] | U37: 1 | V37: =RAND() -> 0.77093812868456268
B38: евД | D38: Две | E38: nom | F38: следующие гонки прошли на очень | G38: f | H38: Вадим Степанов. Семидесятые! (2001) // «Формула», 2001.12.15 | I38: Вадим Степанов | K38: Семидесятые! | L38: 2001 | M38: публицистика , нехудожественная | N38: статья | O38: спорт | P38: «Формула» | Q38: 2001.12.15 | R38: журнал | S38: омонимия не снята | T38: Две следующие гонки прошли на очень быстрых трассах. [Вадим Степанов. Семидесятые! (2001) // «Формула», 2001.12.15] [омонимия не снята] | U38: 1 | V38: =RAND() -> 0.36587048009744905
A39: оп и асуску огоннив или | B39: евд | C39: или винного уксуса и по | D39: две | E39: nom | F39: столовые ложки измельченных свежих трав | G39: f | H39: И. Сокольский. «Кислое вино» // «Наука и жизнь», 2006 | I39: И. Сокольский | K39: «Кислое вино» | L39: 2006 | M39: публицистика , нехудожественная | N39: статья | O39: дом и домашнее хозяйство | P39: «Наука и жизнь» | Q39: 2006 | R39: журнал | S39: омонимия не снята | T39: Для приготовления в домашних условиях облагороженного «уксуса четырех разбойников» по старинной технологии нужно взять 1 л натурального яблочного или винного уксуса и по две столовые ложки измельченных свежих трав лаванды, розмарина, шалфея, полыни, руты и мяты. [И. Сокольский. «Кислое вино» // «Наука и жизнь», 2006] [омонимия не снята] | U39: 1 | V39: =RAND() -> 0.71196770800890263
A40: и еендолох еовдв итчоп олимолаз | B40: евд | C40: заломило почти вдвое холоднее, и | D40: две | E40: nom | F40: паяльные лампы никак не могли | G40: f | H40: Андрей Коткин. А теперь — горбатая! (2013.04.12) // «Новгородские ведомости», 2013 | I40: Андрей Коткин | K40: А теперь — горбатая! | L40: 2013.04.12 | M40: публицистика , нехудожественная | N40: статья | O40: природа, администрация и управление | P40: «Новгородские ведомости» | Q40: 2013 | R40: газета | S40: омонимия не снята | T40: Как хочешь, так и думай, но вместо минус пятнадцати ночью заломило почти вдвое холоднее, и две паяльные лампы никак не могли исправить морозное воздействие на топливо в «Зубрёнке». [Андрей Коткин. А теперь — горбатая! (2013.04.12) // «Новгородские ведомости», 2013] [омонимия не снята] | U40: 1 | V40: =RAND() -> 0.23600345607618589
A41: янем у сачйеС | B41: евд | C41: Сейчас у меня | D41: две | E41: nom | F41: маленькие внучки Маша и Даша | G41: f | H41: Георгий Юдин. Поздравляем с юбилеем! Писателю и художнику Г. Юдину ― 50 лет // «Мурзилка», 2003 | I41: Георгий Юдин | K41: Поздравляем с юбилеем! Писателю и художнику Г. Юдину ― 50 лет | L41: 2003 | M41: публицистика , нехудожественная | N41: автобиография | O41: искусство и культура | P41: «Мурзилка» | Q41: 2003 | R41: журнал | S41: омонимия не снята | T41: Сейчас у меня две маленькие внучки Маша и Даша, а значит, ждут меня их новые вопросы, на которые придётся отвечать новыми книгами. [Георгий Юдин. Поздравляем с юбилеем! Писателю и художнику Г. Юдину ― 50 лет // «Мурзилка», 2003] [омонимия не снята] | U41: 1 | V41: =RAND() -> 0.25688878630909961
A42: ыботч еж мот О | B42: евд | C42: О том же, чтобы | D42: две | E42: nom | F42: регулярные» бригады попытались пробиться сами | G42: f | H42: Армен Асриян. Театр, лобио и демократия (2003) // «Спецназ России», 2003.03.15 | I42: Армен Асриян | K42: Театр, лобио и демократия | L42: 2003 | M42: публицистика , нехудожественная | N42: статья | O42: частная жизнь | P42: «Спецназ России» | Q42: 2003.03.15 | R42: газета | S42: омонимия не снята | T42: О том же, чтобы две «регулярные» бригады попытались пробиться сами, и речи не заходило… [Армен Асриян. Театр, лобио и демократия (2003) // «Спецназ России», 2003.03.15] [омонимия не снята] | U42: 1 | V42: =RAND() -> 0.53698661887881083
A43: лачемто воримохиТ Л | B43: евд | C43: Л. Тихомиров отмечал | D43: две | E43: nom | F43: существенные особенности России, которые неблагоприятны | G43: f | H43: Борис Ключников. Либеральная эпидемия и здоровый протекционизм (2004) // «Наш современник», 2004.10.15 | I43: Борис Ключников | K43: Либеральная эпидемия и здоровый протекционизм | L43: 2004 | M43: публицистика , нехудожественная | N43: статья | O43: бизнес, коммерция, экономика, финансы | P43: «Наш современник» | Q43: 2004.10.15 | R43: журнал | S43: омонимия не снята | T43: Л. Тихомиров отмечал две существенные особенности России, которые неблагоприятны для внешней торговли: удаленность от морских путей и суровый климат. [Борис Ключников. Либеральная эпидемия и здоровый протекционизм (2004) // «Наш современник», 2004.10.15] [омонимия не снята] | U43: 1 | V43: =RAND() -> 0.17141327682969898
A44: адгоК | B44: евд | C44: [Ирида, nick] Когда | D44: две | E44: nom | F44: светские дамы обсуждали образ жизни | G44: f | H44: коллективный. Форум: Обсуждение фильма «Война и Мир» (2007-2011) | I44: коллективный | K44: Форум: Обсуждение фильма «Война и Мир» | L44: 2007-2011 | M44: электронная коммуникация , нехудожественная | N44: форум | O44: досуг, зрелища и развлечения, искусство и культура | P44: Интернет | R44: электронный текст | S44: омонимия не снята | T44: [Ирида, nick] Когда две светские дамы обсуждали образ жизни Кирилла Безухова в молодости, одна из них сказала: «Как старик был хорош! [коллективный. Форум: Обсуждение фильма «Война и Мир» (2007-2011)] [омонимия не снята] | U44: 1 | V44: =RAND() -> 0.23580304911186367
A45: иляотс акжортсо огеншедз торов У | B45: евд | C45: У ворот здешнего острожка стояли | D45: две | E45: nom | F45: коренастые болгарки в нацодеждах с | G45: f | H45: Афанасий Мамедов, Исаак Милькин. Морские рассказы // «Октябрь», 2003 | I45: Афанасий Мамедов, Исаак Милькин | K45: Морские рассказы | L45: 2003 | M45: художественная | N45: рассказ | P45: «Октябрь» | Q45: 2003 | R45: журнал | S45: омонимия не снята | T45: У ворот здешнего острожка стояли две коренастые болгарки в нацодеждах с преобладанием красного цвета и потчевали каждого входящего стаканом вина и куском лепешки. [Афанасий Мамедов, Исаак Милькин. Морские рассказы // «Октябрь», 2003] [омонимия не снята] | U45: 1 | V45: =RAND() -> 0.9393710637708752
B46: евД | D46: Две | E46: nom | F46: американские мечты и другие Игорь | G46: f | H46: Игорь Сирин. Две американские мечты и другие (2004) // «Бизнес-журнал», 2004.01.22 | I46: Игорь Сирин | K46: Две американские мечты и другие | L46: 2004 | M46: публицистика , нехудожественная | N46: отчет | O46: техника | P46: «Бизнес-журнал» | Q46: 2004.01.22 | R46: журнал | S46: омонимия не снята | T46: Две американские мечты и другие Игорь Сирин [Игорь Сирин. Две американские мечты и другие (2004) // «Бизнес-журнал», 2004.01.22] [омонимия не снята] | U46: 1 | V46: =RAND() -> 0.52441380089497613
A47: ынаворидивкил илыб ешьнар имадог ямувД | B47: евд | C47: Двумя годами раньше были ликвидированы | D47: две | E47: nom | F47: головные фабрики Levi Strauss в | G47: f | H47: Владимир Ляпоров. Контракт нерезидента (2004) // «Бизнес-журнал», 2004.03.03 | I47: Владимир Ляпоров | K47: Контракт нерезидента | L47: 2004 | M47: публицистика , нехудожественная | N47: статья | O47: бизнес, коммерция, экономика, финансы | P47: «Бизнес-журнал» | Q47: 2004.03.03 | R47: журнал | S47: омонимия не снята | T47: Двумя годами раньше были ликвидированы две головные фабрики Levi Strauss в Блу-Ридже (штат Джорджия) и Пауэлле (штат Теннесси). [Владимир Ляпоров. Контракт нерезидента (2004) // «Бизнес-журнал», 2004.03.03] [омонимия не снята] | U47: 1 | V47: =RAND() -> 0.92229002806278171
A48: окьлот илерог онмет олыб ежу | B48: евд | C48: уже было темно, горели только | D48: две | E48: nom | F48: неяркие лампочки в баре. | G48: f | H48: Анна Берсенева. Полет над разлукой (2003-2005) | I48: Анна Берсенева | K48: Полет над разлукой | L48: 2003-2005 | M48: художественная | N48: роман | P48: Анна Берсенева. Полет над разлукой | Q48: 2005 | R48: книга | S48: омонимия не снята | T48: В зале уже было темно, горели только две неяркие лампочки в баре. [Анна Берсенева. Полет над разлукой (2003-2005)] [омонимия не снята] | U48: 1 | V48: =RAND() -> 0.25773413407420476
A49: удог 4102 в яинежитсоД | B49: евД | C49: Достижения в 2014 году | D49: Две | E49: nom | F49: золотые медали Олимпийских игр. Александр | G49: f | H49: Вера Михайлова, Мария Цырулева. Лучший спортсмен 2014 года // «Русский репортер», 2014 | I49: Вера Михайлова, Мария Цырулева | K49: Лучший спортсмен 2014 года | L49: 2014 | M49: публицистика, нехудожественная | N49: заметка | O49: спорт | P49: «Русский репортер» | Q49: 2014 | R49: журнал | S49: омонимия не снята | T49: Достижения в 2014 году Две золотые медали Олимпийских игр. Александр Зубков и Алексей Воевода [Вера Михайлова, Мария Цырулева. Лучший спортсмен 2014 года // «Русский репортер», 2014] [омонимия не снята] | U49: 1 | V49: =RAND() -> 0.13130954950736218
A50: жА ясьтаводар ен уме ыб | B50: евд | C50: бы ему не радоваться! Аж | D50: две | E50: nom | F50: золотые монетки он сэкономил! И | G50: f | H50: Елена и Валерий Гордеевы. Не все мы умрем (2002) | I50: Елена и Валерий Гордеевы | K50: Не все мы умрем | L50: 2002 | M50: художественная | N50: роман | P50: Елена и Валерий Гордеевы. Не все мы умрем | Q50: 2002 | R50: книга | S50: омонимия не снята | T50: Еще бы ему не радоваться! Аж две золотые монетки он сэкономил! И охрана по Стране дураков обеспечена, чтобы серную кислоту Карабас Барабас не выпил. [Елена и Валерий Гордеевы. Не все мы умрем (2002)] [омонимия не снята] | U50: 1 | V50: =RAND() -> 0.4449323832704426
A51: олыб ежад янем У | B51: евд | C51: У меня даже было | D51: две | E51: gen | F51: медицинских карточки: обычная в районной | G51: f | H51: Александр Городницкий. Я был как два разных человека – крамольный поэт и благонравный советский инженер (2015) | I51: Александр Городницкий | J51: 1933 | K51: Я был как два разных человека – крамольный поэт и благонравный советский инженер | L51: 2015 | M51: публицистика, нехудожественная | N51: интервью | O51: частная жизнь, искусство и культура | R51: книга | S51: омонимия не снята | T51: У меня даже было две медицинских карточки: обычная в районной поликлинике ― такая, что хоть в гроб клади, а вторая ― хоть в космос посылай! [Александр Городницкий. Я был как два разных человека – крамольный поэт и благонравный советский инженер (2015)] [омонимия не снята] | U51: 1 | V51: 0.75993075115901076
A52: илыб иинежяропсар хи В | B52: евд | C52: В их распоряжении были | D52: две | E52: gen | F52: ванных комнаты, облицованные розовым и | G52: f | H52: Вацлав Михальский. Река времен. Ave Maria // Октябрь, 2010 | I52: Вацлав Михальский | J52: 1938 | K52: Река времен. Ave Maria | L52: 2010 | M52: художественная | N52: роман | P52: Октябрь | Q52: 2010 | R52: журнал | S52: омонимия не снята | T52: В их распоряжении были две ванных комнаты, облицованные розовым и голубоватым мрамором соответственно. [Вацлав Михальский. Река времен. Ave Maria // Октябрь, 2010] [омонимия не снята] | U52: 1 | V52: 0.68827812247925824
B53: евД | D53: Две | E53: gen | F53: косых черточки означают 0, 125 | G53: f | H53: В. Поляков. Заочная школа радиоэлектроники. Усилитель для Нового года // Юный техник, 2010 | I53: В. Поляков | K53: Заочная школа радиоэлектроники. Усилитель для Нового года | L53: 2010 | M53: публицистика, нехудожественная | N53: инструкция | O53: техника | P53: Юный техник | Q53: 2010 | R53: журнал | S53: омонимия не снята | T53: Две косых черточки означают 0, 125 Вт, одна косая ― 0, 25 Вт, продольная ― 0, 5 Вт, поперечная ― 1 Вт. [В. Поляков. Заочная школа радиоэлектроники. Усилитель для Нового года // Юный техник, 2010] [омонимия не снята] | U53: 1 | V53: 2.1873736744923988E-2
A54: ястееми икуан вокиротси идерС | B54: евд | C54: Среди историков науки имеется | D54: две | E54: gen | F54: крупных партии. | G54: f | H54: Георгий Любарский. Теоретики и ремесленники // «Эксперт», 2013 | I54: Георгий Любарский | K54: Теоретики и ремесленники | L54: 2013 | M54: публицистика, нехудожественная | N54: рецензия | O54: наука и технологии, история | P54: «Эксперт» | Q54: 2013 | R54: журнал | S54: омонимия не снята | T54: Среди историков науки имеется две крупных партии. [Георгий Любарский. Теоретики и ремесленники // «Эксперт», 2013] [омонимия не снята] | U54: 1 | V54: 0.10743927732357239
A55: кат еоннедиву линсяъбо йыроток афисоИ | B55: ьмес | C55: Иосифа, который объяснил увиденное так: | D55: семь | E55: gen | F55: тучных коров означают семь плодородных | G55: f | H55: Андрей Ворскла. Съедение человека не считалось большим преступлением... // «Криминальный отдел», 2012 | I55: Андрей Ворскла | K55: Съедение человека не считалось большим преступлением... | L55: 2012 | M55: публицистика, нехудожественная | N55: статья | O55: история, криминал | P55: «Криминальный отдел» | Q55: 2012 | R55: журнал | S55: омонимия не снята | T55: Сделать это не удалось никому, кроме еврея Иосифа, который объяснил увиденное так: семь тучных коров означают семь плодородных для страны лет, а семь тощих коров ― семь лет засухи и голода. [Андрей Ворскла. Съедение человека не считалось большим преступлением... // «Криминальный отдел», 2012] [омонимия не снята] | U55: 1 | V55: 0.3191237692175275
A56: д т и тнегиллетни ахурт | B56: ирТ | C56: труха интеллигент и т. д. | D56: Три | E56: nom | F56: основные категории писательские наметил. Листочки | G56: f | H56: Д. А. Фурманов. Из дневников (1926) | I56: Д. А. Фурманов | J56: 1891 | K56: Из дневников | L56: 1926 | M56: публицистика , нехудожественная | N56: дневник, записные книжки | O56: политика и общественная жизнь, частная жизнь | P56: Фурманов Д. А. Рассказы. Повести. Заметки о литературе | Q56: 1984 | R56: книга | S56: омонимия не снята | T56: То же проделал с поэтами и критиками: поставил стержневые фигуры, наиболее характерные: сложившийся, начинающий, даровитый, бездарный, страстный, вялый, рабочий, старая труха интеллигент и т. д. Три основные категории писательские наметил. Листочки разложил в три груды: бел (летристы), поэты, критики. [Д. А. Фурманов. Из дневников (1926)] [омонимия не снята] | U56: 1 | V56: =RAND() -> 0.48953557043825247
A57: есв сензиб йыньлибом йиксйиссор шан | B57: ирт | C57: наш российский мобильный бизнес, все | D57: три | E57: nom | F57: крупные компании и «Теле-2 | G57: f | H57: Евгения Обухова, Евгений Огородников. Пермский артефакт // «Эксперт», 2013 | I57: Евгения Обухова, Евгений Огородников | K57: Пермский артефакт | L57: 2013 | M57: публицистика, нехудожественная | N57: статья | O57: техника, электроника, бизнес, коммерция, экономика, финансы | P57: «Эксперт» | Q57: 2013 | R57: журнал | S57: омонимия не снята | T57: Больше того, если говорить о компетенции, о профессиональном уровне, то наш российский мобильный бизнес, все три крупные компании и «Теле-2», ― очень качественный с маркетинговой, с рыночной, с производственной точки зрения. [Евгения Обухова, Евгений Огородников. Пермский артефакт // «Эксперт», 2013] [омонимия не снята] | U57: 1 | V57: =RAND() -> 9.3337775795364175E-2
A58: аЗ | B58: ирт | C58: За | D58: три | E58: nom | F58: протекшие года на цирковой арене | G58: m | H58: А. В. Чаянов. История парикмахерской куклы, или Последняя любовь московского архитектора М (1918) | I58: А. В. Чаянов | J58: 1888 | K58: История парикмахерской куклы, или Последняя любовь московского архитектора М | L58: 1918 | M58: художественная | N58: повесть | R58: книга | S58: омонимия не снята | T58: За три протекшие года на цирковой арене вообще не появлялось аналогичных №№, и многие полагали, что сестры в силу какого-либо неблагоприятного стечения обстоятельств потеряли солидных антрепренеров и были вынуждены выступать в третьеразрядных цирках и паноптикумах, не имеющих печатных афиш и не помещающих газетных публикаций. [А. В. Чаянов. История парикмахерской куклы, или Последняя любовь московского архитектора М (1918)] [омонимия не снята] | U58: 1 | V58: =RAND() -> 0.82275555492895713
A59: олыб и ирт в ьсалитарверп | B59: ирт | C59: превратилась в три, и было | D59: три | E59: nom | F59: голубые коробки и три чужие | G59: f | H59: Константин Воробьев. Крик (1962) | I59: Константин Воробьев | J59: 1919 | K59: Крик | L59: 1962 | M59: художественная | N59: повесть | P59: Константин Воробьев. Это мы, Господи!. | Q59: 2005 | R59: книга | S59: омонимия не снята | T59: Там были две сигареты, и я ухватил одну, и в моих пальцах она превратилась в три, и было три голубые коробки и три чужие руки, – глаза заплакали сами без меня. [Константин Воробьев. Крик (1962)] [омонимия не снята] | U59: 1 | V59: =RAND() -> 0.31938525009366092
B60: ирТ | D60: Три | E60: nom | F60: маленькие яхточки дрейфовали в тумане | G60: f | H60: Виктор Конецкий. Начало конца комедии (1978) | I60: Виктор Конецкий | J60: 1929 | K60: Начало конца комедии | L60: 1978 | M60: художественная | N60: рассказ, цикл | P60: Конецкий В. Начало конца комедии | Q60: 1978 | R60: книга | S60: омонимия не снята | T60: Три маленькие яхточки дрейфовали в тумане, связанные тросом. [Виктор Конецкий. Начало конца комедии (1978)] [омонимия не снята] | U60: 1 | V60: =RAND() -> 0.90689930715530309
A61: итсеворп ямерв еешйажилб в ынереман | B61: ирт | C61: намерены в ближайшее время провести | D61: три | E61: nom | F61: крупные политические акции. | G61: f | H61: Дмитрий Чернов. Левые не хотят колоться (2003) // «Время МН», 2003.05.26 | I61: Дмитрий Чернов | K61: Левые не хотят колоться | L61: 2003 | M61: публицистика , нехудожественная | N61: статья | O61: политика и общественная жизнь | P61: «Время МН» | Q61: 2003.05.26 | R61: газета | S61: омонимия не снята | T61: Коммунисты намерены в ближайшее время провести три крупные политические акции. [Дмитрий Чернов. Левые не хотят колоться (2003) // «Время МН», 2003.05.26] [омонимия не снята] | U61: 1 | V61: =RAND() -> 0.71660745632363465
A62: илавовтсйед ьседз хадог 8061 7061 | B62: ирт | C62: 1607-1608 годах здесь действовали | D62: три | E62: nom | F62: старые кузницы и появилась одна | G62: f | H62: И. Грачева. Твердость металла и нежность цветка // «Наука и жизнь», 2007 | I62: И. Грачева | K62: Твердость металла и нежность цветка | L62: 2007 | M62: публицистика , нехудожественная | N62: статья | O62: наука и технологии, история | P62: «Наука и жизнь» | Q62: 2007 | R62: журнал | S62: омонимия не снята | T62: Скупой язык документов повествует, как Павлово из земледельческого селения быстро превращалось в кустарное: в 1607-1608 годах здесь действовали три старые кузницы и появилась одна новая, к 1621 году их было уже 11, а к 1677-му ― 38. [И. Грачева. Твердость металла и нежность цветка // «Наука и жизнь», 2007] [омонимия не снята] | U62: 1 | V62: =RAND() -> 0.73035139231718893
A63: йишваминаз авелоГ ледто йикьнелам и | B63: ирт | C63: и маленький отдел Голева, занимавший | D63: три | E63: nom | F63: сквозные комнаты на втором этаже | G63: f | H63: Анна Матвеева. Голев и Кастро. Приключения гастарбайтера // «Звезда», 2002 | I63: Анна Матвеева | K63: Голев и Кастро. Приключения гастарбайтера | L63: 2002 | M63: художественная | N63: повесть | P63: «Звезда» | Q63: 2002 | R63: журнал | S63: омонимия не снята | T63: Собственно, института уже почти и не было ― только кабинет директора Колобуева и маленький отдел Голева, занимавший три сквозные комнаты на втором этаже. [Анна Матвеева. Голев и Кастро. Приключения гастарбайтера // «Звезда», 2002] [омонимия не снята] | U63: 1 | V63: =RAND() -> 0.64031221079316869
A64: итЭ | B64: ирт | C64: Эти | D64: три | E64: nom | F64: знаменательные события произошли в один | G64: n | H64: Г. С. Эфрон. Дневники. Т. 2 (1941-1943) | I64: Г. С. Эфрон | J64: 1925 | K64: Дневники. Т. 2 | L64: 1941-1943 | M64: бытовая , нехудожественная | N64: дневник, записные книжки | P64: Эфрон Г. Дневники в 2 т | Q64: 2004 | R64: книга | S64: омонимия не снята | T64: Эти три знаменательные события произошли в один и тот же день. [Г. С. Эфрон. Дневники. Т. 2 (1941-1943)] [омонимия не снята] | U64: 1 | V64: =RAND() -> 0.37760609079275742
A65: а отэ ен олизароп хесв | B65: ирт | C65: всех поразило не это, а | D65: три | E65: nom | F65: посеребренные чаши в форме черепов | G65: f | H65: Дмитрий Емец. Таня Гроттер и колодец Посейдона (2004) | I65: Дмитрий Емец | J65: 1974 | K65: Таня Гроттер и колодец Посейдона | L65: 2004 | M65: художественная | N65: роман | P65: Дмитрий Емец. Таня Гроттер и колодец Посейдона | Q65: 2004 | R65: книга | S65: омонимия не снята | T65: Однако всех поразило не это, а три посеребренные чаши в форме черепов. [Дмитрий Емец. Таня Гроттер и колодец Посейдона (2004)] [омонимия не снята] | U65: 1 | V65: =RAND() -> 0.80755031852039783
A66: ьсилянс артсекро и йечер хынзепмоп | B66: ирт | C66: помпезных речей и оркестра, снялись | D66: три | E66: nom | F66: фотонные ракеты типа «Хиус» и | G66: f | H66: Аркадий Стругацкий, Борис Стругацкий. Страна багровых туч (1952-1957) | I66: Аркадий Стругацкий, Борис Стругацкий | J66: 1925, 1933 | K66: Страна багровых туч | L66: 1952-1957 | M66: художественная | N66: роман | Q66: 2004 | R66: книга | S66: омонимия не снята | T66: Восемнадцать месяцев назад, примерно в те дни, когда ты отдувался на экзаменах, с межпланетной базы «Циолковский» по приказу Краюхина, без помпезных речей и оркестра, снялись три фотонные ракеты типа «Хиус» и с интервалом в полтора часа одна за другой ринулись в розовое марево венерианской атмосферы. [Аркадий Стругацкий, Борис Стругацкий. Страна багровых туч (1952-1957)] [омонимия не снята] | U66: 1 | V66: =RAND() -> 0.80365141922024863
A67: 1 | B67: ирТ | C67: 1. | D67: Три | E67: nom | F67: эволюционные группы Parvovirinae. Представлен анализ | G67: f | H67: В. В. Лукашов, J. Goudsmit. Роль стабилизирующего и расщепляющего отбора в эволюции вирусов семейств Parvoviridae и Astroviridae (2004) // «Вопросы вирусологии», 2004.01.05 | I67: В. В. Лукашов, J. Goudsmit | K67: Роль стабилизирующего и расщепляющего отбора в эволюции вирусов семейств Parvoviridae и Astroviridae | L67: 2004 | M67: учебно-научная , нехудожественная | N67: статья | O67: наука и технологии, здоровье и медицина | P67: «Вопросы вирусологии» | Q67: 2004.01.05 | R67: журнал | S67: омонимия не снята | T67: 1. Три эволюционные группы Parvovirinae. Представлен анализ полноразмерных геномов вирусов (р-дистанции), представляющих все индивидуальные виды вирусов подсемейства. [В. В. Лукашов, J. Goudsmit. Роль стабилизирующего и расщепляющего отбора в эволюции вирусов семейств Parvoviridae и Astroviridae (2004) // «Вопросы вирусологии», 2004.01.05] [омонимия не снята] | U67: 1 | V67: =RAND() -> 0.5748104709659243
A68: как иклитсдоп еынняверед хи ьмезан | B68: ирт | C68: наземь их деревянные подстилки, как | D68: три | E68: nom | F68: громовые ракеты возвестили нечто новое | G68: f | H68: В. П. Авенариус. Гоголь-гимназист (1897) | I68: В. П. Авенариус | J68: 1839 | K68: Гоголь-гимназист | L68: 1897 | M68: художественная | N68: повесть | R68: электронный текст | S68: омонимия не снята | T68: И точно: едва потухли оба солнца и грохнули наземь их деревянные подстилки, как три громовые ракеты возвестили нечто новое. [В. П. Авенариус. Гоголь-гимназист (1897)] [омонимия не снята] | U68: 1 | V68: =RAND() -> 0.39164481257277473
B69: ирТ | D69: Три | E69: nom | F69: главные темы в жизни ― Церковь | G69: f | H69: Борис Любимов. Три главные темы в жизни -- Церковь, литература и театр (2015) | I69: Борис Любимов | J69: 1947 | K69: Три главные темы в жизни -- Церковь, литература и театр | L69: 2015 | M69: публицистика, нехудожественная | N69: интервью | O69: религия, искусство и культура | R69: книга | S69: омонимия не снята | T69: Три главные темы в жизни ― Церковь, литература и театр [Борис Любимов. Три главные темы в жизни -- Церковь, литература и театр (2015)] [омонимия не снята] | U69: 1 | V69: =RAND() -> 0.60525029969644839
A70: есВ | B70: ирт | C70: Все | D70: три | E70: nom | F70: основные подсистемы социальной реальности тесно | G70: f | H70: И. М. Савельева, А. В. Полетаев. Знание о прошлом: теория и история. Том 1: Конструирование прошлого (2003) | I70: И. М. Савельева, А. В. Полетаев | J70: 1940-1950 | K70: Знание о прошлом: теория и история. Том 1: Конструирование прошлого | L70: 2003 | M70: учебно-научная , нехудожественная | N70: монография | O70: наука и технологии, история | P70: Савельева И. М., Полетаев А. В. Знание о прошлом: теория и история. — Том 1: Конструирование прошлого. — СПб.: Наука, 2003 | Q70: 2003 | R70: книга | S70: омонимия не снята | T70: Все три основные подсистемы социальной реальности тесно связаны между собой, и речь идет скорее об аналитическом представлении отдельных компонентов, чем о фактическом их разграничении. [И. М. Савельева, А. В. Полетаев. Знание о прошлом: теория и история. Том 1: Конструирование прошлого (2003)] [омонимия не снята] | U70: 1 | V70: =RAND() -> 0.58859553473076165
A71: еж ет есв улгу мовел | B71: ирт | C71: левом углу все те же | D71: три | E71: nom | F71: загадочные буквы «Р.В.С | G71: f | H71: А. П. Гайдар. Р. В. С (1925) | I71: А. П. Гайдар | J71: 1904 | K71: Р. В. С | L71: 1925 | M71: художественная | N71: рассказ | P71: А. Гайдар. Собр. соч.: В 3 т. Том 1 | Q71: 1986 | R71: книга | S71: омонимия не снята | T71: Дежурный посмотрел на Жигана, развернул записку и, заметив в левом углу все те же три загадочные буквы «Р.В.С.» [А. П. Гайдар. Р. В. С (1925)] [омонимия не снята] | U71: 1 | V71: =RAND() -> 0.59145478531329321
A72: ан оннемервондо иицидепскэ илмеЗ юиротси | B72: ирт | C72: историю Земли экспедиции одновременно на | D72: три | E72: nom | F72: звездные системы и впервые попытаемся | G72: f | H72: И. А. Ефремов. Туманность Андромеды (1956) | I72: И. А. Ефремов | J72: 1908 | K72: Туманность Андромеды | L72: 1956 | M72: художественная | N72: роман | R72: книга | S72: омонимия не снята | T72: Отправим впервые за всю историю Земли экспедиции одновременно на три звездные системы и впервые попытаемся достигнуть миров, находящихся на расстоянии семидесяти световых лет! [И. А. Ефремов. Туманность Андромеды (1956)] [омонимия не снята] | U72: 1 | V72: =RAND() -> 0.65650167572910001
A73: аклеб огонротпецер ылукелом толсиконима 053 | B73: ирт | C73: 350 аминокислот молекулы рецепторного белка | D73: три | E73: nom | F73: наружные петли соединяются с тремя | G73: f | H73: В. Майоров. Восприятие запахов // «Наука и жизнь», 2007 | I73: В. Майоров | K73: Восприятие запахов | L73: 2007 | M73: учебно-научная , нехудожественная | N73: статья | O73: наука и технологии, биология | P73: «Наука и жизнь» | Q73: 2007 | R73: журнал | S73: омонимия не снята | T73: У содержащей 300-350 аминокислот молекулы рецепторного белка три наружные петли соединяются с тремя внутриклеточными петлями семью пересекающими мембрану трансмембранными участками. [В. Майоров. Восприятие запахов // «Наука и жизнь», 2007] [омонимия не снята] | U73: 1 | V73: =RAND() -> 0.28400225425844017
A74: ьсилыркс онтарвзовзеб адук еж адут | B74: ирт | C74: туда же, куда безвозвратно скрылись | D74: три | E74: nom | F74: черные недели и регентство Бирона | G74: f | H74: К. П. Масальский. Регентство Бирона (1834) | I74: К. П. Масальский | J74: 1802 | K74: Регентство Бирона | L74: 1834 | M74: художественная | N74: повесть | P74: Русская историческая повесть первой половины XIX века | Q74: 1989 | R74: книга | S74: омонимия не снята | T74: Старый год улетел туда же, куда безвозвратно скрылись три черные недели и регентство Бирона. [К. П. Масальский. Регентство Бирона (1834)] [омонимия не снята] | U74: 1 | V74: =RAND() -> 0.76799436373759855
B75: ирТ | D75: Три | E75: nom | F75: стеклянные двери вели из гостиной | G75: f | H75: В. Ф. Ходасевич. Державин (1929-1931) | I75: В. Ф. Ходасевич | J75: 1886 | K75: Державин | L75: 1929-1931 | M75: публицистика , учебно-научная , нехудожественная | N75: биография | O75: искусство и культура | P75: Ходасевич В. Ф. Державин | Q75: 1988 | R75: книга | S75: омонимия не снята | T75: Три стеклянные двери вели из гостиной на широкую полукруглую лестницу, по которой спускались в сад, раскинутый позади всего дома. [В. Ф. Ходасевич. Державин (1929-1931)] [омонимия не снята] | U75: 1 | V75: =RAND() -> 0.78550139933700791
A76: есв отч онтыпобюЛ | B76: ирт | C76: Любопытно, что все | D76: три | E76: nom | F76: острые речи произнесли сотрудники ФБОН | G76: f | H76: Г. С. Померанц. Записки гадкого утёнка (1998) | I76: Г. С. Померанц | J76: 1918 | K76: Записки гадкого утёнка | L76: 1998 | M76: публицистика , нехудожественная | N76: мемуары | O76: политика и общественная жизнь | P76: Померанц Г. С. Записки гадкого утёнка | Q76: 1998 | R76: книга | S76: омонимия не снята | T76: Любопытно, что все три острые речи произнесли сотрудники ФБОН, библиографы, а не члены официального корпуса советской науки. [Г. С. Померанц. Записки гадкого утёнка (1998)] [омонимия не снята] | U76: 1 | V76: =RAND() -> 0.68589091510927847
B77: ирТ | D77: Три | E77: nom | F77: последние армии противостояли нашим ударным | G77: f | H77: А. И. Деникин. Очерки русской смуты. Том I. Крушение власти и армии (1921) | I77: А. И. Деникин | J77: 1872 | K77: Очерки русской смуты. Том I. Крушение власти и армии | L77: 1921 | M77: публицистика , нехудожественная | N77: очерк, цикл | O77: армия и вооруженные конфликты | P77: А. И. Деникин. Очерки русской смуты | Q77: 1921 | R77: книга | S77: омонимия не снята | T77: Три последние армии противостояли нашим ударным корпусам. [А. И. Деникин. Очерки русской смуты. Том I. Крушение власти и армии (1921)] [омонимия не снята] | U77: 1 | V77: =RAND() -> 0.98331613466207202
A78: олыб ЛМ у отсем еоннепетсоротв | B78: ирт | C78: второстепенное место, у МЛ было | D78: три | E78: nom | F78: основные области занятий: теория стиха | G78: f | H78: Вадим Баевский. Сорок лет // «Знамя», 2007 | I78: Вадим Баевский | J78: 1929 | K78: Сорок лет | L78: 2007 | M78: публицистика , нехудожественная | N78: мемуары | O78: частная жизнь | P78: «Знамя» | Q78: 2007 | R78: журнал | S78: омонимия не снята | T78: * * * Кроме разных побочных интересов, занимавших в его деятельности явно второстепенное место, у МЛ было три основные области занятий: теория стиха, классическая филология, перевод. [Вадим Баевский. Сорок лет // «Знамя», 2007] [омонимия не снята] | U78: 1 | V78: =RAND() -> 0.92656538716341363
A79: он онтяоревеН | B79: ирт | C79: Невероятно, но | D79: три | E79: nom | F79: разрозненные пешки показывают фантастическую силу | G79: f | H79: В. Тихомирова. Не будем спешить! // «Работница», 1980 | I79: В. Тихомирова | K79: Не будем спешить! | L79: 1980 | M79: публицистика, нехудожественная | N79: статья | O79: спорт | P79: «Работница» | Q79: 1980 | R79: журнал | S79: омонимия не снята | T79: Невероятно, но три разрозненные пешки показывают фантастическую силу. [В. Тихомирова. Не будем спешить! // «Работница», 1980] [омонимия не снята] | U79: 1 | V79: =RAND() -> 0.24304076593623258
A80: лешан я йедюл яадюлбаН | B80: ирт | C80: Наблюдая людей я нашел | D80: три | E80: nom | F80: различные рода отношения к религиозным | G80: m | H80: Л. Н. Толстой. О значении христианской религии (1875-1876) | I80: Л. Н. Толстой | J80: 1828 | K80: О значении христианской религии | L80: 1875-1876 | M80: публицистика , нехудожественная | N80: статья | O80: религия | P80: Л. Н. Толстой. Полное собрание сочинений в 90 томах, том 17 | Q80: 1956 | R80: книга | S80: омонимия не снята | T80: Наблюдая людей я нашел три различные рода отношения к религиозным вопросам. [Л. Н. Толстой. О значении христианской религии (1875-1876)] [омонимия не снята] | U80: 1 | V80: =RAND() -> 0.29342975693577511
A81: муминим ьтавзан онжом сачйес ежу | B81: ирт | C81: уже сейчас можно назвать минимум | D81: три | E81: gen | F81: дополнительных направления для диалога с | G81: n | H81: Дмитрий Евстафьев. Стратегия неудобного партнерства // «Эксперт», 2014 | I81: Дмитрий Евстафьев | K81: Стратегия неудобного партнерства | L81: 2014 | M81: публицистика, нехудожественная | N81: статья | O81: политика и общественная жизнь | P81: «Эксперт» | Q81: 2014 | R81: журнал | S81: омонимия не снята | T81: В частности, уже сейчас можно назвать минимум три дополнительных направления для диалога с США. [Дмитрий Евстафьев. Стратегия неудобного партнерства // «Эксперт», 2014] [омонимия не снята] | U81: 1 | V81: 0.80336449970535218
B82: ирТ | D82: Три | E82: gen | F82: альтернативных человечества развивались бок о | G82: n | H82: Андрей Константинов. Предок из пальца // «Русский репортер», № 34 (212), 1 сентября 2011, 2011 | I82: Андрей Константинов | K82: Предок из пальца | L82: 2011 | M82: публицистика , нехудожественная | N82: репортаж | O82: наука и технологии, биология, природа, история | P82: «Русский репортер», № 34 (212), 1 сентября 2011 | Q82: 2011 | R82: журнал | S82: омонимия не снята | T82: Три альтернативных человечества развивались бок о бок. [Андрей Константинов. Предок из пальца // «Русский репортер», № 34 (212), 1 сентября 2011, 2011] [омонимия не снята] | U82: 1 | V82: 0.74972776326318158
B83: ирТ | D83: Три | E83: gen | F83: неурожайных года подряд могут поставить | G83: m | H83: Виталий Правдивцев. Поле битвы — ионосфера // «Наука и религия», 2010 | I83: Виталий Правдивцев | K83: Поле битвы — ионосфера | L83: 2010 | M83: публицистика, нехудожественная | N83: статья | O83: география, природа, техника | P83: «Наука и религия» | Q83: 2010 | R83: журнал | S83: омонимия не снята | T83: Три неурожайных года подряд могут поставить на колени практически любое государство. [Виталий Правдивцев. Поле битвы — ионосфера // «Наука и религия», 2010] [омонимия не снята] | U83: 1 | V83: 0.53690045325468572
A84: корос юьдащолп йещбо ьмес ьтацдавд | B84: ирт | C84: двадцать семь, общей площадью сорок | D84: три | E84: gen | F84: квадратных метра, на шестом этаже | G84: m | H84: Александр Володарский. ЖЗЛ (Жизнеописание занимательных личностей) // «Сибирские огни», 2012 | I84: Александр Володарский | J84: 1954 | K84: ЖЗЛ (Жизнеописание занимательных личностей) | L84: 2012 | M84: художественная | N84: повесть | P84: «Сибирские огни» | Q84: 2012 | R84: журнал | S84: омонимия не снята | T84: ― Моя теща проживает в столице Украины, по адресу Киев, улица Саксаганского, девяносто, квартира сто двадцать семь, общей площадью сорок три квадратных метра, на шестом этаже, вход со двора, налево от арки. [Александр Володарский. ЖЗЛ (Жизнеописание занимательных личностей) // «Сибирские огни», 2012] [омонимия не снята] | U84: 1 | V84: 0.9380483446879182
A85: илетелдоп ущилиж оге к йетсонжомзов | B85: ирт | C85: возможностей), к его жилищу подлетели « | D85: три | E85: gen | F85: неидентифицированных камеры» (ха-ха-ха). | G85: f | H85: Виктор Пелевин. S.N.U.F.F (2011) | I85: Виктор Пелевин | J85: 1962 | K85: S.N.U.F.F | L85: 2011 | M85: художественная | N85: роман | P85: В. Пелевин. S.N.U.F.F | Q85: 2012 | R85: книга | S85: омонимия не снята | T85: Дело было так ― поздно вечером, когда Дюрекс сидел на балконе своего открытого дуплекса в нижней части офшара (высшая степень доступной глобальному урку роскоши независимо от его финансовых возможностей), к его жилищу подлетели «три неидентифицированных камеры» (ха-ха-ха). [Виктор Пелевин. S.N.U.F.F (2011)] [омонимия не снята] | U85: 1 | V85: 0.1758666927405379
A86: елакол в тевиж отк имет | B86: ирт | C86: теми, кто живет в «локале» ― | D86: три | E86: gen | F86: основных здания по типу общежитий | G86: n | H86: Валерий Калныш. Министр в отсидке // «Огонек», 2013 | I86: Валерий Калныш | K86: Министр в отсидке | L86: 2013 | M86: публицистика, нехудожественная | N86: статья | O86: политика и общественная жизнь | P86: «Огонек» | Q86: 2013 | R86: журнал | S86: омонимия не снята | T86: Его и еще несколько человек отселили в специальный барак (раньше здесь был ШИЗО), и поэтому он не видит и не общается с теми, кто живет в «локале» ― три основных здания по типу общежитий, где содержится более полутысячи заключенных колонии № 91. [Валерий Калныш. Министр в отсидке // «Огонек», 2013] [омонимия не снята] | U86: 1 | V86: 0.40443484209481628
A87: аз иьмес доход йищбо теашыверп | B87: ирт | C87: превышает общий доход семьи за | D87: три | E87: gen | F87: последних года. | G87: m | H87: Евгений Козичев. Законы вступили в права // «Огонек», 2013 | I87: Евгений Козичев | K87: Законы вступили в права | L87: 2013 | M87: публицистика, нехудожественная | N87: статья | O87: право, политика и общественная жизнь | P87: «Огонек» | Q87: 2013 | R87: журнал | S87: омонимия не снята | T87: Сведения нужно будет предоставлять по каждой сделке, если ее сумма превышает общий доход семьи за три последних года. [Евгений Козичев. Законы вступили в права // «Огонек», 2013] [омонимия не снята] | U87: 1 | V87: 0.53333625414897856
A88: ан йечарв ытенибак хачолем хесв | B88: ирт | C88: всех мелочах: кабинеты врачей на | D88: три | E88: gen | F88: квадратных метра больше стандартных, чтобы | G88: m | H88: Анастасия Матвеева. Сто лет совершенства // «Эксперт», 2014 | I88: Анастасия Матвеева | K88: Сто лет совершенства | L88: 2014 | M88: публицистика, нехудожественная | N88: статья | O88: здоровье и медицина, бизнес, коммерция, экономика, финансы | P88: «Эксперт» | Q88: 2014 | R88: журнал | S88: омонимия не снята | T88: И так во всех мелочах: кабинеты врачей на три квадратных метра больше стандартных, чтобы можно было поставить для пациентов не стулья, а диваны; данные ЭКГ появляются в электронной карте пациента через пять минут после обследования, тогда как в других лечебницах они становятся доступны врачу только к концу дня; по запросу пациентов, жалующихся на шум, проводится мониторинг уровня громкости в больничных помещениях и потом специальным образом монтируются тележки для подачи еды, чтобы те не тарахтели в коридорах. [Анастасия Матвеева. Сто лет совершенства // «Эксперт», 2014] [омонимия не снята] | U88: 1 | V88: 4.1218348179339337E-2
A89: олыб ачивоноеЛ алиахиМ у отсем | B89: ирт | C89: место, у Михаила Леоновича было | D89: три | E89: gen | F89: основных области занятий: теория стиха | G89: f | H89: Вадим Баевский и др. Штрихи к портрету // «Знамя», 2012 | I89: Вадим Баевский, Вадим Баевский, Вадим Баевский, Вадим Баевский, Вадим Баевский, Вадим Баевский | J89: 1929, 1929, 1929, 1929, 1929, 1929 | K89: Штрихи к портрету, Штрихи к портрету, Штрихи к портрету, Штрихи к портрету, Штрихи к портрету, Штрихи к портрету | L89: 2012, 2012, 2012, 2012, 2012, 2012 | M89: публицистика , нехудожественная, публицистика , нехудожественная, публицистика , нехудожественная, публицистика , нехудожественная, публицистика , нехудожественная, публицистика , нехудожественная | N89: мемуары, мемуары, мемуары, мемуары, мемуары, мемуары | O89: частная жизнь, частная жизнь, частная жизнь, частная жизнь, частная жизнь, частная жизнь | P89: «Знамя», «Знамя», «Знамя», «Знамя», «Знамя», «Знамя» | Q89: 2012, 2012, 2012, 2012, 2012, 2012 | R89: журнал, журнал, журнал, журнал, журнал, журнал | S89: омонимия не снята | T89: . Кроме разных побочных интересов, занимавших в его деятельности явно второстепенное место, у Михаила Леоновича было три основных области занятий: теория стиха, классическая филология, перевод. [Вадим Баевский и др. Штрихи к портрету // «Знамя», 2012] [омонимия не снята] | U89: 1 | V89: 0.12018957504385441
A90: отэ авокобаН ялД | B90: ирт | C90: Для Набокова это | D90: три | E90: gen | F90: неприемлемых философии, потому что они | G90: f | H90: Анастасия Козакевич, Борис Аверин. Бабочки и смерть Владимира Набокова // «Эксперт Северо-Запад», 2015 | I90: Анастасия Козакевич, Борис Аверин | J90: 1942 | K90: Бабочки и смерть Владимира Набокова | L90: 2015 | M90: публицистика, нехудожественная | N90: интервью | O90: искусство и культура, филология | P90: «Эксперт Северо-Запад» | Q90: 2015 | R90: журнал | S90: омонимия не снята | T90: Для Набокова это три неприемлемых философии, потому что они материалистичны. [Анастасия Козакевич, Борис Аверин. Бабочки и смерть Владимира Набокова // «Эксперт Северо-Запад», 2015] [омонимия не снята] | U90: 1 | V90: 0.73608726798297641
A91: и ясхищяортс ирт тядохереп адовазногавларУ | B91: ирт | C91: Уралвагонзавода переходят три строящихся и | D91: три | E91: gen | F91: действующих шахты, обогатительная фабрика, рудоремонтный | G91: f | H91: Андрей Горбунов. Уралвагонзавод добудет уголь // «Эксперт», 2013 | I91: Андрей Горбунов | K91: Уралвагонзавод добудет уголь | L91: 2013 | M91: публицистика, нехудожественная | N91: заметка | O91: производство, машиностроение, бизнес, коммерция, экономика, финансы | P91: «Эксперт» | Q91: 2013 | R91: журнал | S91: омонимия не снята | T91: Под контроль «дочки» Уралвагонзавода переходят три строящихся и три действующих шахты, обогатительная фабрика, рудоремонтный завод в Кемеровской области, угольный терминал Baltic Coal Terminal в латышском Вентспилсе, трейдер CCZ Trade S.A. Также Уралвагонзавод приобретает в той же Кемеровской области Юргинский машиностроительный завод, специализирующийся на производстве горно-шахтного, металлургического и подъемно-транспортного оборудования. [Андрей Горбунов. Уралвагонзавод добудет уголь // «Эксперт», 2013] [омонимия не снята] | U91: 1 | V91: 0.44224069416243328
A92: оннемИ | B92: ирт | C92: Именно | D92: три | E92: gen | F92: последних типа исследований позволили проделать | G92: m | H92: Валерий Ледяев. Изучение власти в городских сообществах: основные этапы и модели исследования // «Неприкосновенный запас», 2010 | I92: Валерий Ледяев | J92: 1955 | K92: Изучение власти в городских сообществах: основные этапы и модели исследования | L92: 2010 | M92: публицистика , нехудожественная | N92: статья | O92: наука и технологии, социология | P92: «Неприкосновенный запас» | Q92: 2010 | R92: журнал | S92: омонимия не снята | T92: Именно три последних типа исследований позволили проделать обстоятельный анализ факторов, обусловливающих диверсификацию властных отношений в городских сообществах. [Валерий Ледяев. Изучение власти в городских сообществах: основные этапы и модели исследования // «Неприкосновенный запас», 2010] [омонимия не снята] | U92: 1 | V92: 0.84047176295235348
A93: олыб сан у а меатобар | B93: ирт | C93: работаем, а у нас было | D93: три | E93: gen | F93: главных конкурента, поставляющих такие же | G93: m | H93: Вера Краснова. Вам не придется экономить // «Эксперт», 2014 | I93: Вера Краснова | K93: Вам не придется экономить | L93: 2014 | M93: публицистика, нехудожественная | N93: статья | O93: бизнес, коммерция, экономика, финансы | P93: «Эксперт» | Q93: 2014 | R93: журнал | S93: омонимия не снята | T93: ― И когда я снова позвонил тому клиенту и спросил, как мы работаем, а у нас было три главных конкурента, поставляющих такие же насосы, он сказал: вы будете получать заказы». [Вера Краснова. Вам не придется экономить // «Эксперт», 2014] [омонимия не снята] | U93: 1 | V93: 0.58504449323111452
A94: ебес агифин анелеХ тировог уаВ | B94: ирТ | C94: Вау, ― говорит Хелена, ― нифига себе! | D94: Три | E94: gen | F94: полных мешка! ― Пойдем, ― говорит Жанна | G94: m | H94: Александра Тайц. Хэллоуин // «Сибирские огни», 2012 | I94: Александра Тайц | J94: 1970 | K94: Хэллоуин | L94: 2012 | M94: художественная | N94: рассказ | P94: «Сибирские огни» | Q94: 2012 | R94: журнал | S94: омонимия не снята | T94: *** ― Вау, ― говорит Хелена, ― нифига себе! Три полных мешка! ― Пойдем, ― говорит Жанна. [Александра Тайц. Хэллоуин // «Сибирские огни», 2012] [омонимия не снята] | U94: 1 | V94: 0.49985691591906001
A95: ьтавиртамссар автсдовзиорподус огонвитартсинимда екдяроп в | B95: ерытеч | C95: в порядке административного судопроизводства рассматривать | D95: четыре | E95: nom | F95: основные группы дел. | G95: f | H95: И. В. Панова. Административное судопроизводство ― вид судопроизводства в Российской Федерации (2003) // «Арбитражный и гражданский процессы», 2003.02.24 | I95: И. В. Панова | K95: Административное судопроизводство ― вид судопроизводства в Российской Федерации | L95: 2003 | M95: учебно-научная , нехудожественная | N95: статья | O95: наука и технологии, право | P95: «Арбитражный и гражданский процессы» | Q95: 2003.02.24 | R95: журнал | S95: омонимия не снята | T95: Ю.А. Тихомиров предлагает в порядке административного судопроизводства рассматривать четыре основные группы дел. [И. В. Панова. Административное судопроизводство ― вид судопроизводства в Российской Федерации (2003) // «Арбитражный и гражданский процессы», 2003.02.24] [омонимия не снята] | U95: 1 | V95: =RAND() -> 0.74289133150294107
A96: илыб ежот яилотанА у монатипак | B96: ерытеч | C96: капитаном, у Анатолия тоже были | D96: четыре | E96: nom | F96: маленькие звездочки на погонах ― мастер | G96: f | H96: Лев Корнешов. Газета (2000) | I96: Лев Корнешов | J96: 1924 | K96: Газета | L96: 2000 | M96: художественная | N96: роман | P96: Лев Корнешов. Газета | Q96: 2000 | R96: книга | S96: омонимия не снята | T96: Страхов был в прошлой своей службе майором, Юрий ― капитаном, у Анатолия тоже были четыре маленькие звездочки на погонах ― мастер восточных единоборств, выбивает 48 из 50 из пистолета на тридцать метров. [Лев Корнешов. Газета (2000)] [омонимия не снята] | U96: 1 | V96: =RAND() -> 0.96188997710686142
A97: ынаворимрофС яинечу еывеоб ишан илатс | B97: ерытеч | C97: стали наши боевые учения. Сформированы | D97: четыре | E97: gen | F97: военных округа вместо шести. В | G97: m | H97: Дмитрий Медведев. Послание Президента РФ Федеральному Собранию Российской Федерации // «Российская газета», 2010 | I97: Дмитрий Медведев | J97: 1965 | K97: Послание Президента РФ Федеральному Собранию Российской Федерации | L97: 2010 | M97: публицистика , нехудожественная | N97: послание | O97: политика и общественная жизнь | P97: «Российская газета» | Q97: 2010 | R97: электронное издание | S97: омонимия не снята | T97: Вновь регулярными и, что немаловажно, масштабными стали наши боевые учения. Сформированы четыре военных округа вместо шести. В рамках Госпрограммы вооружения до 20-го года войска оснащаются современной техникой. [Дмитрий Медведев. Послание Президента РФ Федеральному Собранию Российской Федерации // «Российская газета», 2010] [омонимия не снята] | U97: 1 | V97: 4.1441485638467057E-3
A98: ан яслункилкто доран йикссур йынмузарен | B98: ерытеч | C98: неразумный русский народ откликнулся на | D98: четыре | E98: gen | F98: благополучных года нэпа. | G98: m | H98: Дмитрий Орешкин. Век на месте // «Огонек», 2013 | I98: Дмитрий Орешкин | J98: 1953 | K98: Век на месте | L98: 2013 | M98: публицистика, нехудожественная | N98: статья | O98: история, политика и общественная жизнь | P98: «Огонек» | Q98: 2013 | R98: журнал | S98: омонимия не снята | T98: Все это на фоне, напомним, падения производства хлеба и всплеска деторождений, которым неразумный русский народ откликнулся на четыре благополучных года нэпа. [Дмитрий Орешкин. Век на месте // «Огонек», 2013] [омонимия не снята] | U98: 1 | V98: 0.77446228149423035
B99: ерытеЧ | D99: Четыре | E99: gen | F99: долгих года участники плавания испытывали | G99: m | H99: Валентин Мирошников. Вокруг света на фрегате // «Знание-сила», 2013 | I99: Валентин Мирошников | K99: Вокруг света на фрегате | L99: 2013 | M99: публицистика, нехудожественная | N99: статья | O99: путешествия, история | P99: «Знание-сила» | Q99: 2013 | R99: журнал | S99: омонимия не снята | T99: Четыре долгих года участники плавания испытывали смертельно опасные, жестокие штормы, в которых гибли суда и люди, болели смертельной цингой и вели героические боевые действия на Камчатке против превосходящей англо-французской эскадры. [Валентин Мирошников. Вокруг света на фрегате // «Знание-сила», 2013] [омонимия не снята] | U99: 1 | V99: 0.72816693797154253
A100: огесв туТ ьтатобар одан отсем | B100: ерытеч | C100: место: надо работать. Тут всего | D100: четыре | E100: gen | F100: простых правила: ― возникла идея, задание | G100: n | H100: Александр Левинтов, Ольга Балла. В культуре свободных мест нет // «Знание - сила», 2010 | I100: Александр Левинтов, Ольга Балла | K100: В культуре свободных мест нет | L100: 2010 | M100: публицистика , нехудожественная | N100: интервью | O100: искусство и культура, философия, частная жизнь | P100: «Знание - сила» | Q100: 2010 | R100: журнал | S100: омонимия не снята | T100: Менее всего надо стремиться занять какое-то место: надо работать. Тут всего четыре простых правила: ― возникла идея, задание, заказ ― выполняй сразу, не откладывая; [Александр Левинтов, Ольга Балла. В культуре свободных мест нет // «Знание - сила», 2010] [омонимия не снята] | U100: 1 | V100: 0.31287328699931116
A101: емроф в арытшок ирт и | B101: ьтсеш | C101: и три коштыра в форме ― | D101: шесть | E101: gen | F101: свинцовых кулаков, шесть злых глаз | G101: m | H101: Евгений Чижов. Перевод с подстрочника (2012) | I101: Евгений Чижов | J101: 1966 | K101: Перевод с подстрочника | L101: 2012 | M101: художественная | N101: роман | P101: Евгений Чижов. Перевод с подстрочника | Q101: 2013 | R101: книга | S101: омонимия не снята | T101: Били его недолго и, возможно, даже не слишком сильно, но Печигину казалось, что это длится бесконечно и три коштыра в форме ― шесть свинцовых кулаков, шесть злых глаз, три накачанных деловитой яростью, пляшущих вокруг него лица ― решили его попросту убить. [Евгений Чижов. Перевод с подстрочника (2012)] [омонимия не снята] | U101: 1 | V101: 0.36748215474881274

Sheet: выводы (род)
A1: Количество по полю n | B1: Названия столбцов
A2: Названия строк | B2: f | C2: m | D2: n | E2: (пусто) | F2: Общий итог
A3: gen | B3: 9 | C3: 26 | D3: 15 | F3: 50
A4: nom | B4: 47 | C4: 2 | D4: 1 | F4: 50
A5: (пусто)
A6: Общий итог | B6: 56 | C6: 28 | D6: 16 | F6: 100

Sheet: выводы (число)
A2: Количество по полю два | B2: Названия столбцов
A3: Названия строк | B3: два | C3: две | D3: семь | E3: Три | F3: четыре | G3: шесть | H3: (пусто) | I3: Общий итог
A4: gen | B4: 26 | C4: 4 | D4: 1 | E4: 14 | F4: 4 | G4: 1 | I4: 50
A5: nom | C5: 23 | E5: 25 | F5: 2 | I5: 50
A6: (пусто)
A7: Общий итог | B7: 26 | C7: 27 | D7: 1 | E7: 39 | F7: 6 | G7: 1 | I7: 100