Sheet: 2 gen
A1: Reversed left context | B1: Reversed center | C1: Left context | D1: Center | E1: Punct | F1: Right context | G1: Лексема | H1: значение | I1: gen2 | J1: Title | K1: Author | L1: Birthday | M1: Header | N1: Created | O1: Sphere | P1: Type | Q1: Topic | R1: Publication | S1: Publ_year | T1: Medium | U1: Ambiguity | V1: Full context | W1: =RAND() -> 0.65456976271765044 | X1: 1
B2: укрифиЧ | C2: ― | D2: Чифирку | F2: бы подварить, ― сказал Севочка, укладывая | G2: чифирка | H2: еда (напиток) | I2: gen2 | J2: В. Т. Шаламов. Колымские рассказы (1954-1961) | K2: В. Т. Шаламов | L2: 1907 | M2: Колымские рассказы | N2: 1954-1961 | O2: художественная | P2: рассказ, цикл | R2: Шаламов В.Т. Собр. соч. | S2: 1998 | T2: книга | U2: омонимия снята | V2: ― Чифирку бы подварить, ― сказал Севочка, укладывая выигранные вещи в большой фанерный чемодан. ― Я подожду. [В. Т. Шаламов. Колымские рассказы (1954-1961)] [омонимия снята] | W2: =RAND() -> 0.63724768718191582 | X2: 1
A3: ин изявс ин яадюлбос ен | B3: укдяроп | C3: не соблюдая ни связи, ни | D3: порядку | E3: , | F3: и ты прочтёшь оные с | G3: порядок | I3: gen2 | J3: К. Н. Батюшков. Прогулка по Москве (1811-1812) | K3: К. Н. Батюшков | L3: 1787 | M3: Прогулка по Москве | N3: 1811-1812 | O3: художественная | P3: очерк | R3: К.Н. Батюшков Сочинения | S3: 1934 | T3: книга | U3: омонимия снята | V3: Итак, мимоходом, странствуя из дома в дом, с гулянья на гулянье, с ужина на ужин, я напишу несколько замечаний о городе и о нравах жителей, не соблюдая ни связи, ни порядку, и ты прочтёшь оные с удовольствием: они напомнят тебе о добром приятеле, [К. Н. Батюшков. Прогулка по Москве (1811-1812)] [омонимия снята] | W3: =RAND() -> 0.47946182046176444 | X3: 1
A4: зи ьтитсупу теуксир но еачулс | B4: удив | C4: случае он рискует упустить из | D4: виду | F4: те разнообразные смыслы, в которых | G4: вид | I4: gen2 | J4: В. Г. Лысенко. Классическая индийская философия в переводах и исследованиях российских ученых (1990-1996) (1996) | K4: В. Г. Лысенко | M4: Классическая индийская философия в переводах и исследованиях российских ученых (1990-1996) | N4: 1996 | O4: учебно-научная, нехудожественная | P4: статья | Q4: философия, религия | S4: 1996 | T4: книга | U4: омонимия снята | V4: Но в этом случае он рискует упустить из виду те разнообразные смыслы, в которых этот термин может употребляться в исходном тексте. [В. Г. Лысенко. Классическая индийская философия в переводах и исследованиях российских ученых (1990-1996) (1996)] [омонимия снята] | W4: =RAND() -> 6.2207412362915049E-2 | X4: 1
A5: зи ядохыв ывксоМ ханиарко ан | B5: умод | C5: на окраинах Москвы, выходя из | D5: дому | E5: ― | F5: в школу или в булочную | G5: дом | I5: gen2 | J5: Анвар Тавобов. Террор несовершеннолетних (2002) // «Вечерняя Москва», 2002.02.07 | K5: Анвар Тавобов | M5: Террор несовершеннолетних | N5: 2002 | O5: публицистика, нехудожественная | P5: заметка | Q5: криминал | R5: «Вечерняя Москва» | S5: 2002.02.07 | T5: газета | U5: омонимия снята | V5: Но каждый подросток, в особенности на окраинах Москвы, выходя из дому ― в школу или в булочную за хлебом, ― внутренне готовит себя к тому, что он может стать её участником. [Анвар Тавобов. Террор несовершеннолетних (2002) // «Вечерняя Москва», 2002.02.07] [омонимия снята] | W5: =RAND() -> 0.85078016895668218 | X5: 1
A6: огонисырк но ыб ешчуЛ ииротси | B6: удя | C6: истории. Лучше бы он крысиного | D6: яду | F6: наелся. Такая же тупая как | G6: яд | H6: еда (напиток) | I6: gen2 | J6: Андрей Геласимов. Нежный возраст (2001) | K6: Андрей Геласимов | L6: 1966 | M6: Нежный возраст | N6: 2001 | O6: художественная | P6: рассказ | R6: Геласимов А. Фокс Малдер похож на свинью: Повесть, рассказы | S6: 2001 | T6: книга | U6: омонимия снята | V6: Антон Стрельников сказал, что влюбился в новую училку по истории. Лучше бы он крысиного яду наелся. Такая же тупая как все. [Андрей Геласимов. Нежный возраст (2001)] [омонимия снята] | W6: =RAND() -> 0.10104182214111967 | X6: 1
A7: олеман ёен ан умиз аЗ | B7: угенс | C7: За зиму на неё намело | D7: снегу | E7: . | F7: Корень-выворотень весь зарос им | G7: снег | I7: gen2 | J7: Юрий Коваль. У Кривой сосны (1979) | K7: Юрий Коваль | L7: 1938 | M7: У Кривой сосны | N7: 1979 | O7: художественная | P7: рассказ | R7: Юрий Коваль. Солнечное пятно | S7: 2002 | T7: книга | U7: омонимия снята | V7: Частым осинником вышел я на поляну, где лежала Кривая сосна. За зиму на неё намело снегу. Корень-выворотень весь зарос им и стоял торчком среди осинника, как белый горбатый бык. [Юрий Коваль. У Кривой сосны (1979)] [омонимия снята] | W7: =RAND() -> 0.36684390692259083 | X7: 1
A8: ин яинеджор огеовс атсем ин | B8: удор | C8: ни места своего рождения, ни | D8: роду | E8: , | F8: ни племени, по показанию жителя | G8: род | I8: gen2 | J8: А. Ф. Вельтман. Иоланда (1843) | K8: А. Ф. Вельтман | L8: 1800 | M8: Иоланда | N8: 1843 | O8: художественная | P8: рассказ | R8: Русская фантастическая проза эпохи романтизма | S8: 1991 | T8: книга | U8: омонимия снята | V8: Иоланда, не объявляющая ни места своего рождения, ни роду, ни племени, по показанию жителя Толозы Иегана Реми, ремеслом мельника, проживает у него реченного в доме более года в тишине и неизвестности, платя исправно за постой; посещал её реченную Иоланду по вечерам неизвестный молодой мужчина и неизвестные люди, приносившие ей съестные припасы, а с недавнего времени посещал её другой неизвестный человек подозрительной наружности. [А. Ф. Вельтман. Иоланда (1843)] [омонимия снята] | W8: =RAND() -> 0.99306813345380951 | X8: 1
A9: хин то идж и тов | B9: уклот | C9: вот и жди от них | D9: толку | E9: ! ― | F9: злобно заметил Гриша. | G9: толк | I9: gen2 | J9: М. Е. Салтыков-Щедрин. Святочный рассказ (1858) | K9: М. Е. Салтыков-Щедрин | L9: 1826 | M9: Святочный рассказ | N9: 1858 | O9: художественная | P9: рассказ | R9: М.Е. Салтыков-Щедрин. История одного города и др. | S9: 1989 | T9: книга | U9: омонимия снята | V9: ― Ишь ты! глухие да глупые― вот и жди от них толку! ― злобно заметил Гриша. [М. Е. Салтыков-Щедрин. Святочный рассказ (1858)] [омонимия снята] | W9: =RAND() -> 0.89931060586455303 | X9: 1
A10: с алибс яароток яинога яаньлетимоту | B10: уклот | C10: утомительная агония, которая сбила с | D10: толку | F10: стольких учёных мужей. | G10: толк | I10: gen2 | J10: А. Н. Апухтин. Между жизнью и смертью (1892) | K10: А. Н. Апухтин | L10: 1840 | M10: Между жизнью и смертью | N10: 1892 | O10: художественная | P10: рассказ | R10: Русская фантастическая проза XIX - начала XX века | S10: 1991 | T10: книга | U10: омонимия снята | V10: И вот началась та утомительная агония, которая сбила с толку стольких учёных мужей. [А. Н. Апухтин. Между жизнью и смертью (1892)] [омонимия снята] | W10: =RAND() -> 0.4212522878152315 | X10: 1
A11: с евзар теагорт ен мас | B11: угупси | C11: сам не трогает, разве с | D11: испугу | E11: . | G11: испуг | H11: еда (напиток) | I11: gen2 | J11: Фазиль Искандер. Дедушка (1966) | K11: Фазиль Искандер | L11: 1929 | M11: Дедушка | N11: 1966 | O11: художественная | P11: рассказ | R11: Стоянка человека. Повести и рассказы. | S11: 1995 | T11: книга | U11: омонимия снята | V11: ― Нет, ― отвечает дедушка и ломает ветки черники, ― он сам не трогает, разве с испугу. [Фазиль Искандер. Дедушка (1966)] [омонимия снята] | W11: =RAND() -> 2.236330410947307E-2 | X11: 1
A12: вираваз ьревд верепаз И | B12: юач | C12: И, заперев дверь, заварив | D12: чаю | E12: , | F12: поставил на вертушку купленное выщербленное | G12: чай | I12: gen2 | J12: Татьяна Толстая. Река Оккервиль (1983) | K12: Татьяна Толстая | L12: 1951 | M12: Река Оккервиль | N12: 1983 | O12: художественная | P12: рассказ | T12: книга | U12: омонимия снята | V12: И, заперев дверь, заварив чаю, поставил на вертушку купленное выщербленное сокровище, и, глядя в окно на стягивающиеся на закатной стороне тяжёлые цветные тучи, выстроил, как обычно, кусок гранитной набережной, перекинул мост, ― и башенки нынче отяжелели, и цепи были неподъемно чугунны, и ветер рябил и морщил, волновал широкую, серую гладь реки Оккервиль, и Вера Васильевна, спотыкаясь больше положенного на своих неудобных, придуманных Симеоновым, каблуках,заламывала руки и склоняла маленькую гладко причёсанную головку к покатому плечику, ― тихо, так тихо светит луна, а дума тобой роковая полна, ― луна не поддавалась, мылом выскальзывала из рук, неслась сквозь рваные оккервильские тучи, ― на этом Оккервиле всегда что-то тревожное с небом, ― как беспокойно мечутся прозрачные, приручённые тени нашего воображения, когда сопение и запахи живой жизни проникают в их прохладный, туманный мир! [Татьяна Толстая. Река Оккервиль (1983)] [омонимия снята] | W12: =RAND() -> 0.97593672072693627 | X12: 1
A13: икчёщ в модохыв дереп ыт | B13: укичнолокедо | C13: ты перед выходом в щёчки | D13: одеколончику | E13: - | F13: то вотри, они на улице | G13: одеколончик | I13: gen2 | J13: Эдуард Лимонов. У нас была Великая Эпоха (1987) | K13: Эдуард Лимонов | L13: 1943 | M13: У нас была Великая Эпоха | N13: 1987 | O13: художественная | P13: роман | R13: Собр. соч.: В 3 т. | S13: 1998 | T13: книга | U13: омонимия снята | V13: "На танцы идёшь в клуб или куда в другое общественное место, так ты перед выходом в щёчки одеколончику-то вотри, они на улице и заиграют под ветром или, лучше того, на морозе… [Эдуард Лимонов. У нас была Великая Эпоха (1987)] [омонимия снята] | W13: =RAND() -> 0.91552523279968456 | X13: 1
A14: то бигоп ценокан едг еьлемездоп | B14: удя | C14: подземелье, где наконец погиб от | D14: яду | E14: . | G14: яд | H14: еда (напиток) | I14: gen2 | J14: В. А. Жуковский. Очерки Швеции (1838) | K14: В. А. Жуковский | L14: 1783 | M14: Очерки Швеции | N14: 1838 | O14: бытовая, нехудожественная | P14: письмо | Q14: путешествия | R14: В. Жуковский. Проза поэта | S14: 2001 | T14: книга | U14: омонимия снята | V14: Но эта тюрьма есть великолепное жилище в сравнении с тою ужасною темницею, в которой после был заперт Иоанном Эрик, лишённый им престола, потерявший от горя рассудок и потом брошенный в ужасное подземелье, где наконец погиб от яду. [В. А. Жуковский. Очерки Швеции (1838)] [омонимия снята] | W14: =RAND() -> 0.35864905370703426 | X14: 1
A15: ано ястиоб ен ыдзе ьдашоЛ | B15: умрок | C15: Лошадь езды не боится, она | D15: корму | F15: боится, ― ответил малый наставительно. | G15: корм | H15: еда (напиток) | I15: gen2 | J15: И. А. Бунин. Грамматика любви (1915) | K15: И. А. Бунин | L15: 1870 | M15: Грамматика любви | N15: 1915 | O15: художественная | P15: рассказ | R15: И. А. Бунин. Собрание сочинений в 6-ти т | S15: 1988 | T15: книга | U15: омонимия снята | V15: ― Лошадь езды не боится, она корму боится, ― ответил малый наставительно. [И. А. Бунин. Грамматика любви (1915)] [омонимия снята] | W15: =RAND() -> 0.99618981429888898 | X15: 1
A16: ин еще Я | B16: узар | C16: [agd-ardin, nick] Я еще ни | D16: разу | F16: не тыкнул в москву ближе | G16: раз | I16: gen2 | J16: Переписка в icq между agd-ardin и Колючий друг (2007.12.21) | M16: Переписка в icq между agd-ardin и Колючий друг | N16: 2007.12.21 | O16: электронная коммуникация , нехудожественная | P16: интернет-пейджер | Q16: образование | T16: электронный текст | U16: омонимия снята | V16: [agd-ardin, nick] Я еще ни разу не тыкнул в москву ближе чем на 440 км! [Переписка в icq между agd-ardin и Колючий друг (2007.12.21)] [омонимия снята] | W16: =RAND() -> 0.41103805042064123 | X16: 1
A17: в заР | B17: удог | C17: Раз в | D17: году | F17: могла она приехать и глянуть | G17: год | I17: gen2 | J17: Дина Рубина. Медная шкатулка (сборник) (2015) | K17: Дина Рубина | L17: 1953 | M17: Медная шкатулка (сборник) | N17: 2015 | O17: художественная | P17: рассказ, цикл | R17: Д. И. Рубина. Медная шкатулка (сборник) | S17: 2015 | T17: книга | U17: омонимия не снята | V17: Раз в году могла она приехать и глянуть на сыночка издали, из-за угла дома или в витрину кондитерской, куда его нянька водила пирожными угощать. [Дина Рубина. Медная шкатулка (сборник) (2015)] [омонимия не снята] | W17: =RAND() -> 0.98027865119176583 | X17: 1
A18: йедашол и йенивс то он | B18: юобто | C18: но от свиней и лошадей | D18: отбою | F18: нет. | G18: отбой | I18: gen2 | J18: А. А. Фет. Осенние хлопоты (1862) | K18: А. А. Фет | L18: 1820 | M18: Осенние хлопоты | N18: 1862 | O18: художественная | P18: рассказ | R18: А. Фет. Проза поэта | S18: 2001 | T18: книга | U18: омонимия снята | V18: Озими взошли прекрасные, но от свиней и лошадей отбою нет. [А. А. Фет. Осенние хлопоты (1862)] [омонимия снята] | W18: =RAND() -> 0.79225847259372251 | X18: 1
A19: артнец огоннойар ынебуК-ьтсУ зи ьсилункилктО | B19: утёл | C19: Откликнулись из Усть-Кубены, районного центра, | D19: лёту | F19: до которого пятнадцать или двадцать | G19: лёт | I19: gen2 | J19: Виктор Астафьев. Затеси (1999) // «Новый Мир», 2000 | K19: Виктор Астафьев | L19: 1924 | M19: Затеси | N19: 1999 | O19: публицистика, нехудожественная | P19: мемуары | R19: «Новый Мир» | S19: 2000 | T19: журнал | U19: омонимия снята | V19: Откликнулись из Усть-Кубены, районного центра, лёту до которого пятнадцать или двадцать минут. [Виктор Астафьев. Затеси (1999) // «Новый Мир», 2000] [омонимия снята] | W19: =RAND() -> 0.86089629771481191 | X19: 1
A20: зи илярет ен адгокин ым | B20: удив | C20: мы никогда не теряли из | D20: виду | E20: , | F20: ставили бы его выше и | G20: вид | I20: gen2 | J20: В. С. Соловьев. Три речи в память Достоевского (1881-1883) | K20: В. С. Соловьев | L20: 1853 | M20: Три речи в память Достоевского | N20: 1881-1883 | O20: публицистика, нехудожественная | P20: статья, цикл | Q20: философия | T20: книга | U20: омонимия снята | V20: От нас только требуется, чтобы мы своей маленькой части не ставили на место великого целого, чтобы мы не обособлялись в своём частном деле, а старались бы связать его с делом всечеловеческим, чтобы это великое дело мы никогда не теряли из виду, ставили бы его выше и прежде всего, а все остальное уж― потом. [В. С. Соловьев. Три речи в память Достоевского (1881-1883)] [омонимия снята] | W20: =RAND() -> 0.90423126428811684 | X20: 1
A21: зи ьтагеб или восортам ызакссар | B21: умод | C21: рассказы матросов или бегать из | D21: дому | F21: в ораниенбаумские сады и прятаться | G21: дом | I21: gen2 | J21: К. Г. Паустовский. Орест Кипренский (1936) | K21: К. Г. Паустовский | L21: 1892 | M21: Орест Кипренский | N21: 1936 | O21: художественная | P21: рассказ | R21: К. Паустовский. Собр. соч. в 8-ми т. Т. 6. | S21: 1969 | T21: книга | U21: омонимия снята | V21: Он мог часами слушать рассказы матросов или бегать из дому в ораниенбаумские сады и прятаться там от сторожей и садовников. [К. Г. Паустовский. Орест Кипренский (1936)] [омонимия снята] | W21: =RAND() -> 0.42814835735584478 | X21: 1
A22: с йотезаг йоннойар йонребилакоклем еытыркирП | B22: юарк | C22: Прикрытые мелкокалиберной районной газетой с | D22: краю | F22: лежали серые коржики домашнего, деревенского | G22: край | I22: gen2 | J22: Василий Гроссман. Все течет (1955-1963) // «Октябрь», 1989 | K22: Василий Гроссман | L22: 1905 | M22: Все течет | N22: 1955-1963 | O22: художественная | P22: повесть | R22: «Октябрь» | S22: 1989 | T22: журнал | U22: омонимия снята | V22: Прикрытые мелкокалиберной районной газетой с краю лежали серые коржики домашнего, деревенского печения. [Василий Гроссман. Все течет (1955-1963) // «Октябрь», 1989] [омонимия снята] | W22: =RAND() -> 0.86059488573509946 | X22: 1
A23: то яинещичо ялД | B23: удя | C23: ― Для очищения от | D23: яду | E23: , ― | F23: схитрил В― С., а на | G23: яд | H23: еда (напиток) | I23: gen2 | J23: Василий Аксенов. Романтик Китоусов, академик Великий-Салазкин и таинственная Маргарита // «Литературная газета», 1973 | K23: Василий Аксенов | L23: 1932 | M23: Романтик Китоусов, академик Великий-Салазкин и таинственная Маргарита | N23: 1973 | O23: художественная | P23: рассказ | R23: «Литературная газета» | S23: 1973 | T23: газета | U23: омонимия снята | V23: ― Для очищения от яду, ― схитрил В― С., а на самом-то деле он хотел по сигарете определить, откуда явился "романтик". [Василий Аксенов. Романтик Китоусов, академик Великий-Салазкин и таинственная Маргарита // «Литературная газета», 1973] [омонимия снята] | W23: =RAND() -> 0.76085520737994206 | X23: 1
A24: иледисоП | B24: юач | C24: Посидели, | D24: чаю | F24: попили, теперь уже забытого, с | G24: чай | H24: еда (напиток) | I24: gen2 | J24: Борис Екимов. Пиночет (1999) | K24: Борис Екимов | L24: 1938 | M24: Пиночет | N24: 1999 | O24: художественная | P24: повесть | R24: Борис Екимов. Пиночет | S24: 2001 | T24: книга | U24: омонимия снята | V24: Посидели, чаю попили, теперь уже забытого, с травой "железняк". [Борис Екимов. Пиночет (1999)] [омонимия снята] | W24: =RAND() -> 0.5971624778926663 | X24: 1
A25: икчомюр евд лилан нО | B25: урёкил | C25: Он налил две рюмочки | D25: ликёру | E25: " | F25: Кюрасао Канторовиц" и выпил с | G25: ликёр | H25: еда (напиток) | I25: gen2 | J25: А. Н. Толстой. Черная пятница (1924) | K25: А. Н. Толстой | L25: 1882 | M25: Черная пятница | N25: 1924 | O25: художественная | P25: рассказ | R25: Толстой А.Н. Черная пятница. - Авт.сб. Эмигранты. - М., «Правда» , 1982 | S25: 1982 | T25: книга | U25: омонимия снята | V25: Он налил две рюмочки ликёру "Кюрасао Канторовиц" и выпил с напротив сидящим японцем Котомарой за самую твёрдую из валют ― японскую иену. [А. Н. Толстой. Черная пятница (1924)] [омонимия снята] | W25: =RAND() -> 0.16624192608469435 | X25: 1
B26: удёМ | D26: Мёду | F26: купили 6 р. пуд, вощина | G26: мёд | H26: еда (напиток) | I26: gen2 | J26: А. Н. Радищев. Записки путешествия в Сибирь (1790) | K26: А. Н. Радищев | L26: 1749 | M26: Записки путешествия в Сибирь | N26: 1790 | O26: бытовая, нехудожественная | P26: дневник, записные книжки | R26: Радищев А. Н. Полное собрание сочинений: В 3 т. Т. 3 | S26: 1952 | T26: книга | U26: омонимия снята | V26: Мёду купили 6 р. пуд, вощина ― 10 р., воск чистый― 20 р. По рекам много деревень татарских. [А. Н. Радищев. Записки путешествия в Сибирь (1790)] [омонимия снята] | W26: =RAND() -> 0.40695800289490869 | X26: 1
A27: ан ылегнА анинираМ арднаскелА | B27: удьл | C27: Александра Маринина Ангелы на | D27: льду | F27: не выживают. Том 1 | G27: лёд | I27: gen2 | J27: Александра Маринина. Ангелы на льду не выживают. Т. 1 (2014) | K27: Александра Маринина | L27: 1957 | M27: Ангелы на льду не выживают. Т. 1 | N27: 2014 | O27: художественная | P27: роман | R27: Александра Маринина. Ангелы на льду не выживают. Т. 1 | S27: 2014 | T27: книга | U27: омонимия не снята | V27: Александра Маринина Ангелы на льду не выживают. Том 1 [Александра Маринина. Ангелы на льду не выживают. Т. 1 (2014)] [омонимия не снята] | W27: =RAND() -> 2.8707848135321345E-2 | X27: 1
A28: оготэ с я латс И | B28: узар | C28: И стал я с этого | D28: разу | F28: валенки подмораживать: вечером окуну, и | G28: раз | I28: gen2 | J28: М. М. Пришвин. Зайцы-профессора (1921-1925) | K28: М. М. Пришвин | L28: 1873 | M28: Зайцы-профессора | N28: 1921-1925 | O28: художественная | P28: рассказ | R28: М. Пришвин. «Зеленый шум». Сборник | S28: 1983 | T28: книга | U28: омонимия снята | V28: И стал я с этого разу валенки подмораживать: вечером окуну, и на мороз, ещё окуну и оставлю в сенях на всю ночь, а утром в них смело иду в болото. [М. М. Пришвин. Зайцы-профессора (1921-1925)] [омонимия снята] | W28: =RAND() -> 0.34431854547788499 | X28: 1
A29: ан ьсилороб хатсовх хиовс ан | B29: усев | C29: на своих хвостах, боролись на | D29: весу | F29: друг с другом. | G29: вес | I29: gen2 | J29: Василий Климов. Игра зверей — что это? // «Знание-сила», 2014 | K29: Василий Климов | M29: Игра зверей — что это? | N29: 2014 | O29: публицистика, нехудожественная | P29: статья | Q29: наука и технологии, биология | R29: «Знание-сила» | S29: 2014 | T29: журнал | U29: омонимия не снята | V29: Пара малышей, повиснув на своих хвостах, боролись на весу друг с другом. [Василий Климов. Игра зверей — что это? // «Знание-сила», 2014] [омонимия не снята] | W29: =RAND() -> 6.0162234261274206E-2 | X29: 1
A30: мокичнифарг мынтеваз с иньлапс йонметулоп | B30: укяьнок | C30: полутемной спальни с заветным графинчиком | D30: коньяку | E30: . | G30: коньяк | H30: еда (напиток) | I30: gen2 | J30: В. Ф. Ходасевич. Брюсов (1924) | K30: В. Ф. Ходасевич | L30: 1886 | M30: Брюсов | N30: 1924 | O30: публицистика, нехудожественная | P30: мемуары | R30: Ходасевич В. Ф. Колеблемый треножник : Избранное / Под общ. ред. Н.А. Богомолова Сост. и подгот. текста В.Г. Перельмутера | S30: 1990 | T30: книга | U30: омонимия снята | V30: Яков Кузьмич выходил из своей полутемной спальни с заветным графинчиком коньяку. [В. Ф. Ходасевич. Брюсов (1924)] [омонимия снята] | W30: =RAND() -> 0.23296706664971012 | X30: 1
A31: зи ястеаксупу окгел мотэ ирп | B31: удив | C31: при этом легко упускается из | D31: виду | E31: , | F31: что А. Т. Ф. ниспровергает | G31: вид | I31: gen2 | J31: А. А. Зализняк. Лингвистика по А. Т. Фоменко // «Вопросы языкознания», 2000 | K31: А. А. Зализняк | L31: 1935 | M31: Лингвистика по А. Т. Фоменко | N31: 2000 | O31: учебно-научная, нехудожественная | P31: статья | Q31: наука и технологии, история, филология | R31: «Вопросы языкознания» | S31: 2000 | T31: журнал | U31: омонимия снята | V31: Обычно особенно импонирует то, что ниспровергается "официальная наука", тем более такая замаранная в советское время прислужничеством идеологии, как история (при этом легко упускается из виду, что А. Т. Ф. ниспровергает не советских историков, а по сути дела всех историков всех стран и эпох). [А. А. Зализняк. Лингвистика по А. Т. Фоменко // «Вопросы языкознания», 2000] [омонимия снята] | W31: =RAND() -> 0.50487309781573941 | X31: 1
A32: в ястееми илсЕ течох оготэ | B32: удив | C32: этого хочет. Если имеется в | D32: виду | F32: просто друг. Если это ближайший | G32: вид | I32: gen2 | J32: Д. Менделеева, Ю. Ратанов. Психотерапевт: Что прячут счастливые аккаунты соцсетей? (2015.11.06) | K32: Д. Менделеева, Ю. Ратанов | M32: Психотерапевт: Что прячут счастливые аккаунты соцсетей? | N32: 2015.11.06 | O32: публицистика , нехудожественная | P32: интервью | Q32: частная жизнь | R32: Православие и мир (pravmir.ru) | S32: 2015 | T32: электронный текст | U32: омонимия не снята | V32: ― Я думаю, что единственно правильным будет ― поделиться радостью за этого человека, он ведь этого хочет. Если имеется в виду просто друг. Если это ближайший родственник, есть, наверное, и другие способы связи. [Д. Менделеева, Ю. Ратанов. Психотерапевт: Что прячут счастливые аккаунты соцсетей? (2015.11.06)] [омонимия не снята] | W32: =RAND() -> 0.27089484645427109 | X32: 1
A33: окьлокС илялертсоп еенхи овтсйемес ёсв | B33: удоран | C33: всё семейство ихнее постреляли. Сколько | D33: народу | F33: погибло… Михайла . | G33: народ | I33: gen2 | J33: А. И. Пантелеев. Ночные гости (1944) | K33: А. И. Пантелеев | L33: 1908 | M33: Ночные гости | N33: 1944 | O33: художественная | P33: пьеса | R33: Пантелеев А.И. Собрание сочинений: В 4 т. Т. 1 | S33: 1984 | T33: книга | U33: омонимия снята | V33: Из-за неё, проклятущей, всё семейство ихнее постреляли. Сколько народу погибло… . [А. И. Пантелеев. Ночные гости (1944)] [омонимия снята] | W33: =RAND() -> 0.65571037845684332 | X33: 1
A34: липыв ыб Я картваз ан | B34: уноьлуб | C34: на завтрак?… ― Я бы выпил | D34: бульону | E34: . | F34: Ах, при чём тут Паскаль | G34: бульон | H34: еда (напиток) | I34: gen2 | J34: Андрей Битов. Рассеянный свет (1981) | K34: Андрей Битов | L34: 1937 | M34: Рассеянный свет | N34: 1981 | O34: художественная | P34: рассказ | R34: Антология современной прозы. Т. 1. | S34: 2002 | T34: книга | U34: омонимия снята | V34: Что хочешь на завтрак?… ― Я бы выпил бульону. Ах, при чём тут Паскаль! [Андрей Битов. Рассеянный свет (1981)] [омонимия снята] | W34: =RAND() -> 0.43011106160680312 | X34: 1
A35: 8591 В | B35: удог | C35: В 1958 | D35: году | F35: получил главный приз Каннского кинофестиваля | G35: год | I35: gen2 | J35: Александр Шпагин. Отрицательный интерес // «Огонек», 2015 | K35: Александр Шпагин | M35: Отрицательный интерес | N35: 2015 | O35: публицистика, нехудожественная | P35: заметка | Q35: искусство и культура | R35: «Огонек» | S35: 2015 | T35: журнал | U35: омонимия не снята | V35: В 1958 году получил главный приз Каннского кинофестиваля фильм «Летят журавли». [Александр Шпагин. Отрицательный интерес // «Огонек», 2015] [омонимия не снята] | W35: =RAND() -> 0.15777112256791592 | X35: 1
A36: имакшитс имыньлаицниворп имиксечитсилаер имиом с | B36: удох | C36: с моими реалистическими провинциальными стишками | D36: ходу | F36: не было. | G36: ход | I36: gen2 | J36: В. П. Катаев. Алмазный мой венец (1975-1977) | K36: В. П. Катаев | L36: 1897 | M36: Алмазный мой венец | N36: 1975-1977 | O36: художественная | P36: роман | R36: Катаев В. Трава забвенья. | S36: 1997 | T36: книга | U36: омонимия снята | V36: В эти альманахи, где царили птицелов и эскесс как звёзды первой величины, мне с моими реалистическими провинциальными стишками ходу не было. [В. П. Катаев. Алмазный мой венец (1975-1977)] [омонимия снята] | W36: =RAND() -> 0.64636733708527616 | X36: 1
A37: огокат апюТ яслагупсИ | B37: укирк | C37: Испугался Тюпа— такого | D37: крику | F37: он ни разу не слыхал | G37: крик | I37: gen2 | J37: Е. И. Чарушин. Тюпа, Томка и сорока (1946) | K37: Е. И. Чарушин | L37: 1901 | M37: Тюпа, Томка и сорока | N37: 1946 | O37: художественная | P37: рассказ, цикл | R37: Чарушин Е.И. Тюпа, Томка и сорока | S37: 2004 | T37: книга | U37: омонимия снята | V37: Испугался Тюпа— такого крику он ни разу не слыхал— и ушёл от них поскорее. [Е. И. Чарушин. Тюпа, Томка и сорока (1946)] [омонимия снята] | W37: =RAND() -> 6.8786882382837033E-2 | X37: 1
A38: и хин то онвад хакшинатш | B38: унимоп | C38: штанишках, давно от них и | D38: помину | F38: нет, все обшаркались. | G38: помин | I38: gen2 | J38: А. М. Ремизов. Зайка (1905) | K38: А. М. Ремизов | L38: 1877 | M38: Зайка | N38: 1905 | O38: художественная | P38: сказка | R38: Ремизов А.М. Сочинения: В 2 кн. Кн. 1. | S38: 1993 | T38: книга | U38: омонимия снята | V38: Сам видишь, обносилась вся, локотки продраны, чулочки все в дырках, а какие были кружевца на штанишках, давно от них и помину нет, все обшаркались. [А. М. Ремизов. Зайка (1905)] [омонимия снята] | W38: =RAND() -> 0.14165633804105382 | X38: 1
A39: и кешуртав ман тисонирп и | B39: усавк | C39: и приносит нам ватрушек и | D39: квасу | E39: . | G39: квас | H39: еда (напиток) | I39: gen2 | J39: Л. Н. Толстой. Отрочество (1854) | K39: Л. Н. Толстой | L39: 1828 | M39: Отрочество | N39: 1854 | O39: художественная | P39: повесть | R39: Л.Н. Толстой. Собрание сочинений | S39: 1958 | T39: книга | U39: омонимия снята | V39: В окно кареты высовывается рука с бутылкой и узелком; Василий с удивительной ловкостью на ходу соскакивает с козел и приносит нам ватрушек и квасу. [Л. Н. Толстой. Отрочество (1854)] [омонимия снята] | W39: =RAND() -> 0.73845764791226609 | X39: 1
A40: то тел акорос ежу ичудуб | B40: удор | C40: будучи уже сорока лет от | D40: роду | E40: , | F40: а между тем он выступил | G40: род | I40: gen2 | J40: В. Н. Майков. Полное собрание сочинений И. Крылова... (1847) | K40: В. Н. Майков | L40: 1823 | M40: Полное собрание сочинений И. Крылова... | N40: 1847 | O40: публицистика, нехудожественная | P40: рецензия | Q40: искусство и культура | R40: В. Н. Майков. Литературная критика. Статьи, рецензии | S40: 1985 | T40: книга | U40: омонимия снята | V40: Вам, вероятно, известно, что Крылов начал писать басни, будучи уже сорока лет от роду, а между тем он выступил на литературное поприще ещё двадцатилетним юношей. [В. Н. Майков. Полное собрание сочинений И. Крылова... (1847)] [омонимия снята] | W40: =RAND() -> 1.5961995258489403E-2 | X40: 1
A41: ос ыб онваД | B41: утевс | C41: Давно бы со | D41: свету | F41: сжили, да вот не даюсь | G41: свет | I41: gen2 | J41: Н. А. Тэффи. Покаянное (1910) | K41: Н. А. Тэффи | L41: 1872 | M41: Покаянное | N41: 1910 | O41: художественная | P41: рассказ, миниатюра | R41: Тэффи Н.А. Юмористические рассказы. Из Всеобщей истории, обработанной «Сатириконом» | S41: 1990 | T41: книга | U41: омонимия снята | V41: Давно бы со свету сжили, да вот не даюсь я вам. [Н. А. Тэффи. Покаянное (1910)] [омонимия снята] | W41: =RAND() -> 0.81227678122024727 | X41: 1
A42: од яарк то меинеживд мынболз | B42: ухрев | C42: злобным движением от края до | D42: верху | F42: разорвал юбку и сразу её | G42: верх | I42: gen2 | J42: М. А. Булгаков. Полотенце с петухом (1926) | K42: М. А. Булгаков | L42: 1891 | M42: Полотенце с петухом | N42: 1926 | O42: художественная | P42: рассказ | R42: М. Булгаков. Собрание сочинений. - Т. 1: Записки покойника: Автобиографическая проза | S42: 2002 | T42: книга | U42: омонимия снята | V42: Тут Демьян Лукич резким, как бы злобным движением от края до верху разорвал юбку и сразу её обнажил. [М. А. Булгаков. Полотенце с петухом (1926)] [омонимия снята] | W42: =RAND() -> 0.34270160264948335 | X42: 1
A43: ениволоп йогурд ан как мет | B43: усач | C43: тем как на другой половине | D43: часу | F43: до одиннадцатого пробыли гости и | G43: час | I43: gen2 | J43: Антоний Погорельский. Черная курица (1829) | K43: Антоний Погорельский | L43: 1787 | M43: Черная курица | N43: 1829 | O43: художественная | P43: сказка | R43: А. Погорельский, С. Т. Аксаков. Черная курица, или Подземные жители. Аленький цветочек | S43: 1999 | T43: книга | U43: омонимия снята | V43: Алёша возвратился в дом и весь вечер просидел один в классных комнатах, между тем как на другой половине часу до одиннадцатого пробыли гости и на нескольких столах играли в вист. [Антоний Погорельский. Черная курица (1829)] [омонимия снята] | W43: =RAND() -> 0.75083808453289924 | X43: 1
A44: лип ен месвос итчоп мас | B44: юач | C44: сам почти совсем не пил | D44: чаю | E44: , | F44: а пил, когда была надобность | G44: чай | H44: еда (напиток) | I44: gen2 | J44: Ф. М. Достоевский. Господин Прохарчин (1846) | K44: Ф. М. Достоевский | L44: 1821 | M44: Господин Прохарчин | N44: 1846 | O44: художественная | P44: повесть | R44: Большая хрестоматия. Русская литература XIX века | S44: 2003 | T44: книга | U44: омонимия снята | V44: Это тотчас заметили и приняли в счёт, ибо Семён Иванович никак, ни за что и никому не мог одолжить своего чайника на подержание, хотя бы то было на самое малое время; и тем более был несправедлив в этом деле, что сам почти совсем не пил чаю, а пил, когда была надобность, какой-то довольно приятный настой из полевых цветов и некоторых целебного свойства трав,всегда в значительном количестве у него запасённый. [Ф. М. Достоевский. Господин Прохарчин (1846)] [омонимия снята] | W44: =RAND() -> 0.89785496799946252 | X44: 1
A45: ан иледис иляотс идюл иицкел | B45: улоп | C45: лекции люди стояли, сидели на | D45: полу | E45: , | F45: забирались на подоконники ― зал был | G45: пол | I45: gen2 | J45: А. А. Лотарева. Человек, переоткрывший русский язык (2015.10.06) | K45: А. А. Лотарева | L45: 1983 | M45: Человек, переоткрывший русский язык | N45: 2015.10.06 | O45: публицистика , нехудожественная | P45: заметка | Q45: филология, история | R45: Православие и мир (pravmir.ru) | S45: 2015 | T45: электронный текст | U45: омонимия не снята | V45: Два с половиной часа лекции люди стояли, сидели на полу, забирались на подоконники ― зал был полон с избытком. [А. А. Лотарева. Человек, переоткрывший русский язык (2015.10.06)] [омонимия не снята] | W45: =RAND() -> 0.72056067546389579 | X45: 1
A46: еенем ен ужатимрЭ оп или | B46: усач | C46: или по Эрмитажу не менее | D46: часу | E46: . | G46: час | I46: gen2 | J46: Ю. Н. Тынянов. Малолетный Витушишников (1933) | K46: Ю. Н. Тынянов | L46: 1894 | M46: Малолетный Витушишников | N46: 1933 | O46: художественная | P46: рассказ | R46: Юрий Тынянов. Кюхля. Рассказы | S46: 1973 | T46: книга | U46: омонимия снята | V46: Она должна ежедневно гулять по Аполлоновой зале или по Эрмитажу не менее часу. [Ю. Н. Тынянов. Малолетный Витушишников (1933)] [омонимия снята] | W46: =RAND() -> 0.32724234901712423 | X46: 1
A47: зеб ногав в умен к | B47: утёчс | C47: к нему в вагон «без | D47: счёту | E47: ». | G47: счёт | I47: gen2 | J47: К. И. Чуковский. Репин -- писатель (1930-1950) | K47: К. И. Чуковский | L47: 1882 | M47: Репин -- писатель | N47: 1930-1950 | O47: публицистика, нехудожественная | P47: мемуары | Q47: искусство и культура | R47: К.Чуковский. Собрание сочинений. Т. 4 | S47: 2001 | T47: книга | U47: омонимия снята | V47: Превосходен именно в беллетристическом отношении тот отрывок из его письма к В. В. Стасову, где он описывает ватагу крестьян, набившихся к нему в вагон «без счёту». [К. И. Чуковский. Репин -- писатель (1930-1950)] [омонимия снята] | W47: =RAND() -> 4.6797590632560171E-2 | X47: 1
A48: зеб ничноко зеб йеревд зеб | B48: улоп | C48: без дверей, без окончин, без | D48: полу | E48: ; | F48: кровля давно сгнила и обвалилась | G48: пол | I48: gen2 | J48: Н. М. Карамзин. Бедная Лиза (1792) | K48: Н. М. Карамзин | L48: 1766 | M48: Бедная Лиза | N48: 1792 | O48: художественная | P48: повесть | R48: Н.М. Карамзин. Избранные произведения в прозе | S48: 2003 | T48: книга | U48: омонимия снята | V48: Саженях в семидесяти от монастырской стены, подле берёзовой рощицы, среди зелёного луга, стоит пустая хижина, без дверей, без окончин, без полу; кровля давно сгнила и обвалилась. [Н. М. Карамзин. Бедная Лиза (1792)] [омонимия снята] | W48: =RAND() -> 0.62578263343669116 | X48: 1
A49: ялд ьчомоп и онжом ино | B49: упмет | C49: они, ― можно и помочь для | D49: темпу | E49: . | G49: темп | I49: gen2 | J49: Григорий Горин. Когда горит душа (1974-1984) | K49: Григорий Горин | L49: 1940 | M49: Когда горит душа | N49: 1974-1984 | O49: художественная | P49: рассказ | R49: Григорий Горин. Золотая серия юмора. | S49: 1999 | T49: книга | U49: омонимия снята | V49: ― А что ж, ― говорят они, ― можно и помочь для темпу. [Григорий Горин. Когда горит душа (1974-1984)] [омонимия снята] | W49: =RAND() -> 0.69937024978402595 | X49: 1
A50: то тел 72 олыб умЕ | B50: удор | C50: Ему было 27 лет от | D50: роду | E50: ; | F50: он был высок и строен | G50: род | I50: gen2 | J50: А. С. Пушкин. Арап Петра Великого (1828) | K50: А. С. Пушкин | L50: 1799 | M50: Арап Петра Великого | N50: 1828 | O50: художественная | P50: роман | R50: А. Пушкин. Полное собрание сочинений | S50: 1937-1949 | T50: книга | U50: омонимия снята | V50: Ему было 27 лет от роду; он был высок и строен, и не одна красавица заглядывалась на него с чувством более лестным нежели простое любопытство, но предубеждённый Ибрагим или ничего не замечал или видел одно кокетство. [А. С. Пушкин. Арап Петра Великого (1828)] [омонимия снята] | W50: =RAND() -> 0.44905434614675732 | X50: 1
A51: мот в отч аД как | B51: уклот | C51: как! Да что в том | D51: толку | E51: … | F51: В свете идти на любовь | G51: толк | I51: gen2 | J51: В. А. Соллогуб. Метель (1849) | K51: В. А. Соллогуб | L51: 1814 | M51: Метель | N51: 1849 | O51: художественная | P51: рассказ | R51: В. А. Соллогуб. Избранная проза | S51: 1983 | T51: книга | U51: омонимия снята | V51: Да и как! Да что в том толку… В свете идти на любовь ― значит идти на верный обман. [В. А. Соллогуб. Метель (1849)] [омонимия снята] | W51: =RAND() -> 0.25766854378955195 | X51: 1
A52: 0102 в илиледыв едирдаМ в | B52: удог | C52: в Мадриде выделили в 2010 | D52: году | E52: ― | F52: и вот ― церковь с золотыми | G52: год | I52: gen2 | J52: А. А. Данилова. Местность любви (2015.11.09) | K52: А. А. Данилова | L52: 1981 | M52: Местность любви | N52: 2015.11.09 | O52: публицистика , нехудожественная | P52: репортаж, беседа | Q52: религия, путешествия, частная жизнь | R52: Православие и мир (pravmir.ru) | S52: 2015 | T52: электронный текст | U52: омонимия не снята | V52: Землю под храм в Мадриде выделили в 2010 году ― и вот ― церковь с золотыми куполами. [А. А. Данилова. Местность любви (2015.11.09)] [омонимия не снята] | W52: =RAND() -> 0.44379644519819317 | X52: 1
A53: с йотсорп йокат к еинешонто | B53: удив | C53: отношение к такой простой с | D53: виду | F53: задаче. | G53: вид | I53: gen2 | J53: Максим Горький. Чарли Мэн (1906) | K53: Максим Горький | L53: 1868 | M53: Чарли Мэн | N53: 1906 | O53: художественная | P53: рассказ | T53: книга | U53: омонимия снята | V53: Но оказывается, что Чарли Мэн имеет своё отношение к такой простой с виду задаче. [Максим Горький. Чарли Мэн (1906)] [омонимия снята] | W53: =RAND() -> 8.6674369965499265E-3 | X53: 1
A54: огесв ос и яслажебзар вобуЗ | B54: ухам | C54: Зубов разбежался и со всего | D54: маху | F54: двинулся головой об стену. | G54: мах | I54: gen2 | J54: Д. И. Хармс. Начало очень хорошего летнего дня (симфония) (1939) | K54: Д. И. Хармс | L54: 1905 | M54: Начало очень хорошего летнего дня (симфония) | N54: 1939 | O54: художественная | P54: миниатюра | R54: Хармс Д. Полное собрание сочинений. Том 2 | S54: 1997 | T54: книга | U54: омонимия снята | V54: «Вот ловкач!» ― закричало человеческое стадо, и некто Зубов разбежался и со всего маху двинулся головой об стену. [Д. И. Хармс. Начало очень хорошего летнего дня (симфония) (1939)] [омонимия снята] | W54: =RAND() -> 0.44461849937710596 | X54: 1
A55: с турму итед ьтадорп хи | B55: удолог | C55: их продать, дети умрут с | D55: голоду | E55: . | G55: голод | I55: gen2 | J55: Л. А. Чарская. Король с раскрашенной картинки (1912) | K55: Л. А. Чарская | L55: 1875 | M55: Король с раскрашенной картинки | N55: 1912 | O55: художественная | P55: сказка | R55: Л. А. Чарская. Сказки голубой феи | S55: 1992 | T55: книга | U55: омонимия снята | V55: Если их продать, дети умрут с голоду. [Л. А. Чарская. Король с раскрашенной картинки (1912)] [омонимия снята] | W55: =RAND() -> 0.48643727345772858 | X55: 1
A56: то олес ьсолинлопан оге имасолог | B56: ухрев | C56: голосами его наполнилось село от | D56: верху | F56: до самого, так сказать, до | G56: верх | I56: gen2 | J56: А. И. Левитов. Расправа (1862) | K56: А. И. Левитов | L56: 1835 | M56: Расправа | N56: 1862 | O56: художественная | P56: рассказ | R56: А.И. Левитов. Избранные произведения | S56: 1988 | T56: книга | U56: омонимия снята | V56: На живую руку сбитые ворота с громким скрипом отворяются навстречу стада, и вот многоразличными голосами его наполнилось село от верху до самого, так сказать, до низу. [А. И. Левитов. Расправа (1862)] [омонимия снята] | W56: =RAND() -> 0.30341108863134025 | X56: 1
A57: огокат йавызакссар ен от уретиП | B57: уродзв | C57: Питеру-то не рассказывай такого | D57: вздору | E57: , | F57: ну, что скажет министр или | G57: вздор | I57: gen2 | J57: А. И. Герцен. Мимоездом (1846) | K57: А. И. Герцен | L57: 1812 | M57: Мимоездом | N57: 1846 | O57: художественная | P57: рассказ, отрывок | R57: А.И. Герцен. Сочинения в 9 томах. Том 1 | S57: 1955 | T57: книга | U57: омонимия снята | V57: ― Пожалуйста, батюшка, по Питеру-то не рассказывай такого вздору, ну, что скажет министр или особа какая ― "Баба, а не товарищ председателя". [А. И. Герцен. Мимоездом (1846)] [омонимия снята] | W57: =RAND() -> 0.68105491709505594 | X57: 1
A58: с мин с ыб илировогоп | B58: узалг | C58: поговорили бы с ним с | D58: глазу | F58: на глаз, так он бы | G58: глаз | I58: gen2 | J58: А. Н. Островский. Гроза (1860) | K58: А. Н. Островский | L58: 1823 | M58: Гроза | N58: 1860 | O58: художественная | P58: пьеса | R58: А.Н. Островский. Полное собрание сочинений | S58: 1951 | T58: книга | U58: омонимия снята | V58: Вчетвером этак, впятером в переулке где-нибудь поговорили бы с ним с глазу на глаз, так он бы шёлковый сделался. [А. Н. Островский. Гроза (1860)] [омонимия снята] | W58: =RAND() -> 0.65297535019207253 | X58: 1
A59: зи ьсишвунрев ыджандо и сеныв | B59: умод | C59: вынес и однажды, вернувшись из | D59: дому | F59: Нерягиных, где бывал часто, выстрелил | G59: дом | I59: gen2 | J59: В. Я. Брюсов. Через пятнадцать лет (1909) | K59: В. Я. Брюсов | L59: 1873 | M59: Через пятнадцать лет | N59: 1909 | O59: художественная | P59: рассказ | R59: В.Я. Брюсов. Повести и рассказы | S59: 1983 | T59: книга | U59: омонимия снята | V59: Корецкий этого не вынес и однажды, вернувшись из дому Нерягиных, где бывал часто, выстрелил себе в грудь. [В. Я. Брюсов. Через пятнадцать лет (1909)] [омонимия снята] | W59: =RAND() -> 5.0559419516168602E-2 | X59: 1
A60: макичторов к лунревс и анко | B60: угаШ | C60: окна и свернул к воротчикам. | D60: Шагу | F60: не прибавил. И сразу все | G60: шаг | I60: gen2 | J60: Василий Шукшин. Печки-лавочки (1970-1972) | K60: Василий Шукшин | L60: 1929 | M60: Печки-лавочки | N60: 1970-1972 | O60: художественная | P60: киноповесть | R60: Василий Шукшин. Собрание сочинений (в 3 томах), т3 | S60: 2003 | T60: книга | U60: омонимия снята | V60: Лев Казимирыч поднял умную голову в шляпе, посмотрел на окна и свернул к воротчикам. Шагу не прибавил. И сразу все за столом заговорили об одном ― какой умный этот Лев Казимирыч, сколько он, собака, знает всякой всячины, выращивает даже яблоки и выписывает книги. [Василий Шукшин. Печки-лавочки (1970-1972)] [омонимия снята] | W60: =RAND() -> 1.7843596797070371E-2 | X60: 1
A61: огес ырецифо есв юрадусог каК | B61: уклоп | C61: Как государю все офицеры сего | D61: полку | E61: , | F61: а в том числе и | G61: полк | I61: gen2 | J61: А. Т. Болотов. Жизнь и приключения Андрея Болотова, описанные самим им для своих потомков (1800) | K61: А. Т. Болотов | L61: 1738 | M61: Жизнь и приключения Андрея Болотова, описанные самим им для своих потомков | N61: 1800 | O61: публицистика, нехудожественная | P61: мемуары | R61: Путь к трону: История дворцового переворота 28 июня 1762 года. | S61: 1997 | T61: книга | U61: омонимия снята | V61: Как государю все офицеры сего полку, а в том числе и вы были коротко известны, то сегодня, приехавши смотреть свой полк, не находит он вас и спрашивает, где 6 вы были, и для чего вас нет во фрунте. [А. Т. Болотов. Жизнь и приключения Андрея Болотова, описанные самим им для своих потомков (1800)] [омонимия снята] | W61: =RAND() -> 0.71424331351103643 | X61: 1
A62: овтсежонм олахеирП | B62: удоран | C62: Приехало множество | D62: народу | E62: , | F62: на полу лежали провода, всюду | G62: народ | I62: gen2 | J62: Людмила Петрушевская. Маленькая волшебница // «Октябрь», 1996 | K62: Людмила Петрушевская | L62: 1938 | M62: Маленькая волшебница | N62: 1996 | O62: художественная | P62: роман | R62: «Октябрь» | S62: 1996 | T62: журнал | U62: омонимия снята | V62: Приехало множество народу, на полу лежали провода, всюду слонялись какие-то бездельники с молотками, наушниками и кабелями, редакторша орала, потрясая бумажками с текстом, про домик все как будто забыли ― взоры присутствующих и глазок видеокамеры были прикованы к пустому подоконнику. [Людмила Петрушевская. Маленькая волшебница // «Октябрь», 1996] [омонимия снята] | W62: =RAND() -> 0.27455312051050418 | X62: 1
A63: с илшыв ишан икдерп юинадерп | B63: уноД | C63: преданию, предки наши вышли с | D63: Дону | E63: , | F63: где и до сих пор | G63: Дон | I63: gen2 | J63: П. И. Мельников-Печерский. Начало неоконченной автобиографии (1863) | K63: П. И. Мельников-Печерский | L63: 1819 | M63: Начало неоконченной автобиографии | N63: 1863 | O63: публицистика, нехудожественная | P63: автобиография | Q63: частная жизнь | R63: Мельников-Печерский П. И. Собрание сочинений в 6 т., том 1 | S63: 1963 | T63: книга | U63: омонимия снята | V63: По преданию, предки наши вышли с Дону, где и до сих пор существует фамилия Мельниковых. [П. И. Мельников-Печерский. Начало неоконченной автобиографии (1863)] [омонимия снята] | W63: =RAND() -> 0.12457766172243645 | X63: 1
A64: 4102 в ытатьлузер иьч вореноигел | B64: удог | C64: легионеров, чьи результаты в 2014 | D64: году | F64: могут впечатлить и нынешних, и | G64: год | I64: gen2 | J64: Александра Владимирова. Обрусевшие // «Русский репортер», 2014 | K64: Александра Владимирова | M64: Обрусевшие | N64: 2014 | O64: публицистика, нехудожественная | P64: заметка | Q64: спорт | R64: «Русский репортер» | S64: 2014 | T64: журнал | U64: омонимия не снята | V64: «РР» составил список самых ярких легионеров, чьи результаты в 2014 году могут впечатлить и нынешних, и прежних соотечественников. [Александра Владимирова. Обрусевшие // «Русский репортер», 2014] [омонимия не снята] | W64: =RAND() -> 0.38479719995182859 | X64: 1
A65: огечярог ьтсеъс лыб ьчорп ен | B65: упус | C65: не прочь был съесть горячего | D65: супу | E65: . | G65: суп | H65: еда (напиток) | I65: gen2 | J65: Б. А. Пильняк. Три брата (1923-1928) | K65: Б. А. Пильняк | L65: 1894 | M65: Три брата | N65: 1923-1928 | O65: художественная | P65: рассказ | T65: книга | U65: омонимия снята | V65: Через два дня на третий приходила ко мне хожалка, обыкновенно к этому времени съедался хлеб и я уже не прочь был съесть горячего супу. [Б. А. Пильняк. Три брата (1923-1928)] [омонимия снята] | W65: =RAND() -> 0.94964171766028072 | X65: 1
A66: иличармо иовт ырауторт есв илеыв | B66: удолох | C66: выели все тротуары твои, омрачили, | D66: холоду | F66: нагнали по домам, тифом, холодом | G66: холод | I66: gen2 | J66: Б. К. Зайцев. Улица св. Николая (1921) | K66: Б. К. Зайцев | L66: 1881 | M66: Улица св. Николая | N66: 1921 | O66: художественная | P66: очерк | R66: Собрание сочинений в 5 т. -- Т. 2. Улица Святого Николая: Повести. Рассказы. | S66: 1999 | T66: книга | U66: омонимия снята | V66: По тебе прошли метели страшные, размыли тебя и замертвили, выели все тротуары твои, омрачили, холоду нагнали по домам, тифом, холодом, голодом, казнями пронеслись по жителям твоим, и многих разметали вдаль. [Б. К. Зайцев. Улица св. Николая (1921)] [омонимия снята] | W66: =RAND() -> 0.59707771701694479 | X66: 1
A67: од енм ястёатсо ьледен ьмеС | B67: укорс | C67: Семь недель остаётся мне до | D67: сроку | E67: , | F67: и я нарочно заранее принял | G67: срок | I67: gen2 | J67: Д. И. Фонвизин. К И.П. Елагину (1769) | K67: Д. И. Фонвизин | L67: 1744 | M67: К И.П. Елагину | N67: 1769 | O67: бытовая, нехудожественная | P67: письмо личное | Q67: частная жизнь | R67: Фонвизин Д.И. Собрание сочинений: В 2 т. Т. 2 | S67: 1959 | T67: книга | U67: омонимия снята | V67: Семь недель остаётся мне до сроку, и я нарочно заранее принял смелость всенижайше просить ваше превосходительство об отсрочке мне ещё на полгода для следующих причин: 1) Я время моё провожу здесь весьма полезно, в рассуждении известного вам моего состояния; перевёл "Иосифа", за который возьму 200 руб.; напечатал "Сиднея"; пишу стихи; дописал почти свою комедию, чему свидетель отъезжающий отсюда С. Г. Домашнев, который всё то читал, о чём я имею честь доносить вашему превосходительству. [Д. И. Фонвизин. К И.П. Елагину (1769)] [омонимия снята] | W67: =RAND() -> 0.93695302880410913 | X67: 1
A68: с от юувенчя и ад | B68: юоб | C68: да и ячневую-то с | D68: бою | E68: ― | F68: как самой дешёвой ею откармливали | G68: бой | I68: gen2 | J68: Александр Солженицын. Матренин двор (1960) | K68: Александр Солженицын | L68: 1918 | M68: Матренин двор | N68: 1960 | O68: художественная | P68: рассказ | R68: Солженицын А.И. На краях | S68: 2000 | T68: книга | U68: омонимия снята | V68: Что на завтрак, она не объявляла, да это и догадаться было легко: картовь необлупленная, или суп картонный (так выговаривали все в деревне), или каша ячневая (другой крупы в тот год нельзя было купить в Торфопродукте, да и ячневую-то с бою ― как самой дешёвой ею откармливали свиней и мешками брали). [Александр Солженицын. Матренин двор (1960)] [омонимия снята] | W68: =RAND() -> 0.87220254250132967 | X68: 1
A69: 7191 в ывксоМ то хартемолик | B69: удог | C69: километрах от Москвы (в 1917 | D69: году | F69: было создано несколько «женских команд | G69: год | I69: gen2 | J69: Андрей Архангельский. Ради смерти на земле // «Огонек», 2015 | K69: Андрей Архангельский | L69: 1974 | M69: Ради смерти на земле | N69: 2015 | O69: публицистика, нехудожественная | P69: рецензия | Q69: армия и вооруженные конфликты, искусство и культура | R69: «Огонек» | S69: 2015 | T69: журнал | U69: омонимия не снята | V69: А вот в случае с Первой мировой это уже не так очевидно, тем более что авторы сами говорят, что фронт к тому времени «разложился», а враг без особого рвения «топчет нашу землю» примерно в 800 километрах от Москвы (в 1917 году было создано несколько «женских команд смерти», для поднятия боевого духа армии: один батальон принял участие в боевых действиях в течение трех дней под Молодечно в июле 1917-го; а уже в августе того же года женщинам было запрещено участвовать в боях. [Андрей Архангельский. Ради смерти на земле // «Огонек», 2015] [омонимия не снята] | W69: =RAND() -> 0.72255237512880277 | X69: 1
A70: огот с аросум екалбо в | B70: юарк | C70: в облаке мусора с того | D70: краю | F70: сада, где начиналась дичь: паслён | G70: край | I70: gen2 | J70: Б. Л. Пастернак. Воздушные пути (1924) | K70: Б. Л. Пастернак | L70: 1890 | M70: Воздушные пути | N70: 1924 | O70: художественная | P70: повесть | R70: Борис Пастернак. Полное собрание сочинений в 11 томах | S70: 2005 | T70: книга | U70: омонимия снята | V70: ― Куды, куды! ― поротой губой провыла на весь мир полоумная пастушка и, в предшествии молодого бычка, волоча отдавленную ногу и маша, как молнией, дикой хворостиной, явилась в облаке мусора с того краю сада, где начиналась дичь: паслён, кирпич, мятая проволока, гнилой полумрак. [Б. Л. Пастернак. Воздушные пути (1924)] [омонимия снята] | W70: =RAND() -> 0.79527847837693499 | X70: 1
A71: с вяндоп и ьчинзван яслилавоп | B71: улоп | C71: повалился навзничь и, подняв с | D71: полу | F71: книгу, погрузился в чтение… | G71: пол | I71: gen2 | J71: А. Т. Аверченко. Камень на шее (1910-1914) | K71: А. Т. Аверченко | L71: 1881 | M71: Камень на шее | N71: 1910-1914 | O71: художественная | P71: рассказ | R71: «Аркадий Аверченко. Собрание сочинений в 6 томах. Том 2. «Круги по воде» | S71: 2000 | T71: книга | U71: омонимия снята | V71: Пампасов шумно вздохнул, повалился навзничь и, подняв с полу книгу, погрузился в чтение… [А. Т. Аверченко. Камень на шее (1910-1914)] [омонимия снята] | W71: =RAND() -> 0.86942040735148984 | X71: 1
A72: хапаз ад вотекнек и йечевс | B72: ухороп | C72: свечей и кенкетов да запах | D72: пороху | F72: только на фейерверках. | G72: порох | I72: gen2 | J72: Д. В. Давыдов. Мороз ли истребил французскую армию в 1812 году? (1830-1835) | K72: Д. В. Давыдов | L72: 1784 | M72: Мороз ли истребил французскую армию в 1812 году? | N72: 1830-1835 | O72: публицистика, нехудожественная | P72: статья | Q72: армия и вооруженные конфликты | T72: книга | U72: омонимия снята | V72: И пусть бы разглашали это городские господчики или маменькины сынки, которым известен огонь одних восковых свечей и кенкетов да запах пороху только на фейерверках. [Д. В. Давыдов. Мороз ли истребил французскую армию в 1812 году? (1830-1835)] [омонимия снята] | W72: =RAND() -> 0.94103367255420844 | X72: 1
A73: мокчуп аз корахук хытсинищром и | B73: укул | C73: и морщинистых кухарок за пучком | D73: луку | E73: ! | G73: лук | H73: еда (напиток) | I73: gen2 | J73: А. В. Дружинин. Русские в Японии в конце 1853 и в начале 1854 годов (1855) | K73: А. В. Дружинин | L73: 1824 | M73: Русские в Японии в конце 1853 и в начале 1854 годов | N73: 1855 | O73: публицистика, нехудожественная | P73: статья | Q73: искусство и культура | T73: книга | U73: омонимия снята | V73: А фламандцы всё шли своим путём, не жертвуя ни грациям, ни Аполлону, по временам доходя до смешного в реализме, рисуя Адониса со своих толстых лакеев, не жалея красок на изображение баранов и свиней, убитой дичи и морщинистых кухарок за пучком луку! [А. В. Дружинин. Русские в Японии в конце 1853 и в начале 1854 годов (1855)] [омонимия снята] | W73: =RAND() -> 4.1279381360891487E-2 | X73: 1
A74: зи уме туТ ил окдалс | B74: удоран | C74: сладко ли? Тут ему из | D74: народу | F74: и погрозились: ― Погоди, собака! | G74: народ | I74: gen2 | J74: П. П. Бажов. Демидовские кафтаны (1939) | K74: П. П. Бажов | L74: 1878 | M74: Демидовские кафтаны | N74: 1939 | O74: художественная | P74: сказ | R74: Бажов П. Сочинения: В 3 т. Т.1 | S74: 1986 | T74: книга | U74: омонимия снята | V74: Только носить сладко ли? Тут ему из народу и погрозились: ― Погоди, собака! [П. П. Бажов. Демидовские кафтаны (1939)] [омонимия снята] | W74: =RAND() -> 0.10851527018511931 | X74: 1
A75: икмюр евд андо а орокс | B75: укяьнок | C75: скоро, а одна-две рюмки | D75: коньяку | F75: успокоят его и придадут смелости | G75: коньяк | H75: еда (напиток) | I75: gen2 | J75: В. Г. Распутин. Новая профессия (1998) | K75: В. Г. Распутин | L75: 1937 | M75: Новая профессия | N75: 1998 | O75: художественная | P75: повесть | R75: Проза новой России: В 4 т. Т. 3 | S75: 2003 | T75: книга | U75: омонимия снята | V75: Ничего, ему вступать в свою роль ещё не скоро, а одна-две рюмки коньяку успокоят его и придадут смелости. [В. Г. Распутин. Новая профессия (1998)] [омонимия снята] | W75: =RAND() -> 0.60141694926978684 | X75: 1
A76: зи нО B L сукол в | B76: усел | C76: в локус L B ("Он из | D76: лесу | F76: вышел… и увидел пустыню") | G76: лес | I76: gen2 | J76: В. Э. Карпов, Т. В. Мещерякова. Об автоматизации нетворческих литературных процессов // «Информационные технологии», 2004 | K76: В. Э. Карпов, Т. В. Мещерякова | M76: Об автоматизации нетворческих литературных процессов | N76: 2004 | O76: учебно-научная, нехудожественная | P76: статья | Q76: наука и технологии, информатика | R76: «Информационные технологии» | S76: 2004 | T76: журнал | U76: омонимия снята | V76: ("пустыня"), то необходим текст, увязывающий между собой переход из локуса L в локус L ("Он из лесу вышел… и увидел пустыню") [В. Э. Карпов, Т. В. Мещерякова. Об автоматизации нетворческих литературных процессов // «Информационные технологии», 2004] [омонимия снята] | W76: =RAND() -> 2.8485131060742908E-2 | X76: 1
A77: ос олиром еьтерт зёлс од | B77: ухемс | C77: до слёз, третье морило со | D77: смеху | E77: ; | F77: а между тем он, казалось | G77: смех | I77: gen2 | J77: В. Ф. Одоевский. Импровизатор (1833) | K77: В. Ф. Одоевский | L77: 1803 | M77: Импровизатор | N77: 1833 | O77: художественная | P77: рассказ | R77: Русская романтическая повесть | S77: 1980 | T77: книга | U77: омонимия снята | V77: Этого мало: в одно и то же время ему задавали два и три предмета совершенно различные; он диктовал одно стихотворение, писал другое, импровизировал третье, и каждое было прекрасно в своём роде: одно производило восторг, другое трогало до слёз, третье морило со смеху; а между тем он, казалось, совсем не занимался своею работою, беспрестанно шутил и разговаривал с присутствующими. [В. Ф. Одоевский. Импровизатор (1833)] [омонимия снята] | W77: =RAND() -> 0.18422937812574791 | X77: 1
A78: огонзар тилев ьтязв глод в | B78: уравот | C78: в долг взять велит разного | D78: товару | E78: , | F78: а другой раз даст сотенную | G78: товар | I78: gen2 | J78: И. А. Гончаров. Май месяц в Петербурге (1891) | K78: И. А. Гончаров | L78: 1812 | M78: Май месяц в Петербурге | N78: 1891 | O78: художественная, публицистика | P78: очерк | T78: книга | U78: омонимия снята | V78: ― Как не ходить-то, ― отвечал первый, ― иной раз он в долг взять велит разного товару, а другой раз даст сотенную расплатиться там за всё, что забрано в лавках; а когда станешь отдавать ему сдачи, рублёв с лишком десять: "возьми, скажет, себе на чай! [И. А. Гончаров. Май месяц в Петербурге (1891)] [омонимия снята] | W78: =RAND() -> 0.20461372607202 | X78: 1
A79: 6891 мокелад В | B79: удог | C79: В далеком 1986 | D79: году | F79: мы всего на пять лет | G79: год | I79: gen2 | J79: Александр Стемпковский. Микроэлектронный САПР: вчера, сегодня, завтра // «Эксперт», 2015 | K79: Александр Стемпковский | M79: Микроэлектронный САПР: вчера, сегодня, завтра | N79: 2015 | O79: публицистика, нехудожественная | P79: статья | Q79: техника, электроника, бизнес, коммерция, экономика, финансы | R79: «Эксперт» | S79: 2015 | T79: журнал | U79: омонимия не снята | V79: В далеком 1986 году мы всего на пять лет отставали от США в области разработки и производства интегральных схем, причем этот разрыв год от года сокращался. [Александр Стемпковский. Микроэлектронный САПР: вчера, сегодня, завтра // «Эксперт», 2015] [омонимия не снята] | W79: =RAND() -> 5.4598630483055688E-2 | X79: 1
A80: 7991 в ииссоР атнедизерп мозаку | B80: удог | C80: указом президента России в 1997 | D80: году | E80: . | G80: год | I80: gen2 | J80: Андрей Зверев, Александр Механик. Отечественная электроника не боится санкций // «Эксперт», 2014 | K80: Андрей Зверев, Александр Механик | L80: 1957, 1947 | M80: Отечественная электроника не боится санкций | N80: 2014 | O80: публицистика, нехудожественная | P80: интервью | Q80: техника, электроника, производство, машиностроение, бизнес, коммерция, экономика, финансы | R80: «Эксперт» | S80: 2014 | T80: журнал | U80: омонимия не снята | V80: *Холдинговая компания «Российская электроника» образована в начале 2009 года на базе государственного холдинга «Российская электроника», созданного указом президента России в 1997 году. [Андрей Зверев, Александр Механик. Отечественная электроника не боится санкций // «Эксперт», 2014] [омонимия не снята] | W80: =RAND() -> 0.50495771709507353 | X80: 1
A81: мотэ в он ьнед йындолох | B81: удог | C81: холодный день, но в этом | D81: году | F81: он солнечный. | G81: год | I81: gen2 | J81: А. Гальперина. Эти рвы уравняли всех (2015.10.30) | K81: А. Гальперина | L81: 1972 | M81: Эти рвы уравняли всех | N81: 2015.10.30 | O81: публицистика , нехудожественная | P81: статья | Q81: политика и общественная жизнь, история | R81: Православие и мир (pravmir.ru) | S81: 2015 | T81: электронный текст | U81: омонимия не снята | V81: 30 октября всегда холодный день, но в этом году он солнечный. [А. Гальперина. Эти рвы уравняли всех (2015.10.30)] [омонимия не снята] | W81: =RAND() -> 1.8507445154507418E-2 | X81: 1
A82: ин аретюьпмок ытобар восач 003 | B82: узар | C82: 300 часов работы компьютера ни | D82: разу | F82: не произошло сбоя? | G82: раз | I82: gen2 | J82: В. А. Успенский. Витгенштейн и основания математики (2002) | K82: В. А. Успенский | L82: 1930 | M82: Витгенштейн и основания математики | N82: 2002 | O82: учебно-научная, нехудожественная | P82: статья | Q82: наука и технологии, математика | R82: В. А. Успенский. Труды по нематематике | S82: 2002 | T82: книга | U82: омонимия снята | V82: И можно ли быть уверенным, что― даже при правильных программах ― за 300 часов работы компьютера ни разу не произошло сбоя? [В. А. Успенский. Витгенштейн и основания математики (2002)] [омонимия снята] | W82: =RAND() -> 0.29072954037221566 | X82: 1
A83: ьтивабдоп ил етитох еН | B83: умор | C83: ― Не хотите ли подбавить | D83: рому | E83: ? ― | F83: сказал я своему собеседнику, ― у | G83: ром | H83: еда (напиток) | I83: gen2 | J83: М. Ю. Лермонтов. Герой нашего времени (1839-1841) | K83: М. Ю. Лермонтов | L83: 1814 | M83: Герой нашего времени | N83: 1839-1841 | O83: художественная | P83: роман | R83: М.Ю. Лермонтов. Собрание сочинений в 4 томах | S83: 1958 | T83: книга | U83: омонимия снята | V83: ― Не хотите ли подбавить рому? ― сказал я своему собеседнику, ― у меня есть белый из Тифлиса; теперь холодно. [М. Ю. Лермонтов. Герой нашего времени (1839-1841)] [омонимия снята] | W83: =RAND() -> 0.93009018891332174 | X83: 1
A84: С | B84: удив | C84: С | D84: виду | F84: это был обычный солдатский трёп | G84: вид | I84: gen2 | J84: Василь Быков. Болото (2001) | K84: Василь Быков | L84: 1924 | M84: Болото | N84: 2001 | O84: художественная | P84: повесть | R84: Василь Быков. «Бедные люди» | S84: 2002 | T84: книга | U84: омонимия снята | V84: С виду это был обычный солдатский трёп, беззаботная болтовня подчиненных, ничем конкретно не обеспокоенных. [Василь Быков. Болото (2001)] [омонимия снята] | W84: =RAND() -> 0.45245083451408796 | X84: 1
A85: уклерат ебес ьтадоп лазакирп юьтремс | B85: удём | C85: смертью приказал подать себе тарелку | D85: мёду | F85: и съел все свои деньги | G85: мёд | H85: еда (напиток) | I85: gen2 | J85: А. П. Чехов. Крыжовник (1898) | K85: А. П. Чехов | L85: 1860 | M85: Крыжовник | N85: 1898 | O85: художественная | P85: рассказ | R85: А.П. Чехов. Полное собрание сочинений и писем | S85: 1974 | T85: книга | U85: омонимия снята | V85: Перед смертью приказал подать себе тарелку мёду и съел все свои деньги и выигрышные билеты вместе с мёдом, чтобы никому не досталось. [А. П. Чехов. Крыжовник (1898)] [омонимия снята] | W85: =RAND() -> 0.10015661770644169 | X85: 1
A86: в алеми ано отч ляноп | B86: удив | C86: понял, что она имела в | D86: виду | E86: . | G86: вид | I86: gen2 | J86: Сергей Лукьяненко. Новогодний Дозор (2014) | K86: Сергей Лукьяненко | M86: Новогодний Дозор | N86: 2014 | O86: художественная | P86: рассказ | R86: Новогодний Дозор: Лучшая фантастика 2014 | S86: 2014 | T86: книга | U86: омонимия не снята | V86: Я понял, что она имела в виду. [Сергей Лукьяненко. Новогодний Дозор (2014)] [омонимия не снята] | W86: =RAND() -> 0.23486801333209451 | X86: 1
A87: лялвабирп ёсв дзеоП мецьлап язорг | B87: удох | C87: грозя пальцем. Поезд всё прибавлял | D87: ходу | E87: . | F87: Мужик, ожесточенно нахмурившись и не | G87: ход | I87: gen2 | J87: В. В. Вересаев. В степи (1901) | K87: В. В. Вересаев | L87: 1867 | M87: В степи | N87: 1901 | O87: художественная | P87: рассказ | R87: Вересаев В.В. Избранное. | S87: 1980 | T87: книга | U87: омонимия снята | V87: Я-а тебе! ― угрожающе крикнул кондуктор, высунувшись из окна и грозя пальцем. Поезд всё прибавлял ходу. Мужик, ожесточенно нахмурившись и не глядя на кондуктора, продолжал бежать, вскидывая в стороны худые, стянутые в онучи ноги. [В. В. Вересаев. В степи (1901)] [омонимия снята] | W87: =RAND() -> 0.82642919130308967 | X87: 1
A88: 4102 в итсомиживден йоксвоксоМ екныр | B88: удог | C88: рынке Московской недвижимости в 2014 | D88: году | G88: год | I88: gen2 | J88: Алексей Болдин. О динамике цен на рынке Московской недвижимости в 2014 году // «Русский репортер», 2014 | K88: Алексей Болдин | M88: О динамике цен на рынке Московской недвижимости в 2014 году | N88: 2014 | O88: публицистика, нехудожественная | P88: заметка | Q88: строительство и архитектура, бизнес, коммерция, экономика, финансы | R88: «Русский репортер» | S88: 2014 | T88: журнал | U88: омонимия не снята | V88: О динамике цен на рынке Московской недвижимости в 2014 году [Алексей Болдин. О динамике цен на рынке Московской недвижимости в 2014 году // «Русский репортер», 2014] [омонимия не снята] | W88: =RAND() -> 0.46499840672486836 | X88: 1
A89: ардев яинещолгоп ырудецорп йончыбо елсоп | B89: юач | C89: после обычной процедуры поглощения ведра | D89: чаю | F89: и раскуривания трубок мы погрузились | G89: чай | H89: еда (напиток) | I89: gen2 | J89: И. А. Ефремов. Озеро горных духов (1942-1943) | K89: И. А. Ефремов | L89: 1907 | M89: Озеро горных духов | N89: 1942-1943 | O89: художественная | P89: рассказ | R89: В мире фантастики и приключений. -- Л.: Лениздат, 1963 | S89: 1963 | T89: книга | U89: омонимия снята | V89: Мигом развьючили лошадей, поставили палатки под громадными кедрами, и после обычной процедуры поглощения ведра чаю и раскуривания трубок мы погрузились в глубокий сон. [И. А. Ефремов. Озеро горных духов (1942-1943)] [омонимия снята] | W89: =RAND() -> 0.46912737285087958 | X89: 1
A90: косук тюад уме илсе он | B90: урахас | C90: но если ему дают кусок | D90: сахару | F90: или мелкую монету, он благодарит | G90: сахар | H90: еда (напиток) | I90: gen2 | J90: Н. С. Гумилев. Африканский дневник (1913) | K90: Н. С. Гумилев | L90: 1886 | M90: Африканский дневник | N90: 1913 | O90: публицистика, нехудожественная | P90: дневник, записные книжки, эссе | R90: Николай Гумилев : электронное собрание сочинений | S90: 1997-2006 | T90: книга | U90: омонимия снята | V90: Он ничего не просит, но если ему дают кусок сахару или мелкую монету, он благодарит серьёзно и вежливо, с совсем особенной, выработанной тысячелетьями восточной грацией. [Н. С. Гумилев. Африканский дневник (1913)] [омонимия снята] | W90: =RAND() -> 0.94999274941710943 | X90: 1
A91: ин СНМ огороток еинежяторп ан | B91: узар | C91: на протяжение которого МНС ни | D91: разу | F91: не удалось выполнить налоговое задание | G91: раз | I91: gen2 | J91: Денис Муханов. План повысился, а сборы упали (2002) // «Финансовая Россия», 2002.09.19 | K91: Денис Муханов | M91: План повысился, а сборы упали | N91: 2002 | O91: публицистика, нехудожественная | P91: заметка | Q91: бизнес, коммерция, экономика, финансы | R91: «Финансовая Россия» | S91: 2002.09.19 | T91: газета | U91: омонимия снята | V91: При продолжении наметившейся тенденции в текущем квартале может повториться ситуация второго квартала, на протяжение которого МНС ни разу не удалось выполнить налоговое задание по поступлениям в федеральный бюджет. [Денис Муханов. План повысился, а сборы упали (2002) // «Финансовая Россия», 2002.09.19] [омонимия снята] | W91: =RAND() -> 0.19240161275301393 | X91: 1
A92: то ябес янмоп еН | B92: ухартс | C92: Не помня себя от | D92: страху | E92: , | F92: переметываясь со стороны на сторону | G92: страх | I92: gen2 | J92: Л. Н. Андреев. Кусака (1901) | K92: Л. Н. Андреев | L92: 1871 | M92: Кусака | N92: 1901 | O92: художественная | P92: рассказ | T92: книга | U92: омонимия снята | V92: Не помня себя от страху, переметываясь со стороны на сторону, натыкаясь на загорожи и людей, она мчалась на край посёлка и пряталась в глубине большого сада, в одном ей известном месте. [Л. Н. Андреев. Кусака (1901)] [омонимия снята] | W92: =RAND() -> 0.73804442765696054 | X92: 1
A93: огокакин иланз ен етраза в | B93: ужреду | C93: в азарте не знали никакого | D93: удержу | E93: . | G93: удерж | I93: gen2 | J93: А. И. Куприн. Гранатовый браслет (1911) | K93: А. И. Куприн | L93: 1870 | M93: Гранатовый браслет | N93: 1911 | O93: художественная | P93: повесть | R93: А. И. Куприн. Собрание сочинений в 9 т. | S93: 1972 | T93: книга | U93: омонимия снята | V93: Такие суровые законы были выведены из практики, для обуздания княгини Веры и Анны Николаевны, которые в азарте не знали никакого удержу. [А. И. Куприн. Гранатовый браслет (1911)] [омонимия снята] | W93: =RAND() -> 0.47390039842002984 | X93: 1
A94: еж ьрепет юлпук ен я | B94: ухороп | C94: я не куплю теперь же | D94: пороху | E94: , | F94: крючков, пистонов и табаку, лавки | G94: порох | I94: gen2 | J94: А. С. Грин. Ива (1923) | K94: А. С. Грин | L94: 1880 | M94: Ива | N94: 1923 | O94: художественная | P94: рассказ | R94: Грин А. С. Собрание сочинений в шести томах. Библиотека Огонек. | S94: 1980 | T94: книга | U94: омонимия снята | V94: Если я не куплю теперь же пороху, крючков, пистонов и табаку, лавки, несомненно, закроются, так как часть торгашей будет ожидать конца мира, а другая― начала дневного света, покупатели же исчезнут на крыши». [А. С. Грин. Ива (1923)] [омонимия снята] | W94: =RAND() -> 0.27333417230727153 | X94: 1
A95: алидор юнйовд хымЖ алеЦ | B95: юобтО | C95: ― Цела, Жмых, двойню родила. | D95: Отбою | F95: нету от ребят. ― Ну ничего | G95: отбой | I95: gen2 | J95: А. П. Платонов. Луговые мастера (1928) | K95: А. П. Платонов | L95: 1899 | M95: Луговые мастера | N95: 1928 | O95: художественная | P95: рассказ | R95: Андрей Платонов. Государственный житель | S95: 1988 | T95: книга | U95: омонимия снята | V95: ― Цела, Жмых, двойню родила. Отбою нету от ребят. ― Ну ничего, Степан, рожай, старайся, ― воздуху на всех хватит, ― отвечал Жмых и как бы ехал дальше. [А. П. Платонов. Луговые мастера (1928)] [омонимия снята] | W95: =RAND() -> 0.71356282101972413 | X95: 1
A96: ос ьсилавытакоп еыроток хакисортам хишан | B96: ухемс | C96: наших матросиках, которые покатывались со | D96: смеху | E96: , | F96: указывая пальцами на голые колена | G96: смех | I96: gen2 | J96: А. Ф. Кони. Иван Александрович Гончаров (1911) | K96: А. Ф. Кони | L96: 1844 | M96: Иван Александрович Гончаров | N96: 1911 | O96: публицистика, нехудожественная | P96: очерк | Q96: искусство и культура | T96: книга | U96: омонимия снята | V96: Особенно помнится мне его рассказ о наших матросиках, которые покатывались со смеху, указывая пальцами на голые колена двух неподвижно стоявших у одного из дворцов часовых в шотландском костюме, красных от гнева, но покорных дисциплине. [А. Ф. Кони. Иван Александрович Гончаров (1911)] [омонимия снята] | W96: =RAND() -> 0.80474299378345926 | X96: 1
A97: мотэ в раксО ан ьсолаворинимон | B97: удог | C97: номинировалось на «Оскар» в этом | D97: году | E97: : « | F97: Афера по-американски», «12 лет рабства | G97: год | I97: gen2 | J97: Василий Корецкий. Как стать комиком и не облажаться // «Русский репортер», 2014 | K97: Василий Корецкий | M97: Как стать комиком и не облажаться | N97: 2014 | O97: публицистика, нехудожественная | P97: интервью | Q97: искусство и культура, досуг, зрелища и развлечения | R97: «Русский репортер» | S97: 2014 | T97: журнал | U97: омонимия не снята | V97: Посмотри, что номинировалось на «Оскар» в этом году: «Афера по-американски», «12 лет рабства». [Василий Корецкий. Как стать комиком и не облажаться // «Русский репортер», 2014] [омонимия не снята] | W97: =RAND() -> 0.15437664876819257 | X97: 1
A98: ос яслитакоп Я | B98: ухемс | C98: Я покатился со | D98: смеху | E98: : | F98: уж очень комичен был контраст | G98: смех | I98: gen2 | J98: А. В. Амфитеатров. Чудодей (1932) | K98: А. В. Амфитеатров | L98: 1862 | M98: Чудодей | N98: 1932 | O98: публицистика, нехудожественная | P98: очерк | Q98: искусство и культура | R98: Воспоминания о Максимилиане Волошине. | S98: 1990 | T98: книга | U98: омонимия снята | V98: Я покатился со смеху: уж очень комичен был контраст. [А. В. Амфитеатров. Чудодей (1932)] [омонимия снята] | W98: =RAND() -> 0.87891644384868339 | X98: 1
A99: как тичеровиторп омярп ирт есв | B99: ухуд | C99: все три прямо противоречит как | D99: духу | E99: « | F99: невмешательства», так и конкретным нормативным | G99: дух | I99: gen2 | J99: Борис Жуков. Пределы заповедности // «Знание-сила», 2014 | K99: Борис Жуков | M99: Пределы заповедности | N99: 2014 | O99: публицистика, нехудожественная | P99: статья | Q99: природа, администрация и управление | R99: «Знание-сила» | S99: 2014 | T99: журнал | U99: омонимия не снята | V99: И все три прямо противоречит как духу «невмешательства», так и конкретным нормативным документам. [Борис Жуков. Пределы заповедности // «Знание-сила», 2014] [омонимия не снята] | W99: =RAND() -> 0.70122841091340327 | X99: 1
A100: ин я аречев еинечет в | B100: узар | C100: в течение вечера я ни | D100: разу | F100: не вспомнил о моей жестокой | G100: раз | I100: gen2 | J100: И. С. Тургенев. Ася (1858) | K100: И. С. Тургенев | L100: 1818 | M100: Ася | N100: 1858 | O100: художественная | P100: повесть | R100: И.С. Тургенев. Избранное | S100: 1979 | T100: книга | U100: омонимия снята | V100: Чуть не смеясь от избытка приятных и игривых чувств, я нырнул в постель и уже закрыл было глаза, как вдруг мне пришло на ум, что в течение вечера я ни разу не вспомнил о моей жестокой красавице… [И. С. Тургенев. Ася (1858)] [омонимия снята] | W100: =RAND() -> 0.60024717289472396 | X100: 1
A101: с ежот акйязоХ | B101: удив | C101: Хозяйка, тоже с | D101: виду | F101: гнилая, была на редкость вздорная | G101: вид | I101: gen2 | J101: Людмила Улицкая. Казус Кукоцкого [Путешествие в седьмую сторону света] // «Новый Мир», 2000 | K101: Людмила Улицкая | L101: 1943 | M101: Казус Кукоцкого [Путешествие в седьмую сторону света] | N101: 2000 | O101: художественная | P101: роман | R101: «Новый Мир» | S101: 2000 | T101: журнал | U101: омонимия снята | V101: Хозяйка, тоже с виду гнилая, была на редкость вздорная. [Людмила Улицкая. Казус Кукоцкого [Путешествие в седьмую сторону света] // «Новый Мир», 2000] [омонимия снята] | W101: =RAND() -> 0.53526649804395288 | X101: 1
A102: ин ёще ьвобюл яовт ьтыб | B102: узар | C102: быть, твоя любовь ещё ни | D102: разу | F102: не была более тщетной, более | G102: раз | I102: gen2 | J102: И. Ф. Анненский. Вторая книга отражений (1909) | K102: И. Ф. Анненский | L102: 1855 | M102: Вторая книга отражений | N102: 1909 | O102: публицистика, нехудожественная | P102: очерк, цикл | Q102: искусство и культура | R102: «Серия «Литературные памятники». Иннокентий Ф.Анненский | S102: 1979 | T102: книга | U102: омонимия снята | V102: Может быть, твоя любовь ещё ни разу не была более тщетной, более поруганной, чем в эту ночь. [И. Ф. Анненский. Вторая книга отражений (1909)] [омонимия снята] | W102: =RAND() -> 0.24029828276177922 | X102: 1
A103: оговогенс огобулог хабуш в зором | B103: ухем | C103: мороз, в шубах― голубого снегового | D103: меху | E103: ― | F103: деревья, на шестах полощутся флаги | G103: мех | I103: gen2 | J103: Е. И. Замятин. Русь (1923) | K103: Е. И. Замятин | L103: 1884 | M103: Русь | N103: 1923 | O103: художественная | P103: рассказ | R103: Евгений Замятин. Избранное | S103: 1989 | T103: книга | U103: омонимия снята | V103: Крещенский мороз, в шубах― голубого снегового меху― деревья, на шестах полощутся флаги; балаганы, лотки, ржаные, расписные, архангельские козули, писк глиняных свистулек, радужные воздушные шары у ярославца на снизке, с музыкой крутится карусель. [Е. И. Замятин. Русь (1923)] [омонимия снята] | W103: =RAND() -> 0.25606869365565488 | X103: 1
A104: 0391 в ялшымереП зи адюс | B104: удог | C104: сюда из Перемышля в 1930 | D104: году | F104: поступать, поступил в Институт новых | G104: год | I104: gen2 | J104: Борис Любимов. Три главные темы в жизни -- Церковь, литература и театр (2015) | K104: Борис Любимов | L104: 1947 | M104: Три главные темы в жизни -- Церковь, литература и театр | N104: 2015 | O104: публицистика, нехудожественная | P104: интервью | Q104: религия, искусство и культура | T104: книга | U104: омонимия не снята | V104: Отец приехал сюда из Перемышля в 1930 году поступать, поступил в Институт новых языков, и четыре года своего обучения прожил в этом доме. [Борис Любимов. Три главные темы в жизни -- Церковь, литература и театр (2015)] [омонимия не снята] | W104: =RAND() -> 0.59220423258492105 | X104: 1
A105: окьлокс ещбоов йераселс хёрт укьрипС | B105: удоран | C105: Спирьку, трёх слесарей, ― вообще, сколько | D105: народу | F105: из-за "Карлы" осталось без работы | G105: народ | I105: gen2 | J105: Д. Н. Мамин-Сибиряк. Под домной (1891) | K105: Д. Н. Мамин-Сибиряк | L105: 1852 | M105: Под домной | N105: 1891 | O105: художественная | P105: рассказ | R105: Д.Н. Мамин-Сибиряк. Избранные произведения для детей | S105: 1962 | T105: книга | U105: омонимия снята | V105: На его глазах "Карла" отказал Пимке Мятлеву, работавшему у обжимочного молота подмастерьем, прогнал из-под домны литуха Спирьку, трёх слесарей, ― вообще, сколько народу из-за "Карлы" осталось без работы! [Д. Н. Мамин-Сибиряк. Под домной (1891)] [омонимия снята] | W105: =RAND() -> 0.51006762177456166 | X105: 1
A106: с еинепик или отэ еинежурК | B106: удив | C106: Кружение это, или кипение, с | D106: виду | F106: беспорядочное, бессмысленное, составляло между тем | G106: вид | I106: gen2 | J106: Даниил Гранин. Зубр (1987) | K106: Даниил Гранин | L106: 1919 | M106: Зубр | N106: 1987 | O106: художественная | P106: повесть | R106: Гранин Д.А. Зубр: Повесть | S106: 1987 | T106: книга | U106: омонимия снята | V106: Кружение это, или кипение, с виду беспорядочное, бессмысленное, составляло между тем наибольшее удовольствие и, я бы сказал даже, пользу такого рода международных сборищ. [Даниил Гранин. Зубр (1987)] [омонимия снята] | W106: =RAND() -> 0.82152122649328374 | X106: 1
A107: и олыб ен енираМ о | B107: унимоп | C107: о Марине не было и | D107: помину | E107: . | G107: помин | I107: gen2 | J107: Юрий Трифонов. Дом на набережной (1976) | K107: Юрий Трифонов | L107: 1925 | M107: Дом на набережной | N107: 1976 | O107: художественная | P107: повесть | R107: СС в 4 тт., т.2 | S107: 1986 | T107: книга | U107: омонимия снята | V107: А о Марине не было и помину. [Юрий Трифонов. Дом на набережной (1976)] [омонимия снята] | W107: =RAND() -> 0.65822155736955856 | X107: 1
A108: зи тедйыв отч увтялк лад | B108: умод | C108: дал клятву, что выйдет из | D108: дому | F108: только на одиннадцатый день, чтобы | G108: дом | I108: gen2 | J108: Анатолий Рыбаков. Тяжелый песок (1975-1977) | K108: Анатолий Рыбаков | L108: 1911 | M108: Тяжелый песок | N108: 1975-1977 | O108: художественная | P108: роман | R108: Рыбаков А. Тяжелый песок. | S108: 1982 | T108: книга | U108: омонимия снята | V108: Короче: Хаим дал клятву, что выйдет из дому только на одиннадцатый день, чтобы убедиться, что негодяй провизор убрался из России, а если не уберётся, то он, Хаим, убьёт его. [Анатолий Рыбаков. Тяжелый песок (1975-1977)] [омонимия снята] | W108: =RAND() -> 0.12907003222696645 | X108: 1
A109: мотэ В | B109: удог | C109: В этом | D109: году | E109: , | F109: как всегда, новые правила поступления | G109: год | I109: gen2 | J109: Александр Трушин. Высшие соображения // «Огонек», 2015 | K109: Александр Трушин | M109: Высшие соображения | N109: 2015 | O109: публицистика, нехудожественная | P109: статья | Q109: образование, админстрация и управление | R109: «Огонек» | S109: 2015 | T109: журнал | U109: омонимия не снята | V109: В этом году, как всегда, новые правила поступления. [Александр Трушин. Высшие соображения // «Огонек», 2015] [омонимия не снята] | W109: =RAND() -> 0.48129647227308192 | X109: 1
A110: зи ьтаксупу окандо медуб еН | B110: удив | C110: Не будем, однако, упускать из | D110: виду | F110: специфики изучаемого нами памятника. | G110: вид | I110: gen2 | J110: А. Я. Гуревич. Популярное богословие и народная религиозность средних веков (1976) | K110: А. Я. Гуревич | L110: 1924 | M110: Популярное богословие и народная религиозность средних веков | N110: 1976 | O110: учебно-научная, нехудожественная | P110: статья | Q110: наука и технологии, история, филология | R110: Из истории культуры средних веков и Возрождения. М., 1976 | S110: 1976 | T110: книга | U110: омонимия снята | V110: Не будем, однако, упускать из виду специфики изучаемого нами памятника. [А. Я. Гуревич. Популярное богословие и народная религиозность средних веков (1976)] [омонимия снята] | W110: =RAND() -> 0.16163593182670266 | X110: 1
A111: с йишвипыв ламерд етелиж мондо | B111: уктатсу | C111: одном жилете дремал выпивший «с | D111: устатку | E111: » | F111: Степан-буфетчик. | G111: устаток | I111: gen2 | J111: Б. С. Житков. «Сию минуту-с!..» (1927) | K111: Б. С. Житков | L111: 1882 | M111: «Сию минуту-с!..» | N111: 1927 | O111: художественная | P111: рассказ | R111: Б. Житков. «Джарылгач». Рассказы и повести | S111: 1980 | T111: книга | U111: омонимия снята | V111: А в буфетной, после тревог, в одном жилете дремал выпивший «с устатку» Степан-буфетчик. [Б. С. Житков. «Сию минуту-с!..» (1927)] [омонимия снята] | W111: =RAND() -> 0.64523371269053964 | X111: 1
A112: ин лавыб ен отч ончот | B112: узар | C112: точно что не бывал ни | D112: разу | E112: , ― | F112: вот с вашим братом, значит | G112: раз | I112: gen2 | J112: В. Г. Короленко. Чудная (1880) | K112: В. Г. Короленко | L112: 1853 | M112: Чудная | N112: 1880 | O112: художественная | P112: очерк | R112: В.Г. Короленко. Собрание сочинений в десяти томах. Том 1. Повести и рассказы | S112: 1953 | T112: книга | U112: омонимия снята | V112: А в командировках я точно что не бывал ни разу, ― вот с вашим братом, значит. Оно, хоть, скажем, дело-то нехитрое, а всё же, знаете, инструкции надо усвоить, да и расторопность нужна. Ну, хорошо… [В. Г. Короленко. Чудная (1880)] [омонимия снята] | W112: =RAND() -> 0.69105395452703522 | X112: 1
A113: ьшечоХ окнемьзуК лазакс ледив асубйеллорт | B113: юач | C113: троллейбуса видел, ― сказал Кузьменко. ― Хочешь | D113: чаю | E113: ? | F113: ― Лучше водки. | G113: чай | H113: еда (напиток) | I113: gen2 | J113: Сергей Довлатов. Дорога в новую квартиру (1987) | K113: Сергей Довлатов | L113: 1941 | M113: Дорога в новую квартиру | N113: 1987 | O113: художественная | P113: рассказ | R113: Собрание прозы в 3 т. Т.2 | S113: 1993 | T113: книга | U113: омонимия снята | V113: ― Я её из троллейбуса видел, ― сказал Кузьменко. ― Хочешь чаю? ― Лучше водки. [Сергей Довлатов. Дорога в новую квартиру (1987)] [омонимия снята] | W113: =RAND() -> 0.86583464868707638 | X113: 1
A114: огокясв окьлотс едг ябес у | B114: удоран | C114: у себя, где столько всякого | D114: народу | E114: , | F114: набивает их сам; сидит на | G114: народ | I114: gen2 | J114: З. Н. Гиппиус. Задумчивый странник (о Розанове) (1923) | K114: З. Н. Гиппиус | L114: 1869 | M114: Задумчивый странник (о Розанове) | N114: 1923 | O114: публицистика, нехудожественная | P114: мемуары | R114: Василий Розанов: Pro et contra. Кн. I. | S114: 1995 | T114: книга | U114: омонимия снята | V114: (По воскресеньям, за длинным чайным столом, у себя, где столько всякого народу, набивает их сам; сидит на конце стола, спиной к окнам, и тоже подогнув ногу.) [З. Н. Гиппиус. Задумчивый странник (о Розанове) (1923)] [омонимия снята] | W114: =RAND() -> 0.21060140714921882 | X114: 1
A115: к ежилб инверед ецнок В | B115: усел | C115: В конце деревни, ближе к | D115: лесу | E115: – | F115: утыканный кувшинками пруд. | G115: лес | I115: gen2 | J115: Александр Снегирев. Вера (2015) | K115: Александр Снегирев | L115: 1980 | M115: Вера | N115: 2015 | O115: художественная | P115: роман | R115: А. Снегирев. Вера. | S115: 2015 | T115: книга | U115: омонимия не снята | V115: В конце деревни, ближе к лесу – утыканный кувшинками пруд. [Александр Снегирев. Вера (2015)] [омонимия не снята] | W115: =RAND() -> 0.10723061993993199 | X115: 1
A116: то тилоб итсонжлод еишсыв хищюаминаз | B116: узором | C116: занимающих высшие должности болит от | D116: морозу | F116: лоб и слёзы выступают в | G116: мороз | I116: gen2 | J116: Н. В. Гоголь. Шинель (1842) | K116: Н. В. Гоголь | L116: 1809 | M116: Шинель | N116: 1842 | O116: художественная | P116: повесть | R116: Н.В. Гоголь. Собрание сочинений в 7 томах | S116: 1967 | T116: книга | U116: омонимия снята | V116: В это время, когда даже у занимающих высшие должности болит от морозу лоб и слёзы выступают в глазах, бедные титулярные советники иногда бывают беззащитны. [Н. В. Гоголь. Шинель (1842)] [омонимия снята] | W116: =RAND() -> 0.42330344468430792 | X116: 1
A117: тов ыб енМ | B117: урахас | C117: ― Мне бы вот | D117: сахару | F117: достать, ― говорю я. | G117: сахар | H117: еда (напиток) | I117: gen2 | J117: Булат Окуджава. Новенький как с иголочки (1962) | K117: Булат Окуджава | L117: 1924 | M117: Новенький как с иголочки | N117: 1962 | O117: художественная | P117: повесть | R117: Булат Окуджава. Стихи, рассказы, повести | S117: 1999 | T117: книга | U117: омонимия снята | V117: ― Мне бы вот сахару достать, ― говорю я. [Булат Окуджава. Новенький как с иголочки (1962)] [омонимия снята] | W117: =RAND() -> 0.89736048017057857 | X117: 1

Sheet: 1 gen
A1: Reversed left context | B1: Reversed center | C1: Left context | D1: Center | E1: Punct | F1: Right context | G1: Лексема | H1: значение | I1: gen1 | J1: Title | K1: Author | L1: Birthday | M1: Header | N1: Created | O1: Sphere | P1: Type | Q1: Topic | R1: Publication | S1: Publ_year | T1: Medium | U1: Ambiguity | V1: Full context | W1: =RAND() -> 0.68010213394485974 | X1: 1
A2: хыннавозиламрофобалс яицазимтироглА | B2: чадаз | C2: Алгоритмизация слабоформализованных | D2: задач | F2: оптимального выбора на основе рандомизированных | G2: задача | I2: gen1 | J2: Я. Е. Львович, С. Ю. Белецкая. Алгоритмизация слабоформализованных задач оптимального выбора на основе рандомизированных процедур поискового типа // «Информационные технологии», 2004 | K2: Я. Е. Львович, С. Ю. Белецкая | M2: Алгоритмизация слабоформализованных задач оптимального выбора на основе рандомизированных процедур поискового типа | N2: 2004 | O2: учебно-научная, нехудожественная | P2: статья | Q2: наука и технологии, информатика | R2: «Информационные технологии» | S2: 2004 | T2: журнал | U2: омонимия снята | V2: Алгоритмизация слабоформализованных задач оптимального выбора на основе рандомизированных процедур поискового типа [Я. Е. Львович, С. Ю. Белецкая. Алгоритмизация слабоформализованных задач оптимального выбора на основе рандомизированных процедур поискового типа // «Информационные технологии», 2004] [омонимия снята] | W2: =RAND() -> 0.58770503047117617 | X2: =IF(RC[-13]=R[-1]C[-13]," ",1) -> 1
A3: акнецоереП | B3: йетсоннец | C3: Переоценка | D3: ценностей | F3: После того как на прошедшем | G3: ценность | I3: gen1 | J3: Борис Жуков. Переоценка ценностей (2003) // «Еженедельный журнал», 2003.03.17 | K3: Борис Жуков | M3: Переоценка ценностей | N3: 2003 | O3: публицистика, нехудожественная | P3: статья | Q3: политика и общественная жизнь | R3: «Еженедельный журнал» | S3: 2003.03.17 | T3: журнал | U3: омонимия снята | V3: Переоценка ценностей После того как на прошедшем в четверг заседании правительства премьер фактически отказался слушать докладчика ― первого заместителя министра финансов Сергея Шаталова, стало ясно, что никаких принципиальных решений на сей раз принято не будет. [Борис Жуков. Переоценка ценностей (2003) // «Еженедельный журнал», 2003.03.17] [омонимия снята] | W3: =RAND() -> 0.64685950946875315 | X3: =IF(RC[-13]=R[-1]C[-13]," ",1) -> 1
A4: йонпурк еитяъзИ | B4: иитрап | C4: Изъятие крупной | D4: партии | F4: наркотиков стало первой удачной операцией | G4: партия | I4: gen1 | J4: Екатерина Ерошкина. Прикрыта гашишная заготконтора (2003) // «Ежедневные новости» (Владивосток), 2003.01.15 | K4: Екатерина Ерошкина | M4: Прикрыта гашишная заготконтора | N4: 2003 | O4: публицистика, нехудожественная | P4: заметка | Q4: криминал | R4: «Ежедневные новости» (Владивосток) | S4: 2003.01.15 | T4: газета | U4: омонимия снята | V4: Изъятие крупной партии наркотиков стало первой удачной операцией Приморского УБНОН в новом году [Екатерина Ерошкина. Прикрыта гашишная заготконтора (2003) // «Ежедневные новости» (Владивосток), 2003.01.15] [омонимия снята] | W4: =RAND() -> 0.21526483613603109 | X4: =IF(RC[-13]=R[-1]C[-13]," ",1) -> 1
A5: оголам дас АМЕТ ЯАНВАЛГ авомифЕ аняьтаТ | B5: адоху | C5: Татьяна Ефимова ГЛАВНАЯ ТЕМА | сад малого | D5: ухода | F5: Гравийная отсыпка - прекрасный фон для | G5: уход | I5: gen1 | J5: Татьяна Ефимова. Скажи: легко! (2003) // «Сад своими руками», 2003.09.15 | K5: Татьяна Ефимова | M5: Скажи: легко! | N5: 2003 | O5: публицистика, нехудожественная | P5: статья | Q5: дом и домашнее хозяйство | R5: «Сад своими руками» | S5: 2003.09.15 | T5: газета | U5: омонимия снята | V5: ГЛАВНАЯ ТЕМА | сад малого ухода Гравийная отсыпка - прекрасный фон для хосты, вереска… [Татьяна Ефимова. Скажи: легко! (2003) // «Сад своими руками», 2003.09.15] [омонимия снята] | W5: =RAND() -> 0.44874948634233325 | X5: =IF(RC[-13]=R[-1]C[-13]," ",1) -> 1
A6: огоннежорелгуан еинерапси еовелоП | B6: анедбилом | C6: Полевое испарение науглероженного | D6: молибдена | F6: 194021 Санкт-Петербург, Россия | G6: молибден | I6: gen1 | J6: М. В. Логинов, В. Н. Шредник. Полевое испарение науглероженного молибдена // «Журнал технической физики», 2004 | K6: М. В. Логинов, В. Н. Шредник | M6: Полевое испарение науглероженного молибдена | N6: 2004 | O6: учебно-научная, нехудожественная | P6: аннотация | Q6: наука и технологии, физика | R6: «Журнал технической физики» | S6: 2004 | T6: журнал | U6: омонимия снята | V6: Полевое испарение науглероженного молибдена 194021 Санкт-Петербург, Россия [М. В. Логинов, В. Н. Шредник. Полевое испарение науглероженного молибдена // «Журнал технической физики», 2004] [омонимия снята] | W6: =RAND() -> 0.881120321201873 | X6: =IF(RC[-13]=R[-1]C[-13]," ",1) -> 1
A7: ялд мтирогла йыннорйен йынпатэхувд ястеагалдерП | B7: яинешер | C7: Предлагается двухэтапный нейронный алгоритм для | D7: решения | F7: задачи линейного программирования, который реализуется | G7: решение | I7: gen1 | J7: Р. М. Алгулиев, Р. М. Алыгулиев. Об одном нейронном алгоритме решения задачи линейного программирования // «Информационные технологии», 2004 | K7: Р. М. Алгулиев, Р. М. Алыгулиев | M7: Об одном нейронном алгоритме решения задачи линейного программирования | N7: 2004 | O7: учебно-научная, нехудожественная | P7: статья | Q7: наука и технологии, информатика | R7: «Информационные технологии» | S7: 2004 | T7: журнал | U7: омонимия снята | V7: Предлагается двухэтапный нейронный алгоритм для решения задачи линейного программирования, который реализуется на трехслойной нейронной сети. [Р. М. Алгулиев, Р. М. Алыгулиев. Об одном нейронном алгоритме решения задачи линейного программирования // «Информационные технологии», 2004] [омонимия снята] | W7: =RAND() -> 0.20631968227033382 | X7: =IF(RC[-13]=R[-1]C[-13]," ",1) -> 1
A8: адобовС | B8: итсевос | C8: Свобода | D8: совести | F8: и светскость государства: Следующая часть | G8: совесть | I8: gen1 | J8: Мария Козлова. Свобода совести и светскость государства: проблемы и решения (1 часть) (2004) // «Адвокат», 2004.12.01 | K8: Мария Козлова | M8: Свобода совести и светскость государства: проблемы и решения (1 часть) | N8: 2004 | O8: публицистика, нехудожественная | P8: статья | Q8: политика и общественная жизнь | R8: «Адвокат» | S8: 2004.12.01 | T8: журнал | U8: омонимия снята | V8: Свобода совести и светскость государства: Следующая часть [Мария Козлова. Свобода совести и светскость государства: проблемы и решения (1 часть) (2004) // «Адвокат», 2004.12.01] [омонимия снята] | W8: =RAND() -> 0.99929806417083733 | X8: =IF(RC[-13]=R[-1]C[-13]," ",1) -> 1
A9: 05 04 кинзов нО кызяарп нидо лыб автсечеволеч У амет яанвалГ | B9: чясыт | C9: Главная тема: У человечества был один праязык Он возник 40― 50 | D9: тысяч | F9: лет назад | G9: тысяча | I9: gen1 | J9: Сергей Старостин, Григорий Зеленко. У человечества был один праязык // «Знание -- сила», 2003 | K9: Сергей Старостин, Григорий Зеленко | L9: 1953 | M9: У человечества был один праязык | N9: 2003 | O9: учебно-научная, нехудожественная | P9: статья | Q9: наука и технологии, филология | R9: «Знание -- сила» | S9: 2003 | T9: журнал | U9: омонимия снята | V9: : Он возник 40― 50 тысяч лет назад [Сергей Старостин, Григорий Зеленко. У человечества был один праязык // «Знание -- сила», 2003] [омонимия снята] | W9: =RAND() -> 0.90238455425867059 | X9: =IF(RC[-13]=R[-1]C[-13]," ",1) -> 1
A10: тараппа йонтевц йывреп ен NC | B10: иинапмок | C10: CN― не первый цветной аппарат | D10: компании | F10: и уж тем более не | G10: компания | I10: gen1 | J10: Игорь Лукьяненко. «Брат» в цвете // «Computerworld», 2004 | K10: Игорь Лукьяненко | M10: «Брат» в цвете | N10: 2004 | O10: публицистика, нехудожественная | P10: статья | Q10: техника | R10: «Computerworld» | S10: 2004 | T10: журнал | U10: омонимия снята | V10: Представленный в июне полноцветный лазерный принтер Brother HL-2700 CN― не первый цветной аппарат компании и уж тем более не новинка для мирового рынка, где он продаётся с начала года приблизительно за 800 долл. Но это первый шаг Brother по завоеванию российского рынка цветной лазерной печати. [Игорь Лукьяненко. «Брат» в цвете // «Computerworld», 2004] [омонимия снята] | W10: =RAND() -> 0.94477982514910175 | X10: =IF(RC[-13]=R[-1]C[-13]," ",1) -> 1
A11: хиксвокрам еиненемирП | B11: йеледом | C11: Применение марковских | D11: моделей | F11: для анализа эволюции психологических характеристик | G11: модель | I11: gen1 | J11: Л. С. Куравский, С. Б. Малых. Применение марковских моделей для анализа эволюции психологических характеристик в популяции // «Вопросы психологии», 2003 | K11: Л. С. Куравский, С. Б. Малых | M11: Применение марковских моделей для анализа эволюции психологических характеристик в популяции | N11: 2003 | O11: учебно-научная, нехудожественная | P11: статья | Q11: наука и технологии, психология | R11: «Вопросы психологии» | S11: 2003 | T11: журнал | U11: омонимия снята | V11: Применение марковских моделей для анализа эволюции психологических характеристик в популяции [Л. С. Куравский, С. Б. Малых. Применение марковских моделей для анализа эволюции психологических характеристик в популяции // «Вопросы психологии», 2003] [омонимия снята] | W11: =RAND() -> 0.7927235321618511 | X11: =IF(RC[-13]=R[-1]C[-13]," ",1) -> 1
A12: ЩАЛП | B12: АРОДАЕРОТ | C12: ПЛАЩ | D12: ТОРЕАДОРА | F12: Номер 5. 2003 страницы: 108 | G12: тореадор | I12: gen1 | J12: Александр Будкин. Плащ тореадора (2003) // «За рулем», 2003.05.15 | K12: Александр Будкин | M12: Плащ тореадора | N12: 2003 | O12: публицистика, нехудожественная | P12: статья | Q12: техника | R12: «За рулем» | S12: 2003.05.15 | T12: журнал | U12: омонимия снята | V12: ПЛАЩ ТОРЕАДОРА Номер 5. 2003 страницы: 108, 109, 110, 111 [Александр Будкин. Плащ тореадора (2003) // «За рулем», 2003.05.15] [омонимия снята] | W12: =RAND() -> 0.4666921482271954 | X12: =IF(RC[-13]=R[-1]C[-13]," ",1) -> 1
A13: ерытеЧ атчем яаксвёлмерК | B13: атнедизерп | C13: Кремлёвская мечта. Четыре | D13: президента | F13: сочинили новый экономический союз Праздничная | G13: президент | I13: gen1 | J13: Екатерина Григорьева, Елена Загородняя, Игорь Моисеев. Кремлевская мечта. Четыре президента сочинили новый экономический союз (2003) // «Известия», 2003.02.24 | K13: Екатерина Григорьева, Елена Загородняя, Игорь Моисеев | M13: Кремлевская мечта. Четыре президента сочинили новый экономический союз | N13: 2003 | O13: публицистика, нехудожественная | P13: статья | Q13: политика и общественная жизнь | R13: «Известия» | S13: 2003.02.24 | T13: газета | U13: омонимия снята | V13: Кремлёвская мечта. Четыре президента сочинили новый экономический союз Праздничная встреча президентов России, Украины, Белоруссии и Казахстана по случаю «мужского» праздника 23 февраля ознаменовалась политической сенсацией. [Екатерина Григорьева, Елена Загородняя, Игорь Моисеев. Кремлевская мечта. Четыре президента сочинили новый экономический союз (2003) // «Известия», 2003.02.24] [омонимия снята] | W13: =RAND() -> 0.74347049873791116 | X13: =IF(RC[-13]=R[-1]C[-13]," ",1) -> 1
A14: ИКОРУ ЕЫНДЫТС | B14: АВТСРАБ | C14: СТЫДНЫЕ УРОКИ | D14: БАРСТВА | F14: ВЛАСТЬ И БЕДНОСТЬ Президента В | G14: барство | I14: gen1 | J14: Б. Варецкий. Стыдные уроки барства. Власть и бедность (2003) // «Советская Россия», 2003.08.21 | K14: Б. Варецкий | M14: Стыдные уроки барства. Власть и бедность | N14: 2003 | O14: публицистика, нехудожественная | P14: статья | Q14: политика и общественная жизнь | R14: «Советская Россия» | S14: 2003.08.21 | T14: газета | U14: омонимия снята | V14: СТЫДНЫЕ УРОКИ БАРСТВА ВЛАСТЬ И БЕДНОСТЬ Президента В. Путина спросили: [Б. Варецкий. Стыдные уроки барства. Власть и бедность (2003) // «Советская Россия», 2003.08.21] [омонимия снята] | W14: =RAND() -> 0.96399000084340736 | X14: =IF(RC[-13]=R[-1]C[-13]," ",1) -> 1
A15: ытатьлузер ынещбобО | B15: тобар | C15: Обобщены результаты | D15: работ | F15: в области электрохимического нанесения композиционных | G15: работа | I15: gen1 | J15: Г. К. Буркат, В. Ю. Долматов. Ультрадисперсные алмазы в гальванотехнике // «Физика твёрдого тела», 2004 | K15: Г. К. Буркат, В. Ю. Долматов | M15: Ультрадисперсные алмазы в гальванотехнике | N15: 2004 | O15: учебно-научная, нехудожественная | P15: аннотация | Q15: наука и технологии, физика | R15: «Физика твёрдого тела» | S15: 2004 | T15: журнал | U15: омонимия снята | V15: Обобщены результаты работ в области электрохимического нанесения композиционных покрытий с ультрадисперсными алмазами детонационного синтеза (УДА, наноалмазы). [Г. К. Буркат, В. Ю. Долматов. Ультрадисперсные алмазы в гальванотехнике // «Физика твёрдого тела», 2004] [омонимия снята] | W15: =RAND() -> 0.60778817853652944 | X15: =IF(RC[-13]=R[-1]C[-13]," ",1) -> 1
A16: ымелборП | B16: ирок | C16: Проблемы | D16: кори | E16: , | F16: краснухи и эпидемического паротита в | G16: корь | I16: gen1 | J16: В. В. Зверев, Н. В. Юминова. Проблемы кори, краснухи и эпидемического паротита в Российской Федерации (2004) // «Вопросы вирусологии», 2004.05.03 | K16: В. В. Зверев, Н. В. Юминова | M16: Проблемы кори, краснухи и эпидемического паротита в Российской Федерации | N16: 2004 | O16: учебно-научная, нехудожественная | P16: статья | Q16: наука и технологии, здоровье и медицина | R16: «Вопросы вирусологии» | S16: 2004.05.03 | T16: журнал | U16: омонимия снята | V16: Проблемы кори, краснухи и эпидемического паротита в Российской Федерации [В. В. Зверев, Н. В. Юминова. Проблемы кори, краснухи и эпидемического паротита в Российской Федерации (2004) // «Вопросы вирусологии», 2004.05.03] [омонимия снята] | W16: =RAND() -> 3.9595007246690073E-2 | X16: =IF(RC[-13]=R[-1]C[-13]," ",1) -> 1
A17: хиксром ьнзиЖ кёнок аз отч акьнок огоксром у А | B17: йелетатибо | C17: А у морского конька что за конёк? Жизнь морских | D17: обитателей | F17: нам мало доступна. Вот и | G17: обитатель | I17: gen1 | J17: Александр Голяндин. Рассказы о животных, и не только о них: А у морского конька что за конек? // «Знание -- сила», 2003 | K17: Александр Голяндин | M17: Рассказы о животных, и не только о них: А у морского конька что за конек? | N17: 2003 | O17: учебно-научная, нехудожественная | P17: статья | Q17: наука и технологии, биология | R17: «Знание -- сила» | S17: 2003 | T17: журнал | U17: омонимия снята | V17: ? Жизнь морских обитателей нам мало доступна. Вот и знаем мы их очень плохо. [Александр Голяндин. Рассказы о животных, и не только о них: А у морского конька что за конек? // «Знание -- сила», 2003] [омонимия снята] | W17: =RAND() -> 0.93066414250734097 | X17: =IF(RC[-13]=R[-1]C[-13]," ",1) -> 1
A18: йолс йиксечитоаХ | B18: акинтяам | C18: Хаотический слой | D18: маятника | F18: при низких и средних частотах | G18: маятник | I18: gen1 | J18: В. В. Вячеславов. Хаотический слой маятника при низких и средних частотах возмущений // «Журнал технической физики», 2004 | K18: В. В. Вячеславов | M18: Хаотический слой маятника при низких и средних частотах возмущений | N18: 2004 | O18: учебно-научная, нехудожественная | P18: аннотация | Q18: наука и технологии, физика | R18: «Журнал технической физики» | S18: 2004 | T18: журнал | U18: омонимия снята | V18: Хаотический слой маятника при низких и средних частотах возмущений [В. В. Вячеславов. Хаотический слой маятника при низких и средних частотах возмущений // «Журнал технической физики», 2004] [омонимия снята] | W18: =RAND() -> 6.9433675653822302E-2 | X18: =IF(RC[-13]=R[-1]C[-13]," ",1) -> 1
A19: с йишдешаЗ | B19: ыцилу | C19: Зашедший с | D19: улицы | F19: в антикварный магазин случайный прохожий | G19: улица | I19: gen1 | J19: Лариса Шпаковская. Старые вещи. Ценность: между государством и обществом (2004) // «Неприкосновенный запас», 2004.01.15 | K19: Лариса Шпаковская | L19: 1975 | M19: Старые вещи. Ценность: между государством и обществом | N19: 2004 | O19: публицистика, нехудожественная | P19: статья | Q19: искусство и культура | R19: «Неприкосновенный запас» | S19: 2004.01.15 | T19: журнал | U19: омонимия снята | V19: Зашедший с улицы в антикварный магазин случайный прохожий оказывается в довольно странном мире вещей. [Лариса Шпаковская. Старые вещи. Ценность: между государством и обществом (2004) // «Неприкосновенный запас», 2004.01.15] [омонимия снята] | W19: =RAND() -> 0.93104412654256763 | X19: =IF(RC[-13]=R[-1]C[-13]," ",1) -> 1
A20: хынтсевзи хымас зи нидо йобос | B20: воранилук | C20: собой один из самых известных | D20: кулинаров | F20: страны | G20: кулинар | I20: gen1 | J20: Эльмар Гусейнов. Чисто французское самоубийство. Покончил с собой один из самых известных кулинаров страны (2003) // «Известия», 2003.02.25 | K20: Эльмар Гусейнов | M20: Чисто французское самоубийство. Покончил с собой один из самых известных кулинаров страны | N20: 2003 | O20: публицистика, нехудожественная | P20: комментарий | Q20: криминал | R20: «Известия» | S20: 2003.02.25 | T20: газета | U20: омонимия снята | V20: Покончил с собой один из самых известных кулинаров страны [Эльмар Гусейнов. Чисто французское самоубийство. Покончил с собой один из самых известных кулинаров страны (2003) // «Известия», 2003.02.25] [омонимия снята] | W20: =RAND() -> 0.93346674300920562 | X20: =IF(RC[-13]=R[-1]C[-13]," ",1) -> 1
A21: У | B21: ЕШРОП | C21: У " | D21: ПОРШЕ | E21: " | F21: НЕ ВЫДЕРЖАЛО СЕРДЦЕ Номер 5 | G21: порше | I21: gen1 | J21: Сергей Зиновьев. У «Порше» не выдержало сердце (2003) // «За рулем», 2003.05.15 | K21: Сергей Зиновьев | M21: У «Порше» не выдержало сердце | N21: 2003 | O21: публицистика, нехудожественная | P21: статья | Q21: спорт | R21: «За рулем» | S21: 2003.05.15 | T21: журнал | U21: омонимия снята | V21: У "ПОРШЕ" НЕ ВЫДЕРЖАЛО СЕРДЦЕ Номер 5. 2003 страницы: 206 [Сергей Зиновьев. У «Порше» не выдержало сердце (2003) // «За рулем», 2003.05.15] [омонимия снята] | W21: =RAND() -> 0.91356513081225688 | X21: =IF(RC[-13]=R[-1]C[-13]," ",1) -> 1
A22: ешьлоб ёсв емод молеБ В | B22: вокиньлачан | C22: В Белом доме всё больше | D22: начальников | E22: . | F22: Вслед за вице-премьерами вчера увеличилось | G22: начальник | I22: gen1 | J22: Андрей Литвинов. Касьянов подрос (2003) // «Газета», 2003.07.01 | K22: Андрей Литвинов | M22: Касьянов подрос | N22: 2003 | O22: публицистика, нехудожественная | P22: заметка | Q22: политика и общественная жизнь | R22: «Газета» | S22: 2003.07.01 | T22: газета | U22: омонимия снята | V22: Касьянов подрос В Белом доме всё больше начальников. Вслед за вице-премьерами вчера увеличилось число заместителей главы аппарата правительства. [Андрей Литвинов. Касьянов подрос (2003) // «Газета», 2003.07.01] [омонимия снята] | W22: =RAND() -> 0.82826636702419099 | X22: =IF(RC[-13]=R[-1]C[-13]," ",1) -> 1
A23: зеБ | B23: яиненмос | C23: Без | D23: сомнения | E23: , | F23: проблемы военного строительства вызывают сейчас | G23: сомнение | I23: gen1 | J23: Махмут Гареев. К каким угрозам и войнам должна быть готова Россия // «Отечественные записки», 2003 | K23: Махмут Гареев | L23: 1923 | M23: К каким угрозам и войнам должна быть готова Россия | N23: 2003 | O23: публицистика, нехудожественная | P23: статья | Q23: армия и вооруженные конфликты | R23: «Отечественные записки» | S23: 2003 | T23: журнал | U23: омонимия снята | V23: Без сомнения, проблемы военного строительства вызывают сейчас самый острый интерес в нашем обществе. [Махмут Гареев. К каким угрозам и войнам должна быть готова Россия // «Отечественные записки», 2003] [омонимия снята] | W23: =RAND() -> 0.73854405953211499 | X23: =IF(RC[-13]=R[-1]C[-13]," ",1) -> 1
A24: моцил ьталедс летох йиксвозереБ | B24: иитрап | C24: Березовский хотел сделать лицом | D24: партии | F24: Ельцина, но получился Рыбкин | G24: партия | I24: gen1 | J24: Рустем Фаляхов, Анастасия Матвеева. Березовский хотел сделать лицом партии Ельцина, но получился Рыбкин (2003) // «Газета», 2003.07.08 | K24: Рустем Фаляхов, Анастасия Матвеева | M24: Березовский хотел сделать лицом партии Ельцина, но получился Рыбкин | N24: 2003 | O24: публицистика, нехудожественная | P24: статья | Q24: политика и общественная жизнь | R24: «Газета» | S24: 2003.07.08 | T24: газета | U24: омонимия снята | V24: Березовский хотел сделать лицом партии Ельцина, но получился Рыбкин [Рустем Фаляхов, Анастасия Матвеева. Березовский хотел сделать лицом партии Ельцина, но получился Рыбкин (2003) // «Газета», 2003.07.08] [омонимия снята] | W24: =RAND() -> 0.17840227815709853 | X24: =IF(RC[-13]=R[-1]C[-13]," ",1) -> 1
A25: огоксечимонокэ уртсиним еинадаз лад нитуП | B25: яитивзар | C25: Путин дал задание министру экономического | D25: развития | F25: и торговли Герману Грефу разработать | G25: развитие | I25: gen1 | J25: Даниил Володин. Грефу приказано закрепить население (2003) // «Ежедневные новости» (Владивосток), 2003.08.07 | K25: Даниил Володин | M25: Грефу приказано закрепить население | N25: 2003 | O25: публицистика, нехудожественная | P25: заметка | Q25: политика и общественная жизнь | R25: «Ежедневные новости» (Владивосток) | S25: 2003.08.07 | T25: газета | U25: омонимия снята | V25: Владимир Путин дал задание министру экономического развития и торговли Герману Грефу разработать программу по закреплению населения на Дальнем Востоке России. [Даниил Володин. Грефу приказано закрепить население (2003) // «Ежедневные новости» (Владивосток), 2003.08.07] [омонимия снята] | W25: =RAND() -> 0.8893383745185528 | X25: =IF(RC[-13]=R[-1]C[-13]," ",1) -> 1
A26: огонченоксеб мёрац ябес ьтатичс и | B26: автснартсорп | C26: и считать себя царём бесконечного | D26: пространства | E26: . | F26: Шекспир. | G26: пространство | I26: gen1 | J26: Александр Волков. Миры Стивена Хоукинга // «Знание -- сила», 2003 | K26: Александр Волков | M26: Миры Стивена Хоукинга | N26: 2003 | O26: публицистика, нехудожественная | P26: статья | Q26: наука и технологии, физика | R26: «Знание -- сила» | S26: 2003 | T26: журнал | U26: омонимия снята | V26: О Боже, я бы мог замкнуться в ореховой скорлупе и считать себя царём бесконечного пространства. Шекспир. [Александр Волков. Миры Стивена Хоукинга // «Знание -- сила», 2003] [омонимия снята] | W26: =RAND() -> 0.48616888954523374 | X26: =IF(RC[-13]=R[-1]C[-13]," ",1) -> 1
A27: еинешывоП | B27: талпраз | C27: Повышение | D27: зарплат | F27: российским бюджетникам произойдёт через восемь | G27: зарплата | I27: gen1 | J27: Елена Калашникова. Зарплату повысят завтра, а кушать бюджетникам хочется сейчас (2003) // «Новороссийский рабочий», 2003.02.18 | K27: Елена Калашникова | M27: Зарплату повысят завтра, а кушать бюджетникам хочется сейчас | N27: 2003 | O27: публицистика, нехудожественная | P27: комментарий | Q27: политика и общественная жизнь | R27: «Новороссийский рабочий» | S27: 2003.02.18 | T27: газета | U27: омонимия снята | V27: Повышение зарплат российским бюджетникам произойдёт через восемь месяцев. [Елена Калашникова. Зарплату повысят завтра, а кушать бюджетникам хочется сейчас (2003) // «Новороссийский рабочий», 2003.02.18] [омонимия снята] | W27: =RAND() -> 0.1590240722713272 | X27: =IF(RC[-13]=R[-1]C[-13]," ",1) -> 1
A28: еинешер еоворги-окитероет онедевирП | B28: ичадаз | C28: Приведено теоретико-игровое решение | D28: задачи | F28: синтеза структурного описания конструкции. | G28: задача | I28: gen1 | J28: И. А. Барков. Автоматический синтез структурного описания конструкции // «Информационные технологии», 2004 | K28: И. А. Барков | M28: Автоматический синтез структурного описания конструкции | N28: 2004 | O28: учебно-научная, нехудожественная | P28: статья | Q28: наука и технологии, информатика | R28: «Информационные технологии» | S28: 2004 | T28: журнал | U28: омонимия снята | V28: Приведено теоретико-игровое решение задачи синтеза структурного описания конструкции. [И. А. Барков. Автоматический синтез структурного описания конструкции // «Информационные технологии», 2004] [омонимия снята] | W28: =RAND() -> 0.89468610440687624 | X28: =IF(RC[-13]=R[-1]C[-13]," ",1) -> 1
A29: ялд ыробирП вонаждемахуМ К Г | B29: йинатыпси | C29: Г. К. Мухамеджанов. Приборы для | D29: испытаний | F29: нетканых полотен В Федеральном законе "О техническом регулировании", введённом с 1 июля 2003 г., отмечается, что правила и методы испытаний, необходимые для применения в технических регламентах, разрабатывают в течение 6 месяцев со дня официального опубликования технических регламентов, утверждаются Правительством РФ и носят обязательный характер. | G29: испытание | I29: gen1 | J29: Г. К. Мухамеджанов. Приборы для испытаний нетканых полотен // «Текстиль», 2003 | K29: Г. К. Мухамеджанов | M29: Приборы для испытаний нетканых полотен | N29: 2003 | O29: учебно-научная, нехудожественная | P29: статья | Q29: наука и технологии, производство, легкая и пищевая промышленность | R29: «Текстиль» | S29: 2003 | T29: журнал | U29: омонимия снята | V29: Г. К. Мухамеджанов. Приборы для испытаний нетканых полотен " ", ., , , , , . [Г. К. Мухамеджанов. Приборы для испытаний нетканых полотен // «Текстиль», 2003] [омонимия снята] | W29: =RAND() -> 0.43926221911365693 | X29: =IF(RC[-13]=R[-1]C[-13]," ",1) -> 1
A30: АКНОЛОК | B30: АРОТКАДЕР | C30: КОЛОНКА | D30: РЕДАКТОРА | F30: На минувшей неделе вице-премьер, министр | G30: редактор | I30: gen1 | J30: Елена Калашникова, Мария Ананьева. Колонка редактора (2003) // «Новороссийский рабочий», 2003.01.22 | K30: Елена Калашникова, Мария Ананьева | M30: Колонка редактора | N30: 2003 | O30: публицистика, нехудожественная | P30: заметка | Q30: политика и общественная жизнь | R30: «Новороссийский рабочий» | S30: 2003.01.22 | T30: газета | U30: омонимия снята | V30: КОЛОНКА РЕДАКТОРА На минувшей неделе вице-премьер, министр финансов Алексей КУДРИН объявил на встрече с руководством "Медиа-союза" и представителями региональных средств массовой информации о планах правительства продолжить налоговую реформу. [Елена Калашникова, Мария Ананьева. Колонка редактора (2003) // «Новороссийский рабочий», 2003.01.22] [омонимия снята] | W30: =RAND() -> 0.26971968627950593 | X30: =IF(RC[-13]=R[-1]C[-13]," ",1) -> 1
A31: еинадЗ | B31: акриц | C31: Здание | D31: цирка | F31: уже приведено в состояние боевой | G31: цирк | I31: gen1 | J31: Елена Налимова. На арене - фестиваль (2003) // «Богатей» (Саратов), 2003.09.11 | K31: Елена Налимова | M31: На арене - фестиваль | N31: 2003 | O31: публицистика, нехудожественная | P31: статья | Q31: досуг, зрелища и развлечения | R31: «Богатей» (Саратов) | S31: 2003.09.11 | T31: газета | U31: омонимия снята | V31: Здание цирка уже приведено в состояние боевой готовности. [Елена Налимова. На арене - фестиваль (2003) // «Богатей» (Саратов), 2003.09.11] [омонимия снята] | W31: =RAND() -> 0.59100672051929737 | X31: =IF(RC[-13]=R[-1]C[-13]," ",1) -> 1
A32: йотэ зеб и иланз ёсв | B32: иксипаз | C32: всё знали и без этой | D32: записки | E32: ". | G32: записка | I32: gen1 | J32: Андрей Митьков. «Мы все знали и без этой записки». Год назад спортивные чиновники знали, что у наших спортсменов будут искать допинг (2003) // «Известия», 2003.02.07 | K32: Андрей Митьков | M32: «Мы все знали и без этой записки». Год назад спортивные чиновники знали, что у наших спортсменов будут искать допинг | N32: 2003 | O32: публицистика, нехудожественная | P32: статья | Q32: спорт | R32: «Известия» | S32: 2003.02.07 | T32: газета | U32: омонимия снята | V32: "Мы всё знали и без этой записки". [Андрей Митьков. «Мы все знали и без этой записки». Год назад спортивные чиновники знали, что у наших спортсменов будут искать допинг (2003) // «Известия», 2003.02.07] [омонимия снята] | W32: =RAND() -> 0.58352047654435135 | X32: =IF(RC[-13]=R[-1]C[-13]," ",1) -> 1
A33: еинаводелсси еоньлатнемирепскЭ | B33: вомзинахем | C33: Экспериментальное исследование | D33: механизмов | F33: целостного восприятия В экспериментальном исследовании | G33: механизм | I33: gen1 | J33: Е. П. Крупник. Экспериментальное исследование механизмов целостного восприятия // «Вопросы психологии», 2003 | K33: Е. П. Крупник | M33: Экспериментальное исследование механизмов целостного восприятия | N33: 2003 | O33: учебно-научная, нехудожественная | P33: статья | Q33: наука и технологии, психология | R33: «Вопросы психологии» | S33: 2003 | T33: журнал | U33: омонимия снята | V33: Экспериментальное исследование механизмов целостного восприятия В экспериментальном исследовании механизмов целостного восприятия установлена взаимозависимость творческих способностей индивида и его тенденции к "гештальтированию" воспринимаемого поля. [Е. П. Крупник. Экспериментальное исследование механизмов целостного восприятия // «Вопросы психологии», 2003] [омонимия снята] | W33: =RAND() -> 0.82215185813925329 | X33: =IF(RC[-13]=R[-1]C[-13]," ",1) -> 1
A34: яисрев яакссуР | B34: ыметсис-MRC | C34: Русская версия | D34: CRM-системы | F34: SalesLogix 6. 2 впервые выйдет | G34: CRM-система | I34: gen1 | J34: Павел Куприянов. Sage повернулась к России лицом // «Computerworld», 2004 | K34: Павел Куприянов | M34: Sage повернулась к России лицом | N34: 2004 | O34: публицистика, нехудожественная | P34: статья | Q34: бизнес, коммерция, экономика, финансы | R34: «Computerworld» | S34: 2004 | T34: журнал | U34: омонимия снята | V34: Русская версия CRM-системы SalesLogix 6. 2 впервые выйдет одновременно с английской [Павел Куприянов. Sage повернулась к России лицом // «Computerworld», 2004] [омонимия снята] | W34: =RAND() -> 0.99610234492844929 | X34: =IF(RC[-13]=R[-1]C[-13]," ",1) -> 1
A35: У | B35: анитуП | C35: У | D35: Путина | F35: в Чечне мир, Кремль дружит | G35: Путин | I35: gen1 | J35: Александр Гамаюн. Северокавказский приговор (2003) // «Завтра», 2003.08.06 | K35: Александр Гамаюн | M35: Северокавказский приговор | N35: 2003 | O35: публицистика, нехудожественная | P35: статья | Q35: политика и общественная жизнь | R35: «Завтра» | S35: 2003.08.06 | T35: газета | U35: омонимия снята | V35: У Путина в Чечне мир, Кремль дружит с чеченской администрацией, отводит войска, передаёт местным властям власть, налоги, бюджет и оружие. [Александр Гамаюн. Северокавказский приговор (2003) // «Завтра», 2003.08.06] [омонимия снята] | W35: =RAND() -> 0.18633334471206331 | X35: =IF(RC[-13]=R[-1]C[-13]," ",1) -> 1
A36: ьлетадзоС | B36: ммаргорп | C36: Создатель | D36: программ | F36: Mosaic и Netscape Марк Андриссен | G36: программа | I36: gen1 | J36: Леонид Черняк. Монополист «на час» // «Computerworld», 2004 | K36: Леонид Черняк | M36: Монополист «на час» | N36: 2004 | O36: публицистика, нехудожественная | P36: статья | Q36: наука и технологии, информатика | R36: «Computerworld» | S36: 2004 | T36: журнал | U36: омонимия снята | V36: Создатель программ Mosaic и Netscape Марк Андриссен родился 9 июля 1971 года. [Леонид Черняк. Монополист «на час» // «Computerworld», 2004] [омонимия снята] | W36: =RAND() -> 0.8065599951100304 | X36: =IF(RC[-13]=R[-1]C[-13]," ",1) -> 1
A37: ыволоГ намоР вохороД | B37: вотарип | C37: Дорохов Роман. Головы | D37: пиратов | F37: щедро оплатят. Американцы начинают охоту | G37: пират | I37: gen1 | J37: Роман Дорохов. Головы пиратов щедро оплатят. Американцы начинают охоту на нелегальных производителей DVD (2003) // «Известия», 2003.02.20 | K37: Роман Дорохов | M37: Головы пиратов щедро оплатят. Американцы начинают охоту на нелегальных производителей DVD | N37: 2003 | O37: публицистика, нехудожественная | P37: заметка | Q37: наука и технологии | R37: «Известия» | S37: 2003.02.20 | T37: газета | U37: омонимия снята | V37: Дорохов Роман. Головы пиратов щедро оплатят. Американцы начинают охоту на нелегальных производителей DVD [Роман Дорохов. Головы пиратов щедро оплатят. Американцы начинают охоту на нелегальных производителей DVD (2003) // «Известия», 2003.02.20] [омонимия снята] | W37: =RAND() -> 0.74818808985593255 | X37: =IF(RC[-13]=R[-1]C[-13]," ",1) -> 1
A38: илетилдемаз еынсапозеб иксечиголокэ еывоН | B38: яинерог | C38: Новые экологически безопасные замедлители | D38: горения | F38: и их применение для текстильных | G38: горение | I38: gen1 | J38: Э. Коломейцева, А. Морыганов. Новые экологически безопасные замедлители горения и их применение для текстильных материалов из целлюлозных, полиэфирных и смешанных волокон // «Текстиль», 2003 | K38: Э. Коломейцева, А. Морыганов | M38: Новые экологически безопасные замедлители горения и их применение для текстильных материалов из целлюлозных, полиэфирных и смешанных волокон | N38: 2003 | O38: учебно-научная, нехудожественная | P38: статья | Q38: наука и технологии, производство, легкая и пищевая промышленность | R38: «Текстиль» | S38: 2003 | T38: журнал | U38: омонимия снята | V38: Новые экологически безопасные замедлители горения и их применение для текстильных материалов из целлюлозных, полиэфирных и смешанных волокон [Э. Коломейцева, А. Морыганов. Новые экологически безопасные замедлители горения и их применение для текстильных материалов из целлюлозных, полиэфирных и смешанных волокон // «Текстиль», 2003] [омонимия снята] | W38: =RAND() -> 0.19492674606841465 | X38: =IF(RC[-13]=R[-1]C[-13]," ",1) -> 1
A39: юиняотсос оп нирадуБ йалокиН тваномсок | B39: яьвородз | C39: космонавт Николай Бударин по состоянию | D39: здоровья | F39: отстранён от участия в работах | G39: здоровье | I39: gen1 | J39: Сергей Лесков. Наш космонавт здоров, но в космос не выйдет (2003) // «Известия», 2003.01.08 | K39: Сергей Лесков | M39: Наш космонавт здоров, но в космос не выйдет | N39: 2003 | O39: публицистика, нехудожественная | P39: заметка | Q39: наука и технологии | R39: «Известия» | S39: 2003.01.08 | T39: газета | U39: омонимия снята | V39: Американское NASA официально объявило о том, что работающий на международной космической станции российский космонавт Николай Бударин по состоянию здоровья отстранён от участия в работах в открытом космосе, назначенных на 15 января. [Сергей Лесков. Наш космонавт здоров, но в космос не выйдет (2003) // «Известия», 2003.01.08] [омонимия снята] | W39: =RAND() -> 0.80415208263379412 | X39: =IF(RC[-13]=R[-1]C[-13]," ",1) -> 1
A40: анищводог я-36 ястеачемтО | B40: яинеджор | C40: Отмечается 63-я годовщина | D40: рождения | F40: советской гвардии 18. 09. 2004 | G40: рождение | I40: gen1 | J40: Сергей Останин. Отмечается 63-я годовщина рождения советской гвардии (2004) // ИТАР-ТАСС, 2004.09.18 | K40: Сергей Останин | M40: Отмечается 63-я годовщина рождения советской гвардии | N40: 2004 | O40: публицистика, нехудожественная | P40: заметка | Q40: политика и общественная жизнь | R40: ИТАР-ТАСС | S40: 2004.09.18 | T40: электронное издание | U40: омонимия снята | V40: Отмечается 63-я годовщина рождения советской гвардии 18. 09. 2004, 01. 03 [Сергей Останин. Отмечается 63-я годовщина рождения советской гвардии (2004) // ИТАР-ТАСС, 2004.09.18] [омонимия снята] | W40: =RAND() -> 0.34436362999301973 | X40: =IF(RC[-13]=R[-1]C[-13]," ",1) -> 1
A41: хиксечинилк актыпоп яавреП | B41: йинатыпси | C41: Первая попытка клинических | D41: испытаний | F41: вакцины против СПИДа обернулась неудачей | G41: испытание | I41: gen1 | J41: Ольга Неверова. Надежда -- не компас. Первая попытка клинических испытаний вакцины против СПИДа обернулась неудачей (2003) // «Известия», 2003.02.27 | K41: Ольга Неверова | M41: Надежда -- не компас. Первая попытка клинических испытаний вакцины против СПИДа обернулась неудачей | N41: 2003 | O41: публицистика, нехудожественная | P41: заметка | Q41: наука и технологии | R41: «Известия» | S41: 2003.02.27 | T41: газета | U41: омонимия снята | V41: Первая попытка клинических испытаний вакцины против СПИДа обернулась неудачей [Ольга Неверова. Надежда -- не компас. Первая попытка клинических испытаний вакцины против СПИДа обернулась неудачей (2003) // «Известия», 2003.02.27] [омонимия снята] | W41: =RAND() -> 0.65608382401442922 | X41: =IF(RC[-13]=R[-1]C[-13]," ",1) -> 1
A42: еинеджоР ыробыВ | B42: вобатш | C42: Выборы: Рождение | D42: штабов | F42: У ПАРТИЙ ― разгар строительства штабов | G42: штаб | I42: gen1 | J42: Татьяна Нетреба. Выборы : Рождение штабов (2003) // «Аргументы и факты», 2003.06.11 | K42: Татьяна Нетреба | M42: Выборы : Рождение штабов | N42: 2003 | O42: публицистика, нехудожественная | P42: заметка | Q42: политика и общественная жизнь | R42: «Аргументы и факты» | S42: 2003.06.11 | T42: газета | U42: омонимия снята | V42: Выборы: Рождение штабов У ПАРТИЙ ― разгар строительства штабов и рекламных кампаний. [Татьяна Нетреба. Выборы : Рождение штабов (2003) // «Аргументы и факты», 2003.06.11] [омонимия снята] | W42: =RAND() -> 0.94181430866693483 | X42: =IF(RC[-13]=R[-1]C[-13]," ",1) -> 1
A43: хет ялд йынчывирпен ясливяоп гурдв | B43: тел | C43: вдруг появился непривычный для тех | D43: лет | F43: материал, который бы сегодня не | G43: год | I43: gen1 | J43: Игорь Лалаянц. Детектор лжи на молекулярном уровне? Завтра, завтра… послезавтра! // «Знание -- сила», 2003 | K43: Игорь Лалаянц | M43: Детектор лжи на молекулярном уровне? Завтра, завтра… послезавтра! | N43: 2003 | O43: учебно-научная, нехудожественная | P43: статья | Q43: наука и технологии, биология | R43: «Знание -- сила» | S43: 2003 | T43: журнал | U43: омонимия снята | V43: Помнится, в журнале "Иностранная литература" вдруг появился непривычный для тех лет материал, который бы сегодня не вызвал никакого удивления. [Игорь Лалаянц. Детектор лжи на молекулярном уровне? Завтра, завтра… послезавтра! // «Знание -- сила», 2003] [омонимия снята] | W43: =RAND() -> 0.42328194513555117 | X43: =IF(RC[-13]=R[-1]C[-13]," ",1) -> 1
A44: огоротв яимрА | B44: атрос | C44: Армия второго | D44: сорта | F44: Нельзя иметь армию, в которую | G44: сорт | I44: gen1 | J44: Юлия Латынина. Армия второго сорта (2003) // «Еженедельный журнал», 2003.03.24 | K44: Юлия Латынина | L44: 1966 | M44: Армия второго сорта | N44: 2003 | O44: публицистика, нехудожественная | P44: статья | Q44: политика и общественная жизнь | R44: «Еженедельный журнал» | S44: 2003.03.24 | T44: журнал | U44: омонимия снята | V44: Армия второго сорта Нельзя иметь армию, в которую попадает примерно тот же социальный контингент, что в тюрьму. [Юлия Латынина. Армия второго сорта (2003) // «Еженедельный журнал», 2003.03.24] [омонимия снята] | W44: =RAND() -> 0.66742865149514297 | X44: =IF(RC[-13]=R[-1]C[-13]," ",1) -> 1
A45: ырецифо ьтибу илгом анилмохуС аримидалВ | B45: иицилим | C45: Владимира Сухомлина могли убить офицеры | D45: милиции | F45: В понедельник в Москве хоронили | G45: милиция | I45: gen1 | J45: Елена Лория. Владимира Сухомлина могли убить офицеры милиции (2003) // «Известия», 2003.01.12 | K45: Елена Лория | M45: Владимира Сухомлина могли убить офицеры милиции | N45: 2003 | O45: публицистика, нехудожественная | P45: статья | Q45: криминал | R45: «Известия» | S45: 2003.01.12 | T45: газета | U45: омонимия снята | V45: Лория Елена. Владимира Сухомлина могли убить офицеры милиции В понедельник в Москве хоронили известного программиста и журналиста Владимира Сухомлина. [Елена Лория. Владимира Сухомлина могли убить офицеры милиции (2003) // «Известия», 2003.01.12] [омонимия снята] | W45: =RAND() -> 0.27198497003820377 | X45: =IF(RC[-13]=R[-1]C[-13]," ",1) -> 1
A46: ьлетадесдерп вокуЖ рднаскелА | B46: атетимоК | C46: Александр Жуков, председатель | D46: Комитета | F46: Государственной Думы по бюджету и | G46: Комитет | I46: gen1 | J46: Денис Викторов. Стена (2003) // «Бизнес-журнал», 2003.10.23 | K46: Денис Викторов | M46: Стена | N46: 2003 | O46: публицистика, нехудожественная | P46: статья | Q46: бизнес, коммерция, экономика, финансы | R46: «Бизнес-журнал» | S46: 2003.10.23 | T46: журнал | U46: омонимия снята | V46: Александр Жуков, председатель Комитета Государственной Думы по бюджету и налогам [Денис Викторов. Стена (2003) // «Бизнес-журнал», 2003.10.23] [омонимия снята] | W46: =RAND() -> 0.17187629344857713 | X46: =IF(RC[-13]=R[-1]C[-13]," ",1) -> 1
A47: атс од тёчс илсе ьталед | B47: ичясыт | C47: делать, если счёт до ста, | D47: тысячи | F47: и даже далее не способствует | G47: тысяча | I47: gen1 | J47: Вера Елгаева. Бессонница (2003) // «100% здоровья», 2003.03.01 | K47: Вера Елгаева | M47: Бессонница | N47: 2003 | O47: публицистика, нехудожественная | P47: статья | Q47: здоровье и медицина | R47: «100% здоровья» | S47: 2003.03.01 | T47: журнал | U47: омонимия снята | V47: Что делать, если счёт до ста, тысячи и даже далее не способствует долгожданному сну? [Вера Елгаева. Бессонница (2003) // «100% здоровья», 2003.03.01] [омонимия снята] | W47: =RAND() -> 0.1129611568274429 | X47: =IF(RC[-13]=R[-1]C[-13]," ",1) -> 1
A48: тевтО | B48: ялетитсемаз | C48: Ответ | D48: заместителя | F48: министра иностранных дел России Ю | G48: заместитель | I48: gen1 | J48: Ю. В. Федотов. Ответ на вопрос агентства Интерфакс в связи с ветированием Россией в Совете Безопасности ООН проекта резолюции по Кипру // «Дипломатический вестник», 2004 | K48: Ю. В. Федотов | M48: Ответ на вопрос агентства Интерфакс в связи с ветированием Россией в Совете Безопасности ООН проекта резолюции по Кипру | N48: 2004 | O48: публицистика, нехудожественная | P48: интервью | Q48: политика и общественная жизнь | R48: «Дипломатический вестник» | S48: 2004 | T48: журнал | U48: омонимия снята | V48: Ответ заместителя министра иностранных дел России Ю. В. Федотова на вопрос агентства Интерфакс в связи с ветированием Россией в Совете Безопасности ООН проекта резолюции по Кипру [Ю. В. Федотов. Ответ на вопрос агентства Интерфакс в связи с ветированием Россией в Совете Безопасности ООН проекта резолюции по Кипру // «Дипломатический вестник», 2004] [омонимия снята] | W48: =RAND() -> 0.45278003590319571 | X48: =IF(RC[-13]=R[-1]C[-13]," ",1) -> 1
A49: сензиб мокищватсоп ьтатс течох SBI | B49: йинешер | C49: IBS хочет стать поставщиком бизнес- | D49: решений | F49: для малых и средних предприятий | G49: решение | I49: gen1 | J49: Ирина Шеян. Потребительский рынок созрел // «Computerworld», 2004 | K49: Ирина Шеян | M49: Потребительский рынок созрел | N49: 2004 | O49: публицистика, нехудожественная | P49: статья | Q49: бизнес, коммерция, экономика, финансы | R49: «Computerworld» | S49: 2004 | T49: журнал | U49: омонимия снята | V49: IBS хочет стать поставщиком бизнес-решений для малых и средних предприятий [Ирина Шеян. Потребительский рынок созрел // «Computerworld», 2004] [омонимия снята] | W49: =RAND() -> 0.8844799068039888 | X49: =IF(RC[-13]=R[-1]C[-13]," ",1) -> 1
A50: ежиН яинетсар еынворкоповчоп АМЕТ ЯАНВАЛГ | B50: ыварт | C50: ГЛАВНАЯ ТЕМА | почвопокровные растения Ниже | D50: травы | F50: В природе существует большое количество | G50: трава | I50: gen1 | J50: Сергей Кляцов. Ниже травы (2003) // «Сад своими руками», 2003.07.15 | K50: Сергей Кляцов | M50: Ниже травы | N50: 2003 | O50: публицистика, нехудожественная | P50: статья | Q50: природа | R50: «Сад своими руками» | S50: 2003.07.15 | T50: газета | U50: омонимия снята | V50: ГЛАВНАЯ ТЕМА | почвопокровные растения Ниже травы В природе существует большое количество растений, способных покрывать сплошным густым ковром участки почвы, расти на камнях в суровых условиях. [Сергей Кляцов. Ниже травы (2003) // «Сад своими руками», 2003.07.15] [омонимия снята] | W50: =RAND() -> 0.29195603137644521 | X50: =IF(RC[-13]=R[-1]C[-13]," ",1) -> 1
A51: акитсонгаид яаксечипоксорткепС | B51: ымзалп | C51: Спектроскопическая диагностика | D51: плазмы | F51: лазерной эрозии поликристаллической мишени соединения | G51: плазма | I51: gen1 | J51: А. К. Шаибов, М. П. Чучман. Спекроскопическая диагностика плазмы лазерной эрозии поликристаллической мишени соединения AgGaS2 // «Журнал технической физики», 2005 | K51: А. К. Шаибов, М. П. Чучман | M51: Спекроскопическая диагностика плазмы лазерной эрозии поликристаллической мишени соединения AgGaS2 | N51: 2005 | O51: учебно-научная, нехудожественная | P51: аннотация | Q51: наука и технологии, физика | R51: «Журнал технической физики» | S51: 2005 | T51: журнал | U51: омонимия снята | V51: Спектроскопическая диагностика плазмы лазерной эрозии поликристаллической мишени соединения AgGaS 2 [А. К. Шаибов, М. П. Чучман. Спекроскопическая диагностика плазмы лазерной эрозии поликристаллической мишени соединения AgGaS2 // «Журнал технической физики», 2005] [омонимия снята] | W51: =RAND() -> 8.9149881390987784E-2 | X51: =IF(RC[-13]=R[-1]C[-13]," ",1) -> 1
A52: узебвоС ьтиватсдерп нереман отч ливяъбо | B52: НОО | C52: объявил, что намерен представить Совбезу | D52: ООН | F52: текст новой резолюции по Ираку | G52: ООН | I52: gen1 | J52: Наталия Бабасян. Буш готовится атаковать Совбез. США и Великобритания разрабатывают новую резолюцию по Ираку (2003) // «Известия», 2003.02.19 | K52: Наталия Бабасян | M52: Буш готовится атаковать Совбез. США и Великобритания разрабатывают новую резолюцию по Ираку | N52: 2003 | O52: публицистика, нехудожественная | P52: заметка | Q52: политика и общественная жизнь | R52: «Известия» | S52: 2003.02.19 | T52: газета | U52: омонимия снята | V52: Белый дом объявил, что намерен представить Совбезу ООН текст новой резолюции по Ираку в ближайшие дни ― в конце нынешней или начале следующей недели. [Наталия Бабасян. Буш готовится атаковать Совбез. США и Великобритания разрабатывают новую резолюцию по Ираку (2003) // «Известия», 2003.02.19] [омонимия снята] | W52: =RAND() -> 0.83103306081054351 | X52: =IF(RC[-13]=R[-1]C[-13]," ",1) -> 1
A53: маволс оП МОТНАРГИМЭ ЬТЫБ ТЕЖОМ | B53: акиньлачан | C53: МОЖЕТ БЫТЬ ЭМИГРАНТОМ По словам | D53: начальника | F53: ХОСУ Аркадия Чатитяна, за это | G53: начальник | I53: gen1 | J53: Петр Мельников. Строитель не может быть эмигрантом (2003) // «Московский комсомолец» в Сыктывкаре, 2003.08.06 | K53: Петр Мельников | M53: Строитель не может быть эмигрантом | N53: 2003 | O53: публицистика, нехудожественная | P53: интервью | Q53: строительство и архитектура | R53: «Московский комсомолец» в Сыктывкаре | S53: 2003.08.06 | T53: газета | U53: омонимия снята | V53: СТРОИТЕЛЬ НЕ МОЖЕТ БЫТЬ ЭМИГРАНТОМ По словам начальника ХОСУ Аркадия Чатитяна, за это время в Сыктывкаре было построено 48 различных зданий и сооружений. [Петр Мельников. Строитель не может быть эмигрантом (2003) // «Московский комсомолец» в Сыктывкаре, 2003.08.06] [омонимия снята] | W53: =RAND() -> 0.6021172946044735 | X53: =IF(RC[-13]=R[-1]C[-13]," ",1) -> 1
A54: 4 нароК тюуделсси еынёчУ гинк хынчев ынйаТ | B54: атрам | C54: Тайны вечных книг: Учёные исследуют Коран 4 | D54: марта | F54: прошлого года в газете "International | G54: март | I54: gen1 | J54: Рафаил Нудельман. Тайны вечных книг: ученые исследуют Коран // «Знание -- сила», 2003 | K54: Рафаил Нудельман | M54: Тайны вечных книг: ученые исследуют Коран | N54: 2003 | O54: учебно-научная, нехудожественная | P54: статья | Q54: религия | R54: «Знание -- сила» | S54: 2003 | T54: журнал | U54: омонимия снята | V54: : 4 марта прошлого года в газете "International Herald Tribune" была опубликована статья американского журналиста Александра Шитлле под заголовком―"Учёные исследуют Коран". [Рафаил Нудельман. Тайны вечных книг: ученые исследуют Коран // «Знание -- сила», 2003] [омонимия снята] | W54: =RAND() -> 0.874364078786528 | X54: =IF(RC[-13]=R[-1]C[-13]," ",1) -> 1
A55: зеб ынутеЛ намоР воллириК | B55: анисорек | C55: Кириллов Роман. Летуны без | D55: керосина | E55: . | F55: Минобороны проинспектировало части дальней авиации | G55: керосин | I55: gen1 | J55: Роман Кириллов. Летуны без керосина. Минобороны проинспектировало части дальней авиации (2003) // «Известия», 2003.02.17 | K55: Роман Кириллов | M55: Летуны без керосина. Минобороны проинспектировало части дальней авиации | N55: 2003 | O55: публицистика, нехудожественная | P55: комментарий | Q55: политика и общественная жизнь | R55: «Известия» | S55: 2003.02.17 | T55: газета | U55: омонимия снята | V55: Кириллов Роман. Летуны без керосина. Минобороны проинспектировало части дальней авиации [Роман Кириллов. Летуны без керосина. Минобороны проинспектировало части дальней авиации (2003) // «Известия», 2003.02.17] [омонимия снята] | W55: =RAND() -> 0.54117630045548115 | X55: =IF(RC[-13]=R[-1]C[-13]," ",1) -> 1
A56: дуС веьсанафА рднаскелА | B56: хынжясирп | C56: Александр Афанасьев. Суд | D56: присяжных | F56: в России Изменение политического строя | G56: присяжные | I56: gen1 | J56: Александр Афанасьев. Суд присяжных в России // «Отечественные записки», 2003 | K56: Александр Афанасьев | M56: Суд присяжных в России | N56: 2003 | O56: учебно-научная, нехудожественная | P56: статья | Q56: право | R56: «Отечественные записки» | S56: 2003 | T56: журнал | U56: омонимия снята | V56: Александр Афанасьев. Суд присяжных в России Изменение политического строя, экономических и общественных отношений, создание правового государства и процесс демократизации общества неизбежно влечёт за собой серьёзные судебные преобразования. [Александр Афанасьев. Суд присяжных в России // «Отечественные записки», 2003] [омонимия снята] | W56: =RAND() -> 0.67688412244906926 | X56: =IF(RC[-13]=R[-1]C[-13]," ",1) -> 1
A57: В В оволс еоньлетипутсВ | B57: анитуП | C57: Вступительное слово В. В. | D57: Путина | F57: в ходе российско-египетских переговоров в | G57: Путин | I57: gen1 | J57: В. В. Путин. Вступительное слово в ходе российско-египетских переговоров в расширенном составе // «Дипломатический вестник», 2004 | K57: В. В. Путин | L57: 1952 | M57: Вступительное слово в ходе российско-египетских переговоров в расширенном составе | N57: 2004 | O57: официально-деловая, нехудожественная | P57: речь | Q57: политика и общественная жизнь | R57: «Дипломатический вестник» | S57: 2004 | T57: журнал | U57: омонимия снята | V57: Вступительное слово В. В. Путина в ходе российско-египетских переговоров в расширенном составе 28 мая [В. В. Путин. Вступительное слово в ходе российско-египетских переговоров в расширенном составе // «Дипломатический вестник», 2004] [омонимия снята] | W57: =RAND() -> 0.22809262326124657 | X57: =IF(RC[-13]=R[-1]C[-13]," ",1) -> 1
A58: 71 КСТУКРИ | B58: ярбятнес | C58: ИРКУТСК, 17 | D58: сентября | E58: . | F58: / Корр. ИТАР-ТАСС Владимир Ходий/. | G58: сентябрь | I58: gen1 | J58: Владимир Ходий. Программу «Аншлаг» и ей подобные на государственном телевидении заменят передачи о культуре и специальный детский канал. (2004) // ИТАР-ТАСС, 2004.09.17 | K58: Владимир Ходий | M58: Программу «Аншлаг» и ей подобные на государственном телевидении заменят передачи о культуре и специальный детский канал. | N58: 2004 | O58: публицистика, нехудожественная | P58: заметка | Q58: искусство и культура | R58: ИТАР-ТАСС | S58: 2004.09.17 | T58: электронное издание | U58: омонимия снята | V58: ИРКУТСК, 17 сентября. / Корр. ИТАР-ТАСС Владимир Ходий/. [Владимир Ходий. Программу «Аншлаг» и ей подобные на государственном телевидении заменят передачи о культуре и специальный детский канал. (2004) // ИТАР-ТАСС, 2004.09.17] [омонимия снята] | W58: =RAND() -> 2.0072180763614722E-2 | X58: =IF(RC[-13]=R[-1]C[-13]," ",1) -> 1
A59: огонтогьл яицпецноК коничоП рднаскелА | B59: автсрадусог | C59: Александр Починок: Концепция льготного | D59: государства | F59: бессмысленна Открытый разговор ― Александр Починок | G59: государство | I59: gen1 | J59: Оксана Карпова. Александр Починок: Концепция льготного государства бессмысленна (2003) // «Время МН», 2003.07.31 | K59: Оксана Карпова | M59: Александр Починок: Концепция льготного государства бессмысленна | N59: 2003 | O59: публицистика, нехудожественная | P59: статья | Q59: политика и общественная жизнь | R59: «Время МН» | S59: 2003.07.31 | T59: газета | U59: омонимия снята | V59: Александр Починок: Концепция льготного государства бессмысленна Открытый разговор ― Александр Починок, министр труда и социального развития РФ [Оксана Карпова. Александр Починок: Концепция льготного государства бессмысленна (2003) // «Время МН», 2003.07.31] [омонимия снята] | W59: =RAND() -> 0.98097023962230401 | X59: =IF(RC[-13]=R[-1]C[-13]," ",1) -> 1
A60: евтсдохс О | B60: вомёирп | C60: О сходстве | D60: приёмов | F60: остроумия и механизмов построения парадоксальных | G60: прием | I60: gen1 | J60: М. В. Мусийчук. О сходстве приемов остроумия и механизмов построения парадоксальных задач // «Вопросы психологии», 2003 | K60: М. В. Мусийчук | M60: О сходстве приемов остроумия и механизмов построения парадоксальных задач | N60: 2003 | O60: учебно-научная, нехудожественная | P60: статья | Q60: наука и технологии, психология | R60: «Вопросы психологии» | S60: 2003 | T60: журнал | U60: омонимия снята | V60: О сходстве приёмов остроумия и механизмов построения парадоксальных задач [М. В. Мусийчук. О сходстве приемов остроумия и механизмов построения парадоксальных задач // «Вопросы психологии», 2003] [омонимия снята] | W60: =RAND() -> 0.84683374473751349 | X60: =IF(RC[-13]=R[-1]C[-13]," ",1) -> 1
A61: акорос итацдирт кеволеч йодолом кичзакссаР | B61: тел | C61: Рассказчик ― молодой человек тридцати-сорока | D61: лет | E61: . | F61: Рассказчик стоит вне "ринга", потом | G61: год | I61: gen1 | J61: Евгений Гришковец. ОдноврЕмЕнно (2004) | K61: Евгений Гришковец | L61: 1967 | M61: ОдноврЕмЕнно | N61: 2004 | O61: художественная | P61: пьеса | R61: Е. Гришковец. Город: Сб. пьес | S61: 2001 | T61: книга | U61: омонимия снята | V61: Действующие лица: Рассказчик ― молодой человек тридцати-сорока лет. Рассказчик стоит вне "ринга", потом подходит к нему и после небольшой паузы шагает внутрь. [Евгений Гришковец. ОдноврЕмЕнно (2004)] [омонимия снята] | W61: =RAND() -> 0.6365966324645348 | X61: =IF(RC[-13]=R[-1]C[-13]," ",1) -> 1
A62: яинещарверП йегреС веескелА | B62: йепец | C62: Алексеев Сергей. Превращения | D62: цепей | E62: . | F62: Премия для молодого учёного-теоретика | G62: цепь | I62: gen1 | J62: Сергей Алексеев. Превращения цепей. Премия для молодого ученого-теоретика (2003) // «Известия», 2003.02.20 | K62: Сергей Алексеев | M62: Превращения цепей. Премия для молодого ученого-теоретика | N62: 2003 | O62: публицистика, нехудожественная | P62: статья | Q62: наука и технологии | R62: «Известия» | S62: 2003.02.20 | T62: газета | U62: омонимия снята | V62: Алексеев Сергей. Превращения цепей. Премия для молодого учёного-теоретика [Сергей Алексеев. Превращения цепей. Премия для молодого ученого-теоретика (2003) // «Известия», 2003.02.20] [омонимия снята] | W62: =RAND() -> 0.4863663961641671 | X62: =IF(RC[-13]=R[-1]C[-13]," ",1) -> 1
A63: босопс ястеагалдерП | B63: яинавозарбоерп | C63: Предлагается способ | D63: преобразования | F63: централизованной сетевой базы данных из | G63: преобразование | I63: gen1 | J63: А. Б. Барский. Применение SPMD-технологии при построении сетевых баз данных с циркулирующей информацией // «Информационные технологии», 2004 | K63: А. Б. Барский | M63: Применение SPMD-технологии при построении сетевых баз данных с циркулирующей информацией | N63: 2004 | O63: учебно-научная, нехудожественная | P63: статья | Q63: наука и технологии, информатика | R63: «Информационные технологии» | S63: 2004 | T63: журнал | U63: омонимия снята | V63: Предлагается способ преобразования централизованной сетевой базы данных из традиционно одноканальной в многоканальную систему массового обслуживания на основе применения SPMD- технологии. [А. Б. Барский. Применение SPMD-технологии при построении сетевых баз данных с циркулирующей информацией // «Информационные технологии», 2004] [омонимия снята] | W63: =RAND() -> 0.62245715709093741 | X63: =IF(RC[-13]=R[-1]C[-13]," ",1) -> 1
A64: огошьлоб ялД | B64: алсич | C64: Для большого | D64: числа | F64: проблем, с которыми сталкивается предприниматель | G64: число | I64: gen1 | J64: Леонид Малков. Собственность как товар (2003) // «Бизнес-журнал», 2003.10.23 | K64: Леонид Малков | M64: Собственность как товар | N64: 2003 | O64: публицистика, нехудожественная | P64: статья | Q64: бизнес, коммерция, экономика, финансы | R64: «Бизнес-журнал» | S64: 2003.10.23 | T64: журнал | U64: омонимия снята | V64: Для большого числа проблем, с которыми сталкивается предприниматель в США, имеется универсальное решение: делиться собственностью в фирме. [Леонид Малков. Собственность как товар (2003) // «Бизнес-журнал», 2003.10.23] [омонимия снята] | W64: =RAND() -> 0.97029468457175327 | X64: =IF(RC[-13]=R[-1]C[-13]," ",1) -> 1
A65: йенваден витомтйел лыб вокаТ | B65: иицнерефнок-ссерп | C65: Таков был лейтмотив недавней | D65: пресс-конференции | F65: главного военного прокурора Александра Савенкова | G65: пресс-конференция | I65: gen1 | J65: Марина Гриднева. За взятку - сажать! (2004) // «Московский комсомолец» в Нижнем Новгороде, 2004.07.30 | K65: Марина Гриднева | M65: За взятку - сажать! | N65: 2004 | O65: публицистика, нехудожественная | P65: заметка | Q65: армия и вооруженные конфликты | R65: «Московский комсомолец» в Нижнем Новгороде | S65: 2004.07.30 | T65: газета | U65: омонимия снята | V65: Таков был лейтмотив недавней пресс-конференции главного военного прокурора Александра Савенкова. [Марина Гриднева. За взятку - сажать! (2004) // «Московский комсомолец» в Нижнем Новгороде, 2004.07.30] [омонимия снята] | W65: =RAND() -> 0.75778746734190672 | X65: =IF(RC[-13]=R[-1]C[-13]," ",1) -> 1
A66: ьнеТ | B66: ФРПК | C66: Тень | D66: КПРФ | F66: становится гуще Прочитал в первом | G66: КПРФ | I66: gen1 | J66: Вячеслав Костиков. Тень КПРФ становится гуще (2003) // «Аргументы и факты», 2003.01.29 | K66: Вячеслав Костиков | L66: 1940 | M66: Тень КПРФ становится гуще | N66: 2003 | O66: публицистика, нехудожественная | P66: статья | Q66: политика и общественная жизнь | R66: «Аргументы и факты» | S66: 2003.01.29 | T66: газета | U66: омонимия снята | V66: Тень КПРФ становится гуще Прочитал в первом номере "Аргументов и фактов" слова Е. Гайдара о том, что "социализма не хотят даже коммунисты", и возмутился. [Вячеслав Костиков. Тень КПРФ становится гуще (2003) // «Аргументы и факты», 2003.01.29] [омонимия снята] | W66: =RAND() -> 0.19290034273273116 | X66: =IF(RC[-13]=R[-1]C[-13]," ",1) -> 1
A67: еинечузИ | B67: ииголохисп | C67: Изучение | D67: психологии | F67: подростка в лаборатории Д. Б | G67: психология | I67: gen1 | J67: М. Э. Боцманова, Р. Д. Триггер. Изучение психологии подростка в лаборатории Д.Б. Эльконина // «Вопросы психологии», 2004 | K67: М. Э. Боцманова, Р. Д. Триггер | M67: Изучение психологии подростка в лаборатории Д.Б. Эльконина | N67: 2004 | O67: учебно-научная, нехудожественная | P67: статья | Q67: наука и технологии, психология | R67: «Вопросы психологии» | S67: 2004 | T67: журнал | U67: омонимия снята | V67: Изучение психологии подростка в лаборатории Д. Б. Эльконина [М. Э. Боцманова, Р. Д. Триггер. Изучение психологии подростка в лаборатории Д.Б. Эльконина // «Вопросы психологии», 2004] [омонимия снята] | W67: =RAND() -> 0.74538691723484518 | X67: =IF(RC[-13]=R[-1]C[-13]," ",1) -> 1
A68: огонняотсоП о и еинелпутсыВ | B68: ялетиватсдерп | C68: Выступление и. о. Постоянного | D68: представителя | F68: Российской Федерации при ООН А | G68: представитель | I68: gen1 | J68: А. В. Конузин. Выступление на открытом заседании СБ по вопросу о действии санкций в отношении талибов и «Аль-Каиды» // «Дипломатический вестник», 2004 | K68: А. В. Конузин | M68: Выступление на открытом заседании СБ по вопросу о действии санкций в отношении талибов и «Аль-Каиды» | N68: 2004 | O68: официально-деловая, нехудожественная | P68: речь | Q68: политика и общественная жизнь | R68: «Дипломатический вестник» | S68: 2004 | T68: журнал | U68: омонимия снята | V68: Выступление и. о. Постоянного представителя Российской Федерации при ООН А. В. Конузина на открытом заседании СБ по вопросу о действии санкций в отношении талибов и «Аль-Каиды» 25 мая [А. В. Конузин. Выступление на открытом заседании СБ по вопросу о действии санкций в отношении талибов и «Аль-Каиды» // «Дипломатический вестник», 2004] [омонимия снята] | W68: =RAND() -> 0.50095710527040593 | X68: =IF(RC[-13]=R[-1]C[-13]," ",1) -> 1
A69: еинадижо или киндзарп дог йывоН | B69: акиндзарп | C69: Новый год: праздник или ожидание | D69: праздника | E69: ? | F69: Статус Нового года в современной | G69: праздник | I69: gen1 | J69: Олег Николаев. Новый год: праздник или ожидание праздника? // «Отечественные записки», 2003 | K69: Олег Николаев | M69: Новый год: праздник или ожидание праздника? | N69: 2003 | O69: учебно-научная, нехудожественная | P69: статья | Q69: искусство и культура | R69: «Отечественные записки» | S69: 2003 | T69: журнал | U69: омонимия снята | V69: Олег Николаев. Новый год: праздник или ожидание праздника? Статус Нового года в современной системе российских праздников совершенно уникален. [Олег Николаев. Новый год: праздник или ожидание праздника? // «Отечественные записки», 2003] [омонимия снята] | W69: =RAND() -> 0.53434585535604606 | X69: =IF(RC[-13]=R[-1]C[-13]," ",1) -> 1
A70: еровогаз о ыропС | B70: вохрагило | C70: Споры о "заговоре | D70: олигархов | E70: ", | F70: с одной стороны, и споры | G70: олигарх | I70: gen1 | J70: Сергей Доренко. Левые силы - перезагрузка (2003) // «Завтра», 2003.08.13 | K70: Сергей Доренко | L70: 1959 | M70: Левые силы - перезагрузка | N70: 2003 | O70: публицистика, нехудожественная | P70: статья | Q70: политика и общественная жизнь | R70: «Завтра» | S70: 2003.08.13 | T70: газета | U70: омонимия снята | V70: Споры о "заговоре олигархов", с одной стороны, и споры о "заговоре силовиков", с другой, стали главным событием лета. [Сергей Доренко. Левые силы - перезагрузка (2003) // «Завтра», 2003.08.13] [омонимия снята] | W70: =RAND() -> 0.67427286595693059 | X70: =IF(RC[-13]=R[-1]C[-13]," ",1) -> 1
A71: огортсыб овтссуксИ яидравг яадолоМ | B71: яинавеоваз | C71: Молодая гвардия. Искусство быстрого | D71: завоевания | F71: новых рынков сбыта 04. 11 | G71: завоевание | I71: gen1 | J71: Владимир Ляпоров. Молодая гвардия. Искусство быстрого завоевания новых рынков сбыта (2003) // «Бизнес-журнал», 2003.10.23 | K71: Владимир Ляпоров | M71: Молодая гвардия. Искусство быстрого завоевания новых рынков сбыта | N71: 2003 | O71: публицистика, нехудожественная | P71: статья | Q71: бизнес, коммерция, экономика, финансы | R71: «Бизнес-журнал» | S71: 2003.10.23 | T71: журнал | U71: омонимия снята | V71: Молодая гвардия. Искусство быстрого завоевания новых рынков сбыта 04. 11. 2003 [Владимир Ляпоров. Молодая гвардия. Искусство быстрого завоевания новых рынков сбыта (2003) // «Бизнес-журнал», 2003.10.23] [омонимия снята] | W71: =RAND() -> 0.65324329810443138 | X71: =IF(RC[-13]=R[-1]C[-13]," ",1) -> 1
A72: нинаджарг чивортеП йирЮ ворднаскелА Я | B72: ФР | C72: Я, Александров Юрий Петрович, гражданин | D72: РФ | E72: , | F72: родился 12 августа 1988 г | G72: РФ | I72: gen1 | J72: Автобиография (2006) | M72: Автобиография | N72: 2006 | O72: официально-деловая, нехудожественная | P72: автобиография | Q72: частная жизнь | S72: 2006 | T72: рукопись | U72: омонимия снята | V72: Я, Александров Юрий Петрович, гражданин РФ, родился 12 августа 1988 г. в г. Новочеркасске Ростовской области. [Автобиография (2006)] [омонимия снята] | W72: =RAND() -> 0.39770585351503362 | X72: =IF(RC[-13]=R[-1]C[-13]," ",1) -> 1
A73: елачан о еинешеР | B73: аксупыв | C73: Решение о начале | D73: выпуска | F73: видеокарт под собственной торговой маркой | G73: выпуск | I73: gen1 | J73: Вячеслав Соболев. Есть ли шансы у XGI // «Computerworld», 2004 | K73: Вячеслав Соболев | M73: Есть ли шансы у XGI | N73: 2004 | O73: публицистика, нехудожественная | P73: статья | Q73: бизнес, коммерция, экономика, финансы | R73: «Computerworld» | S73: 2004 | T73: журнал | U73: омонимия снята | V73: Решение о начале выпуска видеокарт под собственной торговой маркой: акт отчаяния или тонкий стратегический ход? [Вячеслав Соболев. Есть ли шансы у XGI // «Computerworld», 2004] [омонимия снята] | W73: =RAND() -> 0.62800512758130889 | X73: =IF(RC[-13]=R[-1]C[-13]," ",1) -> 1
A74: еинавориицинИ | B74: яинерог | C74: Инициирование | D74: горения | F74: метано-воздушной смеси в сверхзвуковом потоке | G74: горение | I74: gen1 | J74: А. М. Старик, Н. С. Титова. Инициирование горения метано-воздушной смеси в сверхзвуковом потоке за ударной волной при возбуждении молекул O2 лазерным излучением // «Журнал технической физики», 2004 | K74: А. М. Старик, Н. С. Титова | M74: Инициирование горения метано-воздушной смеси в сверхзвуковом потоке за ударной волной при возбуждении молекул O2 лазерным излучением | N74: 2004 | O74: учебно-научная, нехудожественная | P74: аннотация | Q74: наука и технологии, физика | R74: «Журнал технической физики» | S74: 2004 | T74: журнал | U74: омонимия снята | V74: Инициирование горения метано-воздушной смеси в сверхзвуковом потоке за ударной волной при возбуждении молекул O 2 лазерным излучением [А. М. Старик, Н. С. Титова. Инициирование горения метано-воздушной смеси в сверхзвуковом потоке за ударной волной при возбуждении молекул O2 лазерным излучением // «Журнал технической физики», 2004] [омонимия снята] | W74: =RAND() -> 0.54230456159575902 | X74: =IF(RC[-13]=R[-1]C[-13]," ",1) -> 1
A75: йоксечитиломег акиманиД | B75: итсонвитка | C75: Динамика гемолитической | D75: активности | F75: комплемента при экспериментальной инфекции Эбола | G75: активность | I75: gen1 | J75: Н. М. Зубавичене, А. А. Чепурнов. Динамика гемолитической активности комплемента при экспериментальной инфекции Эбола (2004) // «Вопросы вирусологии», 2004.03.08 | K75: Н. М. Зубавичене, А. А. Чепурнов | M75: Динамика гемолитической активности комплемента при экспериментальной инфекции Эбола | N75: 2004 | O75: учебно-научная, нехудожественная | P75: статья | Q75: наука и технологии, здоровье и медицина | R75: «Вопросы вирусологии» | S75: 2004.03.08 | T75: журнал | U75: омонимия снята | V75: Динамика гемолитической активности комплемента при экспериментальной инфекции Эбола [Н. М. Зубавичене, А. А. Чепурнов. Динамика гемолитической активности комплемента при экспериментальной инфекции Эбола (2004) // «Вопросы вирусологии», 2004.03.08] [омонимия снята] | W75: =RAND() -> 0.81487489910273547 | X75: =IF(RC[-13]=R[-1]C[-13]," ",1) -> 1
A76: 681 тсоР | B76: вортемитнас | C76: Рост 186 | D76: сантиметров | E76: , | F76: плотного телосложения, размер 52-54 | G76: сантиметр | I76: gen1 | J76: Любовь Дивнова. Помогите (2003) // «Криминальная хроника», 2003.07.08 | K76: Любовь Дивнова | M76: Помогите | N76: 2003 | O76: публицистика, нехудожественная | P76: информационное сообщение | Q76: криминал | R76: «Криминальная хроника» | S76: 2003.07.08 | T76: газета | U76: омонимия снята | V76: Рост 186 сантиметров, плотного телосложения, размер 52-54, цвет волос ― чёрный, стрижка короткая, был одет в военную форму темно-зеленого цвета. [Любовь Дивнова. Помогите (2003) // «Криминальная хроника», 2003.07.08] [омонимия снята] | W76: =RAND() -> 0.27077887299935899 | X76: =IF(RC[-13]=R[-1]C[-13]," ",1) -> 1
A77: ОГОНДОРАН АРТВАЗ И ЯНДОГЕС юьвретни | B77: ЯЛИБОМОТВА | C77: интервью СЕГОДНЯ И ЗАВТРА "НАРОДНОГО" | D77: АВТОМОБИЛЯ | F77: В ТОЛЬЯТТИ ПРИДУТ ИНВЕСТОРЫ… | G77: автомобиль | I77: gen1 | J77: Петр Меньших, Владимир Каданников. В Тольятти придут инвесторы… (2003) // «За рулем», 2003.05.15 | K77: Петр Меньших, Владимир Каданников | M77: В Тольятти придут инвесторы… | N77: 2003 | O77: публицистика, нехудожественная | P77: интервью | Q77: бизнес, коммерция, экономика, финансы | R77: «За рулем» | S77: 2003.05.15 | T77: журнал | U77: омонимия снята | V77: эксклюзивное интервью СЕГОДНЯ И ЗАВТРА "НАРОДНОГО" АВТОМОБИЛЯ В ТОЛЬЯТТИ ПРИДУТ ИНВЕСТОРЫ… [Петр Меньших, Владимир Каданников. В Тольятти придут инвесторы… (2003) // «За рулем», 2003.05.15] [омонимия снята] | W77: =RAND() -> 0.44865830789956618 | X77: =IF(RC[-13]=R[-1]C[-13]," ",1) -> 1
A78: узетнис к дохдоп назакоП | B78: авозук | C78: Показан подход к синтезу | D78: кузова | F78: автомобиля с точки зрения пассивной | G78: кузов | I78: gen1 | J78: В. А. Овчинников. Применение генетических алгоритмов в задачах синтеза кузова автомобиля // «Информационные технологии», 2004 | K78: В. А. Овчинников | M78: Применение генетических алгоритмов в задачах синтеза кузова автомобиля | N78: 2004 | O78: учебно-научная, нехудожественная | P78: статья | Q78: наука и технологии, информатика | R78: «Информационные технологии» | S78: 2004 | T78: журнал | U78: омонимия снята | V78: Показан подход к синтезу кузова автомобиля с точки зрения пассивной безопасности. [В. А. Овчинников. Применение генетических алгоритмов в задачах синтеза кузова автомобиля // «Информационные технологии», 2004] [омонимия снята] | W78: =RAND() -> 0.7672129139183802 | X78: =IF(RC[-13]=R[-1]C[-13]," ",1) -> 1
A79: аз-зи луноту зургохуС нитнатсноК йикснамтеГ | B79: амротш | C79: Гетманский Константин. Сухогруз утонул из-за | D79: шторма | F79: Во вторник в Чёрном море | G79: шторм | I79: gen1 | J79: Константин Гетманский. Сухогруз утонул из-за шторма (2003) // «Известия», 2003.02.03 | K79: Константин Гетманский | M79: Сухогруз утонул из-за шторма | N79: 2003 | O79: публицистика, нехудожественная | P79: статья | Q79: криминал | R79: «Известия» | S79: 2003.02.03 | T79: газета | U79: омонимия снята | V79: Гетманский Константин. Сухогруз утонул из-за шторма Во вторник в Чёрном море продолжились поиски моряков российского сухогруза "Стрелец", который в понедельник утром затонул недалеко от Турции. [Константин Гетманский. Сухогруз утонул из-за шторма (2003) // «Известия», 2003.02.03] [омонимия снята] | W79: =RAND() -> 0.62945907812766233 | X79: =IF(RC[-13]=R[-1]C[-13]," ",1) -> 1
A80: учадзар лачан нитуП римидалВ горип | B80: итсалв | C80: пирог. Владимир Путин начал раздачу | D80: власти | F80: В четверг Госдума рассмотрит в | G80: власть | I80: gen1 | J80: Светлана Бабаева, Екатерина Григорьева. Слоеный пирог. Владимир Путин начал раздачу власти (2003) // «Известия», 2003.02.18 | K80: Светлана Бабаева, Екатерина Григорьева | M80: Слоеный пирог. Владимир Путин начал раздачу власти | N80: 2003 | O80: публицистика, нехудожественная | P80: статья | Q80: политика и общественная жизнь | R80: «Известия» | S80: 2003.02.18 | T80: газета | U80: омонимия снята | V80: Слоёный пирог. Владимир Путин начал раздачу власти В четверг Госдума рассмотрит в первом чтении «революционные», как считают многие политики, законопроекты об организации госвласти в регионах и местном самоуправлении (МСУ). [Светлана Бабаева, Екатерина Григорьева. Слоеный пирог. Владимир Путин начал раздачу власти (2003) // «Известия», 2003.02.18] [омонимия снята] | W80: =RAND() -> 0.37573322660804109 | X80: =IF(RC[-13]=R[-1]C[-13]," ",1) -> 1
A81: хыньлатсо то ьсалачилто ьнечо укьлоксоп | B81: йемес | C81: поскольку очень отличалась от остальных | D81: семей | F81: этого города. | G81: семья | I81: gen1 | J81: Александр Дорофеев. Эле-Фантик // «Мурзилка», 2003 | K81: Александр Дорофеев | M81: Эле-Фантик | N81: 2003 | O81: художественная | P81: рассказ | R81: «Мурзилка» | S81: 2003 | T81: журнал | U81: омонимия снята | V81: Даже счастливая семья, о которой речь, переживала неприятные минуты, поскольку очень отличалась от остальных семей этого города. [Александр Дорофеев. Эле-Фантик // «Мурзилка», 2003] [омонимия снята] | W81: =RAND() -> 0.38400389454622019 | X81: =IF(RC[-13]=R[-1]C[-13]," ",1) -> 1
A82: ротартсномеД рднаскелА никтаЛ | B82: итсевос | C82: Латкин Александр. Демонстратор | D82: совести | E82: . | F82: Знаменитому хакеру разрешили выходить в | G82: совесть | I82: gen1 | J82: Александр Латкин. Демонстратор совести. Знаменитому хакеру разрешили выходить в Интернет (2003) // «Известия», 2003.01.22 | K82: Александр Латкин | M82: Демонстратор совести. Знаменитому хакеру разрешили выходить в Интернет | N82: 2003 | O82: публицистика, нехудожественная | P82: статья | Q82: наука и технологии | R82: «Известия» | S82: 2003.01.22 | T82: газета | U82: омонимия снята | V82: Латкин Александр. Демонстратор совести. Знаменитому хакеру разрешили выходить в Интернет [Александр Латкин. Демонстратор совести. Знаменитому хакеру разрешили выходить в Интернет (2003) // «Известия», 2003.01.22] [омонимия снята] | W82: =RAND() -> 0.33232041955061864 | X82: =IF(RC[-13]=R[-1]C[-13]," ",1) -> 1
A83: огонрялупопен икинорх еынрялупоП екимонокэ йововарп | B83: аноказ | C83: правовой экономике. Популярные хроники непопулярного | D83: закона | F83: 28 декабря 2002 г. Президент Российской Федерации В. В. Путин подписал Федеральный закон "О техническом регулировании". | G83: закон | I83: gen1 | J83: Павел Иванов. Ключ к правовой экономике. Популярные хроники непопулярного закона // «Воздушно-космическая оборона», 2003 | K83: Павел Иванов | M83: Ключ к правовой экономике. Популярные хроники непопулярного закона | N83: 2003 | O83: публицистика, нехудожественная | P83: статья | Q83: право | R83: «Воздушно-космическая оборона» | S83: 2003 | T83: журнал | U83: омонимия снята | V83: Ключ к правовой экономике. Популярные хроники непопулярного закона . . . " ". [Павел Иванов. Ключ к правовой экономике. Популярные хроники непопулярного закона // «Воздушно-космическая оборона», 2003] [омонимия снята] | W83: =RAND() -> 0.58922954835193131 | X83: =IF(RC[-13]=R[-1]C[-13]," ",1) -> 1
A84: аметсис яандораН авобуД яьлатаН | B84: яиненарх | C84: Наталья Дубова. "Народная" система | D84: хранения | F84: 06. 07. 2004 | G84: хранение | I84: gen1 | J84: Наталья Дубова. «Народная» система хранения // «Computerworld», 2004 | K84: Наталья Дубова | M84: «Народная» система хранения | N84: 2004 | O84: публицистика, нехудожественная | P84: статья | Q84: бизнес, коммерция, экономика, финансы | R84: «Computerworld» | S84: 2004 | T84: журнал | U84: омонимия снята | V84: Наталья Дубова. "Народная" система хранения 06. 07. 2004 [Наталья Дубова. «Народная» система хранения // «Computerworld», 2004] [омонимия снята] | W84: =RAND() -> 0.25968697566615995 | X84: =IF(RC[-13]=R[-1]C[-13]," ",1) -> 1
A85: ялД | B85: ФПН | C85: Для | D85: НПФ | F85: закон не писан № Частные фонды | G85: НПФ | I85: gen1 | J85: Наталия Биянова. Для НПФ закон не писан (2003) // «Газета», 2003.06.03 | K85: Наталия Биянова | M85: Для НПФ закон не писан | N85: 2003 | O85: публицистика, нехудожественная | P85: статья | Q85: политика и общественная жизнь | R85: «Газета» | S85: 2003.06.03 | T85: газета | U85: омонимия снята | V85: Для НПФ закон не писан № Частные фонды пойдут по стопам управляющих компаний № Не успело правительство допустить к пенсионной реформе частные управляющие компании, как забили тревогу НПФ. [Наталия Биянова. Для НПФ закон не писан (2003) // «Газета», 2003.06.03] [омонимия снята] | W85: =RAND() -> 0.4335570396954832 | X85: =IF(RC[-13]=R[-1]C[-13]," ",1) -> 1
A86: йиратнеммоК йиксвеалокиН Р В | B86: аголоскес | C86: В. Р. Николаевский. Комментарий | D86: сексолога | F86: • Женщины часто жалуются на то | G86: сексолог | I86: gen1 | J86: В. Р. Николаевский. Комментарий сексолога // «Даша», 2004 | K86: В. Р. Николаевский | M86: Комментарий сексолога | N86: 2004 | O86: публицистика, нехудожественная | P86: комментарий | Q86: частная жизнь | R86: «Даша» | S86: 2004 | T86: журнал | U86: омонимия снята | V86: В. Р. Николаевский. Комментарий сексолога • Женщины часто жалуются на то, что мужчины с самого начала отношений как можно скорее хотят перейти к телесной любви, а потом сами же мужчины возмущаются доступностью женщин, считая их легкомысленными и легкодоступными. [В. Р. Николаевский. Комментарий сексолога // «Даша», 2004] [омонимия снята] | W86: =RAND() -> 0.54309410504203148 | X86: =IF(RC[-13]=R[-1]C[-13]," ",1) -> 1
A87: хыньлетиварпси укиткарп юукстевос ьтунрев тюагалдерп | B87: тобар | C87: предлагают вернуть советскую практику исправительных | D87: работ | E87: . | G87: работа | I87: gen1 | J87: Андрей Гусев. Проституток накажут метлой (2003) // «Аргументы и факты», 2003.06.11 | K87: Андрей Гусев | M87: Проституток накажут метлой | N87: 2003 | O87: публицистика, нехудожественная | P87: комментарий | Q87: политика и общественная жизнь | R87: «Аргументы и факты» | S87: 2003.06.11 | T87: газета | U87: омонимия снята | V87: РОССИЙСКИЕ парламентарии предлагают вернуть советскую практику исправительных работ. [Андрей Гусев. Проституток накажут метлой (2003) // «Аргументы и факты», 2003.06.11] [омонимия снята] | W87: =RAND() -> 0.30301785749408849 | X87: =IF(RC[-13]=R[-1]C[-13]," ",1) -> 1
A88: зи алибыв отсорп аныс юярет | B88: иелок | C88: теряю сына, просто выбила из | D88: колеи | E88: ! | G88: колея | I88: gen1 | J88: Елена Павлова. Вместе мы эту пропасть одолеем! // «Даша», 2004 | K88: Елена Павлова | M88: Вместе мы эту пропасть одолеем! | N88: 2004 | O88: публицистика, нехудожественная | P88: статья | Q88: частная жизнь | R88: «Даша» | S88: 2004 | T88: журнал | U88: омонимия снята | V88: • Мысль о том, что теряю сына, просто выбила из колеи! [Елена Павлова. Вместе мы эту пропасть одолеем! // «Даша», 2004] [омонимия снята] | W88: =RAND() -> 0.27579478906822652 | X88: =IF(RC[-13]=R[-1]C[-13]," ",1) -> 1
A89: йоньланоицан итсоннебосО | B89: ыбьроб | C89: Особенности национальной | D89: борьбы | F89: с терроризмом Президент России убежден | G89: борьба | I89: gen1 | J89: Константин Катанян. Особенности национальной борьбы с терроризмом (2003) // «Время МН», 2003.08.05 | K89: Константин Катанян | L89: 1960 | M89: Особенности национальной борьбы с терроризмом | N89: 2003 | O89: публицистика, нехудожественная | P89: комментарий | Q89: политика и общественная жизнь | R89: «Время МН» | S89: 2003.08.05 | T89: газета | U89: омонимия снята | V89: Особенности национальной борьбы с терроризмом Президент России убежден, что совершению терактов способствует расхлябанность правоохранительных органов. [Константин Катанян. Особенности национальной борьбы с терроризмом (2003) // «Время МН», 2003.08.05] [омонимия снята] | W89: =RAND() -> 0.65369831281956392 | X89: =IF(RC[-13]=R[-1]C[-13]," ",1) -> 1
A90: огоратс ежиН | B90: адорог | C90: Ниже старого | D90: города | E90: , | F90: ближе к морю, новый район | G90: город | I90: gen1 | J90: Вадим Крейд. Георгий Иванов в Йере // «Звезда», 2003 | K90: Вадим Крейд | M90: Георгий Иванов в Йере | N90: 2003 | O90: учебно-научная, нехудожественная | P90: биография | Q90: искусство и культура | R90: «Звезда» | S90: 2003 | T90: журнал | U90: омонимия снята | V90: Ниже старого города, ближе к морю, новый район ― бульвары, светлых тонов виллы. [Вадим Крейд. Георгий Иванов в Йере // «Звезда», 2003] [омонимия снята] | W90: =RAND() -> 0.70137979556943375 | X90: =IF(RC[-13]=R[-1]C[-13]," ",1) -> 1
A91: еынсевонвар еынжомзов евд ынертомссаР | B91: иицаругифнок | C91: Рассмотрены две возможные равновесные | D91: конфигурации | F91: линейного вихря в трехмерной упорядоченной | G91: конфигурация | I91: gen1 | J91: М. А. Зеликман. Линейные вихри в трехмерной упорядоченной джозефсоновской среде // «Журнал технической физики», 2005 | K91: М. А. Зеликман | M91: Линейные вихри в трехмерной упорядоченной джозефсоновской среде | N91: 2005 | O91: учебно-научная, нехудожественная | P91: аннотация | Q91: наука и технологии, физика | R91: «Журнал технической физики» | S91: 2005 | T91: журнал | U91: омонимия снята | V91: Рассмотрены две возможные равновесные конфигурации линейного вихря в трехмерной упорядоченной джозефсоновской среде: а) центр вихря расположен в центре одной из ячеек, б) центр вихря расположен на одном из контактов. [М. А. Зеликман. Линейные вихри в трехмерной упорядоченной джозефсоновской среде // «Журнал технической физики», 2005] [омонимия снята] | W91: =RAND() -> 0.82917110410607209 | X91: =IF(RC[-13]=R[-1]C[-13]," ",1) -> 1
A92: с литсупс ыджандо матшьледнаМ чивеьлимЭ | B92: ыцинтсел | C92: Эмильевич Мандельштам однажды спустил с | D92: лестницы | F92: коллегу, пришедшего пожаловаться, что его | G92: лестница | I92: gen1 | J92: Антон Носик. Самиздат, Интернет и профессиональный читатель // «Отечественные записки», 2003 | K92: Антон Носик | L92: 1966 | M92: Самиздат, Интернет и профессиональный читатель | N92: 2003 | O92: публицистика, нехудожественная | P92: статья | Q92: искусство и культура | R92: «Отечественные записки» | S92: 2003 | T92: журнал | U92: омонимия снята | V92: Рассказывают, будто Осип Эмильевич Мандельштам однажды спустил с лестницы коллегу, пришедшего пожаловаться, что его стихи не печатают. [Антон Носик. Самиздат, Интернет и профессиональный читатель // «Отечественные записки», 2003] [омонимия снята] | W92: =RAND() -> 0.67247312298800743 | X92: =IF(RC[-13]=R[-1]C[-13]," ",1) -> 1
A93: еинелсичыВ | B93: вортемарап | C93: Вычисление | D93: параметров | F93: асимметрии углового распределения и спиновой | G93: параметр | I93: gen1 | J93: А. Ю. Елизаров, И. И. Тупицын. Вычисление параметров асимметрии углового распределения и спиновой поляризации оже-электронов для атомов с открытыми оболочками // «Журнал технической физики», 2004 | K93: А. Ю. Елизаров, И. И. Тупицын | M93: Вычисление параметров асимметрии углового распределения и спиновой поляризации оже-электронов для атомов с открытыми оболочками | N93: 2004 | O93: учебно-научная, нехудожественная | P93: аннотация | Q93: наука и технологии, физика | R93: «Журнал технической физики» | S93: 2004 | T93: журнал | U93: омонимия снята | V93: Вычисление параметров асимметрии углового распределения и спиновой поляризации оже-электронов для атомов с открытыми оболочками [А. Ю. Елизаров, И. И. Тупицын. Вычисление параметров асимметрии углового распределения и спиновой поляризации оже-электронов для атомов с открытыми оболочками // «Журнал технической физики», 2004] [омонимия снята] | W93: =RAND() -> 0.16831311812855743 | X93: =IF(RC[-13]=R[-1]C[-13]," ",1) -> 1
A94: огоннелсичогонм у ясьтавосеретниоп алишеР | B94: яинелесан | C94: [Архангел Михаил, nick] Решила поинтересоваться у многочисленного | D94: населения | F94: форума, что легче, школа или | G94: население | I94: gen1 | J94: коллективный. Форум: Школа или универ где легче?)) (2006) | K94: коллективный | M94: Форум: Школа или универ где легче?)) | N94: 2006 | O94: электронная коммуникация , нехудожественная | P94: форум | Q94: образование, частная жизнь | S94: 2006 | T94: электронный текст | U94: омонимия снята | V94: [Архангел Михаил, nick] Решила поинтересоваться у многочисленного населения форума, что легче, школа или универ? [коллективный. Форум: Школа или универ где легче?)) (2006)] [омонимия снята] | W94: =RAND() -> 0.89140749083597692 | X94: =IF(RC[-13]=R[-1]C[-13]," ",1) -> 1
A95: ииняилв О | B95: яинеживд | C95: О влиянии | D95: движения | F95: газа внутри заряжённого пузырька в | G95: движение | I95: gen1 | J95: А. Н. Жаров, А. И. Григорьев. О влиянии движения газа внутри заряженного пузырька в жидкости на параметры его осцилляций // «Журнал технической физики», 2004 | K95: А. Н. Жаров, А. И. Григорьев | M95: О влиянии движения газа внутри заряженного пузырька в жидкости на параметры его осцилляций | N95: 2004 | O95: учебно-научная, нехудожественная | P95: аннотация | Q95: наука и технологии, физика | R95: «Журнал технической физики» | S95: 2004 | T95: журнал | U95: омонимия снята | V95: О влиянии движения газа внутри заряжённого пузырька в жидкости на параметры его осцилляций [А. Н. Жаров, А. И. Григорьев. О влиянии движения газа внутри заряженного пузырька в жидкости на параметры его осцилляций // «Журнал технической физики», 2004] [омонимия снята] | W95: =RAND() -> 0.43976727013527861 | X95: =IF(RC[-13]=R[-1]C[-13]," ",1) -> 1
A96: оговолис амрофер яандеречО | B96: аколб | C96: Очередная реформа силового | D96: блока | F96: грозит обернуться ведомственной монополией на | G96: блок | I96: gen1 | J96: Александр Гольц. Кремлевский звездопад (2003) // «Еженедельный журнал», 2003.03.17 | K96: Александр Гольц | L96: 1955 | M96: Кремлевский звездопад | N96: 2003 | O96: публицистика, нехудожественная | P96: статья | Q96: политика и общественная жизнь | R96: «Еженедельный журнал» | S96: 2003.03.17 | T96: журнал | U96: омонимия снята | V96: Очередная реформа силового блока грозит обернуться ведомственной монополией на информацию. [Александр Гольц. Кремлевский звездопад (2003) // «Еженедельный журнал», 2003.03.17] [омонимия снята] | W96: =RAND() -> 0.50923623674122942 | X96: =IF(RC[-13]=R[-1]C[-13]," ",1) -> 1
A97: еелоб яащюачурду анелвяыв анитрак зар | B97: ыниволоп | C97: раз картина выявлена удручающая: более | D97: половины | F97: объектов отрасли к зиме не | G97: половина | I97: gen1 | J97: Леонид Барков. Вице-премьера позвали в трущобы (2003) // «Время МН», 2003.08.06 | K97: Леонид Барков | M97: Вице-премьера позвали в трущобы | N97: 2003 | O97: публицистика, нехудожественная | P97: отчет | Q97: политика и общественная жизнь | R97: «Время МН» | S97: 2003.08.06 | T97: газета | U97: омонимия снята | V97: В очередной раз картина выявлена удручающая: более половины объектов отрасли к зиме не готовы. [Леонид Барков. Вице-премьера позвали в трущобы (2003) // «Время МН», 2003.08.06] [омонимия снята] | W97: =RAND() -> 0.21020216247576984 | X97: =IF(RC[-13]=R[-1]C[-13]," ",1) -> 1
A98: огонм аз ытыркто илыб ырим | B98: тел | C98: миры были открыты за много | D98: лет | F98: до того, как это случилось | G98: год | I98: gen1 | J98: Эдуард Вирапян. Дарующая возвращение // «Знание -- сила», 2003 | K98: Эдуард Вирапян | M98: Дарующая возвращение | N98: 2003 | O98: публицистика, нехудожественная | P98: заметка | Q98: наука и технологии, история | R98: «Знание -- сила» | S98: 2003 | T98: журнал | U98: омонимия снята | V98: Пути в позжедоступные миры были открыты за много лет до того, как это случилось, и будут открываться ещё много раз и после того, когда все открытия завершатся. [Эдуард Вирапян. Дарующая возвращение // «Знание -- сила», 2003] [омонимия снята] | W98: =RAND() -> 0.61704603598697738 | X98: =IF(RC[-13]=R[-1]C[-13]," ",1) -> 1
A99: итсоннебосО | B99: яитивзар | C99: Особенности | D99: развития | F99: старших дошкольников при перинатальной патологии | G99: развитие | I99: gen1 | J99: Л. А. Захирина, Н. Ф. Бережная. Особенности развития старших дошкольников при перинатальной патологии ЦНС // «Вопросы психологии», 2004 | K99: Л. А. Захирина, Н. Ф. Бережная | M99: Особенности развития старших дошкольников при перинатальной патологии ЦНС | N99: 2004 | O99: учебно-научная, нехудожественная | P99: статья | Q99: наука и технологии, психология | R99: «Вопросы психологии» | S99: 2004 | T99: журнал | U99: омонимия снята | V99: Особенности развития старших дошкольников при перинатальной патологии ЦНС [Л. А. Захирина, Н. Ф. Бережная. Особенности развития старших дошкольников при перинатальной патологии ЦНС // «Вопросы психологии», 2004] [омонимия снята] | W99: =RAND() -> 0.3048972652600852 | X99: =IF(RC[-13]=R[-1]C[-13]," ",1) -> 1
A100: хяинадесаз о окьлокс еж окьлотс | B100: автсьлетиварп | C100: столько же, сколько о… заседаниях | D100: правительства | E100: . | G100: правительство | I100: gen1 | J100: Михаил Ламцов, Валерий Булдаков. Авторитетные собрания (2003) // «Аргументы и факты», 2003.01.29 | K100: Михаил Ламцов, Валерий Булдаков | M100: Авторитетные собрания | N100: 2003 | O100: публицистика, нехудожественная | P100: статья | Q100: политика и общественная жизнь | R100: «Аргументы и факты» | S100: 2003.01.29 | T100: газета | U100: омонимия снята | V100: О ВОРОВСКИХ сходках российский гражданин знает столько же, сколько о… заседаниях правительства. [Михаил Ламцов, Валерий Булдаков. Авторитетные собрания (2003) // «Аргументы и факты», 2003.01.29] [омонимия снята] | W100: =RAND() -> 9.7455052493009231E-2 | X100: =IF(RC[-13]=R[-1]C[-13]," ",1) -> 1
A101: РТСИНИМ | B101: ЯИНЕНАРХООВАРДЗ | C101: МИНИСТР | D101: ЗДРАВООХРАНЕНИЯ | F101: ЭЛЬВИРА НЕЧАЕВА, ОКАЗЫВАЕТСЯ, ПОГОРЯЧИЛАСЬ, ЗАКРЫВ | G101: здравоохранение | I101: gen1 | J101: Ольга Муравская. Пойманное слово. (2003) // «Московский комсомолец» в Сыктывкаре, 2003.08.06 | K101: Ольга Муравская | M101: Пойманное слово. | N101: 2003 | O101: публицистика, нехудожественная | P101: статья | Q101: политика и общественная жизнь | R101: «Московский комсомолец» в Сыктывкаре | S101: 2003.08.06 | T101: газета | U101: омонимия снята | V101: МИНИСТР ЗДРАВООХРАНЕНИЯ ЭЛЬВИРА НЕЧАЕВА, ОКАЗЫВАЕТСЯ, ПОГОРЯЧИЛАСЬ, ЗАКРЫВ СЫКТЫВКАРЦАМ ДВЕРЬ В СТАЦИОНАРЫ. [Ольга Муравская. Пойманное слово. (2003) // «Московский комсомолец» в Сыктывкаре, 2003.08.06] [омонимия снята] | W101: =RAND() -> 0.76579339543038472 | X101: =IF(RC[-13]=R[-1]C[-13]," ",1) -> 1
A102: йонвалсоварп йокссуР аливарП | B102: ивкрец | C102: Правила Русской православной | D102: церкви | E102: , | F102: закреплённые в принятых в 2000 | G102: церковь | I102: gen1 | J102: Александр Верховский. Между паствой и электоратом (2003) // «Еженедельный журнал», 2003.04.08 | K102: Александр Верховский | M102: Между паствой и электоратом | N102: 2003 | O102: публицистика, нехудожественная | P102: статья | Q102: политика и общественная жизнь | R102: «Еженедельный журнал» | S102: 2003.04.08 | T102: журнал | U102: омонимия снята | V102: Правила Русской православной церкви, закреплённые в принятых в 2000 году "Основах социальной концепции", прямо запрещают участие клириков РПЦ в политике, во всяком случае ― в выборах. [Александр Верховский. Между паствой и электоратом (2003) // «Еженедельный журнал», 2003.04.08] [омонимия снята] | W102: =RAND() -> 5.0744542882005805E-2 | X102: =IF(RC[-13]=R[-1]C[-13]," ",1) -> 1
A103: огончитапмис ывызирП | B103: афариж | C103: Призывы симпатичного | D103: жирафа | F103: с рекламных щитов: "Сходи в | G103: жираф | I103: gen1 | J103: О. Г. Баринов. Зоологический сад // «Первое сентября», 2003 | K103: О. Г. Баринов | M103: Зоологический сад | N103: 2003 | O103: публицистика, нехудожественная | P103: статья | Q103: досуг, зрелища и развлечения | R103: «Первое сентября» | S103: 2003 | T103: газета | U103: омонимия снята | V103: Призывы симпатичного жирафа с рекламных щитов: "Сходи в зоопарк" я не то чтобы игнорировал. [О. Г. Баринов. Зоологический сад // «Первое сентября», 2003] [омонимия снята] | W103: =RAND() -> 0.25829297263087569 | X103: =IF(RC[-13]=R[-1]C[-13]," ",1) -> 1
A104: йечярог кинчотси недйаН | B104: ыдов | C104: Найден источник горячей | D104: воды | F104: Ирина ГНАТЮК Что нужно для счастья не избалованному вниманием властей и измученному разрухой ЖКХ среднестатистическому россиянину? | G104: вода | I104: gen1 | J104: Ирина Гнатюк. Найден источник горячей воды (2003) // «Богатей» (Саратов), 2003.05.22 | K104: Ирина Гнатюк | M104: Найден источник горячей воды | N104: 2003 | O104: публицистика, нехудожественная | P104: статья | Q104: политика и общественная жизнь | R104: «Богатей» (Саратов) | S104: 2003.05.22 | T104: газета | U104: омонимия снята | V104: Найден источник горячей воды Ирина ГНАТЮК ? [Ирина Гнатюк. Найден источник горячей воды (2003) // «Богатей» (Саратов), 2003.05.22] [омонимия снята] | W104: =RAND() -> 1.7523906782319632E-2 | X104: =IF(RC[-13]=R[-1]C[-13]," ",1) -> 1
A105: ьлетиремзИ АКПУКОП ЯАНЧАДУ | B105: янвору | C105: УДАЧНАЯ ПОКУПКА Измеритель | D105: уровня | F105: воды. Блеск для листьев. | G105: уровень | I105: gen1 | J105: Татьяна Булгакова. Цветочная «косметичка» (2003) // «Сад своими руками», 2003.01.15 | K105: Татьяна Булгакова | M105: Цветочная «косметичка» | N105: 2003 | O105: публицистика, нехудожественная | P105: статья | Q105: здоровье и медицина | R105: «Сад своими руками» | S105: 2003.01.15 | T105: газета | U105: омонимия снята | V105: УДАЧНАЯ ПОКУПКА Измеритель уровня воды. Блеск для листьев. [Татьяна Булгакова. Цветочная «косметичка» (2003) // «Сад своими руками», 2003.01.15] [омонимия снята] | W105: =RAND() -> 0.55736688753297248 | X105: =IF(RC[-13]=R[-1]C[-13]," ",1) -> 1
A106: од йоктерубат вореноиснеп либ котсордоп | B106: итремс | C106: подросток бил пенсионеров табуреткой до | D106: смерти | G106: смерть | I106: gen1 | J106: Александр Богомолов. Прирожденный убийца. 17-летний подросток бил пенсионеров табуреткой до смерти (2003) // «Известия», 2003.02.17 | K106: Александр Богомолов | M106: Прирожденный убийца. 17-летний подросток бил пенсионеров табуреткой до смерти | N106: 2003 | O106: публицистика, нехудожественная | P106: заметка | Q106: криминал | R106: «Известия» | S106: 2003.02.17 | T106: газета | U106: омонимия снята | V106: 17-летний подросток бил пенсионеров табуреткой до смерти [Александр Богомолов. Прирожденный убийца. 17-летний подросток бил пенсионеров табуреткой до смерти (2003) // «Известия», 2003.02.17] [омонимия снята] | W106: =RAND() -> 0.22278149121351665 | X106: =IF(RC[-13]=#REF!," ",1) -> #REF!
A107: огеншенын ецнок в ежу ястяотсос | B107: адог | C107: состоятся уже в конце нынешнего | D107: года | E107: . " | G107: год | I107: gen1 | J107: Александр Градов. «Медведи» залили партийный фундамент (2003) // «Аргументы и факты», 2003.01.22 | K107: Александр Градов | M107: «Медведи» залили партийный фундамент | N107: 2003 | O107: публицистика, нехудожественная | P107: интервью | Q107: политика и общественная жизнь | R107: «Аргументы и факты» | S107: 2003.01.22 | T107: газета | U107: омонимия снята | V107: ПАРЛАМЕНТСКИЕ выборы состоятся уже в конце нынешнего года. " [Александр Градов. «Медведи» залили партийный фундамент (2003) // «Аргументы и факты», 2003.01.22] [омонимия снята] | W107: =RAND() -> 0.34517966590369675 | X107: =IF(RC[-13]=R[-1]C[-13]," ",1) -> 1
A108: зИ вокалуК валсидалВ | B108: ацнок | C108: Владислав Кулаков. Из | D108: конца | F108: в конец 06. 07. 2004 | G108: конец | I108: gen1 | J108: Владислав Кулаков. Из конца в конец // «Computerworld», 2004 | K108: Владислав Кулаков | M108: Из конца в конец | N108: 2004 | O108: публицистика, нехудожественная | P108: статья | Q108: бизнес, коммерция, экономика, финансы | R108: «Computerworld» | S108: 2004 | T108: журнал | U108: омонимия снята | V108: Владислав Кулаков. Из конца в конец 06. 07. 2004 [Владислав Кулаков. Из конца в конец // «Computerworld», 2004] [омонимия снята] | W108: =RAND() -> 0.56236334737794436 | X108: =IF(RC[-13]=R[-1]C[-13]," ",1) -> 1
A109: акробс яаньлетяотсомаС | B109: вореврес | C109: Самостоятельная сборка | D109: серверов | F109: на основе Itanium 2 подходит | G109: сервер | I109: gen1 | J109: Михаил Кузьминский. Водопады Supermicro // «Computerworld», 2004 | K109: Михаил Кузьминский | M109: Водопады Supermicro | N109: 2004 | O109: публицистика, нехудожественная | P109: статья | Q109: производство | R109: «Computerworld» | S109: 2004 | T109: журнал | U109: омонимия снята | V109: Самостоятельная сборка серверов на основе Itanium 2 подходит не всем, но, по крайней мере, она становится возможной [Михаил Кузьминский. Водопады Supermicro // «Computerworld», 2004] [омонимия снята] | W109: =RAND() -> 0.39122129559326224 | X109: =IF(RC[-13]=R[-1]C[-13]," ",1) -> 1
A110: еинаминв ебес к илакелвирп адгесв | B110: йедюл | C110: всегда привлекали к себе внимание | D110: людей | F110: и как красивоцветущие растения, и | G110: люди | I110: gen1 | J110: С. А. Курганская. Акониты // «Первое сентября», 2003 | K110: С. А. Курганская | M110: Акониты | N110: 2003 | O110: учебно-научная, нехудожественная | P110: статья | Q110: наука и технологии, биология | R110: «Первое сентября» | S110: 2003 | T110: газета | U110: омонимия снята | V110: Акониты всегда привлекали к себе внимание людей и как красивоцветущие растения, и как лекарственные, содержащие сильнодействующие, а нередко и очень ядовитые вещества. [С. А. Курганская. Акониты // «Первое сентября», 2003] [омонимия снята] | W110: =RAND() -> 0.9086731929312678 | X110: =IF(RC[-13]=R[-1]C[-13]," ",1) -> 1
A111: елсоп юувреп илеворп воназяР радьлЭ | B111: яинечурв | C111: Эльдар Рязанов провели первую после | D111: вручения | E111: " | F111: Золотого орла" пресс-конференцию конкурирующей структуры | G111: вручение | I111: gen1 | J111: Мария Кувшинова. «Ника» отступает, но не сдается. Старейшая киноакадемия объявила о своих планах (2003) // «Известия», 2003.02.25 | K111: Мария Кувшинова | M111: «Ника» отступает, но не сдается. Старейшая киноакадемия объявила о своих планах | N111: 2003 | O111: публицистика, нехудожественная | P111: заметка | Q111: искусство и культура | R111: «Известия» | S111: 2003.02.25 | T111: газета | U111: омонимия снята | V111: Юлий Гусман и Эльдар Рязанов провели первую после вручения "Золотого орла" пресс-конференцию конкурирующей структуры ― первой российской кинопремии "Ника". [Мария Кувшинова. «Ника» отступает, но не сдается. Старейшая киноакадемия объявила о своих планах (2003) // «Известия», 2003.02.25] [омонимия снята] | W111: =RAND() -> 0.52234697350376891 | X111: =IF(RC[-13]=#REF!," ",1) -> #REF!
A112: алокШ | B112: яинавижыв | C112: Школа | D112: выживания | F112: Ирина Мельникова, Андрей Замахин (фото | G112: выживание | I112: gen1 | J112: Ирина Мельникова. Школа выживания (2003) // «Итоги», 2003.02.11 | K112: Ирина Мельникова | M112: Школа выживания | N112: 2003 | O112: публицистика, нехудожественная | P112: статья | Q112: политика и общественная жизнь | R112: «Итоги» | S112: 2003.02.11 | T112: журнал | U112: омонимия снята | V112: Школа выживания Ирина Мельникова, Андрей Замахин (фото) [Ирина Мельникова. Школа выживания (2003) // «Итоги», 2003.02.11] [омонимия снята] | W112: =RAND() -> 0.78912843437799374 | X112: =IF(RC[-13]=R[-1]C[-13]," ",1) -> 1
A113: хыннёлиму ароП | B113: йинеджуссар | C113: Пора умилённых | D113: рассуждений | F113: об информационных технологиях в образовании | G113: рассуждение | I113: gen1 | J113: Михаил Арапов. Когда текст обретает смысл // «Знание -- сила», 2003 | K113: Михаил Арапов | L113: 1939 | M113: Когда текст обретает смысл | N113: 2003 | O113: учебно-научная, нехудожественная | P113: статья | Q113: наука и технологии, образование | R113: «Знание -- сила» | S113: 2003 | T113: журнал | U113: омонимия снята | V113: Пора умилённых рассуждений об информационных технологиях в образовании прошла безвозвратно. [Михаил Арапов. Когда текст обретает смысл // «Знание -- сила», 2003] [омонимия снята] | W113: =RAND() -> 0.73742437107352354 | X113: =IF(RC[-13]=R[-1]C[-13]," ",1) -> 1
A114: зеб яьмеС | B114: акнёбер | C114: Семья без | D114: ребёнка | F114: счастливой быть не может! | G114: ребенок | I114: gen1 | J114: Мария Давыдова. Кто в доме хозяин? (2003) // «100% здоровья», 2003.01.15 | K114: Мария Давыдова | M114: Кто в доме хозяин? | N114: 2003 | O114: публицистика, нехудожественная | P114: статья | Q114: частная жизнь | R114: «100% здоровья» | S114: 2003.01.15 | T114: журнал | U114: омонимия снята | V114: Семья без ребёнка счастливой быть не может! [Мария Давыдова. Кто в доме хозяин? (2003) // «100% здоровья», 2003.01.15] [омонимия снята] | W114: =RAND() -> 0.17662179195875471 | X114: =IF(RC[-13]=R[-1]C[-13]," ",1) -> 1
A115: огеншаречв ос отЭ огок ан | B115: янд | C115: на кого Это со вчерашнего | D115: дня | F115: статус [Герда, nick] Ааа! | G115: день | I115: gen1 | J115: Переписка в icq между agd-ardin и Герда (2008.03.17) | M115: Переписка в icq между agd-ardin и Герда | N115: 2008.03.17 | O115: электронная коммуникация , нехудожественная | P115: интернет-пейджер | Q115: частная жизнь | T115: электронный текст | U115: омонимия снята | V115: [agd-ardin, nick] Сегодня ни на кого Это со вчерашнего дня статус [Герда, nick] Ааа! [Переписка в icq между agd-ardin и Герда (2008.03.17)] [омонимия снята] | W115: =RAND() -> 0.77759042856042715 | X115: =IF(RC[-13]=R[-1]C[-13]," ",1) -> 1

Sheet: 1+2
A1: Reversed left context | B1: Reversed center | C1: Left context | D1: Center | E1: Punct | F1: Right context | G1: Лексема | H1: значение | I1: gen2 | J1: Title | K1: Author | L1: Birthday | M1: Header | N1: Created | O1: Sphere | P1: Type | Q1: Topic | R1: Publication | S1: Publ_year | T1: Medium | U1: Ambiguity | V1: Full context | W1: =RAND() -> 0.34646080596270168 | X1: 1
B2: укрифиЧ | C2: ― | D2: Чифирку | F2: бы подварить, ― сказал Севочка, укладывая | G2: чифирка | H2: еда (напиток) | I2: gen2 | J2: В. Т. Шаламов. Колымские рассказы (1954-1961) | K2: В. Т. Шаламов | L2: 1907 | M2: Колымские рассказы | N2: 1954-1961 | O2: художественная | P2: рассказ, цикл | R2: Шаламов В.Т. Собр. соч. | S2: 1998 | T2: книга | U2: омонимия снята | V2: ― Чифирку бы подварить, ― сказал Севочка, укладывая выигранные вещи в большой фанерный чемодан. ― Я подожду. [В. Т. Шаламов. Колымские рассказы (1954-1961)] [омонимия снята] | W2: =RAND() -> 0.23515863025342376 | X2: 1
A3: ин изявс ин яадюлбос ен | B3: укдяроп | C3: не соблюдая ни связи, ни | D3: порядку | E3: , | F3: и ты прочтёшь оные с | G3: порядок | I3: gen2 | J3: К. Н. Батюшков. Прогулка по Москве (1811-1812) | K3: К. Н. Батюшков | L3: 1787 | M3: Прогулка по Москве | N3: 1811-1812 | O3: художественная | P3: очерк | R3: К.Н. Батюшков Сочинения | S3: 1934 | T3: книга | U3: омонимия снята | V3: Итак, мимоходом, странствуя из дома в дом, с гулянья на гулянье, с ужина на ужин, я напишу несколько замечаний о городе и о нравах жителей, не соблюдая ни связи, ни порядку, и ты прочтёшь оные с удовольствием: они напомнят тебе о добром приятеле, [К. Н. Батюшков. Прогулка по Москве (1811-1812)] [омонимия снята] | W3: =RAND() -> 0.49241113059434682 | X3: 1
A4: зи ьтитсупу теуксир но еачулс | B4: удив | C4: случае он рискует упустить из | D4: виду | F4: те разнообразные смыслы, в которых | G4: вид | I4: gen2 | J4: В. Г. Лысенко. Классическая индийская философия в переводах и исследованиях российских ученых (1990-1996) (1996) | K4: В. Г. Лысенко | M4: Классическая индийская философия в переводах и исследованиях российских ученых (1990-1996) | N4: 1996 | O4: учебно-научная, нехудожественная | P4: статья | Q4: философия, религия | S4: 1996 | T4: книга | U4: омонимия снята | V4: Но в этом случае он рискует упустить из виду те разнообразные смыслы, в которых этот термин может употребляться в исходном тексте. [В. Г. Лысенко. Классическая индийская философия в переводах и исследованиях российских ученых (1990-1996) (1996)] [омонимия снята] | W4: =RAND() -> 0.72801823642288677 | X4: 1
A5: зи ядохыв ывксоМ ханиарко ан | B5: умод | C5: на окраинах Москвы, выходя из | D5: дому | E5: ― | F5: в школу или в булочную | G5: дом | I5: gen2 | J5: Анвар Тавобов. Террор несовершеннолетних (2002) // «Вечерняя Москва», 2002.02.07 | K5: Анвар Тавобов | M5: Террор несовершеннолетних | N5: 2002 | O5: публицистика, нехудожественная | P5: заметка | Q5: криминал | R5: «Вечерняя Москва» | S5: 2002.02.07 | T5: газета | U5: омонимия снята | V5: Но каждый подросток, в особенности на окраинах Москвы, выходя из дому ― в школу или в булочную за хлебом, ― внутренне готовит себя к тому, что он может стать её участником. [Анвар Тавобов. Террор несовершеннолетних (2002) // «Вечерняя Москва», 2002.02.07] [омонимия снята] | W5: =RAND() -> 0.62962220985481909 | X5: 1
A6: огонисырк но ыб ешчуЛ ииротси | B6: удя | C6: истории. Лучше бы он крысиного | D6: яду | F6: наелся. Такая же тупая как | G6: яд | H6: еда (напиток) | I6: gen2 | J6: Андрей Геласимов. Нежный возраст (2001) | K6: Андрей Геласимов | L6: 1966 | M6: Нежный возраст | N6: 2001 | O6: художественная | P6: рассказ | R6: Геласимов А. Фокс Малдер похож на свинью: Повесть, рассказы | S6: 2001 | T6: книга | U6: омонимия снята | V6: Антон Стрельников сказал, что влюбился в новую училку по истории. Лучше бы он крысиного яду наелся. Такая же тупая как все. [Андрей Геласимов. Нежный возраст (2001)] [омонимия снята] | W6: =RAND() -> 0.211130970614822 | X6: 1
A7: олеман ёен ан умиз аЗ | B7: угенс | C7: За зиму на неё намело | D7: снегу | E7: . | F7: Корень-выворотень весь зарос им | G7: снег | I7: gen2 | J7: Юрий Коваль. У Кривой сосны (1979) | K7: Юрий Коваль | L7: 1938 | M7: У Кривой сосны | N7: 1979 | O7: художественная | P7: рассказ | R7: Юрий Коваль. Солнечное пятно | S7: 2002 | T7: книга | U7: омонимия снята | V7: Частым осинником вышел я на поляну, где лежала Кривая сосна. За зиму на неё намело снегу. Корень-выворотень весь зарос им и стоял торчком среди осинника, как белый горбатый бык. [Юрий Коваль. У Кривой сосны (1979)] [омонимия снята] | W7: =RAND() -> 0.32001597122561731 | X7: 1
A8: ин яинеджор огеовс атсем ин | B8: удор | C8: ни места своего рождения, ни | D8: роду | E8: , | F8: ни племени, по показанию жителя | G8: род | I8: gen2 | J8: А. Ф. Вельтман. Иоланда (1843) | K8: А. Ф. Вельтман | L8: 1800 | M8: Иоланда | N8: 1843 | O8: художественная | P8: рассказ | R8: Русская фантастическая проза эпохи романтизма | S8: 1991 | T8: книга | U8: омонимия снята | V8: Иоланда, не объявляющая ни места своего рождения, ни роду, ни племени, по показанию жителя Толозы Иегана Реми, ремеслом мельника, проживает у него реченного в доме более года в тишине и неизвестности, платя исправно за постой; посещал её реченную Иоланду по вечерам неизвестный молодой мужчина и неизвестные люди, приносившие ей съестные припасы, а с недавнего времени посещал её другой неизвестный человек подозрительной наружности. [А. Ф. Вельтман. Иоланда (1843)] [омонимия снята] | W8: =RAND() -> 0.72469955989673007 | X8: 1
A9: хин то идж и тов | B9: уклот | C9: вот и жди от них | D9: толку | E9: ! ― | F9: злобно заметил Гриша. | G9: толк | I9: gen2 | J9: М. Е. Салтыков-Щедрин. Святочный рассказ (1858) | K9: М. Е. Салтыков-Щедрин | L9: 1826 | M9: Святочный рассказ | N9: 1858 | O9: художественная | P9: рассказ | R9: М.Е. Салтыков-Щедрин. История одного города и др. | S9: 1989 | T9: книга | U9: омонимия снята | V9: ― Ишь ты! глухие да глупые― вот и жди от них толку! ― злобно заметил Гриша. [М. Е. Салтыков-Щедрин. Святочный рассказ (1858)] [омонимия снята] | W9: =RAND() -> 0.10356155154589219 | X9: 1
A10: с алибс яароток яинога яаньлетимоту | B10: уклот | C10: утомительная агония, которая сбила с | D10: толку | F10: стольких учёных мужей. | G10: толк | I10: gen2 | J10: А. Н. Апухтин. Между жизнью и смертью (1892) | K10: А. Н. Апухтин | L10: 1840 | M10: Между жизнью и смертью | N10: 1892 | O10: художественная | P10: рассказ | R10: Русская фантастическая проза XIX - начала XX века | S10: 1991 | T10: книга | U10: омонимия снята | V10: И вот началась та утомительная агония, которая сбила с толку стольких учёных мужей. [А. Н. Апухтин. Между жизнью и смертью (1892)] [омонимия снята] | W10: =RAND() -> 0.71457448504245769 | X10: 1
A11: с евзар теагорт ен мас | B11: угупси | C11: сам не трогает, разве с | D11: испугу | E11: . | G11: испуг | H11: еда (напиток) | I11: gen2 | J11: Фазиль Искандер. Дедушка (1966) | K11: Фазиль Искандер | L11: 1929 | M11: Дедушка | N11: 1966 | O11: художественная | P11: рассказ | R11: Стоянка человека. Повести и рассказы. | S11: 1995 | T11: книга | U11: омонимия снята | V11: ― Нет, ― отвечает дедушка и ломает ветки черники, ― он сам не трогает, разве с испугу. [Фазиль Искандер. Дедушка (1966)] [омонимия снята] | W11: =RAND() -> 1.1794246823106036E-2 | X11: 1
A12: вираваз ьревд верепаз И | B12: юач | C12: И, заперев дверь, заварив | D12: чаю | E12: , | F12: поставил на вертушку купленное выщербленное | G12: чай | I12: gen2 | J12: Татьяна Толстая. Река Оккервиль (1983) | K12: Татьяна Толстая | L12: 1951 | M12: Река Оккервиль | N12: 1983 | O12: художественная | P12: рассказ | T12: книга | U12: омонимия снята | V12: И, заперев дверь, заварив чаю, поставил на вертушку купленное выщербленное сокровище, и, глядя в окно на стягивающиеся на закатной стороне тяжёлые цветные тучи, выстроил, как обычно, кусок гранитной набережной, перекинул мост, ― и башенки нынче отяжелели, и цепи были неподъемно чугунны, и ветер рябил и морщил, волновал широкую, серую гладь реки Оккервиль, и Вера Васильевна, спотыкаясь больше положенного на своих неудобных, придуманных Симеоновым, каблуках,заламывала руки и склоняла маленькую гладко причёсанную головку к покатому плечику, ― тихо, так тихо светит луна, а дума тобой роковая полна, ― луна не поддавалась, мылом выскальзывала из рук, неслась сквозь рваные оккервильские тучи, ― на этом Оккервиле всегда что-то тревожное с небом, ― как беспокойно мечутся прозрачные, приручённые тени нашего воображения, когда сопение и запахи живой жизни проникают в их прохладный, туманный мир! [Татьяна Толстая. Река Оккервиль (1983)] [омонимия снята] | W12: =RAND() -> 0.86447856797358069 | X12: 1
A13: икчёщ в модохыв дереп ыт | B13: укичнолокедо | C13: ты перед выходом в щёчки | D13: одеколончику | E13: - | F13: то вотри, они на улице | G13: одеколончик | I13: gen2 | J13: Эдуард Лимонов. У нас была Великая Эпоха (1987) | K13: Эдуард Лимонов | L13: 1943 | M13: У нас была Великая Эпоха | N13: 1987 | O13: художественная | P13: роман | R13: Собр. соч.: В 3 т. | S13: 1998 | T13: книга | U13: омонимия снята | V13: "На танцы идёшь в клуб или куда в другое общественное место, так ты перед выходом в щёчки одеколончику-то вотри, они на улице и заиграют под ветром или, лучше того, на морозе… [Эдуард Лимонов. У нас была Великая Эпоха (1987)] [омонимия снята] | W13: =RAND() -> 0.95776185479413278 | X13: 1
A14: то бигоп ценокан едг еьлемездоп | B14: удя | C14: подземелье, где наконец погиб от | D14: яду | E14: . | G14: яд | H14: еда (напиток) | I14: gen2 | J14: В. А. Жуковский. Очерки Швеции (1838) | K14: В. А. Жуковский | L14: 1783 | M14: Очерки Швеции | N14: 1838 | O14: бытовая, нехудожественная | P14: письмо | Q14: путешествия | R14: В. Жуковский. Проза поэта | S14: 2001 | T14: книга | U14: омонимия снята | V14: Но эта тюрьма есть великолепное жилище в сравнении с тою ужасною темницею, в которой после был заперт Иоанном Эрик, лишённый им престола, потерявший от горя рассудок и потом брошенный в ужасное подземелье, где наконец погиб от яду. [В. А. Жуковский. Очерки Швеции (1838)] [омонимия снята] | W14: =RAND() -> 0.18922186426729393 | X14: 1
A15: ано ястиоб ен ыдзе ьдашоЛ | B15: умрок | C15: Лошадь езды не боится, она | D15: корму | F15: боится, ― ответил малый наставительно. | G15: корм | H15: еда (напиток) | I15: gen2 | J15: И. А. Бунин. Грамматика любви (1915) | K15: И. А. Бунин | L15: 1870 | M15: Грамматика любви | N15: 1915 | O15: художественная | P15: рассказ | R15: И. А. Бунин. Собрание сочинений в 6-ти т | S15: 1988 | T15: книга | U15: омонимия снята | V15: ― Лошадь езды не боится, она корму боится, ― ответил малый наставительно. [И. А. Бунин. Грамматика любви (1915)] [омонимия снята] | W15: =RAND() -> 0.27256561460224582 | X15: 1
A16: ин еще Я | B16: узар | C16: [agd-ardin, nick] Я еще ни | D16: разу | F16: не тыкнул в москву ближе | G16: раз | I16: gen2 | J16: Переписка в icq между agd-ardin и Колючий друг (2007.12.21) | M16: Переписка в icq между agd-ardin и Колючий друг | N16: 2007.12.21 | O16: электронная коммуникация , нехудожественная | P16: интернет-пейджер | Q16: образование | T16: электронный текст | U16: омонимия снята | V16: [agd-ardin, nick] Я еще ни разу не тыкнул в москву ближе чем на 440 км! [Переписка в icq между agd-ardin и Колючий друг (2007.12.21)] [омонимия снята] | W16: =RAND() -> 0.86069855932779693 | X16: 1
A17: в заР | B17: удог | C17: Раз в | D17: году | F17: могла она приехать и глянуть | G17: год | I17: gen2 | J17: Дина Рубина. Медная шкатулка (сборник) (2015) | K17: Дина Рубина | L17: 1953 | M17: Медная шкатулка (сборник) | N17: 2015 | O17: художественная | P17: рассказ, цикл | R17: Д. И. Рубина. Медная шкатулка (сборник) | S17: 2015 | T17: книга | U17: омонимия не снята | V17: Раз в году могла она приехать и глянуть на сыночка издали, из-за угла дома или в витрину кондитерской, куда его нянька водила пирожными угощать. [Дина Рубина. Медная шкатулка (сборник) (2015)] [омонимия не снята] | W17: =RAND() -> 0.76628000071540114 | X17: 1
A18: йедашол и йенивс то он | B18: юобто | C18: но от свиней и лошадей | D18: отбою | F18: нет. | G18: отбой | I18: gen2 | J18: А. А. Фет. Осенние хлопоты (1862) | K18: А. А. Фет | L18: 1820 | M18: Осенние хлопоты | N18: 1862 | O18: художественная | P18: рассказ | R18: А. Фет. Проза поэта | S18: 2001 | T18: книга | U18: омонимия снята | V18: Озими взошли прекрасные, но от свиней и лошадей отбою нет. [А. А. Фет. Осенние хлопоты (1862)] [омонимия снята] | W18: =RAND() -> 0.35708531762858953 | X18: 1
A19: артнец огоннойар ынебуК-ьтсУ зи ьсилункилктО | B19: утёл | C19: Откликнулись из Усть-Кубены, районного центра, | D19: лёту | F19: до которого пятнадцать или двадцать | G19: лёт | I19: gen2 | J19: Виктор Астафьев. Затеси (1999) // «Новый Мир», 2000 | K19: Виктор Астафьев | L19: 1924 | M19: Затеси | N19: 1999 | O19: публицистика, нехудожественная | P19: мемуары | R19: «Новый Мир» | S19: 2000 | T19: журнал | U19: омонимия снята | V19: Откликнулись из Усть-Кубены, районного центра, лёту до которого пятнадцать или двадцать минут. [Виктор Астафьев. Затеси (1999) // «Новый Мир», 2000] [омонимия снята] | W19: =RAND() -> 0.88466634559953683 | X19: 1
A20: зи илярет ен адгокин ым | B20: удив | C20: мы никогда не теряли из | D20: виду | E20: , | F20: ставили бы его выше и | G20: вид | I20: gen2 | J20: В. С. Соловьев. Три речи в память Достоевского (1881-1883) | K20: В. С. Соловьев | L20: 1853 | M20: Три речи в память Достоевского | N20: 1881-1883 | O20: публицистика, нехудожественная | P20: статья, цикл | Q20: философия | T20: книга | U20: омонимия снята | V20: От нас только требуется, чтобы мы своей маленькой части не ставили на место великого целого, чтобы мы не обособлялись в своём частном деле, а старались бы связать его с делом всечеловеческим, чтобы это великое дело мы никогда не теряли из виду, ставили бы его выше и прежде всего, а все остальное уж― потом. [В. С. Соловьев. Три речи в память Достоевского (1881-1883)] [омонимия снята] | W20: =RAND() -> 0.37749119933155806 | X20: 1
A21: зи ьтагеб или восортам ызакссар | B21: умод | C21: рассказы матросов или бегать из | D21: дому | F21: в ораниенбаумские сады и прятаться | G21: дом | I21: gen2 | J21: К. Г. Паустовский. Орест Кипренский (1936) | K21: К. Г. Паустовский | L21: 1892 | M21: Орест Кипренский | N21: 1936 | O21: художественная | P21: рассказ | R21: К. Паустовский. Собр. соч. в 8-ми т. Т. 6. | S21: 1969 | T21: книга | U21: омонимия снята | V21: Он мог часами слушать рассказы матросов или бегать из дому в ораниенбаумские сады и прятаться там от сторожей и садовников. [К. Г. Паустовский. Орест Кипренский (1936)] [омонимия снята] | W21: =RAND() -> 0.37856685538342605 | X21: 1
A22: с йотезаг йоннойар йонребилакоклем еытыркирП | B22: юарк | C22: Прикрытые мелкокалиберной районной газетой с | D22: краю | F22: лежали серые коржики домашнего, деревенского | G22: край | I22: gen2 | J22: Василий Гроссман. Все течет (1955-1963) // «Октябрь», 1989 | K22: Василий Гроссман | L22: 1905 | M22: Все течет | N22: 1955-1963 | O22: художественная | P22: повесть | R22: «Октябрь» | S22: 1989 | T22: журнал | U22: омонимия снята | V22: Прикрытые мелкокалиберной районной газетой с краю лежали серые коржики домашнего, деревенского печения. [Василий Гроссман. Все течет (1955-1963) // «Октябрь», 1989] [омонимия снята] | W22: =RAND() -> 0.71336468438352874 | X22: 1
A23: то яинещичо ялД | B23: удя | C23: ― Для очищения от | D23: яду | E23: , ― | F23: схитрил В― С., а на | G23: яд | H23: еда (напиток) | I23: gen2 | J23: Василий Аксенов. Романтик Китоусов, академик Великий-Салазкин и таинственная Маргарита // «Литературная газета», 1973 | K23: Василий Аксенов | L23: 1932 | M23: Романтик Китоусов, академик Великий-Салазкин и таинственная Маргарита | N23: 1973 | O23: художественная | P23: рассказ | R23: «Литературная газета» | S23: 1973 | T23: газета | U23: омонимия снята | V23: ― Для очищения от яду, ― схитрил В― С., а на самом-то деле он хотел по сигарете определить, откуда явился "романтик". [Василий Аксенов. Романтик Китоусов, академик Великий-Салазкин и таинственная Маргарита // «Литературная газета», 1973] [омонимия снята] | W23: =RAND() -> 0.31947023520793194 | X23: 1
A24: иледисоП | B24: юач | C24: Посидели, | D24: чаю | F24: попили, теперь уже забытого, с | G24: чай | H24: еда (напиток) | I24: gen2 | J24: Борис Екимов. Пиночет (1999) | K24: Борис Екимов | L24: 1938 | M24: Пиночет | N24: 1999 | O24: художественная | P24: повесть | R24: Борис Екимов. Пиночет | S24: 2001 | T24: книга | U24: омонимия снята | V24: Посидели, чаю попили, теперь уже забытого, с травой "железняк". [Борис Екимов. Пиночет (1999)] [омонимия снята] | W24: =RAND() -> 0.26339568611490183 | X24: 1
A25: икчомюр евд лилан нО | B25: урёкил | C25: Он налил две рюмочки | D25: ликёру | E25: " | F25: Кюрасао Канторовиц" и выпил с | G25: ликёр | H25: еда (напиток) | I25: gen2 | J25: А. Н. Толстой. Черная пятница (1924) | K25: А. Н. Толстой | L25: 1882 | M25: Черная пятница | N25: 1924 | O25: художественная | P25: рассказ | R25: Толстой А.Н. Черная пятница. - Авт.сб. Эмигранты. - М., «Правда» , 1982 | S25: 1982 | T25: книга | U25: омонимия снята | V25: Он налил две рюмочки ликёру "Кюрасао Канторовиц" и выпил с напротив сидящим японцем Котомарой за самую твёрдую из валют ― японскую иену. [А. Н. Толстой. Черная пятница (1924)] [омонимия снята] | W25: =RAND() -> 1.5141151643596196E-2 | X25: 1
B26: удёМ | D26: Мёду | F26: купили 6 р. пуд, вощина | G26: мёд | H26: еда (напиток) | I26: gen2 | J26: А. Н. Радищев. Записки путешествия в Сибирь (1790) | K26: А. Н. Радищев | L26: 1749 | M26: Записки путешествия в Сибирь | N26: 1790 | O26: бытовая, нехудожественная | P26: дневник, записные книжки | R26: Радищев А. Н. Полное собрание сочинений: В 3 т. Т. 3 | S26: 1952 | T26: книга | U26: омонимия снята | V26: Мёду купили 6 р. пуд, вощина ― 10 р., воск чистый― 20 р. По рекам много деревень татарских. [А. Н. Радищев. Записки путешествия в Сибирь (1790)] [омонимия снята] | W26: =RAND() -> 0.48201626556479438 | X26: 1
A27: ан ылегнА анинираМ арднаскелА | B27: удьл | C27: Александра Маринина Ангелы на | D27: льду | F27: не выживают. Том 1 | G27: лёд | I27: gen2 | J27: Александра Маринина. Ангелы на льду не выживают. Т. 1 (2014) | K27: Александра Маринина | L27: 1957 | M27: Ангелы на льду не выживают. Т. 1 | N27: 2014 | O27: художественная | P27: роман | R27: Александра Маринина. Ангелы на льду не выживают. Т. 1 | S27: 2014 | T27: книга | U27: омонимия не снята | V27: Александра Маринина Ангелы на льду не выживают. Том 1 [Александра Маринина. Ангелы на льду не выживают. Т. 1 (2014)] [омонимия не снята] | W27: =RAND() -> 0.33371159077560975 | X27: 1
A28: оготэ с я латс И | B28: узар | C28: И стал я с этого | D28: разу | F28: валенки подмораживать: вечером окуну, и | G28: раз | I28: gen2 | J28: М. М. Пришвин. Зайцы-профессора (1921-1925) | K28: М. М. Пришвин | L28: 1873 | M28: Зайцы-профессора | N28: 1921-1925 | O28: художественная | P28: рассказ | R28: М. Пришвин. «Зеленый шум». Сборник | S28: 1983 | T28: книга | U28: омонимия снята | V28: И стал я с этого разу валенки подмораживать: вечером окуну, и на мороз, ещё окуну и оставлю в сенях на всю ночь, а утром в них смело иду в болото. [М. М. Пришвин. Зайцы-профессора (1921-1925)] [омонимия снята] | W28: =RAND() -> 0.67116145022183149 | X28: 1
A29: ан ьсилороб хатсовх хиовс ан | B29: усев | C29: на своих хвостах, боролись на | D29: весу | F29: друг с другом. | G29: вес | I29: gen2 | J29: Василий Климов. Игра зверей — что это? // «Знание-сила», 2014 | K29: Василий Климов | M29: Игра зверей — что это? | N29: 2014 | O29: публицистика, нехудожественная | P29: статья | Q29: наука и технологии, биология | R29: «Знание-сила» | S29: 2014 | T29: журнал | U29: омонимия не снята | V29: Пара малышей, повиснув на своих хвостах, боролись на весу друг с другом. [Василий Климов. Игра зверей — что это? // «Знание-сила», 2014] [омонимия не снята] | W29: =RAND() -> 0.69479384097481545 | X29: 1
A30: мокичнифарг мынтеваз с иньлапс йонметулоп | B30: укяьнок | C30: полутемной спальни с заветным графинчиком | D30: коньяку | E30: . | G30: коньяк | H30: еда (напиток) | I30: gen2 | J30: В. Ф. Ходасевич. Брюсов (1924) | K30: В. Ф. Ходасевич | L30: 1886 | M30: Брюсов | N30: 1924 | O30: публицистика, нехудожественная | P30: мемуары | R30: Ходасевич В. Ф. Колеблемый треножник : Избранное / Под общ. ред. Н.А. Богомолова Сост. и подгот. текста В.Г. Перельмутера | S30: 1990 | T30: книга | U30: омонимия снята | V30: Яков Кузьмич выходил из своей полутемной спальни с заветным графинчиком коньяку. [В. Ф. Ходасевич. Брюсов (1924)] [омонимия снята] | W30: =RAND() -> 0.12053436763484238 | X30: 1
A31: зи ястеаксупу окгел мотэ ирп | B31: удив | C31: при этом легко упускается из | D31: виду | E31: , | F31: что А. Т. Ф. ниспровергает | G31: вид | I31: gen2 | J31: А. А. Зализняк. Лингвистика по А. Т. Фоменко // «Вопросы языкознания», 2000 | K31: А. А. Зализняк | L31: 1935 | M31: Лингвистика по А. Т. Фоменко | N31: 2000 | O31: учебно-научная, нехудожественная | P31: статья | Q31: наука и технологии, история, филология | R31: «Вопросы языкознания» | S31: 2000 | T31: журнал | U31: омонимия снята | V31: Обычно особенно импонирует то, что ниспровергается "официальная наука", тем более такая замаранная в советское время прислужничеством идеологии, как история (при этом легко упускается из виду, что А. Т. Ф. ниспровергает не советских историков, а по сути дела всех историков всех стран и эпох). [А. А. Зализняк. Лингвистика по А. Т. Фоменко // «Вопросы языкознания», 2000] [омонимия снята] | W31: =RAND() -> 0.88539192701373692 | X31: 1
A32: в ястееми илсЕ течох оготэ | B32: удив | C32: этого хочет. Если имеется в | D32: виду | F32: просто друг. Если это ближайший | G32: вид | I32: gen2 | J32: Д. Менделеева, Ю. Ратанов. Психотерапевт: Что прячут счастливые аккаунты соцсетей? (2015.11.06) | K32: Д. Менделеева, Ю. Ратанов | M32: Психотерапевт: Что прячут счастливые аккаунты соцсетей? | N32: 2015.11.06 | O32: публицистика , нехудожественная | P32: интервью | Q32: частная жизнь | R32: Православие и мир (pravmir.ru) | S32: 2015 | T32: электронный текст | U32: омонимия не снята | V32: ― Я думаю, что единственно правильным будет ― поделиться радостью за этого человека, он ведь этого хочет. Если имеется в виду просто друг. Если это ближайший родственник, есть, наверное, и другие способы связи. [Д. Менделеева, Ю. Ратанов. Психотерапевт: Что прячут счастливые аккаунты соцсетей? (2015.11.06)] [омонимия не снята] | W32: =RAND() -> 8.5454296679084774E-2 | X32: 1
A33: окьлокС илялертсоп еенхи овтсйемес ёсв | B33: удоран | C33: всё семейство ихнее постреляли. Сколько | D33: народу | F33: погибло… Михайла . | G33: народ | I33: gen2 | J33: А. И. Пантелеев. Ночные гости (1944) | K33: А. И. Пантелеев | L33: 1908 | M33: Ночные гости | N33: 1944 | O33: художественная | P33: пьеса | R33: Пантелеев А.И. Собрание сочинений: В 4 т. Т. 1 | S33: 1984 | T33: книга | U33: омонимия снята | V33: Из-за неё, проклятущей, всё семейство ихнее постреляли. Сколько народу погибло… . [А. И. Пантелеев. Ночные гости (1944)] [омонимия снята] | W33: =RAND() -> 0.65780594391251801 | X33: 1
A34: липыв ыб Я картваз ан | B34: уноьлуб | C34: на завтрак?… ― Я бы выпил | D34: бульону | E34: . | F34: Ах, при чём тут Паскаль | G34: бульон | H34: еда (напиток) | I34: gen2 | J34: Андрей Битов. Рассеянный свет (1981) | K34: Андрей Битов | L34: 1937 | M34: Рассеянный свет | N34: 1981 | O34: художественная | P34: рассказ | R34: Антология современной прозы. Т. 1. | S34: 2002 | T34: книга | U34: омонимия снята | V34: Что хочешь на завтрак?… ― Я бы выпил бульону. Ах, при чём тут Паскаль! [Андрей Битов. Рассеянный свет (1981)] [омонимия снята] | W34: =RAND() -> 0.29564645878528273 | X34: 1
A35: 8591 В | B35: удог | C35: В 1958 | D35: году | F35: получил главный приз Каннского кинофестиваля | G35: год | I35: gen2 | J35: Александр Шпагин. Отрицательный интерес // «Огонек», 2015 | K35: Александр Шпагин | M35: Отрицательный интерес | N35: 2015 | O35: публицистика, нехудожественная | P35: заметка | Q35: искусство и культура | R35: «Огонек» | S35: 2015 | T35: журнал | U35: омонимия не снята | V35: В 1958 году получил главный приз Каннского кинофестиваля фильм «Летят журавли». [Александр Шпагин. Отрицательный интерес // «Огонек», 2015] [омонимия не снята] | W35: =RAND() -> 0.66899470400416727 | X35: 1
A36: имакшитс имыньлаицниворп имиксечитсилаер имиом с | B36: удох | C36: с моими реалистическими провинциальными стишками | D36: ходу | F36: не было. | G36: ход | I36: gen2 | J36: В. П. Катаев. Алмазный мой венец (1975-1977) | K36: В. П. Катаев | L36: 1897 | M36: Алмазный мой венец | N36: 1975-1977 | O36: художественная | P36: роман | R36: Катаев В. Трава забвенья. | S36: 1997 | T36: книга | U36: омонимия снята | V36: В эти альманахи, где царили птицелов и эскесс как звёзды первой величины, мне с моими реалистическими провинциальными стишками ходу не было. [В. П. Катаев. Алмазный мой венец (1975-1977)] [омонимия снята] | W36: =RAND() -> 0.24813083738917729 | X36: 1
A37: огокат апюТ яслагупсИ | B37: укирк | C37: Испугался Тюпа— такого | D37: крику | F37: он ни разу не слыхал | G37: крик | I37: gen2 | J37: Е. И. Чарушин. Тюпа, Томка и сорока (1946) | K37: Е. И. Чарушин | L37: 1901 | M37: Тюпа, Томка и сорока | N37: 1946 | O37: художественная | P37: рассказ, цикл | R37: Чарушин Е.И. Тюпа, Томка и сорока | S37: 2004 | T37: книга | U37: омонимия снята | V37: Испугался Тюпа— такого крику он ни разу не слыхал— и ушёл от них поскорее. [Е. И. Чарушин. Тюпа, Томка и сорока (1946)] [омонимия снята] | W37: =RAND() -> 0.1515733978432946 | X37: 1
A38: и хин то онвад хакшинатш | B38: унимоп | C38: штанишках, давно от них и | D38: помину | F38: нет, все обшаркались. | G38: помин | I38: gen2 | J38: А. М. Ремизов. Зайка (1905) | K38: А. М. Ремизов | L38: 1877 | M38: Зайка | N38: 1905 | O38: художественная | P38: сказка | R38: Ремизов А.М. Сочинения: В 2 кн. Кн. 1. | S38: 1993 | T38: книга | U38: омонимия снята | V38: Сам видишь, обносилась вся, локотки продраны, чулочки все в дырках, а какие были кружевца на штанишках, давно от них и помину нет, все обшаркались. [А. М. Ремизов. Зайка (1905)] [омонимия снята] | W38: =RAND() -> 3.9160425908706831E-2 | X38: 1
A39: и кешуртав ман тисонирп и | B39: усавк | C39: и приносит нам ватрушек и | D39: квасу | E39: . | G39: квас | H39: еда (напиток) | I39: gen2 | J39: Л. Н. Толстой. Отрочество (1854) | K39: Л. Н. Толстой | L39: 1828 | M39: Отрочество | N39: 1854 | O39: художественная | P39: повесть | R39: Л.Н. Толстой. Собрание сочинений | S39: 1958 | T39: книга | U39: омонимия снята | V39: В окно кареты высовывается рука с бутылкой и узелком; Василий с удивительной ловкостью на ходу соскакивает с козел и приносит нам ватрушек и квасу. [Л. Н. Толстой. Отрочество (1854)] [омонимия снята] | W39: =RAND() -> 0.14134836107115722 | X39: 1
A40: то тел акорос ежу ичудуб | B40: удор | C40: будучи уже сорока лет от | D40: роду | E40: , | F40: а между тем он выступил | G40: род | I40: gen2 | J40: В. Н. Майков. Полное собрание сочинений И. Крылова... (1847) | K40: В. Н. Майков | L40: 1823 | M40: Полное собрание сочинений И. Крылова... | N40: 1847 | O40: публицистика, нехудожественная | P40: рецензия | Q40: искусство и культура | R40: В. Н. Майков. Литературная критика. Статьи, рецензии | S40: 1985 | T40: книга | U40: омонимия снята | V40: Вам, вероятно, известно, что Крылов начал писать басни, будучи уже сорока лет от роду, а между тем он выступил на литературное поприще ещё двадцатилетним юношей. [В. Н. Майков. Полное собрание сочинений И. Крылова... (1847)] [омонимия снята] | W40: =RAND() -> 0.33569947330007477 | X40: 1
A41: ос ыб онваД | B41: утевс | C41: Давно бы со | D41: свету | F41: сжили, да вот не даюсь | G41: свет | I41: gen2 | J41: Н. А. Тэффи. Покаянное (1910) | K41: Н. А. Тэффи | L41: 1872 | M41: Покаянное | N41: 1910 | O41: художественная | P41: рассказ, миниатюра | R41: Тэффи Н.А. Юмористические рассказы. Из Всеобщей истории, обработанной «Сатириконом» | S41: 1990 | T41: книга | U41: омонимия снята | V41: Давно бы со свету сжили, да вот не даюсь я вам. [Н. А. Тэффи. Покаянное (1910)] [омонимия снята] | W41: =RAND() -> 0.90107606286929021 | X41: 1
A42: од яарк то меинеживд мынболз | B42: ухрев | C42: злобным движением от края до | D42: верху | F42: разорвал юбку и сразу её | G42: верх | I42: gen2 | J42: М. А. Булгаков. Полотенце с петухом (1926) | K42: М. А. Булгаков | L42: 1891 | M42: Полотенце с петухом | N42: 1926 | O42: художественная | P42: рассказ | R42: М. Булгаков. Собрание сочинений. - Т. 1: Записки покойника: Автобиографическая проза | S42: 2002 | T42: книга | U42: омонимия снята | V42: Тут Демьян Лукич резким, как бы злобным движением от края до верху разорвал юбку и сразу её обнажил. [М. А. Булгаков. Полотенце с петухом (1926)] [омонимия снята] | W42: =RAND() -> 0.99811763517912244 | X42: 1
A43: ениволоп йогурд ан как мет | B43: усач | C43: тем как на другой половине | D43: часу | F43: до одиннадцатого пробыли гости и | G43: час | I43: gen2 | J43: Антоний Погорельский. Черная курица (1829) | K43: Антоний Погорельский | L43: 1787 | M43: Черная курица | N43: 1829 | O43: художественная | P43: сказка | R43: А. Погорельский, С. Т. Аксаков. Черная курица, или Подземные жители. Аленький цветочек | S43: 1999 | T43: книга | U43: омонимия снята | V43: Алёша возвратился в дом и весь вечер просидел один в классных комнатах, между тем как на другой половине часу до одиннадцатого пробыли гости и на нескольких столах играли в вист. [Антоний Погорельский. Черная курица (1829)] [омонимия снята] | W43: =RAND() -> 0.16143201275411789 | X43: 1
A44: лип ен месвос итчоп мас | B44: юач | C44: сам почти совсем не пил | D44: чаю | E44: , | F44: а пил, когда была надобность | G44: чай | H44: еда (напиток) | I44: gen2 | J44: Ф. М. Достоевский. Господин Прохарчин (1846) | K44: Ф. М. Достоевский | L44: 1821 | M44: Господин Прохарчин | N44: 1846 | O44: художественная | P44: повесть | R44: Большая хрестоматия. Русская литература XIX века | S44: 2003 | T44: книга | U44: омонимия снята | V44: Это тотчас заметили и приняли в счёт, ибо Семён Иванович никак, ни за что и никому не мог одолжить своего чайника на подержание, хотя бы то было на самое малое время; и тем более был несправедлив в этом деле, что сам почти совсем не пил чаю, а пил, когда была надобность, какой-то довольно приятный настой из полевых цветов и некоторых целебного свойства трав,всегда в значительном количестве у него запасённый. [Ф. М. Достоевский. Господин Прохарчин (1846)] [омонимия снята] | W44: =RAND() -> 0.43457911811199146 | X44: 1
A45: ан иледис иляотс идюл иицкел | B45: улоп | C45: лекции люди стояли, сидели на | D45: полу | E45: , | F45: забирались на подоконники ― зал был | G45: пол | I45: gen2 | J45: А. А. Лотарева. Человек, переоткрывший русский язык (2015.10.06) | K45: А. А. Лотарева | L45: 1983 | M45: Человек, переоткрывший русский язык | N45: 2015.10.06 | O45: публицистика , нехудожественная | P45: заметка | Q45: филология, история | R45: Православие и мир (pravmir.ru) | S45: 2015 | T45: электронный текст | U45: омонимия не снята | V45: Два с половиной часа лекции люди стояли, сидели на полу, забирались на подоконники ― зал был полон с избытком. [А. А. Лотарева. Человек, переоткрывший русский язык (2015.10.06)] [омонимия не снята] | W45: =RAND() -> 0.30979227222044237 | X45: 1
A46: еенем ен ужатимрЭ оп или | B46: усач | C46: или по Эрмитажу не менее | D46: часу | E46: . | G46: час | I46: gen2 | J46: Ю. Н. Тынянов. Малолетный Витушишников (1933) | K46: Ю. Н. Тынянов | L46: 1894 | M46: Малолетный Витушишников | N46: 1933 | O46: художественная | P46: рассказ | R46: Юрий Тынянов. Кюхля. Рассказы | S46: 1973 | T46: книга | U46: омонимия снята | V46: Она должна ежедневно гулять по Аполлоновой зале или по Эрмитажу не менее часу. [Ю. Н. Тынянов. Малолетный Витушишников (1933)] [омонимия снята] | W46: =RAND() -> 2.3572939359701839E-2 | X46: 1
A47: зеб ногав в умен к | B47: утёчс | C47: к нему в вагон «без | D47: счёту | E47: ». | G47: счёт | I47: gen2 | J47: К. И. Чуковский. Репин -- писатель (1930-1950) | K47: К. И. Чуковский | L47: 1882 | M47: Репин -- писатель | N47: 1930-1950 | O47: публицистика, нехудожественная | P47: мемуары | Q47: искусство и культура | R47: К.Чуковский. Собрание сочинений. Т. 4 | S47: 2001 | T47: книга | U47: омонимия снята | V47: Превосходен именно в беллетристическом отношении тот отрывок из его письма к В. В. Стасову, где он описывает ватагу крестьян, набившихся к нему в вагон «без счёту». [К. И. Чуковский. Репин -- писатель (1930-1950)] [омонимия снята] | W47: =RAND() -> 0.470316068189776 | X47: 1
A48: зеб ничноко зеб йеревд зеб | B48: улоп | C48: без дверей, без окончин, без | D48: полу | E48: ; | F48: кровля давно сгнила и обвалилась | G48: пол | I48: gen2 | J48: Н. М. Карамзин. Бедная Лиза (1792) | K48: Н. М. Карамзин | L48: 1766 | M48: Бедная Лиза | N48: 1792 | O48: художественная | P48: повесть | R48: Н.М. Карамзин. Избранные произведения в прозе | S48: 2003 | T48: книга | U48: омонимия снята | V48: Саженях в семидесяти от монастырской стены, подле берёзовой рощицы, среди зелёного луга, стоит пустая хижина, без дверей, без окончин, без полу; кровля давно сгнила и обвалилась. [Н. М. Карамзин. Бедная Лиза (1792)] [омонимия снята] | W48: =RAND() -> 0.14816007710444423 | X48: 1
A49: ялд ьчомоп и онжом ино | B49: упмет | C49: они, ― можно и помочь для | D49: темпу | E49: . | G49: темп | I49: gen2 | J49: Григорий Горин. Когда горит душа (1974-1984) | K49: Григорий Горин | L49: 1940 | M49: Когда горит душа | N49: 1974-1984 | O49: художественная | P49: рассказ | R49: Григорий Горин. Золотая серия юмора. | S49: 1999 | T49: книга | U49: омонимия снята | V49: ― А что ж, ― говорят они, ― можно и помочь для темпу. [Григорий Горин. Когда горит душа (1974-1984)] [омонимия снята] | W49: =RAND() -> 0.12772670364122918 | X49: 1
A50: то тел 72 олыб умЕ | B50: удор | C50: Ему было 27 лет от | D50: роду | E50: ; | F50: он был высок и строен | G50: род | I50: gen2 | J50: А. С. Пушкин. Арап Петра Великого (1828) | K50: А. С. Пушкин | L50: 1799 | M50: Арап Петра Великого | N50: 1828 | O50: художественная | P50: роман | R50: А. Пушкин. Полное собрание сочинений | S50: 1937-1949 | T50: книга | U50: омонимия снята | V50: Ему было 27 лет от роду; он был высок и строен, и не одна красавица заглядывалась на него с чувством более лестным нежели простое любопытство, но предубеждённый Ибрагим или ничего не замечал или видел одно кокетство. [А. С. Пушкин. Арап Петра Великого (1828)] [омонимия снята] | W50: =RAND() -> 0.82498366476405116 | X50: 1
A51: мот в отч аД как | B51: уклот | C51: как! Да что в том | D51: толку | E51: … | F51: В свете идти на любовь | G51: толк | I51: gen2 | J51: В. А. Соллогуб. Метель (1849) | K51: В. А. Соллогуб | L51: 1814 | M51: Метель | N51: 1849 | O51: художественная | P51: рассказ | R51: В. А. Соллогуб. Избранная проза | S51: 1983 | T51: книга | U51: омонимия снята | V51: Да и как! Да что в том толку… В свете идти на любовь ― значит идти на верный обман. [В. А. Соллогуб. Метель (1849)] [омонимия снята] | W51: =RAND() -> 0.69772728085871849 | X51: 1
A52: 0102 в илиледыв едирдаМ в | B52: удог | C52: в Мадриде выделили в 2010 | D52: году | E52: ― | F52: и вот ― церковь с золотыми | G52: год | I52: gen2 | J52: А. А. Данилова. Местность любви (2015.11.09) | K52: А. А. Данилова | L52: 1981 | M52: Местность любви | N52: 2015.11.09 | O52: публицистика , нехудожественная | P52: репортаж, беседа | Q52: религия, путешествия, частная жизнь | R52: Православие и мир (pravmir.ru) | S52: 2015 | T52: электронный текст | U52: омонимия не снята | V52: Землю под храм в Мадриде выделили в 2010 году ― и вот ― церковь с золотыми куполами. [А. А. Данилова. Местность любви (2015.11.09)] [омонимия не снята] | W52: =RAND() -> 8.5651772206647325E-2 | X52: 1
A53: с йотсорп йокат к еинешонто | B53: удив | C53: отношение к такой простой с | D53: виду | F53: задаче. | G53: вид | I53: gen2 | J53: Максим Горький. Чарли Мэн (1906) | K53: Максим Горький | L53: 1868 | M53: Чарли Мэн | N53: 1906 | O53: художественная | P53: рассказ | T53: книга | U53: омонимия снята | V53: Но оказывается, что Чарли Мэн имеет своё отношение к такой простой с виду задаче. [Максим Горький. Чарли Мэн (1906)] [омонимия снята] | W53: =RAND() -> 0.4572539856002662 | X53: 1
A54: огесв ос и яслажебзар вобуЗ | B54: ухам | C54: Зубов разбежался и со всего | D54: маху | F54: двинулся головой об стену. | G54: мах | I54: gen2 | J54: Д. И. Хармс. Начало очень хорошего летнего дня (симфония) (1939) | K54: Д. И. Хармс | L54: 1905 | M54: Начало очень хорошего летнего дня (симфония) | N54: 1939 | O54: художественная | P54: миниатюра | R54: Хармс Д. Полное собрание сочинений. Том 2 | S54: 1997 | T54: книга | U54: омонимия снята | V54: «Вот ловкач!» ― закричало человеческое стадо, и некто Зубов разбежался и со всего маху двинулся головой об стену. [Д. И. Хармс. Начало очень хорошего летнего дня (симфония) (1939)] [омонимия снята] | W54: =RAND() -> 0.48111215075195968 | X54: 1
A55: с турму итед ьтадорп хи | B55: удолог | C55: их продать, дети умрут с | D55: голоду | E55: . | G55: голод | I55: gen2 | J55: Л. А. Чарская. Король с раскрашенной картинки (1912) | K55: Л. А. Чарская | L55: 1875 | M55: Король с раскрашенной картинки | N55: 1912 | O55: художественная | P55: сказка | R55: Л. А. Чарская. Сказки голубой феи | S55: 1992 | T55: книга | U55: омонимия снята | V55: Если их продать, дети умрут с голоду. [Л. А. Чарская. Король с раскрашенной картинки (1912)] [омонимия снята] | W55: =RAND() -> 0.39972729332385337 | X55: 1
A56: то олес ьсолинлопан оге имасолог | B56: ухрев | C56: голосами его наполнилось село от | D56: верху | F56: до самого, так сказать, до | G56: верх | I56: gen2 | J56: А. И. Левитов. Расправа (1862) | K56: А. И. Левитов | L56: 1835 | M56: Расправа | N56: 1862 | O56: художественная | P56: рассказ | R56: А.И. Левитов. Избранные произведения | S56: 1988 | T56: книга | U56: омонимия снята | V56: На живую руку сбитые ворота с громким скрипом отворяются навстречу стада, и вот многоразличными голосами его наполнилось село от верху до самого, так сказать, до низу. [А. И. Левитов. Расправа (1862)] [омонимия снята] | W56: =RAND() -> 0.44518072133173547 | X56: 1
A57: огокат йавызакссар ен от уретиП | B57: уродзв | C57: Питеру-то не рассказывай такого | D57: вздору | E57: , | F57: ну, что скажет министр или | G57: вздор | I57: gen2 | J57: А. И. Герцен. Мимоездом (1846) | K57: А. И. Герцен | L57: 1812 | M57: Мимоездом | N57: 1846 | O57: художественная | P57: рассказ, отрывок | R57: А.И. Герцен. Сочинения в 9 томах. Том 1 | S57: 1955 | T57: книга | U57: омонимия снята | V57: ― Пожалуйста, батюшка, по Питеру-то не рассказывай такого вздору, ну, что скажет министр или особа какая ― "Баба, а не товарищ председателя". [А. И. Герцен. Мимоездом (1846)] [омонимия снята] | W57: =RAND() -> 0.69048819068899725 | X57: 1
A58: с мин с ыб илировогоп | B58: узалг | C58: поговорили бы с ним с | D58: глазу | F58: на глаз, так он бы | G58: глаз | I58: gen2 | J58: А. Н. Островский. Гроза (1860) | K58: А. Н. Островский | L58: 1823 | M58: Гроза | N58: 1860 | O58: художественная | P58: пьеса | R58: А.Н. Островский. Полное собрание сочинений | S58: 1951 | T58: книга | U58: омонимия снята | V58: Вчетвером этак, впятером в переулке где-нибудь поговорили бы с ним с глазу на глаз, так он бы шёлковый сделался. [А. Н. Островский. Гроза (1860)] [омонимия снята] | W58: =RAND() -> 0.43893364117785882 | X58: 1
A59: зи ьсишвунрев ыджандо и сеныв | B59: умод | C59: вынес и однажды, вернувшись из | D59: дому | F59: Нерягиных, где бывал часто, выстрелил | G59: дом | I59: gen2 | J59: В. Я. Брюсов. Через пятнадцать лет (1909) | K59: В. Я. Брюсов | L59: 1873 | M59: Через пятнадцать лет | N59: 1909 | O59: художественная | P59: рассказ | R59: В.Я. Брюсов. Повести и рассказы | S59: 1983 | T59: книга | U59: омонимия снята | V59: Корецкий этого не вынес и однажды, вернувшись из дому Нерягиных, где бывал часто, выстрелил себе в грудь. [В. Я. Брюсов. Через пятнадцать лет (1909)] [омонимия снята] | W59: =RAND() -> 0.77119107325801395 | X59: 1
A60: макичторов к лунревс и анко | B60: угаШ | C60: окна и свернул к воротчикам. | D60: Шагу | F60: не прибавил. И сразу все | G60: шаг | I60: gen2 | J60: Василий Шукшин. Печки-лавочки (1970-1972) | K60: Василий Шукшин | L60: 1929 | M60: Печки-лавочки | N60: 1970-1972 | O60: художественная | P60: киноповесть | R60: Василий Шукшин. Собрание сочинений (в 3 томах), т3 | S60: 2003 | T60: книга | U60: омонимия снята | V60: Лев Казимирыч поднял умную голову в шляпе, посмотрел на окна и свернул к воротчикам. Шагу не прибавил. И сразу все за столом заговорили об одном ― какой умный этот Лев Казимирыч, сколько он, собака, знает всякой всячины, выращивает даже яблоки и выписывает книги. [Василий Шукшин. Печки-лавочки (1970-1972)] [омонимия снята] | W60: =RAND() -> 0.72188994043626198 | X60: 1
A61: огес ырецифо есв юрадусог каК | B61: уклоп | C61: Как государю все офицеры сего | D61: полку | E61: , | F61: а в том числе и | G61: полк | I61: gen2 | J61: А. Т. Болотов. Жизнь и приключения Андрея Болотова, описанные самим им для своих потомков (1800) | K61: А. Т. Болотов | L61: 1738 | M61: Жизнь и приключения Андрея Болотова, описанные самим им для своих потомков | N61: 1800 | O61: публицистика, нехудожественная | P61: мемуары | R61: Путь к трону: История дворцового переворота 28 июня 1762 года. | S61: 1997 | T61: книга | U61: омонимия снята | V61: Как государю все офицеры сего полку, а в том числе и вы были коротко известны, то сегодня, приехавши смотреть свой полк, не находит он вас и спрашивает, где 6 вы были, и для чего вас нет во фрунте. [А. Т. Болотов. Жизнь и приключения Андрея Болотова, описанные самим им для своих потомков (1800)] [омонимия снята] | W61: =RAND() -> 0.87883954951400978 | X61: 1
A62: овтсежонм олахеирП | B62: удоран | C62: Приехало множество | D62: народу | E62: , | F62: на полу лежали провода, всюду | G62: народ | I62: gen2 | J62: Людмила Петрушевская. Маленькая волшебница // «Октябрь», 1996 | K62: Людмила Петрушевская | L62: 1938 | M62: Маленькая волшебница | N62: 1996 | O62: художественная | P62: роман | R62: «Октябрь» | S62: 1996 | T62: журнал | U62: омонимия снята | V62: Приехало множество народу, на полу лежали провода, всюду слонялись какие-то бездельники с молотками, наушниками и кабелями, редакторша орала, потрясая бумажками с текстом, про домик все как будто забыли ― взоры присутствующих и глазок видеокамеры были прикованы к пустому подоконнику. [Людмила Петрушевская. Маленькая волшебница // «Октябрь», 1996] [омонимия снята] | W62: =RAND() -> 0.14889815795090988 | X62: 1
A63: с илшыв ишан икдерп юинадерп | B63: уноД | C63: преданию, предки наши вышли с | D63: Дону | E63: , | F63: где и до сих пор | G63: Дон | I63: gen2 | J63: П. И. Мельников-Печерский. Начало неоконченной автобиографии (1863) | K63: П. И. Мельников-Печерский | L63: 1819 | M63: Начало неоконченной автобиографии | N63: 1863 | O63: публицистика, нехудожественная | P63: автобиография | Q63: частная жизнь | R63: Мельников-Печерский П. И. Собрание сочинений в 6 т., том 1 | S63: 1963 | T63: книга | U63: омонимия снята | V63: По преданию, предки наши вышли с Дону, где и до сих пор существует фамилия Мельниковых. [П. И. Мельников-Печерский. Начало неоконченной автобиографии (1863)] [омонимия снята] | W63: =RAND() -> 0.73457441270916068 | X63: 1
A64: 4102 в ытатьлузер иьч вореноигел | B64: удог | C64: легионеров, чьи результаты в 2014 | D64: году | F64: могут впечатлить и нынешних, и | G64: год | I64: gen2 | J64: Александра Владимирова. Обрусевшие // «Русский репортер», 2014 | K64: Александра Владимирова | M64: Обрусевшие | N64: 2014 | O64: публицистика, нехудожественная | P64: заметка | Q64: спорт | R64: «Русский репортер» | S64: 2014 | T64: журнал | U64: омонимия не снята | V64: «РР» составил список самых ярких легионеров, чьи результаты в 2014 году могут впечатлить и нынешних, и прежних соотечественников. [Александра Владимирова. Обрусевшие // «Русский репортер», 2014] [омонимия не снята] | W64: =RAND() -> 0.72302401231731261 | X64: 1
A65: огечярог ьтсеъс лыб ьчорп ен | B65: упус | C65: не прочь был съесть горячего | D65: супу | E65: . | G65: суп | H65: еда (напиток) | I65: gen2 | J65: Б. А. Пильняк. Три брата (1923-1928) | K65: Б. А. Пильняк | L65: 1894 | M65: Три брата | N65: 1923-1928 | O65: художественная | P65: рассказ | T65: книга | U65: омонимия снята | V65: Через два дня на третий приходила ко мне хожалка, обыкновенно к этому времени съедался хлеб и я уже не прочь был съесть горячего супу. [Б. А. Пильняк. Три брата (1923-1928)] [омонимия снята] | W65: =RAND() -> 0.70228095130566237 | X65: 1
A66: иличармо иовт ырауторт есв илеыв | B66: удолох | C66: выели все тротуары твои, омрачили, | D66: холоду | F66: нагнали по домам, тифом, холодом | G66: холод | I66: gen2 | J66: Б. К. Зайцев. Улица св. Николая (1921) | K66: Б. К. Зайцев | L66: 1881 | M66: Улица св. Николая | N66: 1921 | O66: художественная | P66: очерк | R66: Собрание сочинений в 5 т. -- Т. 2. Улица Святого Николая: Повести. Рассказы. | S66: 1999 | T66: книга | U66: омонимия снята | V66: По тебе прошли метели страшные, размыли тебя и замертвили, выели все тротуары твои, омрачили, холоду нагнали по домам, тифом, холодом, голодом, казнями пронеслись по жителям твоим, и многих разметали вдаль. [Б. К. Зайцев. Улица св. Николая (1921)] [омонимия снята] | W66: =RAND() -> 0.65365443422339131 | X66: 1
A67: од енм ястёатсо ьледен ьмеС | B67: укорс | C67: Семь недель остаётся мне до | D67: сроку | E67: , | F67: и я нарочно заранее принял | G67: срок | I67: gen2 | J67: Д. И. Фонвизин. К И.П. Елагину (1769) | K67: Д. И. Фонвизин | L67: 1744 | M67: К И.П. Елагину | N67: 1769 | O67: бытовая, нехудожественная | P67: письмо личное | Q67: частная жизнь | R67: Фонвизин Д.И. Собрание сочинений: В 2 т. Т. 2 | S67: 1959 | T67: книга | U67: омонимия снята | V67: Семь недель остаётся мне до сроку, и я нарочно заранее принял смелость всенижайше просить ваше превосходительство об отсрочке мне ещё на полгода для следующих причин: 1) Я время моё провожу здесь весьма полезно, в рассуждении известного вам моего состояния; перевёл "Иосифа", за который возьму 200 руб.; напечатал "Сиднея"; пишу стихи; дописал почти свою комедию, чему свидетель отъезжающий отсюда С. Г. Домашнев, который всё то читал, о чём я имею честь доносить вашему превосходительству. [Д. И. Фонвизин. К И.П. Елагину (1769)] [омонимия снята] | W67: =RAND() -> 0.6665219410483475 | X67: 1
A68: с от юувенчя и ад | B68: юоб | C68: да и ячневую-то с | D68: бою | E68: ― | F68: как самой дешёвой ею откармливали | G68: бой | I68: gen2 | J68: Александр Солженицын. Матренин двор (1960) | K68: Александр Солженицын | L68: 1918 | M68: Матренин двор | N68: 1960 | O68: художественная | P68: рассказ | R68: Солженицын А.И. На краях | S68: 2000 | T68: книга | U68: омонимия снята | V68: Что на завтрак, она не объявляла, да это и догадаться было легко: картовь необлупленная, или суп картонный (так выговаривали все в деревне), или каша ячневая (другой крупы в тот год нельзя было купить в Торфопродукте, да и ячневую-то с бою ― как самой дешёвой ею откармливали свиней и мешками брали). [Александр Солженицын. Матренин двор (1960)] [омонимия снята] | W68: =RAND() -> 3.6032893593520687E-2 | X68: 1
A69: 7191 в ывксоМ то хартемолик | B69: удог | C69: километрах от Москвы (в 1917 | D69: году | F69: было создано несколько «женских команд | G69: год | I69: gen2 | J69: Андрей Архангельский. Ради смерти на земле // «Огонек», 2015 | K69: Андрей Архангельский | L69: 1974 | M69: Ради смерти на земле | N69: 2015 | O69: публицистика, нехудожественная | P69: рецензия | Q69: армия и вооруженные конфликты, искусство и культура | R69: «Огонек» | S69: 2015 | T69: журнал | U69: омонимия не снята | V69: А вот в случае с Первой мировой это уже не так очевидно, тем более что авторы сами говорят, что фронт к тому времени «разложился», а враг без особого рвения «топчет нашу землю» примерно в 800 километрах от Москвы (в 1917 году было создано несколько «женских команд смерти», для поднятия боевого духа армии: один батальон принял участие в боевых действиях в течение трех дней под Молодечно в июле 1917-го; а уже в августе того же года женщинам было запрещено участвовать в боях. [Андрей Архангельский. Ради смерти на земле // «Огонек», 2015] [омонимия не снята] | W69: =RAND() -> 0.11398119347724156 | X69: 1
A70: огот с аросум екалбо в | B70: юарк | C70: в облаке мусора с того | D70: краю | F70: сада, где начиналась дичь: паслён | G70: край | I70: gen2 | J70: Б. Л. Пастернак. Воздушные пути (1924) | K70: Б. Л. Пастернак | L70: 1890 | M70: Воздушные пути | N70: 1924 | O70: художественная | P70: повесть | R70: Борис Пастернак. Полное собрание сочинений в 11 томах | S70: 2005 | T70: книга | U70: омонимия снята | V70: ― Куды, куды! ― поротой губой провыла на весь мир полоумная пастушка и, в предшествии молодого бычка, волоча отдавленную ногу и маша, как молнией, дикой хворостиной, явилась в облаке мусора с того краю сада, где начиналась дичь: паслён, кирпич, мятая проволока, гнилой полумрак. [Б. Л. Пастернак. Воздушные пути (1924)] [омонимия снята] | W70: =RAND() -> 0.25277651068025664 | X70: 1
A71: с вяндоп и ьчинзван яслилавоп | B71: улоп | C71: повалился навзничь и, подняв с | D71: полу | F71: книгу, погрузился в чтение… | G71: пол | I71: gen2 | J71: А. Т. Аверченко. Камень на шее (1910-1914) | K71: А. Т. Аверченко | L71: 1881 | M71: Камень на шее | N71: 1910-1914 | O71: художественная | P71: рассказ | R71: «Аркадий Аверченко. Собрание сочинений в 6 томах. Том 2. «Круги по воде» | S71: 2000 | T71: книга | U71: омонимия снята | V71: Пампасов шумно вздохнул, повалился навзничь и, подняв с полу книгу, погрузился в чтение… [А. Т. Аверченко. Камень на шее (1910-1914)] [омонимия снята] | W71: =RAND() -> 0.38125242734801368 | X71: 1
A72: хапаз ад вотекнек и йечевс | B72: ухороп | C72: свечей и кенкетов да запах | D72: пороху | F72: только на фейерверках. | G72: порох | I72: gen2 | J72: Д. В. Давыдов. Мороз ли истребил французскую армию в 1812 году? (1830-1835) | K72: Д. В. Давыдов | L72: 1784 | M72: Мороз ли истребил французскую армию в 1812 году? | N72: 1830-1835 | O72: публицистика, нехудожественная | P72: статья | Q72: армия и вооруженные конфликты | T72: книга | U72: омонимия снята | V72: И пусть бы разглашали это городские господчики или маменькины сынки, которым известен огонь одних восковых свечей и кенкетов да запах пороху только на фейерверках. [Д. В. Давыдов. Мороз ли истребил французскую армию в 1812 году? (1830-1835)] [омонимия снята] | W72: =RAND() -> 0.89069944160600267 | X72: 1
A73: мокчуп аз корахук хытсинищром и | B73: укул | C73: и морщинистых кухарок за пучком | D73: луку | E73: ! | G73: лук | H73: еда (напиток) | I73: gen2 | J73: А. В. Дружинин. Русские в Японии в конце 1853 и в начале 1854 годов (1855) | K73: А. В. Дружинин | L73: 1824 | M73: Русские в Японии в конце 1853 и в начале 1854 годов | N73: 1855 | O73: публицистика, нехудожественная | P73: статья | Q73: искусство и культура | T73: книга | U73: омонимия снята | V73: А фламандцы всё шли своим путём, не жертвуя ни грациям, ни Аполлону, по временам доходя до смешного в реализме, рисуя Адониса со своих толстых лакеев, не жалея красок на изображение баранов и свиней, убитой дичи и морщинистых кухарок за пучком луку! [А. В. Дружинин. Русские в Японии в конце 1853 и в начале 1854 годов (1855)] [омонимия снята] | W73: =RAND() -> 0.48634349496332296 | X73: 1
A74: зи уме туТ ил окдалс | B74: удоран | C74: сладко ли? Тут ему из | D74: народу | F74: и погрозились: ― Погоди, собака! | G74: народ | I74: gen2 | J74: П. П. Бажов. Демидовские кафтаны (1939) | K74: П. П. Бажов | L74: 1878 | M74: Демидовские кафтаны | N74: 1939 | O74: художественная | P74: сказ | R74: Бажов П. Сочинения: В 3 т. Т.1 | S74: 1986 | T74: книга | U74: омонимия снята | V74: Только носить сладко ли? Тут ему из народу и погрозились: ― Погоди, собака! [П. П. Бажов. Демидовские кафтаны (1939)] [омонимия снята] | W74: =RAND() -> 0.87987106557541994 | X74: 1
A75: икмюр евд андо а орокс | B75: укяьнок | C75: скоро, а одна-две рюмки | D75: коньяку | F75: успокоят его и придадут смелости | G75: коньяк | H75: еда (напиток) | I75: gen2 | J75: В. Г. Распутин. Новая профессия (1998) | K75: В. Г. Распутин | L75: 1937 | M75: Новая профессия | N75: 1998 | O75: художественная | P75: повесть | R75: Проза новой России: В 4 т. Т. 3 | S75: 2003 | T75: книга | U75: омонимия снята | V75: Ничего, ему вступать в свою роль ещё не скоро, а одна-две рюмки коньяку успокоят его и придадут смелости. [В. Г. Распутин. Новая профессия (1998)] [омонимия снята] | W75: =RAND() -> 0.52011711562353102 | X75: 1
A76: зи нО B L сукол в | B76: усел | C76: в локус L B ("Он из | D76: лесу | F76: вышел… и увидел пустыню") | G76: лес | I76: gen2 | J76: В. Э. Карпов, Т. В. Мещерякова. Об автоматизации нетворческих литературных процессов // «Информационные технологии», 2004 | K76: В. Э. Карпов, Т. В. Мещерякова | M76: Об автоматизации нетворческих литературных процессов | N76: 2004 | O76: учебно-научная, нехудожественная | P76: статья | Q76: наука и технологии, информатика | R76: «Информационные технологии» | S76: 2004 | T76: журнал | U76: омонимия снята | V76: ("пустыня"), то необходим текст, увязывающий между собой переход из локуса L в локус L ("Он из лесу вышел… и увидел пустыню") [В. Э. Карпов, Т. В. Мещерякова. Об автоматизации нетворческих литературных процессов // «Информационные технологии», 2004] [омонимия снята] | W76: =RAND() -> 0.84631156115227335 | X76: 1
A77: ос олиром еьтерт зёлс од | B77: ухемс | C77: до слёз, третье морило со | D77: смеху | E77: ; | F77: а между тем он, казалось | G77: смех | I77: gen2 | J77: В. Ф. Одоевский. Импровизатор (1833) | K77: В. Ф. Одоевский | L77: 1803 | M77: Импровизатор | N77: 1833 | O77: художественная | P77: рассказ | R77: Русская романтическая повесть | S77: 1980 | T77: книга | U77: омонимия снята | V77: Этого мало: в одно и то же время ему задавали два и три предмета совершенно различные; он диктовал одно стихотворение, писал другое, импровизировал третье, и каждое было прекрасно в своём роде: одно производило восторг, другое трогало до слёз, третье морило со смеху; а между тем он, казалось, совсем не занимался своею работою, беспрестанно шутил и разговаривал с присутствующими. [В. Ф. Одоевский. Импровизатор (1833)] [омонимия снята] | W77: =RAND() -> 0.46007394453548367 | X77: 1
A78: огонзар тилев ьтязв глод в | B78: уравот | C78: в долг взять велит разного | D78: товару | E78: , | F78: а другой раз даст сотенную | G78: товар | I78: gen2 | J78: И. А. Гончаров. Май месяц в Петербурге (1891) | K78: И. А. Гончаров | L78: 1812 | M78: Май месяц в Петербурге | N78: 1891 | O78: художественная, публицистика | P78: очерк | T78: книга | U78: омонимия снята | V78: ― Как не ходить-то, ― отвечал первый, ― иной раз он в долг взять велит разного товару, а другой раз даст сотенную расплатиться там за всё, что забрано в лавках; а когда станешь отдавать ему сдачи, рублёв с лишком десять: "возьми, скажет, себе на чай! [И. А. Гончаров. Май месяц в Петербурге (1891)] [омонимия снята] | W78: =RAND() -> 0.39520700937336617 | X78: 1
A79: 6891 мокелад В | B79: удог | C79: В далеком 1986 | D79: году | F79: мы всего на пять лет | G79: год | I79: gen2 | J79: Александр Стемпковский. Микроэлектронный САПР: вчера, сегодня, завтра // «Эксперт», 2015 | K79: Александр Стемпковский | M79: Микроэлектронный САПР: вчера, сегодня, завтра | N79: 2015 | O79: публицистика, нехудожественная | P79: статья | Q79: техника, электроника, бизнес, коммерция, экономика, финансы | R79: «Эксперт» | S79: 2015 | T79: журнал | U79: омонимия не снята | V79: В далеком 1986 году мы всего на пять лет отставали от США в области разработки и производства интегральных схем, причем этот разрыв год от года сокращался. [Александр Стемпковский. Микроэлектронный САПР: вчера, сегодня, завтра // «Эксперт», 2015] [омонимия не снята] | W79: =RAND() -> 0.3347328779428157 | X79: 1
A80: 7991 в ииссоР атнедизерп мозаку | B80: удог | C80: указом президента России в 1997 | D80: году | E80: . | G80: год | I80: gen2 | J80: Андрей Зверев, Александр Механик. Отечественная электроника не боится санкций // «Эксперт», 2014 | K80: Андрей Зверев, Александр Механик | L80: 1957, 1947 | M80: Отечественная электроника не боится санкций | N80: 2014 | O80: публицистика, нехудожественная | P80: интервью | Q80: техника, электроника, производство, машиностроение, бизнес, коммерция, экономика, финансы | R80: «Эксперт» | S80: 2014 | T80: журнал | U80: омонимия не снята | V80: *Холдинговая компания «Российская электроника» образована в начале 2009 года на базе государственного холдинга «Российская электроника», созданного указом президента России в 1997 году. [Андрей Зверев, Александр Механик. Отечественная электроника не боится санкций // «Эксперт», 2014] [омонимия не снята] | W80: =RAND() -> 0.95106489734437238 | X80: 1
A81: мотэ в он ьнед йындолох | B81: удог | C81: холодный день, но в этом | D81: году | F81: он солнечный. | G81: год | I81: gen2 | J81: А. Гальперина. Эти рвы уравняли всех (2015.10.30) | K81: А. Гальперина | L81: 1972 | M81: Эти рвы уравняли всех | N81: 2015.10.30 | O81: публицистика , нехудожественная | P81: статья | Q81: политика и общественная жизнь, история | R81: Православие и мир (pravmir.ru) | S81: 2015 | T81: электронный текст | U81: омонимия не снята | V81: 30 октября всегда холодный день, но в этом году он солнечный. [А. Гальперина. Эти рвы уравняли всех (2015.10.30)] [омонимия не снята] | W81: =RAND() -> 0.92107881091305133 | X81: 1
A82: ин аретюьпмок ытобар восач 003 | B82: узар | C82: 300 часов работы компьютера ни | D82: разу | F82: не произошло сбоя? | G82: раз | I82: gen2 | J82: В. А. Успенский. Витгенштейн и основания математики (2002) | K82: В. А. Успенский | L82: 1930 | M82: Витгенштейн и основания математики | N82: 2002 | O82: учебно-научная, нехудожественная | P82: статья | Q82: наука и технологии, математика | R82: В. А. Успенский. Труды по нематематике | S82: 2002 | T82: книга | U82: омонимия снята | V82: И можно ли быть уверенным, что― даже при правильных программах ― за 300 часов работы компьютера ни разу не произошло сбоя? [В. А. Успенский. Витгенштейн и основания математики (2002)] [омонимия снята] | W82: =RAND() -> 0.33252397909540432 | X82: 1
A83: ьтивабдоп ил етитох еН | B83: умор | C83: ― Не хотите ли подбавить | D83: рому | E83: ? ― | F83: сказал я своему собеседнику, ― у | G83: ром | H83: еда (напиток) | I83: gen2 | J83: М. Ю. Лермонтов. Герой нашего времени (1839-1841) | K83: М. Ю. Лермонтов | L83: 1814 | M83: Герой нашего времени | N83: 1839-1841 | O83: художественная | P83: роман | R83: М.Ю. Лермонтов. Собрание сочинений в 4 томах | S83: 1958 | T83: книга | U83: омонимия снята | V83: ― Не хотите ли подбавить рому? ― сказал я своему собеседнику, ― у меня есть белый из Тифлиса; теперь холодно. [М. Ю. Лермонтов. Герой нашего времени (1839-1841)] [омонимия снята] | W83: =RAND() -> 8.0728204173546869E-2 | X83: 1
A84: С | B84: удив | C84: С | D84: виду | F84: это был обычный солдатский трёп | G84: вид | I84: gen2 | J84: Василь Быков. Болото (2001) | K84: Василь Быков | L84: 1924 | M84: Болото | N84: 2001 | O84: художественная | P84: повесть | R84: Василь Быков. «Бедные люди» | S84: 2002 | T84: книга | U84: омонимия снята | V84: С виду это был обычный солдатский трёп, беззаботная болтовня подчиненных, ничем конкретно не обеспокоенных. [Василь Быков. Болото (2001)] [омонимия снята] | W84: =RAND() -> 0.95606460393907544 | X84: 1
A85: уклерат ебес ьтадоп лазакирп юьтремс | B85: удём | C85: смертью приказал подать себе тарелку | D85: мёду | F85: и съел все свои деньги | G85: мёд | H85: еда (напиток) | I85: gen2 | J85: А. П. Чехов. Крыжовник (1898) | K85: А. П. Чехов | L85: 1860 | M85: Крыжовник | N85: 1898 | O85: художественная | P85: рассказ | R85: А.П. Чехов. Полное собрание сочинений и писем | S85: 1974 | T85: книга | U85: омонимия снята | V85: Перед смертью приказал подать себе тарелку мёду и съел все свои деньги и выигрышные билеты вместе с мёдом, чтобы никому не досталось. [А. П. Чехов. Крыжовник (1898)] [омонимия снята] | W85: =RAND() -> 2.6412242871261205E-2 | X85: 1
A86: в алеми ано отч ляноп | B86: удив | C86: понял, что она имела в | D86: виду | E86: . | G86: вид | I86: gen2 | J86: Сергей Лукьяненко. Новогодний Дозор (2014) | K86: Сергей Лукьяненко | M86: Новогодний Дозор | N86: 2014 | O86: художественная | P86: рассказ | R86: Новогодний Дозор: Лучшая фантастика 2014 | S86: 2014 | T86: книга | U86: омонимия не снята | V86: Я понял, что она имела в виду. [Сергей Лукьяненко. Новогодний Дозор (2014)] [омонимия не снята] | W86: =RAND() -> 0.71084295670814002 | X86: 1
A87: лялвабирп ёсв дзеоП мецьлап язорг | B87: удох | C87: грозя пальцем. Поезд всё прибавлял | D87: ходу | E87: . | F87: Мужик, ожесточенно нахмурившись и не | G87: ход | I87: gen2 | J87: В. В. Вересаев. В степи (1901) | K87: В. В. Вересаев | L87: 1867 | M87: В степи | N87: 1901 | O87: художественная | P87: рассказ | R87: Вересаев В.В. Избранное. | S87: 1980 | T87: книга | U87: омонимия снята | V87: Я-а тебе! ― угрожающе крикнул кондуктор, высунувшись из окна и грозя пальцем. Поезд всё прибавлял ходу. Мужик, ожесточенно нахмурившись и не глядя на кондуктора, продолжал бежать, вскидывая в стороны худые, стянутые в онучи ноги. [В. В. Вересаев. В степи (1901)] [омонимия снята] | W87: =RAND() -> 0.86048094182475576 | X87: 1
A88: 4102 в итсомиживден йоксвоксоМ екныр | B88: удог | C88: рынке Московской недвижимости в 2014 | D88: году | G88: год | I88: gen2 | J88: Алексей Болдин. О динамике цен на рынке Московской недвижимости в 2014 году // «Русский репортер», 2014 | K88: Алексей Болдин | M88: О динамике цен на рынке Московской недвижимости в 2014 году | N88: 2014 | O88: публицистика, нехудожественная | P88: заметка | Q88: строительство и архитектура, бизнес, коммерция, экономика, финансы | R88: «Русский репортер» | S88: 2014 | T88: журнал | U88: омонимия не снята | V88: О динамике цен на рынке Московской недвижимости в 2014 году [Алексей Болдин. О динамике цен на рынке Московской недвижимости в 2014 году // «Русский репортер», 2014] [омонимия не снята] | W88: =RAND() -> 0.70108393873667307 | X88: 1
A89: ардев яинещолгоп ырудецорп йончыбо елсоп | B89: юач | C89: после обычной процедуры поглощения ведра | D89: чаю | F89: и раскуривания трубок мы погрузились | G89: чай | H89: еда (напиток) | I89: gen2 | J89: И. А. Ефремов. Озеро горных духов (1942-1943) | K89: И. А. Ефремов | L89: 1907 | M89: Озеро горных духов | N89: 1942-1943 | O89: художественная | P89: рассказ | R89: В мире фантастики и приключений. -- Л.: Лениздат, 1963 | S89: 1963 | T89: книга | U89: омонимия снята | V89: Мигом развьючили лошадей, поставили палатки под громадными кедрами, и после обычной процедуры поглощения ведра чаю и раскуривания трубок мы погрузились в глубокий сон. [И. А. Ефремов. Озеро горных духов (1942-1943)] [омонимия снята] | W89: =RAND() -> 0.95480511440826765 | X89: 1
A90: косук тюад уме илсе он | B90: урахас | C90: но если ему дают кусок | D90: сахару | F90: или мелкую монету, он благодарит | G90: сахар | H90: еда (напиток) | I90: gen2 | J90: Н. С. Гумилев. Африканский дневник (1913) | K90: Н. С. Гумилев | L90: 1886 | M90: Африканский дневник | N90: 1913 | O90: публицистика, нехудожественная | P90: дневник, записные книжки, эссе | R90: Николай Гумилев : электронное собрание сочинений | S90: 1997-2006 | T90: книга | U90: омонимия снята | V90: Он ничего не просит, но если ему дают кусок сахару или мелкую монету, он благодарит серьёзно и вежливо, с совсем особенной, выработанной тысячелетьями восточной грацией. [Н. С. Гумилев. Африканский дневник (1913)] [омонимия снята] | W90: =RAND() -> 0.72861567405029293 | X90: 1
A91: ин СНМ огороток еинежяторп ан | B91: узар | C91: на протяжение которого МНС ни | D91: разу | F91: не удалось выполнить налоговое задание | G91: раз | I91: gen2 | J91: Денис Муханов. План повысился, а сборы упали (2002) // «Финансовая Россия», 2002.09.19 | K91: Денис Муханов | M91: План повысился, а сборы упали | N91: 2002 | O91: публицистика, нехудожественная | P91: заметка | Q91: бизнес, коммерция, экономика, финансы | R91: «Финансовая Россия» | S91: 2002.09.19 | T91: газета | U91: омонимия снята | V91: При продолжении наметившейся тенденции в текущем квартале может повториться ситуация второго квартала, на протяжение которого МНС ни разу не удалось выполнить налоговое задание по поступлениям в федеральный бюджет. [Денис Муханов. План повысился, а сборы упали (2002) // «Финансовая Россия», 2002.09.19] [омонимия снята] | W91: =RAND() -> 0.339642848418795 | X91: 1
A92: то ябес янмоп еН | B92: ухартс | C92: Не помня себя от | D92: страху | E92: , | F92: переметываясь со стороны на сторону | G92: страх | I92: gen2 | J92: Л. Н. Андреев. Кусака (1901) | K92: Л. Н. Андреев | L92: 1871 | M92: Кусака | N92: 1901 | O92: художественная | P92: рассказ | T92: книга | U92: омонимия снята | V92: Не помня себя от страху, переметываясь со стороны на сторону, натыкаясь на загорожи и людей, она мчалась на край посёлка и пряталась в глубине большого сада, в одном ей известном месте. [Л. Н. Андреев. Кусака (1901)] [омонимия снята] | W92: =RAND() -> 0.13330829204730599 | X92: 1
A93: огокакин иланз ен етраза в | B93: ужреду | C93: в азарте не знали никакого | D93: удержу | E93: . | G93: удерж | I93: gen2 | J93: А. И. Куприн. Гранатовый браслет (1911) | K93: А. И. Куприн | L93: 1870 | M93: Гранатовый браслет | N93: 1911 | O93: художественная | P93: повесть | R93: А. И. Куприн. Собрание сочинений в 9 т. | S93: 1972 | T93: книга | U93: омонимия снята | V93: Такие суровые законы были выведены из практики, для обуздания княгини Веры и Анны Николаевны, которые в азарте не знали никакого удержу. [А. И. Куприн. Гранатовый браслет (1911)] [омонимия снята] | W93: =RAND() -> 0.8998982479211467 | X93: 1
A94: еж ьрепет юлпук ен я | B94: ухороп | C94: я не куплю теперь же | D94: пороху | E94: , | F94: крючков, пистонов и табаку, лавки | G94: порох | I94: gen2 | J94: А. С. Грин. Ива (1923) | K94: А. С. Грин | L94: 1880 | M94: Ива | N94: 1923 | O94: художественная | P94: рассказ | R94: Грин А. С. Собрание сочинений в шести томах. Библиотека Огонек. | S94: 1980 | T94: книга | U94: омонимия снята | V94: Если я не куплю теперь же пороху, крючков, пистонов и табаку, лавки, несомненно, закроются, так как часть торгашей будет ожидать конца мира, а другая― начала дневного света, покупатели же исчезнут на крыши». [А. С. Грин. Ива (1923)] [омонимия снята] | W94: =RAND() -> 0.40007350973842015 | X94: 1
A95: алидор юнйовд хымЖ алеЦ | B95: юобтО | C95: ― Цела, Жмых, двойню родила. | D95: Отбою | F95: нету от ребят. ― Ну ничего | G95: отбой | I95: gen2 | J95: А. П. Платонов. Луговые мастера (1928) | K95: А. П. Платонов | L95: 1899 | M95: Луговые мастера | N95: 1928 | O95: художественная | P95: рассказ | R95: Андрей Платонов. Государственный житель | S95: 1988 | T95: книга | U95: омонимия снята | V95: ― Цела, Жмых, двойню родила. Отбою нету от ребят. ― Ну ничего, Степан, рожай, старайся, ― воздуху на всех хватит, ― отвечал Жмых и как бы ехал дальше. [А. П. Платонов. Луговые мастера (1928)] [омонимия снята] | W95: =RAND() -> 7.896311902323927E-2 | X95: 1
A96: ос ьсилавытакоп еыроток хакисортам хишан | B96: ухемс | C96: наших матросиках, которые покатывались со | D96: смеху | E96: , | F96: указывая пальцами на голые колена | G96: смех | I96: gen2 | J96: А. Ф. Кони. Иван Александрович Гончаров (1911) | K96: А. Ф. Кони | L96: 1844 | M96: Иван Александрович Гончаров | N96: 1911 | O96: публицистика, нехудожественная | P96: очерк | Q96: искусство и культура | T96: книга | U96: омонимия снята | V96: Особенно помнится мне его рассказ о наших матросиках, которые покатывались со смеху, указывая пальцами на голые колена двух неподвижно стоявших у одного из дворцов часовых в шотландском костюме, красных от гнева, но покорных дисциплине. [А. Ф. Кони. Иван Александрович Гончаров (1911)] [омонимия снята] | W96: =RAND() -> 0.60685610332781625 | X96: 1
A97: мотэ в раксО ан ьсолаворинимон | B97: удог | C97: номинировалось на «Оскар» в этом | D97: году | E97: : « | F97: Афера по-американски», «12 лет рабства | G97: год | I97: gen2 | J97: Василий Корецкий. Как стать комиком и не облажаться // «Русский репортер», 2014 | K97: Василий Корецкий | M97: Как стать комиком и не облажаться | N97: 2014 | O97: публицистика, нехудожественная | P97: интервью | Q97: искусство и культура, досуг, зрелища и развлечения | R97: «Русский репортер» | S97: 2014 | T97: журнал | U97: омонимия не снята | V97: Посмотри, что номинировалось на «Оскар» в этом году: «Афера по-американски», «12 лет рабства». [Василий Корецкий. Как стать комиком и не облажаться // «Русский репортер», 2014] [омонимия не снята] | W97: =RAND() -> 0.16280890301140827 | X97: 1
A98: ос яслитакоп Я | B98: ухемс | C98: Я покатился со | D98: смеху | E98: : | F98: уж очень комичен был контраст | G98: смех | I98: gen2 | J98: А. В. Амфитеатров. Чудодей (1932) | K98: А. В. Амфитеатров | L98: 1862 | M98: Чудодей | N98: 1932 | O98: публицистика, нехудожественная | P98: очерк | Q98: искусство и культура | R98: Воспоминания о Максимилиане Волошине. | S98: 1990 | T98: книга | U98: омонимия снята | V98: Я покатился со смеху: уж очень комичен был контраст. [А. В. Амфитеатров. Чудодей (1932)] [омонимия снята] | W98: =RAND() -> 0.89419640404440537 | X98: 1
A99: как тичеровиторп омярп ирт есв | B99: ухуд | C99: все три прямо противоречит как | D99: духу | E99: « | F99: невмешательства», так и конкретным нормативным | G99: дух | I99: gen2 | J99: Борис Жуков. Пределы заповедности // «Знание-сила», 2014 | K99: Борис Жуков | M99: Пределы заповедности | N99: 2014 | O99: публицистика, нехудожественная | P99: статья | Q99: природа, администрация и управление | R99: «Знание-сила» | S99: 2014 | T99: журнал | U99: омонимия не снята | V99: И все три прямо противоречит как духу «невмешательства», так и конкретным нормативным документам. [Борис Жуков. Пределы заповедности // «Знание-сила», 2014] [омонимия не снята] | W99: =RAND() -> 0.33452019835857938 | X99: 1
A100: ин я аречев еинечет в | B100: узар | C100: в течение вечера я ни | D100: разу | F100: не вспомнил о моей жестокой | G100: раз | I100: gen2 | J100: И. С. Тургенев. Ася (1858) | K100: И. С. Тургенев | L100: 1818 | M100: Ася | N100: 1858 | O100: художественная | P100: повесть | R100: И.С. Тургенев. Избранное | S100: 1979 | T100: книга | U100: омонимия снята | V100: Чуть не смеясь от избытка приятных и игривых чувств, я нырнул в постель и уже закрыл было глаза, как вдруг мне пришло на ум, что в течение вечера я ни разу не вспомнил о моей жестокой красавице… [И. С. Тургенев. Ася (1858)] [омонимия снята] | W100: =RAND() -> 0.47634154672849449 | X100: 1
A101: с ежот акйязоХ | B101: удив | C101: Хозяйка, тоже с | D101: виду | F101: гнилая, была на редкость вздорная | G101: вид | I101: gen2 | J101: Людмила Улицкая. Казус Кукоцкого [Путешествие в седьмую сторону света] // «Новый Мир», 2000 | K101: Людмила Улицкая | L101: 1943 | M101: Казус Кукоцкого [Путешествие в седьмую сторону света] | N101: 2000 | O101: художественная | P101: роман | R101: «Новый Мир» | S101: 2000 | T101: журнал | U101: омонимия снята | V101: Хозяйка, тоже с виду гнилая, была на редкость вздорная. [Людмила Улицкая. Казус Кукоцкого [Путешествие в седьмую сторону света] // «Новый Мир», 2000] [омонимия снята] | W101: =RAND() -> 0.86522786079710201 | X101: 1
A102: ин ёще ьвобюл яовт ьтыб | B102: узар | C102: быть, твоя любовь ещё ни | D102: разу | F102: не была более тщетной, более | G102: раз | I102: gen2 | J102: И. Ф. Анненский. Вторая книга отражений (1909) | K102: И. Ф. Анненский | L102: 1855 | M102: Вторая книга отражений | N102: 1909 | O102: публицистика, нехудожественная | P102: очерк, цикл | Q102: искусство и культура | R102: «Серия «Литературные памятники». Иннокентий Ф.Анненский | S102: 1979 | T102: книга | U102: омонимия снята | V102: Может быть, твоя любовь ещё ни разу не была более тщетной, более поруганной, чем в эту ночь. [И. Ф. Анненский. Вторая книга отражений (1909)] [омонимия снята] | W102: =RAND() -> 0.21842381046736836 | X102: 1
A103: оговогенс огобулог хабуш в зором | B103: ухем | C103: мороз, в шубах― голубого снегового | D103: меху | E103: ― | F103: деревья, на шестах полощутся флаги | G103: мех | I103: gen2 | J103: Е. И. Замятин. Русь (1923) | K103: Е. И. Замятин | L103: 1884 | M103: Русь | N103: 1923 | O103: художественная | P103: рассказ | R103: Евгений Замятин. Избранное | S103: 1989 | T103: книга | U103: омонимия снята | V103: Крещенский мороз, в шубах― голубого снегового меху― деревья, на шестах полощутся флаги; балаганы, лотки, ржаные, расписные, архангельские козули, писк глиняных свистулек, радужные воздушные шары у ярославца на снизке, с музыкой крутится карусель. [Е. И. Замятин. Русь (1923)] [омонимия снята] | W103: =RAND() -> 0.49175416541113159 | X103: 1
A104: 0391 в ялшымереП зи адюс | B104: удог | C104: сюда из Перемышля в 1930 | D104: году | F104: поступать, поступил в Институт новых | G104: год | I104: gen2 | J104: Борис Любимов. Три главные темы в жизни -- Церковь, литература и театр (2015) | K104: Борис Любимов | L104: 1947 | M104: Три главные темы в жизни -- Церковь, литература и театр | N104: 2015 | O104: публицистика, нехудожественная | P104: интервью | Q104: религия, искусство и культура | T104: книга | U104: омонимия не снята | V104: Отец приехал сюда из Перемышля в 1930 году поступать, поступил в Институт новых языков, и четыре года своего обучения прожил в этом доме. [Борис Любимов. Три главные темы в жизни -- Церковь, литература и театр (2015)] [омонимия не снята] | W104: =RAND() -> 0.69178311114120616 | X104: 1
A105: окьлокс ещбоов йераселс хёрт укьрипС | B105: удоран | C105: Спирьку, трёх слесарей, ― вообще, сколько | D105: народу | F105: из-за "Карлы" осталось без работы | G105: народ | I105: gen2 | J105: Д. Н. Мамин-Сибиряк. Под домной (1891) | K105: Д. Н. Мамин-Сибиряк | L105: 1852 | M105: Под домной | N105: 1891 | O105: художественная | P105: рассказ | R105: Д.Н. Мамин-Сибиряк. Избранные произведения для детей | S105: 1962 | T105: книга | U105: омонимия снята | V105: На его глазах "Карла" отказал Пимке Мятлеву, работавшему у обжимочного молота подмастерьем, прогнал из-под домны литуха Спирьку, трёх слесарей, ― вообще, сколько народу из-за "Карлы" осталось без работы! [Д. Н. Мамин-Сибиряк. Под домной (1891)] [омонимия снята] | W105: =RAND() -> 0.38315316148879941 | X105: 1
A106: с еинепик или отэ еинежурК | B106: удив | C106: Кружение это, или кипение, с | D106: виду | F106: беспорядочное, бессмысленное, составляло между тем | G106: вид | I106: gen2 | J106: Даниил Гранин. Зубр (1987) | K106: Даниил Гранин | L106: 1919 | M106: Зубр | N106: 1987 | O106: художественная | P106: повесть | R106: Гранин Д.А. Зубр: Повесть | S106: 1987 | T106: книга | U106: омонимия снята | V106: Кружение это, или кипение, с виду беспорядочное, бессмысленное, составляло между тем наибольшее удовольствие и, я бы сказал даже, пользу такого рода международных сборищ. [Даниил Гранин. Зубр (1987)] [омонимия снята] | W106: =RAND() -> 0.71511861867220261 | X106: 1
A107: и олыб ен енираМ о | B107: унимоп | C107: о Марине не было и | D107: помину | E107: . | G107: помин | I107: gen2 | J107: Юрий Трифонов. Дом на набережной (1976) | K107: Юрий Трифонов | L107: 1925 | M107: Дом на набережной | N107: 1976 | O107: художественная | P107: повесть | R107: СС в 4 тт., т.2 | S107: 1986 | T107: книга | U107: омонимия снята | V107: А о Марине не было и помину. [Юрий Трифонов. Дом на набережной (1976)] [омонимия снята] | W107: =RAND() -> 9.9341670372854463E-2 | X107: 1
A108: зи тедйыв отч увтялк лад | B108: умод | C108: дал клятву, что выйдет из | D108: дому | F108: только на одиннадцатый день, чтобы | G108: дом | I108: gen2 | J108: Анатолий Рыбаков. Тяжелый песок (1975-1977) | K108: Анатолий Рыбаков | L108: 1911 | M108: Тяжелый песок | N108: 1975-1977 | O108: художественная | P108: роман | R108: Рыбаков А. Тяжелый песок. | S108: 1982 | T108: книга | U108: омонимия снята | V108: Короче: Хаим дал клятву, что выйдет из дому только на одиннадцатый день, чтобы убедиться, что негодяй провизор убрался из России, а если не уберётся, то он, Хаим, убьёт его. [Анатолий Рыбаков. Тяжелый песок (1975-1977)] [омонимия снята] | W108: =RAND() -> 0.11254428998163435 | X108: 1
A109: мотэ В | B109: удог | C109: В этом | D109: году | E109: , | F109: как всегда, новые правила поступления | G109: год | I109: gen2 | J109: Александр Трушин. Высшие соображения // «Огонек», 2015 | K109: Александр Трушин | M109: Высшие соображения | N109: 2015 | O109: публицистика, нехудожественная | P109: статья | Q109: образование, админстрация и управление | R109: «Огонек» | S109: 2015 | T109: журнал | U109: омонимия не снята | V109: В этом году, как всегда, новые правила поступления. [Александр Трушин. Высшие соображения // «Огонек», 2015] [омонимия не снята] | W109: =RAND() -> 0.49637750090193611 | X109: 1
A110: зи ьтаксупу окандо медуб еН | B110: удив | C110: Не будем, однако, упускать из | D110: виду | F110: специфики изучаемого нами памятника. | G110: вид | I110: gen2 | J110: А. Я. Гуревич. Популярное богословие и народная религиозность средних веков (1976) | K110: А. Я. Гуревич | L110: 1924 | M110: Популярное богословие и народная религиозность средних веков | N110: 1976 | O110: учебно-научная, нехудожественная | P110: статья | Q110: наука и технологии, история, филология | R110: Из истории культуры средних веков и Возрождения. М., 1976 | S110: 1976 | T110: книга | U110: омонимия снята | V110: Не будем, однако, упускать из виду специфики изучаемого нами памятника. [А. Я. Гуревич. Популярное богословие и народная религиозность средних веков (1976)] [омонимия снята] | W110: =RAND() -> 0.41368101562893034 | X110: 1
A111: с йишвипыв ламерд етелиж мондо | B111: уктатсу | C111: одном жилете дремал выпивший «с | D111: устатку | E111: » | F111: Степан-буфетчик. | G111: устаток | I111: gen2 | J111: Б. С. Житков. «Сию минуту-с!..» (1927) | K111: Б. С. Житков | L111: 1882 | M111: «Сию минуту-с!..» | N111: 1927 | O111: художественная | P111: рассказ | R111: Б. Житков. «Джарылгач». Рассказы и повести | S111: 1980 | T111: книга | U111: омонимия снята | V111: А в буфетной, после тревог, в одном жилете дремал выпивший «с устатку» Степан-буфетчик. [Б. С. Житков. «Сию минуту-с!..» (1927)] [омонимия снята] | W111: =RAND() -> 2.3899189034842117E-2 | X111: 1
A112: ин лавыб ен отч ончот | B112: узар | C112: точно что не бывал ни | D112: разу | E112: , ― | F112: вот с вашим братом, значит | G112: раз | I112: gen2 | J112: В. Г. Короленко. Чудная (1880) | K112: В. Г. Короленко | L112: 1853 | M112: Чудная | N112: 1880 | O112: художественная | P112: очерк | R112: В.Г. Короленко. Собрание сочинений в десяти томах. Том 1. Повести и рассказы | S112: 1953 | T112: книга | U112: омонимия снята | V112: А в командировках я точно что не бывал ни разу, ― вот с вашим братом, значит. Оно, хоть, скажем, дело-то нехитрое, а всё же, знаете, инструкции надо усвоить, да и расторопность нужна. Ну, хорошо… [В. Г. Короленко. Чудная (1880)] [омонимия снята] | W112: =RAND() -> 0.88233643472291401 | X112: 1
A113: ьшечоХ окнемьзуК лазакс ледив асубйеллорт | B113: юач | C113: троллейбуса видел, ― сказал Кузьменко. ― Хочешь | D113: чаю | E113: ? | F113: ― Лучше водки. | G113: чай | H113: еда (напиток) | I113: gen2 | J113: Сергей Довлатов. Дорога в новую квартиру (1987) | K113: Сергей Довлатов | L113: 1941 | M113: Дорога в новую квартиру | N113: 1987 | O113: художественная | P113: рассказ | R113: Собрание прозы в 3 т. Т.2 | S113: 1993 | T113: книга | U113: омонимия снята | V113: ― Я её из троллейбуса видел, ― сказал Кузьменко. ― Хочешь чаю? ― Лучше водки. [Сергей Довлатов. Дорога в новую квартиру (1987)] [омонимия снята] | W113: =RAND() -> 0.98628171766669692 | X113: 1
A114: огокясв окьлотс едг ябес у | B114: удоран | C114: у себя, где столько всякого | D114: народу | E114: , | F114: набивает их сам; сидит на | G114: народ | I114: gen2 | J114: З. Н. Гиппиус. Задумчивый странник (о Розанове) (1923) | K114: З. Н. Гиппиус | L114: 1869 | M114: Задумчивый странник (о Розанове) | N114: 1923 | O114: публицистика, нехудожественная | P114: мемуары | R114: Василий Розанов: Pro et contra. Кн. I. | S114: 1995 | T114: книга | U114: омонимия снята | V114: (По воскресеньям, за длинным чайным столом, у себя, где столько всякого народу, набивает их сам; сидит на конце стола, спиной к окнам, и тоже подогнув ногу.) [З. Н. Гиппиус. Задумчивый странник (о Розанове) (1923)] [омонимия снята] | W114: =RAND() -> 0.96798346197771734 | X114: 1
A115: к ежилб инверед ецнок В | B115: усел | C115: В конце деревни, ближе к | D115: лесу | E115: – | F115: утыканный кувшинками пруд. | G115: лес | I115: gen2 | J115: Александр Снегирев. Вера (2015) | K115: Александр Снегирев | L115: 1980 | M115: Вера | N115: 2015 | O115: художественная | P115: роман | R115: А. Снегирев. Вера. | S115: 2015 | T115: книга | U115: омонимия не снята | V115: В конце деревни, ближе к лесу – утыканный кувшинками пруд. [Александр Снегирев. Вера (2015)] [омонимия не снята] | W115: =RAND() -> 0.96589933710997755 | X115: 1
A116: то тилоб итсонжлод еишсыв хищюаминаз | B116: узором | C116: занимающих высшие должности болит от | D116: морозу | F116: лоб и слёзы выступают в | G116: мороз | I116: gen2 | J116: Н. В. Гоголь. Шинель (1842) | K116: Н. В. Гоголь | L116: 1809 | M116: Шинель | N116: 1842 | O116: художественная | P116: повесть | R116: Н.В. Гоголь. Собрание сочинений в 7 томах | S116: 1967 | T116: книга | U116: омонимия снята | V116: В это время, когда даже у занимающих высшие должности болит от морозу лоб и слёзы выступают в глазах, бедные титулярные советники иногда бывают беззащитны. [Н. В. Гоголь. Шинель (1842)] [омонимия снята] | W116: =RAND() -> 0.51437637422988658 | X116: 1
A117: тов ыб енМ | B117: урахас | C117: ― Мне бы вот | D117: сахару | F117: достать, ― говорю я. | G117: сахар | H117: еда (напиток) | I117: gen2 | J117: Булат Окуджава. Новенький как с иголочки (1962) | K117: Булат Окуджава | L117: 1924 | M117: Новенький как с иголочки | N117: 1962 | O117: художественная | P117: повесть | R117: Булат Окуджава. Стихи, рассказы, повести | S117: 1999 | T117: книга | U117: омонимия снята | V117: ― Мне бы вот сахару достать, ― говорю я. [Булат Окуджава. Новенький как с иголочки (1962)] [омонимия снята] | W117: =RAND() -> 0.95852306032890688 | X117: 1
A118: хыннавозиламрофобалс яицазимтироглА | B118: чадаз | C118: Алгоритмизация слабоформализованных | D118: задач | F118: оптимального выбора на основе рандомизированных | G118: задача | I118: gen1 | J118: Я. Е. Львович, С. Ю. Белецкая. Алгоритмизация слабоформализованных задач оптимального выбора на основе рандомизированных процедур поискового типа // «Информационные технологии», 2004 | K118: Я. Е. Львович, С. Ю. Белецкая | M118: Алгоритмизация слабоформализованных задач оптимального выбора на основе рандомизированных процедур поискового типа | N118: 2004 | O118: учебно-научная, нехудожественная | P118: статья | Q118: наука и технологии, информатика | R118: «Информационные технологии» | S118: 2004 | T118: журнал | U118: омонимия снята | V118: Алгоритмизация слабоформализованных задач оптимального выбора на основе рандомизированных процедур поискового типа [Я. Е. Львович, С. Ю. Белецкая. Алгоритмизация слабоформализованных задач оптимального выбора на основе рандомизированных процедур поискового типа // «Информационные технологии», 2004] [омонимия снята] | W118: =RAND() -> 0.26954861276775588 | X118: =IF(RC[-13]=R[-1]C[-13]," ",1) -> 1
A119: акнецоереП | B119: йетсоннец | C119: Переоценка | D119: ценностей | F119: После того как на прошедшем | G119: ценность | I119: gen1 | J119: Борис Жуков. Переоценка ценностей (2003) // «Еженедельный журнал», 2003.03.17 | K119: Борис Жуков | M119: Переоценка ценностей | N119: 2003 | O119: публицистика, нехудожественная | P119: статья | Q119: политика и общественная жизнь | R119: «Еженедельный журнал» | S119: 2003.03.17 | T119: журнал | U119: омонимия снята | V119: Переоценка ценностей После того как на прошедшем в четверг заседании правительства премьер фактически отказался слушать докладчика ― первого заместителя министра финансов Сергея Шаталова, стало ясно, что никаких принципиальных решений на сей раз принято не будет. [Борис Жуков. Переоценка ценностей (2003) // «Еженедельный журнал», 2003.03.17] [омонимия снята] | W119: =RAND() -> 8.2919793831622846E-2 | X119: =IF(RC[-13]=R[-1]C[-13]," ",1) -> 1
A120: йонпурк еитяъзИ | B120: иитрап | C120: Изъятие крупной | D120: партии | F120: наркотиков стало первой удачной операцией | G120: партия | I120: gen1 | J120: Екатерина Ерошкина. Прикрыта гашишная заготконтора (2003) // «Ежедневные новости» (Владивосток), 2003.01.15 | K120: Екатерина Ерошкина | M120: Прикрыта гашишная заготконтора | N120: 2003 | O120: публицистика, нехудожественная | P120: заметка | Q120: криминал | R120: «Ежедневные новости» (Владивосток) | S120: 2003.01.15 | T120: газета | U120: омонимия снята | V120: Изъятие крупной партии наркотиков стало первой удачной операцией Приморского УБНОН в новом году [Екатерина Ерошкина. Прикрыта гашишная заготконтора (2003) // «Ежедневные новости» (Владивосток), 2003.01.15] [омонимия снята] | W120: =RAND() -> 5.5248981075153081E-2 | X120: =IF(RC[-13]=R[-1]C[-13]," ",1) -> 1
A121: оголам дас АМЕТ ЯАНВАЛГ авомифЕ аняьтаТ | B121: адоху | C121: Татьяна Ефимова ГЛАВНАЯ ТЕМА | сад малого | D121: ухода | F121: Гравийная отсыпка - прекрасный фон для | G121: уход | I121: gen1 | J121: Татьяна Ефимова. Скажи: легко! (2003) // «Сад своими руками», 2003.09.15 | K121: Татьяна Ефимова | M121: Скажи: легко! | N121: 2003 | O121: публицистика, нехудожественная | P121: статья | Q121: дом и домашнее хозяйство | R121: «Сад своими руками» | S121: 2003.09.15 | T121: газета | U121: омонимия снята | V121: ГЛАВНАЯ ТЕМА | сад малого ухода Гравийная отсыпка - прекрасный фон для хосты, вереска… [Татьяна Ефимова. Скажи: легко! (2003) // «Сад своими руками», 2003.09.15] [омонимия снята] | W121: =RAND() -> 0.28638288567672032 | X121: =IF(RC[-13]=R[-1]C[-13]," ",1) -> 1
A122: огоннежорелгуан еинерапси еовелоП | B122: анедбилом | C122: Полевое испарение науглероженного | D122: молибдена | F122: 194021 Санкт-Петербург, Россия | G122: молибден | I122: gen1 | J122: М. В. Логинов, В. Н. Шредник. Полевое испарение науглероженного молибдена // «Журнал технической физики», 2004 | K122: М. В. Логинов, В. Н. Шредник | M122: Полевое испарение науглероженного молибдена | N122: 2004 | O122: учебно-научная, нехудожественная | P122: аннотация | Q122: наука и технологии, физика | R122: «Журнал технической физики» | S122: 2004 | T122: журнал | U122: омонимия снята | V122: Полевое испарение науглероженного молибдена 194021 Санкт-Петербург, Россия [М. В. Логинов, В. Н. Шредник. Полевое испарение науглероженного молибдена // «Журнал технической физики», 2004] [омонимия снята] | W122: =RAND() -> 0.82131954870246182 | X122: =IF(RC[-13]=R[-1]C[-13]," ",1) -> 1
A123: ялд мтирогла йыннорйен йынпатэхувд ястеагалдерП | B123: яинешер | C123: Предлагается двухэтапный нейронный алгоритм для | D123: решения | F123: задачи линейного программирования, который реализуется | G123: решение | I123: gen1 | J123: Р. М. Алгулиев, Р. М. Алыгулиев. Об одном нейронном алгоритме решения задачи линейного программирования // «Информационные технологии», 2004 | K123: Р. М. Алгулиев, Р. М. Алыгулиев | M123: Об одном нейронном алгоритме решения задачи линейного программирования | N123: 2004 | O123: учебно-научная, нехудожественная | P123: статья | Q123: наука и технологии, информатика | R123: «Информационные технологии» | S123: 2004 | T123: журнал | U123: омонимия снята | V123: Предлагается двухэтапный нейронный алгоритм для решения задачи линейного программирования, который реализуется на трехслойной нейронной сети. [Р. М. Алгулиев, Р. М. Алыгулиев. Об одном нейронном алгоритме решения задачи линейного программирования // «Информационные технологии», 2004] [омонимия снята] | W123: =RAND() -> 0.41408777462078761 | X123: =IF(RC[-13]=R[-1]C[-13]," ",1) -> 1
A124: адобовС | B124: итсевос | C124: Свобода | D124: совести | F124: и светскость государства: Следующая часть | G124: совесть | I124: gen1 | J124: Мария Козлова. Свобода совести и светскость государства: проблемы и решения (1 часть) (2004) // «Адвокат», 2004.12.01 | K124: Мария Козлова | M124: Свобода совести и светскость государства: проблемы и решения (1 часть) | N124: 2004 | O124: публицистика, нехудожественная | P124: статья | Q124: политика и общественная жизнь | R124: «Адвокат» | S124: 2004.12.01 | T124: журнал | U124: омонимия снята | V124: Свобода совести и светскость государства: Следующая часть [Мария Козлова. Свобода совести и светскость государства: проблемы и решения (1 часть) (2004) // «Адвокат», 2004.12.01] [омонимия снята] | W124: =RAND() -> 0.87864805377886301 | X124: =IF(RC[-13]=R[-1]C[-13]," ",1) -> 1
A125: 05 04 кинзов нО кызяарп нидо лыб автсечеволеч У амет яанвалГ | B125: чясыт | C125: Главная тема: У человечества был один праязык Он возник 40― 50 | D125: тысяч | F125: лет назад | G125: тысяча | I125: gen1 | J125: Сергей Старостин, Григорий Зеленко. У человечества был один праязык // «Знание -- сила», 2003 | K125: Сергей Старостин, Григорий Зеленко | L125: 1953 | M125: У человечества был один праязык | N125: 2003 | O125: учебно-научная, нехудожественная | P125: статья | Q125: наука и технологии, филология | R125: «Знание -- сила» | S125: 2003 | T125: журнал | U125: омонимия снята | V125: : Он возник 40― 50 тысяч лет назад [Сергей Старостин, Григорий Зеленко. У человечества был один праязык // «Знание -- сила», 2003] [омонимия снята] | W125: =RAND() -> 0.50179534337580844 | X125: =IF(RC[-13]=R[-1]C[-13]," ",1) -> 1
A126: тараппа йонтевц йывреп ен NC | B126: иинапмок | C126: CN― не первый цветной аппарат | D126: компании | F126: и уж тем более не | G126: компания | I126: gen1 | J126: Игорь Лукьяненко. «Брат» в цвете // «Computerworld», 2004 | K126: Игорь Лукьяненко | M126: «Брат» в цвете | N126: 2004 | O126: публицистика, нехудожественная | P126: статья | Q126: техника | R126: «Computerworld» | S126: 2004 | T126: журнал | U126: омонимия снята | V126: Представленный в июне полноцветный лазерный принтер Brother HL-2700 CN― не первый цветной аппарат компании и уж тем более не новинка для мирового рынка, где он продаётся с начала года приблизительно за 800 долл. Но это первый шаг Brother по завоеванию российского рынка цветной лазерной печати. [Игорь Лукьяненко. «Брат» в цвете // «Computerworld», 2004] [омонимия снята] | W126: =RAND() -> 0.84385885490612467 | X126: =IF(RC[-13]=R[-1]C[-13]," ",1) -> 1
A127: хиксвокрам еиненемирП | B127: йеледом | C127: Применение марковских | D127: моделей | F127: для анализа эволюции психологических характеристик | G127: модель | I127: gen1 | J127: Л. С. Куравский, С. Б. Малых. Применение марковских моделей для анализа эволюции психологических характеристик в популяции // «Вопросы психологии», 2003 | K127: Л. С. Куравский, С. Б. Малых | M127: Применение марковских моделей для анализа эволюции психологических характеристик в популяции | N127: 2003 | O127: учебно-научная, нехудожественная | P127: статья | Q127: наука и технологии, психология | R127: «Вопросы психологии» | S127: 2003 | T127: журнал | U127: омонимия снята | V127: Применение марковских моделей для анализа эволюции психологических характеристик в популяции [Л. С. Куравский, С. Б. Малых. Применение марковских моделей для анализа эволюции психологических характеристик в популяции // «Вопросы психологии», 2003] [омонимия снята] | W127: =RAND() -> 0.37246404312980863 | X127: =IF(RC[-13]=R[-1]C[-13]," ",1) -> 1
A128: ЩАЛП | B128: АРОДАЕРОТ | C128: ПЛАЩ | D128: ТОРЕАДОРА | F128: Номер 5. 2003 страницы: 108 | G128: тореадор | I128: gen1 | J128: Александр Будкин. Плащ тореадора (2003) // «За рулем», 2003.05.15 | K128: Александр Будкин | M128: Плащ тореадора | N128: 2003 | O128: публицистика, нехудожественная | P128: статья | Q128: техника | R128: «За рулем» | S128: 2003.05.15 | T128: журнал | U128: омонимия снята | V128: ПЛАЩ ТОРЕАДОРА Номер 5. 2003 страницы: 108, 109, 110, 111 [Александр Будкин. Плащ тореадора (2003) // «За рулем», 2003.05.15] [омонимия снята] | W128: =RAND() -> 0.94647675800893605 | X128: =IF(RC[-13]=R[-1]C[-13]," ",1) -> 1
A129: ерытеЧ атчем яаксвёлмерК | B129: атнедизерп | C129: Кремлёвская мечта. Четыре | D129: президента | F129: сочинили новый экономический союз Праздничная | G129: президент | I129: gen1 | J129: Екатерина Григорьева, Елена Загородняя, Игорь Моисеев. Кремлевская мечта. Четыре президента сочинили новый экономический союз (2003) // «Известия», 2003.02.24 | K129: Екатерина Григорьева, Елена Загородняя, Игорь Моисеев | M129: Кремлевская мечта. Четыре президента сочинили новый экономический союз | N129: 2003 | O129: публицистика, нехудожественная | P129: статья | Q129: политика и общественная жизнь | R129: «Известия» | S129: 2003.02.24 | T129: газета | U129: омонимия снята | V129: Кремлёвская мечта. Четыре президента сочинили новый экономический союз Праздничная встреча президентов России, Украины, Белоруссии и Казахстана по случаю «мужского» праздника 23 февраля ознаменовалась политической сенсацией. [Екатерина Григорьева, Елена Загородняя, Игорь Моисеев. Кремлевская мечта. Четыре президента сочинили новый экономический союз (2003) // «Известия», 2003.02.24] [омонимия снята] | W129: =RAND() -> 0.13080835397662582 | X129: =IF(RC[-13]=R[-1]C[-13]," ",1) -> 1
A130: ИКОРУ ЕЫНДЫТС | B130: АВТСРАБ | C130: СТЫДНЫЕ УРОКИ | D130: БАРСТВА | F130: ВЛАСТЬ И БЕДНОСТЬ Президента В | G130: барство | I130: gen1 | J130: Б. Варецкий. Стыдные уроки барства. Власть и бедность (2003) // «Советская Россия», 2003.08.21 | K130: Б. Варецкий | M130: Стыдные уроки барства. Власть и бедность | N130: 2003 | O130: публицистика, нехудожественная | P130: статья | Q130: политика и общественная жизнь | R130: «Советская Россия» | S130: 2003.08.21 | T130: газета | U130: омонимия снята | V130: СТЫДНЫЕ УРОКИ БАРСТВА ВЛАСТЬ И БЕДНОСТЬ Президента В. Путина спросили: [Б. Варецкий. Стыдные уроки барства. Власть и бедность (2003) // «Советская Россия», 2003.08.21] [омонимия снята] | W130: =RAND() -> 0.4728116935491925 | X130: =IF(RC[-13]=R[-1]C[-13]," ",1) -> 1
A131: ытатьлузер ынещбобО | B131: тобар | C131: Обобщены результаты | D131: работ | F131: в области электрохимического нанесения композиционных | G131: работа | I131: gen1 | J131: Г. К. Буркат, В. Ю. Долматов. Ультрадисперсные алмазы в гальванотехнике // «Физика твёрдого тела», 2004 | K131: Г. К. Буркат, В. Ю. Долматов | M131: Ультрадисперсные алмазы в гальванотехнике | N131: 2004 | O131: учебно-научная, нехудожественная | P131: аннотация | Q131: наука и технологии, физика | R131: «Физика твёрдого тела» | S131: 2004 | T131: журнал | U131: омонимия снята | V131: Обобщены результаты работ в области электрохимического нанесения композиционных покрытий с ультрадисперсными алмазами детонационного синтеза (УДА, наноалмазы). [Г. К. Буркат, В. Ю. Долматов. Ультрадисперсные алмазы в гальванотехнике // «Физика твёрдого тела», 2004] [омонимия снята] | W131: =RAND() -> 1.6754350107068494E-2 | X131: =IF(RC[-13]=R[-1]C[-13]," ",1) -> 1
A132: ымелборП | B132: ирок | C132: Проблемы | D132: кори | E132: , | F132: краснухи и эпидемического паротита в | G132: корь | I132: gen1 | J132: В. В. Зверев, Н. В. Юминова. Проблемы кори, краснухи и эпидемического паротита в Российской Федерации (2004) // «Вопросы вирусологии», 2004.05.03 | K132: В. В. Зверев, Н. В. Юминова | M132: Проблемы кори, краснухи и эпидемического паротита в Российской Федерации | N132: 2004 | O132: учебно-научная, нехудожественная | P132: статья | Q132: наука и технологии, здоровье и медицина | R132: «Вопросы вирусологии» | S132: 2004.05.03 | T132: журнал | U132: омонимия снята | V132: Проблемы кори, краснухи и эпидемического паротита в Российской Федерации [В. В. Зверев, Н. В. Юминова. Проблемы кори, краснухи и эпидемического паротита в Российской Федерации (2004) // «Вопросы вирусологии», 2004.05.03] [омонимия снята] | W132: =RAND() -> 0.67238974283679831 | X132: =IF(RC[-13]=R[-1]C[-13]," ",1) -> 1
A133: хиксром ьнзиЖ кёнок аз отч акьнок огоксром у А | B133: йелетатибо | C133: А у морского конька что за конёк? Жизнь морских | D133: обитателей | F133: нам мало доступна. Вот и | G133: обитатель | I133: gen1 | J133: Александр Голяндин. Рассказы о животных, и не только о них: А у морского конька что за конек? // «Знание -- сила», 2003 | K133: Александр Голяндин | M133: Рассказы о животных, и не только о них: А у морского конька что за конек? | N133: 2003 | O133: учебно-научная, нехудожественная | P133: статья | Q133: наука и технологии, биология | R133: «Знание -- сила» | S133: 2003 | T133: журнал | U133: омонимия снята | V133: ? Жизнь морских обитателей нам мало доступна. Вот и знаем мы их очень плохо. [Александр Голяндин. Рассказы о животных, и не только о них: А у морского конька что за конек? // «Знание -- сила», 2003] [омонимия снята] | W133: =RAND() -> 0.13586919615008486 | X133: =IF(RC[-13]=R[-1]C[-13]," ",1) -> 1
A134: йолс йиксечитоаХ | B134: акинтяам | C134: Хаотический слой | D134: маятника | F134: при низких и средних частотах | G134: маятник | I134: gen1 | J134: В. В. Вячеславов. Хаотический слой маятника при низких и средних частотах возмущений // «Журнал технической физики», 2004 | K134: В. В. Вячеславов | M134: Хаотический слой маятника при низких и средних частотах возмущений | N134: 2004 | O134: учебно-научная, нехудожественная | P134: аннотация | Q134: наука и технологии, физика | R134: «Журнал технической физики» | S134: 2004 | T134: журнал | U134: омонимия снята | V134: Хаотический слой маятника при низких и средних частотах возмущений [В. В. Вячеславов. Хаотический слой маятника при низких и средних частотах возмущений // «Журнал технической физики», 2004] [омонимия снята] | W134: =RAND() -> 0.69556526681065389 | X134: =IF(RC[-13]=R[-1]C[-13]," ",1) -> 1
A135: с йишдешаЗ | B135: ыцилу | C135: Зашедший с | D135: улицы | F135: в антикварный магазин случайный прохожий | G135: улица | I135: gen1 | J135: Лариса Шпаковская. Старые вещи. Ценность: между государством и обществом (2004) // «Неприкосновенный запас», 2004.01.15 | K135: Лариса Шпаковская | L135: 1975 | M135: Старые вещи. Ценность: между государством и обществом | N135: 2004 | O135: публицистика, нехудожественная | P135: статья | Q135: искусство и культура | R135: «Неприкосновенный запас» | S135: 2004.01.15 | T135: журнал | U135: омонимия снята | V135: Зашедший с улицы в антикварный магазин случайный прохожий оказывается в довольно странном мире вещей. [Лариса Шпаковская. Старые вещи. Ценность: между государством и обществом (2004) // «Неприкосновенный запас», 2004.01.15] [омонимия снята] | W135: =RAND() -> 9.3614630287917056E-2 | X135: =IF(RC[-13]=R[-1]C[-13]," ",1) -> 1
A136: хынтсевзи хымас зи нидо йобос | B136: воранилук | C136: собой один из самых известных | D136: кулинаров | F136: страны | G136: кулинар | I136: gen1 | J136: Эльмар Гусейнов. Чисто французское самоубийство. Покончил с собой один из самых известных кулинаров страны (2003) // «Известия», 2003.02.25 | K136: Эльмар Гусейнов | M136: Чисто французское самоубийство. Покончил с собой один из самых известных кулинаров страны | N136: 2003 | O136: публицистика, нехудожественная | P136: комментарий | Q136: криминал | R136: «Известия» | S136: 2003.02.25 | T136: газета | U136: омонимия снята | V136: Покончил с собой один из самых известных кулинаров страны [Эльмар Гусейнов. Чисто французское самоубийство. Покончил с собой один из самых известных кулинаров страны (2003) // «Известия», 2003.02.25] [омонимия снята] | W136: =RAND() -> 0.23329172717156954 | X136: =IF(RC[-13]=R[-1]C[-13]," ",1) -> 1
A137: У | B137: ЕШРОП | C137: У " | D137: ПОРШЕ | E137: " | F137: НЕ ВЫДЕРЖАЛО СЕРДЦЕ Номер 5 | G137: порше | I137: gen1 | J137: Сергей Зиновьев. У «Порше» не выдержало сердце (2003) // «За рулем», 2003.05.15 | K137: Сергей Зиновьев | M137: У «Порше» не выдержало сердце | N137: 2003 | O137: публицистика, нехудожественная | P137: статья | Q137: спорт | R137: «За рулем» | S137: 2003.05.15 | T137: журнал | U137: омонимия снята | V137: У "ПОРШЕ" НЕ ВЫДЕРЖАЛО СЕРДЦЕ Номер 5. 2003 страницы: 206 [Сергей Зиновьев. У «Порше» не выдержало сердце (2003) // «За рулем», 2003.05.15] [омонимия снята] | W137: =RAND() -> 0.19296183568414693 | X137: =IF(RC[-13]=R[-1]C[-13]," ",1) -> 1
A138: ешьлоб ёсв емод молеБ В | B138: вокиньлачан | C138: В Белом доме всё больше | D138: начальников | E138: . | F138: Вслед за вице-премьерами вчера увеличилось | G138: начальник | I138: gen1 | J138: Андрей Литвинов. Касьянов подрос (2003) // «Газета», 2003.07.01 | K138: Андрей Литвинов | M138: Касьянов подрос | N138: 2003 | O138: публицистика, нехудожественная | P138: заметка | Q138: политика и общественная жизнь | R138: «Газета» | S138: 2003.07.01 | T138: газета | U138: омонимия снята | V138: Касьянов подрос В Белом доме всё больше начальников. Вслед за вице-премьерами вчера увеличилось число заместителей главы аппарата правительства. [Андрей Литвинов. Касьянов подрос (2003) // «Газета», 2003.07.01] [омонимия снята] | W138: =RAND() -> 0.75656863285269904 | X138: =IF(RC[-13]=R[-1]C[-13]," ",1) -> 1
A139: зеБ | B139: яиненмос | C139: Без | D139: сомнения | E139: , | F139: проблемы военного строительства вызывают сейчас | G139: сомнение | I139: gen1 | J139: Махмут Гареев. К каким угрозам и войнам должна быть готова Россия // «Отечественные записки», 2003 | K139: Махмут Гареев | L139: 1923 | M139: К каким угрозам и войнам должна быть готова Россия | N139: 2003 | O139: публицистика, нехудожественная | P139: статья | Q139: армия и вооруженные конфликты | R139: «Отечественные записки» | S139: 2003 | T139: журнал | U139: омонимия снята | V139: Без сомнения, проблемы военного строительства вызывают сейчас самый острый интерес в нашем обществе. [Махмут Гареев. К каким угрозам и войнам должна быть готова Россия // «Отечественные записки», 2003] [омонимия снята] | W139: =RAND() -> 0.68239078141321541 | X139: =IF(RC[-13]=R[-1]C[-13]," ",1) -> 1
A140: моцил ьталедс летох йиксвозереБ | B140: иитрап | C140: Березовский хотел сделать лицом | D140: партии | F140: Ельцина, но получился Рыбкин | G140: партия | I140: gen1 | J140: Рустем Фаляхов, Анастасия Матвеева. Березовский хотел сделать лицом партии Ельцина, но получился Рыбкин (2003) // «Газета», 2003.07.08 | K140: Рустем Фаляхов, Анастасия Матвеева | M140: Березовский хотел сделать лицом партии Ельцина, но получился Рыбкин | N140: 2003 | O140: публицистика, нехудожественная | P140: статья | Q140: политика и общественная жизнь | R140: «Газета» | S140: 2003.07.08 | T140: газета | U140: омонимия снята | V140: Березовский хотел сделать лицом партии Ельцина, но получился Рыбкин [Рустем Фаляхов, Анастасия Матвеева. Березовский хотел сделать лицом партии Ельцина, но получился Рыбкин (2003) // «Газета», 2003.07.08] [омонимия снята] | W140: =RAND() -> 0.38764175928750322 | X140: =IF(RC[-13]=R[-1]C[-13]," ",1) -> 1
A141: огоксечимонокэ уртсиним еинадаз лад нитуП | B141: яитивзар | C141: Путин дал задание министру экономического | D141: развития | F141: и торговли Герману Грефу разработать | G141: развитие | I141: gen1 | J141: Даниил Володин. Грефу приказано закрепить население (2003) // «Ежедневные новости» (Владивосток), 2003.08.07 | K141: Даниил Володин | M141: Грефу приказано закрепить население | N141: 2003 | O141: публицистика, нехудожественная | P141: заметка | Q141: политика и общественная жизнь | R141: «Ежедневные новости» (Владивосток) | S141: 2003.08.07 | T141: газета | U141: омонимия снята | V141: Владимир Путин дал задание министру экономического развития и торговли Герману Грефу разработать программу по закреплению населения на Дальнем Востоке России. [Даниил Володин. Грефу приказано закрепить население (2003) // «Ежедневные новости» (Владивосток), 2003.08.07] [омонимия снята] | W141: =RAND() -> 0.10842327938266261 | X141: =IF(RC[-13]=R[-1]C[-13]," ",1) -> 1
A142: огонченоксеб мёрац ябес ьтатичс и | B142: автснартсорп | C142: и считать себя царём бесконечного | D142: пространства | E142: . | F142: Шекспир. | G142: пространство | I142: gen1 | J142: Александр Волков. Миры Стивена Хоукинга // «Знание -- сила», 2003 | K142: Александр Волков | M142: Миры Стивена Хоукинга | N142: 2003 | O142: публицистика, нехудожественная | P142: статья | Q142: наука и технологии, физика | R142: «Знание -- сила» | S142: 2003 | T142: журнал | U142: омонимия снята | V142: О Боже, я бы мог замкнуться в ореховой скорлупе и считать себя царём бесконечного пространства. Шекспир. [Александр Волков. Миры Стивена Хоукинга // «Знание -- сила», 2003] [омонимия снята] | W142: =RAND() -> 0.75841336868383791 | X142: =IF(RC[-13]=R[-1]C[-13]," ",1) -> 1
A143: еинешывоП | B143: талпраз | C143: Повышение | D143: зарплат | F143: российским бюджетникам произойдёт через восемь | G143: зарплата | I143: gen1 | J143: Елена Калашникова. Зарплату повысят завтра, а кушать бюджетникам хочется сейчас (2003) // «Новороссийский рабочий», 2003.02.18 | K143: Елена Калашникова | M143: Зарплату повысят завтра, а кушать бюджетникам хочется сейчас | N143: 2003 | O143: публицистика, нехудожественная | P143: комментарий | Q143: политика и общественная жизнь | R143: «Новороссийский рабочий» | S143: 2003.02.18 | T143: газета | U143: омонимия снята | V143: Повышение зарплат российским бюджетникам произойдёт через восемь месяцев. [Елена Калашникова. Зарплату повысят завтра, а кушать бюджетникам хочется сейчас (2003) // «Новороссийский рабочий», 2003.02.18] [омонимия снята] | W143: =RAND() -> 0.2853162409789578 | X143: =IF(RC[-13]=R[-1]C[-13]," ",1) -> 1
A144: еинешер еоворги-окитероет онедевирП | B144: ичадаз | C144: Приведено теоретико-игровое решение | D144: задачи | F144: синтеза структурного описания конструкции. | G144: задача | I144: gen1 | J144: И. А. Барков. Автоматический синтез структурного описания конструкции // «Информационные технологии», 2004 | K144: И. А. Барков | M144: Автоматический синтез структурного описания конструкции | N144: 2004 | O144: учебно-научная, нехудожественная | P144: статья | Q144: наука и технологии, информатика | R144: «Информационные технологии» | S144: 2004 | T144: журнал | U144: омонимия снята | V144: Приведено теоретико-игровое решение задачи синтеза структурного описания конструкции. [И. А. Барков. Автоматический синтез структурного описания конструкции // «Информационные технологии», 2004] [омонимия снята] | W144: =RAND() -> 0.60233211150336141 | X144: =IF(RC[-13]=R[-1]C[-13]," ",1) -> 1
A145: ялд ыробирП вонаждемахуМ К Г | B145: йинатыпси | C145: Г. К. Мухамеджанов. Приборы для | D145: испытаний | F145: нетканых полотен В Федеральном законе "О техническом регулировании", введённом с 1 июля 2003 г., отмечается, что правила и методы испытаний, необходимые для применения в технических регламентах, разрабатывают в течение 6 месяцев со дня официального опубликования технических регламентов, утверждаются Правительством РФ и носят обязательный характер. | G145: испытание | I145: gen1 | J145: Г. К. Мухамеджанов. Приборы для испытаний нетканых полотен // «Текстиль», 2003 | K145: Г. К. Мухамеджанов | M145: Приборы для испытаний нетканых полотен | N145: 2003 | O145: учебно-научная, нехудожественная | P145: статья | Q145: наука и технологии, производство, легкая и пищевая промышленность | R145: «Текстиль» | S145: 2003 | T145: журнал | U145: омонимия снята | V145: Г. К. Мухамеджанов. Приборы для испытаний нетканых полотен " ", ., , , , , . [Г. К. Мухамеджанов. Приборы для испытаний нетканых полотен // «Текстиль», 2003] [омонимия снята] | W145: =RAND() -> 0.62565852832843338 | X145: =IF(RC[-13]=R[-1]C[-13]," ",1) -> 1
A146: АКНОЛОК | B146: АРОТКАДЕР | C146: КОЛОНКА | D146: РЕДАКТОРА | F146: На минувшей неделе вице-премьер, министр | G146: редактор | I146: gen1 | J146: Елена Калашникова, Мария Ананьева. Колонка редактора (2003) // «Новороссийский рабочий», 2003.01.22 | K146: Елена Калашникова, Мария Ананьева | M146: Колонка редактора | N146: 2003 | O146: публицистика, нехудожественная | P146: заметка | Q146: политика и общественная жизнь | R146: «Новороссийский рабочий» | S146: 2003.01.22 | T146: газета | U146: омонимия снята | V146: КОЛОНКА РЕДАКТОРА На минувшей неделе вице-премьер, министр финансов Алексей КУДРИН объявил на встрече с руководством "Медиа-союза" и представителями региональных средств массовой информации о планах правительства продолжить налоговую реформу. [Елена Калашникова, Мария Ананьева. Колонка редактора (2003) // «Новороссийский рабочий», 2003.01.22] [омонимия снята] | W146: =RAND() -> 0.42498067663684269 | X146: =IF(RC[-13]=R[-1]C[-13]," ",1) -> 1
A147: еинадЗ | B147: акриц | C147: Здание | D147: цирка | F147: уже приведено в состояние боевой | G147: цирк | I147: gen1 | J147: Елена Налимова. На арене - фестиваль (2003) // «Богатей» (Саратов), 2003.09.11 | K147: Елена Налимова | M147: На арене - фестиваль | N147: 2003 | O147: публицистика, нехудожественная | P147: статья | Q147: досуг, зрелища и развлечения | R147: «Богатей» (Саратов) | S147: 2003.09.11 | T147: газета | U147: омонимия снята | V147: Здание цирка уже приведено в состояние боевой готовности. [Елена Налимова. На арене - фестиваль (2003) // «Богатей» (Саратов), 2003.09.11] [омонимия снята] | W147: =RAND() -> 0.18362599282274872 | X147: =IF(RC[-13]=R[-1]C[-13]," ",1) -> 1
A148: йотэ зеб и иланз ёсв | B148: иксипаз | C148: всё знали и без этой | D148: записки | E148: ". | G148: записка | I148: gen1 | J148: Андрей Митьков. «Мы все знали и без этой записки». Год назад спортивные чиновники знали, что у наших спортсменов будут искать допинг (2003) // «Известия», 2003.02.07 | K148: Андрей Митьков | M148: «Мы все знали и без этой записки». Год назад спортивные чиновники знали, что у наших спортсменов будут искать допинг | N148: 2003 | O148: публицистика, нехудожественная | P148: статья | Q148: спорт | R148: «Известия» | S148: 2003.02.07 | T148: газета | U148: омонимия снята | V148: "Мы всё знали и без этой записки". [Андрей Митьков. «Мы все знали и без этой записки». Год назад спортивные чиновники знали, что у наших спортсменов будут искать допинг (2003) // «Известия», 2003.02.07] [омонимия снята] | W148: =RAND() -> 3.4127250915707674E-2 | X148: =IF(RC[-13]=R[-1]C[-13]," ",1) -> 1
A149: еинаводелсси еоньлатнемирепскЭ | B149: вомзинахем | C149: Экспериментальное исследование | D149: механизмов | F149: целостного восприятия В экспериментальном исследовании | G149: механизм | I149: gen1 | J149: Е. П. Крупник. Экспериментальное исследование механизмов целостного восприятия // «Вопросы психологии», 2003 | K149: Е. П. Крупник | M149: Экспериментальное исследование механизмов целостного восприятия | N149: 2003 | O149: учебно-научная, нехудожественная | P149: статья | Q149: наука и технологии, психология | R149: «Вопросы психологии» | S149: 2003 | T149: журнал | U149: омонимия снята | V149: Экспериментальное исследование механизмов целостного восприятия В экспериментальном исследовании механизмов целостного восприятия установлена взаимозависимость творческих способностей индивида и его тенденции к "гештальтированию" воспринимаемого поля. [Е. П. Крупник. Экспериментальное исследование механизмов целостного восприятия // «Вопросы психологии», 2003] [омонимия снята] | W149: =RAND() -> 0.62637069372853271 | X149: =IF(RC[-13]=R[-1]C[-13]," ",1) -> 1
A150: яисрев яакссуР | B150: ыметсис-MRC | C150: Русская версия | D150: CRM-системы | F150: SalesLogix 6. 2 впервые выйдет | G150: CRM-система | I150: gen1 | J150: Павел Куприянов. Sage повернулась к России лицом // «Computerworld», 2004 | K150: Павел Куприянов | M150: Sage повернулась к России лицом | N150: 2004 | O150: публицистика, нехудожественная | P150: статья | Q150: бизнес, коммерция, экономика, финансы | R150: «Computerworld» | S150: 2004 | T150: журнал | U150: омонимия снята | V150: Русская версия CRM-системы SalesLogix 6. 2 впервые выйдет одновременно с английской [Павел Куприянов. Sage повернулась к России лицом // «Computerworld», 2004] [омонимия снята] | W150: =RAND() -> 0.2063422525004619 | X150: =IF(RC[-13]=R[-1]C[-13]," ",1) -> 1
A151: У | B151: анитуП | C151: У | D151: Путина | F151: в Чечне мир, Кремль дружит | G151: Путин | I151: gen1 | J151: Александр Гамаюн. Северокавказский приговор (2003) // «Завтра», 2003.08.06 | K151: Александр Гамаюн | M151: Северокавказский приговор | N151: 2003 | O151: публицистика, нехудожественная | P151: статья | Q151: политика и общественная жизнь | R151: «Завтра» | S151: 2003.08.06 | T151: газета | U151: омонимия снята | V151: У Путина в Чечне мир, Кремль дружит с чеченской администрацией, отводит войска, передаёт местным властям власть, налоги, бюджет и оружие. [Александр Гамаюн. Северокавказский приговор (2003) // «Завтра», 2003.08.06] [омонимия снята] | W151: =RAND() -> 0.89935692529445588 | X151: =IF(RC[-13]=R[-1]C[-13]," ",1) -> 1
A152: ьлетадзоС | B152: ммаргорп | C152: Создатель | D152: программ | F152: Mosaic и Netscape Марк Андриссен | G152: программа | I152: gen1 | J152: Леонид Черняк. Монополист «на час» // «Computerworld», 2004 | K152: Леонид Черняк | M152: Монополист «на час» | N152: 2004 | O152: публицистика, нехудожественная | P152: статья | Q152: наука и технологии, информатика | R152: «Computerworld» | S152: 2004 | T152: журнал | U152: омонимия снята | V152: Создатель программ Mosaic и Netscape Марк Андриссен родился 9 июля 1971 года. [Леонид Черняк. Монополист «на час» // «Computerworld», 2004] [омонимия снята] | W152: =RAND() -> 2.7429950083732724E-2 | X152: =IF(RC[-13]=R[-1]C[-13]," ",1) -> 1
A153: ыволоГ намоР вохороД | B153: вотарип | C153: Дорохов Роман. Головы | D153: пиратов | F153: щедро оплатят. Американцы начинают охоту | G153: пират | I153: gen1 | J153: Роман Дорохов. Головы пиратов щедро оплатят. Американцы начинают охоту на нелегальных производителей DVD (2003) // «Известия», 2003.02.20 | K153: Роман Дорохов | M153: Головы пиратов щедро оплатят. Американцы начинают охоту на нелегальных производителей DVD | N153: 2003 | O153: публицистика, нехудожественная | P153: заметка | Q153: наука и технологии | R153: «Известия» | S153: 2003.02.20 | T153: газета | U153: омонимия снята | V153: Дорохов Роман. Головы пиратов щедро оплатят. Американцы начинают охоту на нелегальных производителей DVD [Роман Дорохов. Головы пиратов щедро оплатят. Американцы начинают охоту на нелегальных производителей DVD (2003) // «Известия», 2003.02.20] [омонимия снята] | W153: =RAND() -> 0.53086660100482774 | X153: =IF(RC[-13]=R[-1]C[-13]," ",1) -> 1
A154: илетилдемаз еынсапозеб иксечиголокэ еывоН | B154: яинерог | C154: Новые экологически безопасные замедлители | D154: горения | F154: и их применение для текстильных | G154: горение | I154: gen1 | J154: Э. Коломейцева, А. Морыганов. Новые экологически безопасные замедлители горения и их применение для текстильных материалов из целлюлозных, полиэфирных и смешанных волокон // «Текстиль», 2003 | K154: Э. Коломейцева, А. Морыганов | M154: Новые экологически безопасные замедлители горения и их применение для текстильных материалов из целлюлозных, полиэфирных и смешанных волокон | N154: 2003 | O154: учебно-научная, нехудожественная | P154: статья | Q154: наука и технологии, производство, легкая и пищевая промышленность | R154: «Текстиль» | S154: 2003 | T154: журнал | U154: омонимия снята | V154: Новые экологически безопасные замедлители горения и их применение для текстильных материалов из целлюлозных, полиэфирных и смешанных волокон [Э. Коломейцева, А. Морыганов. Новые экологически безопасные замедлители горения и их применение для текстильных материалов из целлюлозных, полиэфирных и смешанных волокон // «Текстиль», 2003] [омонимия снята] | W154: =RAND() -> 0.98798830356135003 | X154: =IF(RC[-13]=R[-1]C[-13]," ",1) -> 1
A155: юиняотсос оп нирадуБ йалокиН тваномсок | B155: яьвородз | C155: космонавт Николай Бударин по состоянию | D155: здоровья | F155: отстранён от участия в работах | G155: здоровье | I155: gen1 | J155: Сергей Лесков. Наш космонавт здоров, но в космос не выйдет (2003) // «Известия», 2003.01.08 | K155: Сергей Лесков | M155: Наш космонавт здоров, но в космос не выйдет | N155: 2003 | O155: публицистика, нехудожественная | P155: заметка | Q155: наука и технологии | R155: «Известия» | S155: 2003.01.08 | T155: газета | U155: омонимия снята | V155: Американское NASA официально объявило о том, что работающий на международной космической станции российский космонавт Николай Бударин по состоянию здоровья отстранён от участия в работах в открытом космосе, назначенных на 15 января. [Сергей Лесков. Наш космонавт здоров, но в космос не выйдет (2003) // «Известия», 2003.01.08] [омонимия снята] | W155: =RAND() -> 1.1044808487194357E-2 | X155: =IF(RC[-13]=R[-1]C[-13]," ",1) -> 1
A156: анищводог я-36 ястеачемтО | B156: яинеджор | C156: Отмечается 63-я годовщина | D156: рождения | F156: советской гвардии 18. 09. 2004 | G156: рождение | I156: gen1 | J156: Сергей Останин. Отмечается 63-я годовщина рождения советской гвардии (2004) // ИТАР-ТАСС, 2004.09.18 | K156: Сергей Останин | M156: Отмечается 63-я годовщина рождения советской гвардии | N156: 2004 | O156: публицистика, нехудожественная | P156: заметка | Q156: политика и общественная жизнь | R156: ИТАР-ТАСС | S156: 2004.09.18 | T156: электронное издание | U156: омонимия снята | V156: Отмечается 63-я годовщина рождения советской гвардии 18. 09. 2004, 01. 03 [Сергей Останин. Отмечается 63-я годовщина рождения советской гвардии (2004) // ИТАР-ТАСС, 2004.09.18] [омонимия снята] | W156: =RAND() -> 0.37221833949233085 | X156: =IF(RC[-13]=R[-1]C[-13]," ",1) -> 1
A157: хиксечинилк актыпоп яавреП | B157: йинатыпси | C157: Первая попытка клинических | D157: испытаний | F157: вакцины против СПИДа обернулась неудачей | G157: испытание | I157: gen1 | J157: Ольга Неверова. Надежда -- не компас. Первая попытка клинических испытаний вакцины против СПИДа обернулась неудачей (2003) // «Известия», 2003.02.27 | K157: Ольга Неверова | M157: Надежда -- не компас. Первая попытка клинических испытаний вакцины против СПИДа обернулась неудачей | N157: 2003 | O157: публицистика, нехудожественная | P157: заметка | Q157: наука и технологии | R157: «Известия» | S157: 2003.02.27 | T157: газета | U157: омонимия снята | V157: Первая попытка клинических испытаний вакцины против СПИДа обернулась неудачей [Ольга Неверова. Надежда -- не компас. Первая попытка клинических испытаний вакцины против СПИДа обернулась неудачей (2003) // «Известия», 2003.02.27] [омонимия снята] | W157: =RAND() -> 0.76347083275350802 | X157: =IF(RC[-13]=R[-1]C[-13]," ",1) -> 1
A158: еинеджоР ыробыВ | B158: вобатш | C158: Выборы: Рождение | D158: штабов | F158: У ПАРТИЙ ― разгар строительства штабов | G158: штаб | I158: gen1 | J158: Татьяна Нетреба. Выборы : Рождение штабов (2003) // «Аргументы и факты», 2003.06.11 | K158: Татьяна Нетреба | M158: Выборы : Рождение штабов | N158: 2003 | O158: публицистика, нехудожественная | P158: заметка | Q158: политика и общественная жизнь | R158: «Аргументы и факты» | S158: 2003.06.11 | T158: газета | U158: омонимия снята | V158: Выборы: Рождение штабов У ПАРТИЙ ― разгар строительства штабов и рекламных кампаний. [Татьяна Нетреба. Выборы : Рождение штабов (2003) // «Аргументы и факты», 2003.06.11] [омонимия снята] | W158: =RAND() -> 0.38288592438442237 | X158: =IF(RC[-13]=R[-1]C[-13]," ",1) -> 1
A159: хет ялд йынчывирпен ясливяоп гурдв | B159: тел | C159: вдруг появился непривычный для тех | D159: лет | F159: материал, который бы сегодня не | G159: год | I159: gen1 | J159: Игорь Лалаянц. Детектор лжи на молекулярном уровне? Завтра, завтра… послезавтра! // «Знание -- сила», 2003 | K159: Игорь Лалаянц | M159: Детектор лжи на молекулярном уровне? Завтра, завтра… послезавтра! | N159: 2003 | O159: учебно-научная, нехудожественная | P159: статья | Q159: наука и технологии, биология | R159: «Знание -- сила» | S159: 2003 | T159: журнал | U159: омонимия снята | V159: Помнится, в журнале "Иностранная литература" вдруг появился непривычный для тех лет материал, который бы сегодня не вызвал никакого удивления. [Игорь Лалаянц. Детектор лжи на молекулярном уровне? Завтра, завтра… послезавтра! // «Знание -- сила», 2003] [омонимия снята] | W159: =RAND() -> 5.1779766500747337E-2 | X159: =IF(RC[-13]=R[-1]C[-13]," ",1) -> 1
A160: огоротв яимрА | B160: атрос | C160: Армия второго | D160: сорта | F160: Нельзя иметь армию, в которую | G160: сорт | I160: gen1 | J160: Юлия Латынина. Армия второго сорта (2003) // «Еженедельный журнал», 2003.03.24 | K160: Юлия Латынина | L160: 1966 | M160: Армия второго сорта | N160: 2003 | O160: публицистика, нехудожественная | P160: статья | Q160: политика и общественная жизнь | R160: «Еженедельный журнал» | S160: 2003.03.24 | T160: журнал | U160: омонимия снята | V160: Армия второго сорта Нельзя иметь армию, в которую попадает примерно тот же социальный контингент, что в тюрьму. [Юлия Латынина. Армия второго сорта (2003) // «Еженедельный журнал», 2003.03.24] [омонимия снята] | W160: =RAND() -> 5.6510448886987197E-2 | X160: =IF(RC[-13]=R[-1]C[-13]," ",1) -> 1
A161: ырецифо ьтибу илгом анилмохуС аримидалВ | B161: иицилим | C161: Владимира Сухомлина могли убить офицеры | D161: милиции | F161: В понедельник в Москве хоронили | G161: милиция | I161: gen1 | J161: Елена Лория. Владимира Сухомлина могли убить офицеры милиции (2003) // «Известия», 2003.01.12 | K161: Елена Лория | M161: Владимира Сухомлина могли убить офицеры милиции | N161: 2003 | O161: публицистика, нехудожественная | P161: статья | Q161: криминал | R161: «Известия» | S161: 2003.01.12 | T161: газета | U161: омонимия снята | V161: Лория Елена. Владимира Сухомлина могли убить офицеры милиции В понедельник в Москве хоронили известного программиста и журналиста Владимира Сухомлина. [Елена Лория. Владимира Сухомлина могли убить офицеры милиции (2003) // «Известия», 2003.01.12] [омонимия снята] | W161: =RAND() -> 0.1423820622251728 | X161: =IF(RC[-13]=R[-1]C[-13]," ",1) -> 1
A162: ьлетадесдерп вокуЖ рднаскелА | B162: атетимоК | C162: Александр Жуков, председатель | D162: Комитета | F162: Государственной Думы по бюджету и | G162: Комитет | I162: gen1 | J162: Денис Викторов. Стена (2003) // «Бизнес-журнал», 2003.10.23 | K162: Денис Викторов | M162: Стена | N162: 2003 | O162: публицистика, нехудожественная | P162: статья | Q162: бизнес, коммерция, экономика, финансы | R162: «Бизнес-журнал» | S162: 2003.10.23 | T162: журнал | U162: омонимия снята | V162: Александр Жуков, председатель Комитета Государственной Думы по бюджету и налогам [Денис Викторов. Стена (2003) // «Бизнес-журнал», 2003.10.23] [омонимия снята] | W162: =RAND() -> 0.99745186809213993 | X162: =IF(RC[-13]=R[-1]C[-13]," ",1) -> 1
A163: атс од тёчс илсе ьталед | B163: ичясыт | C163: делать, если счёт до ста, | D163: тысячи | F163: и даже далее не способствует | G163: тысяча | I163: gen1 | J163: Вера Елгаева. Бессонница (2003) // «100% здоровья», 2003.03.01 | K163: Вера Елгаева | M163: Бессонница | N163: 2003 | O163: публицистика, нехудожественная | P163: статья | Q163: здоровье и медицина | R163: «100% здоровья» | S163: 2003.03.01 | T163: журнал | U163: омонимия снята | V163: Что делать, если счёт до ста, тысячи и даже далее не способствует долгожданному сну? [Вера Елгаева. Бессонница (2003) // «100% здоровья», 2003.03.01] [омонимия снята] | W163: =RAND() -> 0.74417204169780449 | X163: =IF(RC[-13]=R[-1]C[-13]," ",1) -> 1
A164: тевтО | B164: ялетитсемаз | C164: Ответ | D164: заместителя | F164: министра иностранных дел России Ю | G164: заместитель | I164: gen1 | J164: Ю. В. Федотов. Ответ на вопрос агентства Интерфакс в связи с ветированием Россией в Совете Безопасности ООН проекта резолюции по Кипру // «Дипломатический вестник», 2004 | K164: Ю. В. Федотов | M164: Ответ на вопрос агентства Интерфакс в связи с ветированием Россией в Совете Безопасности ООН проекта резолюции по Кипру | N164: 2004 | O164: публицистика, нехудожественная | P164: интервью | Q164: политика и общественная жизнь | R164: «Дипломатический вестник» | S164: 2004 | T164: журнал | U164: омонимия снята | V164: Ответ заместителя министра иностранных дел России Ю. В. Федотова на вопрос агентства Интерфакс в связи с ветированием Россией в Совете Безопасности ООН проекта резолюции по Кипру [Ю. В. Федотов. Ответ на вопрос агентства Интерфакс в связи с ветированием Россией в Совете Безопасности ООН проекта резолюции по Кипру // «Дипломатический вестник», 2004] [омонимия снята] | W164: =RAND() -> 9.5720396904813154E-2 | X164: =IF(RC[-13]=R[-1]C[-13]," ",1) -> 1
A165: сензиб мокищватсоп ьтатс течох SBI | B165: йинешер | C165: IBS хочет стать поставщиком бизнес- | D165: решений | F165: для малых и средних предприятий | G165: решение | I165: gen1 | J165: Ирина Шеян. Потребительский рынок созрел // «Computerworld», 2004 | K165: Ирина Шеян | M165: Потребительский рынок созрел | N165: 2004 | O165: публицистика, нехудожественная | P165: статья | Q165: бизнес, коммерция, экономика, финансы | R165: «Computerworld» | S165: 2004 | T165: журнал | U165: омонимия снята | V165: IBS хочет стать поставщиком бизнес-решений для малых и средних предприятий [Ирина Шеян. Потребительский рынок созрел // «Computerworld», 2004] [омонимия снята] | W165: =RAND() -> 0.27733865240794098 | X165: =IF(RC[-13]=R[-1]C[-13]," ",1) -> 1
A166: ежиН яинетсар еынворкоповчоп АМЕТ ЯАНВАЛГ | B166: ыварт | C166: ГЛАВНАЯ ТЕМА | почвопокровные растения Ниже | D166: травы | F166: В природе существует большое количество | G166: трава | I166: gen1 | J166: Сергей Кляцов. Ниже травы (2003) // «Сад своими руками», 2003.07.15 | K166: Сергей Кляцов | M166: Ниже травы | N166: 2003 | O166: публицистика, нехудожественная | P166: статья | Q166: природа | R166: «Сад своими руками» | S166: 2003.07.15 | T166: газета | U166: омонимия снята | V166: ГЛАВНАЯ ТЕМА | почвопокровные растения Ниже травы В природе существует большое количество растений, способных покрывать сплошным густым ковром участки почвы, расти на камнях в суровых условиях. [Сергей Кляцов. Ниже травы (2003) // «Сад своими руками», 2003.07.15] [омонимия снята] | W166: =RAND() -> 0.72129580806613791 | X166: =IF(RC[-13]=R[-1]C[-13]," ",1) -> 1
A167: акитсонгаид яаксечипоксорткепС | B167: ымзалп | C167: Спектроскопическая диагностика | D167: плазмы | F167: лазерной эрозии поликристаллической мишени соединения | G167: плазма | I167: gen1 | J167: А. К. Шаибов, М. П. Чучман. Спекроскопическая диагностика плазмы лазерной эрозии поликристаллической мишени соединения AgGaS2 // «Журнал технической физики», 2005 | K167: А. К. Шаибов, М. П. Чучман | M167: Спекроскопическая диагностика плазмы лазерной эрозии поликристаллической мишени соединения AgGaS2 | N167: 2005 | O167: учебно-научная, нехудожественная | P167: аннотация | Q167: наука и технологии, физика | R167: «Журнал технической физики» | S167: 2005 | T167: журнал | U167: омонимия снята | V167: Спектроскопическая диагностика плазмы лазерной эрозии поликристаллической мишени соединения AgGaS 2 [А. К. Шаибов, М. П. Чучман. Спекроскопическая диагностика плазмы лазерной эрозии поликристаллической мишени соединения AgGaS2 // «Журнал технической физики», 2005] [омонимия снята] | W167: =RAND() -> 0.94883315683463487 | X167: =IF(RC[-13]=R[-1]C[-13]," ",1) -> 1
A168: узебвоС ьтиватсдерп нереман отч ливяъбо | B168: НОО | C168: объявил, что намерен представить Совбезу | D168: ООН | F168: текст новой резолюции по Ираку | G168: ООН | I168: gen1 | J168: Наталия Бабасян. Буш готовится атаковать Совбез. США и Великобритания разрабатывают новую резолюцию по Ираку (2003) // «Известия», 2003.02.19 | K168: Наталия Бабасян | M168: Буш готовится атаковать Совбез. США и Великобритания разрабатывают новую резолюцию по Ираку | N168: 2003 | O168: публицистика, нехудожественная | P168: заметка | Q168: политика и общественная жизнь | R168: «Известия» | S168: 2003.02.19 | T168: газета | U168: омонимия снята | V168: Белый дом объявил, что намерен представить Совбезу ООН текст новой резолюции по Ираку в ближайшие дни ― в конце нынешней или начале следующей недели. [Наталия Бабасян. Буш готовится атаковать Совбез. США и Великобритания разрабатывают новую резолюцию по Ираку (2003) // «Известия», 2003.02.19] [омонимия снята] | W168: =RAND() -> 8.1958678862104506E-2 | X168: =IF(RC[-13]=R[-1]C[-13]," ",1) -> 1
A169: маволс оП МОТНАРГИМЭ ЬТЫБ ТЕЖОМ | B169: акиньлачан | C169: МОЖЕТ БЫТЬ ЭМИГРАНТОМ По словам | D169: начальника | F169: ХОСУ Аркадия Чатитяна, за это | G169: начальник | I169: gen1 | J169: Петр Мельников. Строитель не может быть эмигрантом (2003) // «Московский комсомолец» в Сыктывкаре, 2003.08.06 | K169: Петр Мельников | M169: Строитель не может быть эмигрантом | N169: 2003 | O169: публицистика, нехудожественная | P169: интервью | Q169: строительство и архитектура | R169: «Московский комсомолец» в Сыктывкаре | S169: 2003.08.06 | T169: газета | U169: омонимия снята | V169: СТРОИТЕЛЬ НЕ МОЖЕТ БЫТЬ ЭМИГРАНТОМ По словам начальника ХОСУ Аркадия Чатитяна, за это время в Сыктывкаре было построено 48 различных зданий и сооружений. [Петр Мельников. Строитель не может быть эмигрантом (2003) // «Московский комсомолец» в Сыктывкаре, 2003.08.06] [омонимия снята] | W169: =RAND() -> 0.7301849939670948 | X169: =IF(RC[-13]=R[-1]C[-13]," ",1) -> 1
A170: 4 нароК тюуделсси еынёчУ гинк хынчев ынйаТ | B170: атрам | C170: Тайны вечных книг: Учёные исследуют Коран 4 | D170: марта | F170: прошлого года в газете "International | G170: март | I170: gen1 | J170: Рафаил Нудельман. Тайны вечных книг: ученые исследуют Коран // «Знание -- сила», 2003 | K170: Рафаил Нудельман | M170: Тайны вечных книг: ученые исследуют Коран | N170: 2003 | O170: учебно-научная, нехудожественная | P170: статья | Q170: религия | R170: «Знание -- сила» | S170: 2003 | T170: журнал | U170: омонимия снята | V170: : 4 марта прошлого года в газете "International Herald Tribune" была опубликована статья американского журналиста Александра Шитлле под заголовком―"Учёные исследуют Коран". [Рафаил Нудельман. Тайны вечных книг: ученые исследуют Коран // «Знание -- сила», 2003] [омонимия снята] | W170: =RAND() -> 0.16770051561990773 | X170: =IF(RC[-13]=R[-1]C[-13]," ",1) -> 1
A171: зеб ынутеЛ намоР воллириК | B171: анисорек | C171: Кириллов Роман. Летуны без | D171: керосина | E171: . | F171: Минобороны проинспектировало части дальней авиации | G171: керосин | I171: gen1 | J171: Роман Кириллов. Летуны без керосина. Минобороны проинспектировало части дальней авиации (2003) // «Известия», 2003.02.17 | K171: Роман Кириллов | M171: Летуны без керосина. Минобороны проинспектировало части дальней авиации | N171: 2003 | O171: публицистика, нехудожественная | P171: комментарий | Q171: политика и общественная жизнь | R171: «Известия» | S171: 2003.02.17 | T171: газета | U171: омонимия снята | V171: Кириллов Роман. Летуны без керосина. Минобороны проинспектировало части дальней авиации [Роман Кириллов. Летуны без керосина. Минобороны проинспектировало части дальней авиации (2003) // «Известия», 2003.02.17] [омонимия снята] | W171: =RAND() -> 0.38142756470651762 | X171: =IF(RC[-13]=R[-1]C[-13]," ",1) -> 1
A172: дуС веьсанафА рднаскелА | B172: хынжясирп | C172: Александр Афанасьев. Суд | D172: присяжных | F172: в России Изменение политического строя | G172: присяжные | I172: gen1 | J172: Александр Афанасьев. Суд присяжных в России // «Отечественные записки», 2003 | K172: Александр Афанасьев | M172: Суд присяжных в России | N172: 2003 | O172: учебно-научная, нехудожественная | P172: статья | Q172: право | R172: «Отечественные записки» | S172: 2003 | T172: журнал | U172: омонимия снята | V172: Александр Афанасьев. Суд присяжных в России Изменение политического строя, экономических и общественных отношений, создание правового государства и процесс демократизации общества неизбежно влечёт за собой серьёзные судебные преобразования. [Александр Афанасьев. Суд присяжных в России // «Отечественные записки», 2003] [омонимия снята] | W172: =RAND() -> 0.20390954198205002 | X172: =IF(RC[-13]=R[-1]C[-13]," ",1) -> 1
A173: В В оволс еоньлетипутсВ | B173: анитуП | C173: Вступительное слово В. В. | D173: Путина | F173: в ходе российско-египетских переговоров в | G173: Путин | I173: gen1 | J173: В. В. Путин. Вступительное слово в ходе российско-египетских переговоров в расширенном составе // «Дипломатический вестник», 2004 | K173: В. В. Путин | L173: 1952 | M173: Вступительное слово в ходе российско-египетских переговоров в расширенном составе | N173: 2004 | O173: официально-деловая, нехудожественная | P173: речь | Q173: политика и общественная жизнь | R173: «Дипломатический вестник» | S173: 2004 | T173: журнал | U173: омонимия снята | V173: Вступительное слово В. В. Путина в ходе российско-египетских переговоров в расширенном составе 28 мая [В. В. Путин. Вступительное слово в ходе российско-египетских переговоров в расширенном составе // «Дипломатический вестник», 2004] [омонимия снята] | W173: =RAND() -> 0.35114386315854629 | X173: =IF(RC[-13]=R[-1]C[-13]," ",1) -> 1
A174: 71 КСТУКРИ | B174: ярбятнес | C174: ИРКУТСК, 17 | D174: сентября | E174: . | F174: / Корр. ИТАР-ТАСС Владимир Ходий/. | G174: сентябрь | I174: gen1 | J174: Владимир Ходий. Программу «Аншлаг» и ей подобные на государственном телевидении заменят передачи о культуре и специальный детский канал. (2004) // ИТАР-ТАСС, 2004.09.17 | K174: Владимир Ходий | M174: Программу «Аншлаг» и ей подобные на государственном телевидении заменят передачи о культуре и специальный детский канал. | N174: 2004 | O174: публицистика, нехудожественная | P174: заметка | Q174: искусство и культура | R174: ИТАР-ТАСС | S174: 2004.09.17 | T174: электронное издание | U174: омонимия снята | V174: ИРКУТСК, 17 сентября. / Корр. ИТАР-ТАСС Владимир Ходий/. [Владимир Ходий. Программу «Аншлаг» и ей подобные на государственном телевидении заменят передачи о культуре и специальный детский канал. (2004) // ИТАР-ТАСС, 2004.09.17] [омонимия снята] | W174: =RAND() -> 0.14273538716840017 | X174: =IF(RC[-13]=R[-1]C[-13]," ",1) -> 1
A175: огонтогьл яицпецноК коничоП рднаскелА | B175: автсрадусог | C175: Александр Починок: Концепция льготного | D175: государства | F175: бессмысленна Открытый разговор ― Александр Починок | G175: государство | I175: gen1 | J175: Оксана Карпова. Александр Починок: Концепция льготного государства бессмысленна (2003) // «Время МН», 2003.07.31 | K175: Оксана Карпова | M175: Александр Починок: Концепция льготного государства бессмысленна | N175: 2003 | O175: публицистика, нехудожественная | P175: статья | Q175: политика и общественная жизнь | R175: «Время МН» | S175: 2003.07.31 | T175: газета | U175: омонимия снята | V175: Александр Починок: Концепция льготного государства бессмысленна Открытый разговор ― Александр Починок, министр труда и социального развития РФ [Оксана Карпова. Александр Починок: Концепция льготного государства бессмысленна (2003) // «Время МН», 2003.07.31] [омонимия снята] | W175: =RAND() -> 0.60957245188762077 | X175: =IF(RC[-13]=R[-1]C[-13]," ",1) -> 1
A176: евтсдохс О | B176: вомёирп | C176: О сходстве | D176: приёмов | F176: остроумия и механизмов построения парадоксальных | G176: прием | I176: gen1 | J176: М. В. Мусийчук. О сходстве приемов остроумия и механизмов построения парадоксальных задач // «Вопросы психологии», 2003 | K176: М. В. Мусийчук | M176: О сходстве приемов остроумия и механизмов построения парадоксальных задач | N176: 2003 | O176: учебно-научная, нехудожественная | P176: статья | Q176: наука и технологии, психология | R176: «Вопросы психологии» | S176: 2003 | T176: журнал | U176: омонимия снята | V176: О сходстве приёмов остроумия и механизмов построения парадоксальных задач [М. В. Мусийчук. О сходстве приемов остроумия и механизмов построения парадоксальных задач // «Вопросы психологии», 2003] [омонимия снята] | W176: =RAND() -> 0.94433565456668045 | X176: =IF(RC[-13]=R[-1]C[-13]," ",1) -> 1
A177: акорос итацдирт кеволеч йодолом кичзакссаР | B177: тел | C177: Рассказчик ― молодой человек тридцати-сорока | D177: лет | E177: . | F177: Рассказчик стоит вне "ринга", потом | G177: год | I177: gen1 | J177: Евгений Гришковец. ОдноврЕмЕнно (2004) | K177: Евгений Гришковец | L177: 1967 | M177: ОдноврЕмЕнно | N177: 2004 | O177: художественная | P177: пьеса | R177: Е. Гришковец. Город: Сб. пьес | S177: 2001 | T177: книга | U177: омонимия снята | V177: Действующие лица: Рассказчик ― молодой человек тридцати-сорока лет. Рассказчик стоит вне "ринга", потом подходит к нему и после небольшой паузы шагает внутрь. [Евгений Гришковец. ОдноврЕмЕнно (2004)] [омонимия снята] | W177: =RAND() -> 0.35733713051129334 | X177: =IF(RC[-13]=R[-1]C[-13]," ",1) -> 1
A178: яинещарверП йегреС веескелА | B178: йепец | C178: Алексеев Сергей. Превращения | D178: цепей | E178: . | F178: Премия для молодого учёного-теоретика | G178: цепь | I178: gen1 | J178: Сергей Алексеев. Превращения цепей. Премия для молодого ученого-теоретика (2003) // «Известия», 2003.02.20 | K178: Сергей Алексеев | M178: Превращения цепей. Премия для молодого ученого-теоретика | N178: 2003 | O178: публицистика, нехудожественная | P178: статья | Q178: наука и технологии | R178: «Известия» | S178: 2003.02.20 | T178: газета | U178: омонимия снята | V178: Алексеев Сергей. Превращения цепей. Премия для молодого учёного-теоретика [Сергей Алексеев. Превращения цепей. Премия для молодого ученого-теоретика (2003) // «Известия», 2003.02.20] [омонимия снята] | W178: =RAND() -> 0.47959411474568536 | X178: =IF(RC[-13]=R[-1]C[-13]," ",1) -> 1
A179: босопс ястеагалдерП | B179: яинавозарбоерп | C179: Предлагается способ | D179: преобразования | F179: централизованной сетевой базы данных из | G179: преобразование | I179: gen1 | J179: А. Б. Барский. Применение SPMD-технологии при построении сетевых баз данных с циркулирующей информацией // «Информационные технологии», 2004 | K179: А. Б. Барский | M179: Применение SPMD-технологии при построении сетевых баз данных с циркулирующей информацией | N179: 2004 | O179: учебно-научная, нехудожественная | P179: статья | Q179: наука и технологии, информатика | R179: «Информационные технологии» | S179: 2004 | T179: журнал | U179: омонимия снята | V179: Предлагается способ преобразования централизованной сетевой базы данных из традиционно одноканальной в многоканальную систему массового обслуживания на основе применения SPMD- технологии. [А. Б. Барский. Применение SPMD-технологии при построении сетевых баз данных с циркулирующей информацией // «Информационные технологии», 2004] [омонимия снята] | W179: =RAND() -> 0.56661902936503694 | X179: =IF(RC[-13]=R[-1]C[-13]," ",1) -> 1
A180: огошьлоб ялД | B180: алсич | C180: Для большого | D180: числа | F180: проблем, с которыми сталкивается предприниматель | G180: число | I180: gen1 | J180: Леонид Малков. Собственность как товар (2003) // «Бизнес-журнал», 2003.10.23 | K180: Леонид Малков | M180: Собственность как товар | N180: 2003 | O180: публицистика, нехудожественная | P180: статья | Q180: бизнес, коммерция, экономика, финансы | R180: «Бизнес-журнал» | S180: 2003.10.23 | T180: журнал | U180: омонимия снята | V180: Для большого числа проблем, с которыми сталкивается предприниматель в США, имеется универсальное решение: делиться собственностью в фирме. [Леонид Малков. Собственность как товар (2003) // «Бизнес-журнал», 2003.10.23] [омонимия снята] | W180: =RAND() -> 0.98860534921368692 | X180: =IF(RC[-13]=R[-1]C[-13]," ",1) -> 1
A181: йенваден витомтйел лыб вокаТ | B181: иицнерефнок-ссерп | C181: Таков был лейтмотив недавней | D181: пресс-конференции | F181: главного военного прокурора Александра Савенкова | G181: пресс-конференция | I181: gen1 | J181: Марина Гриднева. За взятку - сажать! (2004) // «Московский комсомолец» в Нижнем Новгороде, 2004.07.30 | K181: Марина Гриднева | M181: За взятку - сажать! | N181: 2004 | O181: публицистика, нехудожественная | P181: заметка | Q181: армия и вооруженные конфликты | R181: «Московский комсомолец» в Нижнем Новгороде | S181: 2004.07.30 | T181: газета | U181: омонимия снята | V181: Таков был лейтмотив недавней пресс-конференции главного военного прокурора Александра Савенкова. [Марина Гриднева. За взятку - сажать! (2004) // «Московский комсомолец» в Нижнем Новгороде, 2004.07.30] [омонимия снята] | W181: =RAND() -> 0.19132177313624865 | X181: =IF(RC[-13]=R[-1]C[-13]," ",1) -> 1
A182: ьнеТ | B182: ФРПК | C182: Тень | D182: КПРФ | F182: становится гуще Прочитал в первом | G182: КПРФ | I182: gen1 | J182: Вячеслав Костиков. Тень КПРФ становится гуще (2003) // «Аргументы и факты», 2003.01.29 | K182: Вячеслав Костиков | L182: 1940 | M182: Тень КПРФ становится гуще | N182: 2003 | O182: публицистика, нехудожественная | P182: статья | Q182: политика и общественная жизнь | R182: «Аргументы и факты» | S182: 2003.01.29 | T182: газета | U182: омонимия снята | V182: Тень КПРФ становится гуще Прочитал в первом номере "Аргументов и фактов" слова Е. Гайдара о том, что "социализма не хотят даже коммунисты", и возмутился. [Вячеслав Костиков. Тень КПРФ становится гуще (2003) // «Аргументы и факты», 2003.01.29] [омонимия снята] | W182: =RAND() -> 0.41820824831751435 | X182: =IF(RC[-13]=R[-1]C[-13]," ",1) -> 1
A183: еинечузИ | B183: ииголохисп | C183: Изучение | D183: психологии | F183: подростка в лаборатории Д. Б | G183: психология | I183: gen1 | J183: М. Э. Боцманова, Р. Д. Триггер. Изучение психологии подростка в лаборатории Д.Б. Эльконина // «Вопросы психологии», 2004 | K183: М. Э. Боцманова, Р. Д. Триггер | M183: Изучение психологии подростка в лаборатории Д.Б. Эльконина | N183: 2004 | O183: учебно-научная, нехудожественная | P183: статья | Q183: наука и технологии, психология | R183: «Вопросы психологии» | S183: 2004 | T183: журнал | U183: омонимия снята | V183: Изучение психологии подростка в лаборатории Д. Б. Эльконина [М. Э. Боцманова, Р. Д. Триггер. Изучение психологии подростка в лаборатории Д.Б. Эльконина // «Вопросы психологии», 2004] [омонимия снята] | W183: =RAND() -> 0.32741686944172232 | X183: =IF(RC[-13]=R[-1]C[-13]," ",1) -> 1
A184: огонняотсоП о и еинелпутсыВ | B184: ялетиватсдерп | C184: Выступление и. о. Постоянного | D184: представителя | F184: Российской Федерации при ООН А | G184: представитель | I184: gen1 | J184: А. В. Конузин. Выступление на открытом заседании СБ по вопросу о действии санкций в отношении талибов и «Аль-Каиды» // «Дипломатический вестник», 2004 | K184: А. В. Конузин | M184: Выступление на открытом заседании СБ по вопросу о действии санкций в отношении талибов и «Аль-Каиды» | N184: 2004 | O184: официально-деловая, нехудожественная | P184: речь | Q184: политика и общественная жизнь | R184: «Дипломатический вестник» | S184: 2004 | T184: журнал | U184: омонимия снята | V184: Выступление и. о. Постоянного представителя Российской Федерации при ООН А. В. Конузина на открытом заседании СБ по вопросу о действии санкций в отношении талибов и «Аль-Каиды» 25 мая [А. В. Конузин. Выступление на открытом заседании СБ по вопросу о действии санкций в отношении талибов и «Аль-Каиды» // «Дипломатический вестник», 2004] [омонимия снята] | W184: =RAND() -> 0.28716321852128246 | X184: =IF(RC[-13]=R[-1]C[-13]," ",1) -> 1
A185: еинадижо или киндзарп дог йывоН | B185: акиндзарп | C185: Новый год: праздник или ожидание | D185: праздника | E185: ? | F185: Статус Нового года в современной | G185: праздник | I185: gen1 | J185: Олег Николаев. Новый год: праздник или ожидание праздника? // «Отечественные записки», 2003 | K185: Олег Николаев | M185: Новый год: праздник или ожидание праздника? | N185: 2003 | O185: учебно-научная, нехудожественная | P185: статья | Q185: искусство и культура | R185: «Отечественные записки» | S185: 2003 | T185: журнал | U185: омонимия снята | V185: Олег Николаев. Новый год: праздник или ожидание праздника? Статус Нового года в современной системе российских праздников совершенно уникален. [Олег Николаев. Новый год: праздник или ожидание праздника? // «Отечественные записки», 2003] [омонимия снята] | W185: =RAND() -> 0.43910562120271179 | X185: =IF(RC[-13]=R[-1]C[-13]," ",1) -> 1
A186: еровогаз о ыропС | B186: вохрагило | C186: Споры о "заговоре | D186: олигархов | E186: ", | F186: с одной стороны, и споры | G186: олигарх | I186: gen1 | J186: Сергей Доренко. Левые силы - перезагрузка (2003) // «Завтра», 2003.08.13 | K186: Сергей Доренко | L186: 1959 | M186: Левые силы - перезагрузка | N186: 2003 | O186: публицистика, нехудожественная | P186: статья | Q186: политика и общественная жизнь | R186: «Завтра» | S186: 2003.08.13 | T186: газета | U186: омонимия снята | V186: Споры о "заговоре олигархов", с одной стороны, и споры о "заговоре силовиков", с другой, стали главным событием лета. [Сергей Доренко. Левые силы - перезагрузка (2003) // «Завтра», 2003.08.13] [омонимия снята] | W186: =RAND() -> 0.89234848203942951 | X186: =IF(RC[-13]=R[-1]C[-13]," ",1) -> 1
A187: огортсыб овтссуксИ яидравг яадолоМ | B187: яинавеоваз | C187: Молодая гвардия. Искусство быстрого | D187: завоевания | F187: новых рынков сбыта 04. 11 | G187: завоевание | I187: gen1 | J187: Владимир Ляпоров. Молодая гвардия. Искусство быстрого завоевания новых рынков сбыта (2003) // «Бизнес-журнал», 2003.10.23 | K187: Владимир Ляпоров | M187: Молодая гвардия. Искусство быстрого завоевания новых рынков сбыта | N187: 2003 | O187: публицистика, нехудожественная | P187: статья | Q187: бизнес, коммерция, экономика, финансы | R187: «Бизнес-журнал» | S187: 2003.10.23 | T187: журнал | U187: омонимия снята | V187: Молодая гвардия. Искусство быстрого завоевания новых рынков сбыта 04. 11. 2003 [Владимир Ляпоров. Молодая гвардия. Искусство быстрого завоевания новых рынков сбыта (2003) // «Бизнес-журнал», 2003.10.23] [омонимия снята] | W187: =RAND() -> 0.43187761104697753 | X187: =IF(RC[-13]=R[-1]C[-13]," ",1) -> 1
A188: нинаджарг чивортеП йирЮ ворднаскелА Я | B188: ФР | C188: Я, Александров Юрий Петрович, гражданин | D188: РФ | E188: , | F188: родился 12 августа 1988 г | G188: РФ | I188: gen1 | J188: Автобиография (2006) | M188: Автобиография | N188: 2006 | O188: официально-деловая, нехудожественная | P188: автобиография | Q188: частная жизнь | S188: 2006 | T188: рукопись | U188: омонимия снята | V188: Я, Александров Юрий Петрович, гражданин РФ, родился 12 августа 1988 г. в г. Новочеркасске Ростовской области. [Автобиография (2006)] [омонимия снята] | W188: =RAND() -> 0.30022165220442831 | X188: =IF(RC[-13]=R[-1]C[-13]," ",1) -> 1
A189: елачан о еинешеР | B189: аксупыв | C189: Решение о начале | D189: выпуска | F189: видеокарт под собственной торговой маркой | G189: выпуск | I189: gen1 | J189: Вячеслав Соболев. Есть ли шансы у XGI // «Computerworld», 2004 | K189: Вячеслав Соболев | M189: Есть ли шансы у XGI | N189: 2004 | O189: публицистика, нехудожественная | P189: статья | Q189: бизнес, коммерция, экономика, финансы | R189: «Computerworld» | S189: 2004 | T189: журнал | U189: омонимия снята | V189: Решение о начале выпуска видеокарт под собственной торговой маркой: акт отчаяния или тонкий стратегический ход? [Вячеслав Соболев. Есть ли шансы у XGI // «Computerworld», 2004] [омонимия снята] | W189: =RAND() -> 9.0731247728148334E-2 | X189: =IF(RC[-13]=R[-1]C[-13]," ",1) -> 1
A190: еинавориицинИ | B190: яинерог | C190: Инициирование | D190: горения | F190: метано-воздушной смеси в сверхзвуковом потоке | G190: горение | I190: gen1 | J190: А. М. Старик, Н. С. Титова. Инициирование горения метано-воздушной смеси в сверхзвуковом потоке за ударной волной при возбуждении молекул O2 лазерным излучением // «Журнал технической физики», 2004 | K190: А. М. Старик, Н. С. Титова | M190: Инициирование горения метано-воздушной смеси в сверхзвуковом потоке за ударной волной при возбуждении молекул O2 лазерным излучением | N190: 2004 | O190: учебно-научная, нехудожественная | P190: аннотация | Q190: наука и технологии, физика | R190: «Журнал технической физики» | S190: 2004 | T190: журнал | U190: омонимия снята | V190: Инициирование горения метано-воздушной смеси в сверхзвуковом потоке за ударной волной при возбуждении молекул O 2 лазерным излучением [А. М. Старик, Н. С. Титова. Инициирование горения метано-воздушной смеси в сверхзвуковом потоке за ударной волной при возбуждении молекул O2 лазерным излучением // «Журнал технической физики», 2004] [омонимия снята] | W190: =RAND() -> 0.85422532208588176 | X190: =IF(RC[-13]=R[-1]C[-13]," ",1) -> 1
A191: йоксечитиломег акиманиД | B191: итсонвитка | C191: Динамика гемолитической | D191: активности | F191: комплемента при экспериментальной инфекции Эбола | G191: активность | I191: gen1 | J191: Н. М. Зубавичене, А. А. Чепурнов. Динамика гемолитической активности комплемента при экспериментальной инфекции Эбола (2004) // «Вопросы вирусологии», 2004.03.08 | K191: Н. М. Зубавичене, А. А. Чепурнов | M191: Динамика гемолитической активности комплемента при экспериментальной инфекции Эбола | N191: 2004 | O191: учебно-научная, нехудожественная | P191: статья | Q191: наука и технологии, здоровье и медицина | R191: «Вопросы вирусологии» | S191: 2004.03.08 | T191: журнал | U191: омонимия снята | V191: Динамика гемолитической активности комплемента при экспериментальной инфекции Эбола [Н. М. Зубавичене, А. А. Чепурнов. Динамика гемолитической активности комплемента при экспериментальной инфекции Эбола (2004) // «Вопросы вирусологии», 2004.03.08] [омонимия снята] | W191: =RAND() -> 1.9100735528553847E-2 | X191: =IF(RC[-13]=R[-1]C[-13]," ",1) -> 1
A192: 681 тсоР | B192: вортемитнас | C192: Рост 186 | D192: сантиметров | E192: , | F192: плотного телосложения, размер 52-54 | G192: сантиметр | I192: gen1 | J192: Любовь Дивнова. Помогите (2003) // «Криминальная хроника», 2003.07.08 | K192: Любовь Дивнова | M192: Помогите | N192: 2003 | O192: публицистика, нехудожественная | P192: информационное сообщение | Q192: криминал | R192: «Криминальная хроника» | S192: 2003.07.08 | T192: газета | U192: омонимия снята | V192: Рост 186 сантиметров, плотного телосложения, размер 52-54, цвет волос ― чёрный, стрижка короткая, был одет в военную форму темно-зеленого цвета. [Любовь Дивнова. Помогите (2003) // «Криминальная хроника», 2003.07.08] [омонимия снята] | W192: =RAND() -> 0.40957300298689847 | X192: =IF(RC[-13]=R[-1]C[-13]," ",1) -> 1
A193: ОГОНДОРАН АРТВАЗ И ЯНДОГЕС юьвретни | B193: ЯЛИБОМОТВА | C193: интервью СЕГОДНЯ И ЗАВТРА "НАРОДНОГО" | D193: АВТОМОБИЛЯ | F193: В ТОЛЬЯТТИ ПРИДУТ ИНВЕСТОРЫ… | G193: автомобиль | I193: gen1 | J193: Петр Меньших, Владимир Каданников. В Тольятти придут инвесторы… (2003) // «За рулем», 2003.05.15 | K193: Петр Меньших, Владимир Каданников | M193: В Тольятти придут инвесторы… | N193: 2003 | O193: публицистика, нехудожественная | P193: интервью | Q193: бизнес, коммерция, экономика, финансы | R193: «За рулем» | S193: 2003.05.15 | T193: журнал | U193: омонимия снята | V193: эксклюзивное интервью СЕГОДНЯ И ЗАВТРА "НАРОДНОГО" АВТОМОБИЛЯ В ТОЛЬЯТТИ ПРИДУТ ИНВЕСТОРЫ… [Петр Меньших, Владимир Каданников. В Тольятти придут инвесторы… (2003) // «За рулем», 2003.05.15] [омонимия снята] | W193: =RAND() -> 6.6484974998040403E-2 | X193: =IF(RC[-13]=R[-1]C[-13]," ",1) -> 1
A194: узетнис к дохдоп назакоП | B194: авозук | C194: Показан подход к синтезу | D194: кузова | F194: автомобиля с точки зрения пассивной | G194: кузов | I194: gen1 | J194: В. А. Овчинников. Применение генетических алгоритмов в задачах синтеза кузова автомобиля // «Информационные технологии», 2004 | K194: В. А. Овчинников | M194: Применение генетических алгоритмов в задачах синтеза кузова автомобиля | N194: 2004 | O194: учебно-научная, нехудожественная | P194: статья | Q194: наука и технологии, информатика | R194: «Информационные технологии» | S194: 2004 | T194: журнал | U194: омонимия снята | V194: Показан подход к синтезу кузова автомобиля с точки зрения пассивной безопасности. [В. А. Овчинников. Применение генетических алгоритмов в задачах синтеза кузова автомобиля // «Информационные технологии», 2004] [омонимия снята] | W194: =RAND() -> 0.69562282398614428 | X194: =IF(RC[-13]=R[-1]C[-13]," ",1) -> 1
A195: аз-зи луноту зургохуС нитнатсноК йикснамтеГ | B195: амротш | C195: Гетманский Константин. Сухогруз утонул из-за | D195: шторма | F195: Во вторник в Чёрном море | G195: шторм | I195: gen1 | J195: Константин Гетманский. Сухогруз утонул из-за шторма (2003) // «Известия», 2003.02.03 | K195: Константин Гетманский | M195: Сухогруз утонул из-за шторма | N195: 2003 | O195: публицистика, нехудожественная | P195: статья | Q195: криминал | R195: «Известия» | S195: 2003.02.03 | T195: газета | U195: омонимия снята | V195: Гетманский Константин. Сухогруз утонул из-за шторма Во вторник в Чёрном море продолжились поиски моряков российского сухогруза "Стрелец", который в понедельник утром затонул недалеко от Турции. [Константин Гетманский. Сухогруз утонул из-за шторма (2003) // «Известия», 2003.02.03] [омонимия снята] | W195: =RAND() -> 0.3456539780366813 | X195: =IF(RC[-13]=R[-1]C[-13]," ",1) -> 1
A196: учадзар лачан нитуП римидалВ горип | B196: итсалв | C196: пирог. Владимир Путин начал раздачу | D196: власти | F196: В четверг Госдума рассмотрит в | G196: власть | I196: gen1 | J196: Светлана Бабаева, Екатерина Григорьева. Слоеный пирог. Владимир Путин начал раздачу власти (2003) // «Известия», 2003.02.18 | K196: Светлана Бабаева, Екатерина Григорьева | M196: Слоеный пирог. Владимир Путин начал раздачу власти | N196: 2003 | O196: публицистика, нехудожественная | P196: статья | Q196: политика и общественная жизнь | R196: «Известия» | S196: 2003.02.18 | T196: газета | U196: омонимия снята | V196: Слоёный пирог. Владимир Путин начал раздачу власти В четверг Госдума рассмотрит в первом чтении «революционные», как считают многие политики, законопроекты об организации госвласти в регионах и местном самоуправлении (МСУ). [Светлана Бабаева, Екатерина Григорьева. Слоеный пирог. Владимир Путин начал раздачу власти (2003) // «Известия», 2003.02.18] [омонимия снята] | W196: =RAND() -> 0.54714551303929726 | X196: =IF(RC[-13]=R[-1]C[-13]," ",1) -> 1
A197: хыньлатсо то ьсалачилто ьнечо укьлоксоп | B197: йемес | C197: поскольку очень отличалась от остальных | D197: семей | F197: этого города. | G197: семья | I197: gen1 | J197: Александр Дорофеев. Эле-Фантик // «Мурзилка», 2003 | K197: Александр Дорофеев | M197: Эле-Фантик | N197: 2003 | O197: художественная | P197: рассказ | R197: «Мурзилка» | S197: 2003 | T197: журнал | U197: омонимия снята | V197: Даже счастливая семья, о которой речь, переживала неприятные минуты, поскольку очень отличалась от остальных семей этого города. [Александр Дорофеев. Эле-Фантик // «Мурзилка», 2003] [омонимия снята] | W197: =RAND() -> 0.78262057306575172 | X197: =IF(RC[-13]=R[-1]C[-13]," ",1) -> 1
A198: ротартсномеД рднаскелА никтаЛ | B198: итсевос | C198: Латкин Александр. Демонстратор | D198: совести | E198: . | F198: Знаменитому хакеру разрешили выходить в | G198: совесть | I198: gen1 | J198: Александр Латкин. Демонстратор совести. Знаменитому хакеру разрешили выходить в Интернет (2003) // «Известия», 2003.01.22 | K198: Александр Латкин | M198: Демонстратор совести. Знаменитому хакеру разрешили выходить в Интернет | N198: 2003 | O198: публицистика, нехудожественная | P198: статья | Q198: наука и технологии | R198: «Известия» | S198: 2003.01.22 | T198: газета | U198: омонимия снята | V198: Латкин Александр. Демонстратор совести. Знаменитому хакеру разрешили выходить в Интернет [Александр Латкин. Демонстратор совести. Знаменитому хакеру разрешили выходить в Интернет (2003) // «Известия», 2003.01.22] [омонимия снята] | W198: =RAND() -> 0.988499611161613 | X198: =IF(RC[-13]=R[-1]C[-13]," ",1) -> 1
A199: огонрялупопен икинорх еынрялупоП екимонокэ йововарп | B199: аноказ | C199: правовой экономике. Популярные хроники непопулярного | D199: закона | F199: 28 декабря 2002 г. Президент Российской Федерации В. В. Путин подписал Федеральный закон "О техническом регулировании". | G199: закон | I199: gen1 | J199: Павел Иванов. Ключ к правовой экономике. Популярные хроники непопулярного закона // «Воздушно-космическая оборона», 2003 | K199: Павел Иванов | M199: Ключ к правовой экономике. Популярные хроники непопулярного закона | N199: 2003 | O199: публицистика, нехудожественная | P199: статья | Q199: право | R199: «Воздушно-космическая оборона» | S199: 2003 | T199: журнал | U199: омонимия снята | V199: Ключ к правовой экономике. Популярные хроники непопулярного закона . . . " ". [Павел Иванов. Ключ к правовой экономике. Популярные хроники непопулярного закона // «Воздушно-космическая оборона», 2003] [омонимия снята] | W199: =RAND() -> 0.16855935265803579 | X199: =IF(RC[-13]=R[-1]C[-13]," ",1) -> 1
A200: аметсис яандораН авобуД яьлатаН | B200: яиненарх | C200: Наталья Дубова. "Народная" система | D200: хранения | F200: 06. 07. 2004 | G200: хранение | I200: gen1 | J200: Наталья Дубова. «Народная» система хранения // «Computerworld», 2004 | K200: Наталья Дубова | M200: «Народная» система хранения | N200: 2004 | O200: публицистика, нехудожественная | P200: статья | Q200: бизнес, коммерция, экономика, финансы | R200: «Computerworld» | S200: 2004 | T200: журнал | U200: омонимия снята | V200: Наталья Дубова. "Народная" система хранения 06. 07. 2004 [Наталья Дубова. «Народная» система хранения // «Computerworld», 2004] [омонимия снята] | W200: =RAND() -> 0.75282111135098306 | X200: =IF(RC[-13]=R[-1]C[-13]," ",1) -> 1
A201: ялД | B201: ФПН | C201: Для | D201: НПФ | F201: закон не писан № Частные фонды | G201: НПФ | I201: gen1 | J201: Наталия Биянова. Для НПФ закон не писан (2003) // «Газета», 2003.06.03 | K201: Наталия Биянова | M201: Для НПФ закон не писан | N201: 2003 | O201: публицистика, нехудожественная | P201: статья | Q201: политика и общественная жизнь | R201: «Газета» | S201: 2003.06.03 | T201: газета | U201: омонимия снята | V201: Для НПФ закон не писан № Частные фонды пойдут по стопам управляющих компаний № Не успело правительство допустить к пенсионной реформе частные управляющие компании, как забили тревогу НПФ. [Наталия Биянова. Для НПФ закон не писан (2003) // «Газета», 2003.06.03] [омонимия снята] | W201: =RAND() -> 0.67214653316303397 | X201: =IF(RC[-13]=R[-1]C[-13]," ",1) -> 1
A202: йиратнеммоК йиксвеалокиН Р В | B202: аголоскес | C202: В. Р. Николаевский. Комментарий | D202: сексолога | F202: • Женщины часто жалуются на то | G202: сексолог | I202: gen1 | J202: В. Р. Николаевский. Комментарий сексолога // «Даша», 2004 | K202: В. Р. Николаевский | M202: Комментарий сексолога | N202: 2004 | O202: публицистика, нехудожественная | P202: комментарий | Q202: частная жизнь | R202: «Даша» | S202: 2004 | T202: журнал | U202: омонимия снята | V202: В. Р. Николаевский. Комментарий сексолога • Женщины часто жалуются на то, что мужчины с самого начала отношений как можно скорее хотят перейти к телесной любви, а потом сами же мужчины возмущаются доступностью женщин, считая их легкомысленными и легкодоступными. [В. Р. Николаевский. Комментарий сексолога // «Даша», 2004] [омонимия снята] | W202: =RAND() -> 0.6359408197504659 | X202: =IF(RC[-13]=R[-1]C[-13]," ",1) -> 1
A203: хыньлетиварпси укиткарп юукстевос ьтунрев тюагалдерп | B203: тобар | C203: предлагают вернуть советскую практику исправительных | D203: работ | E203: . | G203: работа | I203: gen1 | J203: Андрей Гусев. Проституток накажут метлой (2003) // «Аргументы и факты», 2003.06.11 | K203: Андрей Гусев | M203: Проституток накажут метлой | N203: 2003 | O203: публицистика, нехудожественная | P203: комментарий | Q203: политика и общественная жизнь | R203: «Аргументы и факты» | S203: 2003.06.11 | T203: газета | U203: омонимия снята | V203: РОССИЙСКИЕ парламентарии предлагают вернуть советскую практику исправительных работ. [Андрей Гусев. Проституток накажут метлой (2003) // «Аргументы и факты», 2003.06.11] [омонимия снята] | W203: =RAND() -> 0.26067812827071613 | X203: =IF(RC[-13]=R[-1]C[-13]," ",1) -> 1
A204: зи алибыв отсорп аныс юярет | B204: иелок | C204: теряю сына, просто выбила из | D204: колеи | E204: ! | G204: колея | I204: gen1 | J204: Елена Павлова. Вместе мы эту пропасть одолеем! // «Даша», 2004 | K204: Елена Павлова | M204: Вместе мы эту пропасть одолеем! | N204: 2004 | O204: публицистика, нехудожественная | P204: статья | Q204: частная жизнь | R204: «Даша» | S204: 2004 | T204: журнал | U204: омонимия снята | V204: • Мысль о том, что теряю сына, просто выбила из колеи! [Елена Павлова. Вместе мы эту пропасть одолеем! // «Даша», 2004] [омонимия снята] | W204: =RAND() -> 0.3886949962127948 | X204: =IF(RC[-13]=R[-1]C[-13]," ",1) -> 1
A205: йоньланоицан итсоннебосО | B205: ыбьроб | C205: Особенности национальной | D205: борьбы | F205: с терроризмом Президент России убежден | G205: борьба | I205: gen1 | J205: Константин Катанян. Особенности национальной борьбы с терроризмом (2003) // «Время МН», 2003.08.05 | K205: Константин Катанян | L205: 1960 | M205: Особенности национальной борьбы с терроризмом | N205: 2003 | O205: публицистика, нехудожественная | P205: комментарий | Q205: политика и общественная жизнь | R205: «Время МН» | S205: 2003.08.05 | T205: газета | U205: омонимия снята | V205: Особенности национальной борьбы с терроризмом Президент России убежден, что совершению терактов способствует расхлябанность правоохранительных органов. [Константин Катанян. Особенности национальной борьбы с терроризмом (2003) // «Время МН», 2003.08.05] [омонимия снята] | W205: =RAND() -> 0.52196722497520764 | X205: =IF(RC[-13]=R[-1]C[-13]," ",1) -> 1
A206: огоратс ежиН | B206: адорог | C206: Ниже старого | D206: города | E206: , | F206: ближе к морю, новый район | G206: город | I206: gen1 | J206: Вадим Крейд. Георгий Иванов в Йере // «Звезда», 2003 | K206: Вадим Крейд | M206: Георгий Иванов в Йере | N206: 2003 | O206: учебно-научная, нехудожественная | P206: биография | Q206: искусство и культура | R206: «Звезда» | S206: 2003 | T206: журнал | U206: омонимия снята | V206: Ниже старого города, ближе к морю, новый район ― бульвары, светлых тонов виллы. [Вадим Крейд. Георгий Иванов в Йере // «Звезда», 2003] [омонимия снята] | W206: =RAND() -> 0.75985293698069367 | X206: =IF(RC[-13]=R[-1]C[-13]," ",1) -> 1
A207: еынсевонвар еынжомзов евд ынертомссаР | B207: иицаругифнок | C207: Рассмотрены две возможные равновесные | D207: конфигурации | F207: линейного вихря в трехмерной упорядоченной | G207: конфигурация | I207: gen1 | J207: М. А. Зеликман. Линейные вихри в трехмерной упорядоченной джозефсоновской среде // «Журнал технической физики», 2005 | K207: М. А. Зеликман | M207: Линейные вихри в трехмерной упорядоченной джозефсоновской среде | N207: 2005 | O207: учебно-научная, нехудожественная | P207: аннотация | Q207: наука и технологии, физика | R207: «Журнал технической физики» | S207: 2005 | T207: журнал | U207: омонимия снята | V207: Рассмотрены две возможные равновесные конфигурации линейного вихря в трехмерной упорядоченной джозефсоновской среде: а) центр вихря расположен в центре одной из ячеек, б) центр вихря расположен на одном из контактов. [М. А. Зеликман. Линейные вихри в трехмерной упорядоченной джозефсоновской среде // «Журнал технической физики», 2005] [омонимия снята] | W207: =RAND() -> 0.72381508731342825 | X207: =IF(RC[-13]=R[-1]C[-13]," ",1) -> 1
A208: с литсупс ыджандо матшьледнаМ чивеьлимЭ | B208: ыцинтсел | C208: Эмильевич Мандельштам однажды спустил с | D208: лестницы | F208: коллегу, пришедшего пожаловаться, что его | G208: лестница | I208: gen1 | J208: Антон Носик. Самиздат, Интернет и профессиональный читатель // «Отечественные записки», 2003 | K208: Антон Носик | L208: 1966 | M208: Самиздат, Интернет и профессиональный читатель | N208: 2003 | O208: публицистика, нехудожественная | P208: статья | Q208: искусство и культура | R208: «Отечественные записки» | S208: 2003 | T208: журнал | U208: омонимия снята | V208: Рассказывают, будто Осип Эмильевич Мандельштам однажды спустил с лестницы коллегу, пришедшего пожаловаться, что его стихи не печатают. [Антон Носик. Самиздат, Интернет и профессиональный читатель // «Отечественные записки», 2003] [омонимия снята] | W208: =RAND() -> 7.8258130392692915E-2 | X208: =IF(RC[-13]=R[-1]C[-13]," ",1) -> 1
A209: еинелсичыВ | B209: вортемарап | C209: Вычисление | D209: параметров | F209: асимметрии углового распределения и спиновой | G209: параметр | I209: gen1 | J209: А. Ю. Елизаров, И. И. Тупицын. Вычисление параметров асимметрии углового распределения и спиновой поляризации оже-электронов для атомов с открытыми оболочками // «Журнал технической физики», 2004 | K209: А. Ю. Елизаров, И. И. Тупицын | M209: Вычисление параметров асимметрии углового распределения и спиновой поляризации оже-электронов для атомов с открытыми оболочками | N209: 2004 | O209: учебно-научная, нехудожественная | P209: аннотация | Q209: наука и технологии, физика | R209: «Журнал технической физики» | S209: 2004 | T209: журнал | U209: омонимия снята | V209: Вычисление параметров асимметрии углового распределения и спиновой поляризации оже-электронов для атомов с открытыми оболочками [А. Ю. Елизаров, И. И. Тупицын. Вычисление параметров асимметрии углового распределения и спиновой поляризации оже-электронов для атомов с открытыми оболочками // «Журнал технической физики», 2004] [омонимия снята] | W209: =RAND() -> 0.74700318599682369 | X209: =IF(RC[-13]=R[-1]C[-13]," ",1) -> 1
A210: огоннелсичогонм у ясьтавосеретниоп алишеР | B210: яинелесан | C210: [Архангел Михаил, nick] Решила поинтересоваться у многочисленного | D210: населения | F210: форума, что легче, школа или | G210: население | I210: gen1 | J210: коллективный. Форум: Школа или универ где легче?)) (2006) | K210: коллективный | M210: Форум: Школа или универ где легче?)) | N210: 2006 | O210: электронная коммуникация , нехудожественная | P210: форум | Q210: образование, частная жизнь | S210: 2006 | T210: электронный текст | U210: омонимия снята | V210: [Архангел Михаил, nick] Решила поинтересоваться у многочисленного населения форума, что легче, школа или универ? [коллективный. Форум: Школа или универ где легче?)) (2006)] [омонимия снята] | W210: =RAND() -> 0.19460086304491875 | X210: =IF(RC[-13]=R[-1]C[-13]," ",1) -> 1
A211: ииняилв О | B211: яинеживд | C211: О влиянии | D211: движения | F211: газа внутри заряжённого пузырька в | G211: движение | I211: gen1 | J211: А. Н. Жаров, А. И. Григорьев. О влиянии движения газа внутри заряженного пузырька в жидкости на параметры его осцилляций // «Журнал технической физики», 2004 | K211: А. Н. Жаров, А. И. Григорьев | M211: О влиянии движения газа внутри заряженного пузырька в жидкости на параметры его осцилляций | N211: 2004 | O211: учебно-научная, нехудожественная | P211: аннотация | Q211: наука и технологии, физика | R211: «Журнал технической физики» | S211: 2004 | T211: журнал | U211: омонимия снята | V211: О влиянии движения газа внутри заряжённого пузырька в жидкости на параметры его осцилляций [А. Н. Жаров, А. И. Григорьев. О влиянии движения газа внутри заряженного пузырька в жидкости на параметры его осцилляций // «Журнал технической физики», 2004] [омонимия снята] | W211: =RAND() -> 0.744014797107868 | X211: =IF(RC[-13]=R[-1]C[-13]," ",1) -> 1
A212: оговолис амрофер яандеречО | B212: аколб | C212: Очередная реформа силового | D212: блока | F212: грозит обернуться ведомственной монополией на | G212: блок | I212: gen1 | J212: Александр Гольц. Кремлевский звездопад (2003) // «Еженедельный журнал», 2003.03.17 | K212: Александр Гольц | L212: 1955 | M212: Кремлевский звездопад | N212: 2003 | O212: публицистика, нехудожественная | P212: статья | Q212: политика и общественная жизнь | R212: «Еженедельный журнал» | S212: 2003.03.17 | T212: журнал | U212: омонимия снята | V212: Очередная реформа силового блока грозит обернуться ведомственной монополией на информацию. [Александр Гольц. Кремлевский звездопад (2003) // «Еженедельный журнал», 2003.03.17] [омонимия снята] | W212: =RAND() -> 0.94968574576718234 | X212: =IF(RC[-13]=R[-1]C[-13]," ",1) -> 1
A213: еелоб яащюачурду анелвяыв анитрак зар | B213: ыниволоп | C213: раз картина выявлена удручающая: более | D213: половины | F213: объектов отрасли к зиме не | G213: половина | I213: gen1 | J213: Леонид Барков. Вице-премьера позвали в трущобы (2003) // «Время МН», 2003.08.06 | K213: Леонид Барков | M213: Вице-премьера позвали в трущобы | N213: 2003 | O213: публицистика, нехудожественная | P213: отчет | Q213: политика и общественная жизнь | R213: «Время МН» | S213: 2003.08.06 | T213: газета | U213: омонимия снята | V213: В очередной раз картина выявлена удручающая: более половины объектов отрасли к зиме не готовы. [Леонид Барков. Вице-премьера позвали в трущобы (2003) // «Время МН», 2003.08.06] [омонимия снята] | W213: =RAND() -> 0.6843845841179611 | X213: =IF(RC[-13]=R[-1]C[-13]," ",1) -> 1
A214: огонм аз ытыркто илыб ырим | B214: тел | C214: миры были открыты за много | D214: лет | F214: до того, как это случилось | G214: год | I214: gen1 | J214: Эдуард Вирапян. Дарующая возвращение // «Знание -- сила», 2003 | K214: Эдуард Вирапян | M214: Дарующая возвращение | N214: 2003 | O214: публицистика, нехудожественная | P214: заметка | Q214: наука и технологии, история | R214: «Знание -- сила» | S214: 2003 | T214: журнал | U214: омонимия снята | V214: Пути в позжедоступные миры были открыты за много лет до того, как это случилось, и будут открываться ещё много раз и после того, когда все открытия завершатся. [Эдуард Вирапян. Дарующая возвращение // «Знание -- сила», 2003] [омонимия снята] | W214: =RAND() -> 0.35197415482483019 | X214: =IF(RC[-13]=R[-1]C[-13]," ",1) -> 1
A215: итсоннебосО | B215: яитивзар | C215: Особенности | D215: развития | F215: старших дошкольников при перинатальной патологии | G215: развитие | I215: gen1 | J215: Л. А. Захирина, Н. Ф. Бережная. Особенности развития старших дошкольников при перинатальной патологии ЦНС // «Вопросы психологии», 2004 | K215: Л. А. Захирина, Н. Ф. Бережная | M215: Особенности развития старших дошкольников при перинатальной патологии ЦНС | N215: 2004 | O215: учебно-научная, нехудожественная | P215: статья | Q215: наука и технологии, психология | R215: «Вопросы психологии» | S215: 2004 | T215: журнал | U215: омонимия снята | V215: Особенности развития старших дошкольников при перинатальной патологии ЦНС [Л. А. Захирина, Н. Ф. Бережная. Особенности развития старших дошкольников при перинатальной патологии ЦНС // «Вопросы психологии», 2004] [омонимия снята] | W215: =RAND() -> 0.85144606673893719 | X215: =IF(RC[-13]=R[-1]C[-13]," ",1) -> 1
A216: хяинадесаз о окьлокс еж окьлотс | B216: автсьлетиварп | C216: столько же, сколько о… заседаниях | D216: правительства | E216: . | G216: правительство | I216: gen1 | J216: Михаил Ламцов, Валерий Булдаков. Авторитетные собрания (2003) // «Аргументы и факты», 2003.01.29 | K216: Михаил Ламцов, Валерий Булдаков | M216: Авторитетные собрания | N216: 2003 | O216: публицистика, нехудожественная | P216: статья | Q216: политика и общественная жизнь | R216: «Аргументы и факты» | S216: 2003.01.29 | T216: газета | U216: омонимия снята | V216: О ВОРОВСКИХ сходках российский гражданин знает столько же, сколько о… заседаниях правительства. [Михаил Ламцов, Валерий Булдаков. Авторитетные собрания (2003) // «Аргументы и факты», 2003.01.29] [омонимия снята] | W216: =RAND() -> 0.16989309725192692 | X216: =IF(RC[-13]=R[-1]C[-13]," ",1) -> 1
A217: РТСИНИМ | B217: ЯИНЕНАРХООВАРДЗ | C217: МИНИСТР | D217: ЗДРАВООХРАНЕНИЯ | F217: ЭЛЬВИРА НЕЧАЕВА, ОКАЗЫВАЕТСЯ, ПОГОРЯЧИЛАСЬ, ЗАКРЫВ | G217: здравоохранение | I217: gen1 | J217: Ольга Муравская. Пойманное слово. (2003) // «Московский комсомолец» в Сыктывкаре, 2003.08.06 | K217: Ольга Муравская | M217: Пойманное слово. | N217: 2003 | O217: публицистика, нехудожественная | P217: статья | Q217: политика и общественная жизнь | R217: «Московский комсомолец» в Сыктывкаре | S217: 2003.08.06 | T217: газета | U217: омонимия снята | V217: МИНИСТР ЗДРАВООХРАНЕНИЯ ЭЛЬВИРА НЕЧАЕВА, ОКАЗЫВАЕТСЯ, ПОГОРЯЧИЛАСЬ, ЗАКРЫВ СЫКТЫВКАРЦАМ ДВЕРЬ В СТАЦИОНАРЫ. [Ольга Муравская. Пойманное слово. (2003) // «Московский комсомолец» в Сыктывкаре, 2003.08.06] [омонимия снята] | W217: =RAND() -> 0.87831629961032487 | X217: =IF(RC[-13]=R[-1]C[-13]," ",1) -> 1
A218: йонвалсоварп йокссуР аливарП | B218: ивкрец | C218: Правила Русской православной | D218: церкви | E218: , | F218: закреплённые в принятых в 2000 | G218: церковь | I218: gen1 | J218: Александр Верховский. Между паствой и электоратом (2003) // «Еженедельный журнал», 2003.04.08 | K218: Александр Верховский | M218: Между паствой и электоратом | N218: 2003 | O218: публицистика, нехудожественная | P218: статья | Q218: политика и общественная жизнь | R218: «Еженедельный журнал» | S218: 2003.04.08 | T218: журнал | U218: омонимия снята | V218: Правила Русской православной церкви, закреплённые в принятых в 2000 году "Основах социальной концепции", прямо запрещают участие клириков РПЦ в политике, во всяком случае ― в выборах. [Александр Верховский. Между паствой и электоратом (2003) // «Еженедельный журнал», 2003.04.08] [омонимия снята] | W218: =RAND() -> 0.69775342701887899 | X218: =IF(RC[-13]=R[-1]C[-13]," ",1) -> 1
A219: огончитапмис ывызирП | B219: афариж | C219: Призывы симпатичного | D219: жирафа | F219: с рекламных щитов: "Сходи в | G219: жираф | I219: gen1 | J219: О. Г. Баринов. Зоологический сад // «Первое сентября», 2003 | K219: О. Г. Баринов | M219: Зоологический сад | N219: 2003 | O219: публицистика, нехудожественная | P219: статья | Q219: досуг, зрелища и развлечения | R219: «Первое сентября» | S219: 2003 | T219: газета | U219: омонимия снята | V219: Призывы симпатичного жирафа с рекламных щитов: "Сходи в зоопарк" я не то чтобы игнорировал. [О. Г. Баринов. Зоологический сад // «Первое сентября», 2003] [омонимия снята] | W219: =RAND() -> 8.3761055950692942E-4 | X219: =IF(RC[-13]=R[-1]C[-13]," ",1) -> 1
A220: йечярог кинчотси недйаН | B220: ыдов | C220: Найден источник горячей | D220: воды | F220: Ирина ГНАТЮК Что нужно для счастья не избалованному вниманием властей и измученному разрухой ЖКХ среднестатистическому россиянину? | G220: вода | I220: gen1 | J220: Ирина Гнатюк. Найден источник горячей воды (2003) // «Богатей» (Саратов), 2003.05.22 | K220: Ирина Гнатюк | M220: Найден источник горячей воды | N220: 2003 | O220: публицистика, нехудожественная | P220: статья | Q220: политика и общественная жизнь | R220: «Богатей» (Саратов) | S220: 2003.05.22 | T220: газета | U220: омонимия снята | V220: Найден источник горячей воды Ирина ГНАТЮК ? [Ирина Гнатюк. Найден источник горячей воды (2003) // «Богатей» (Саратов), 2003.05.22] [омонимия снята] | W220: =RAND() -> 0.2308372528238728 | X220: =IF(RC[-13]=R[-1]C[-13]," ",1) -> 1
A221: ьлетиремзИ АКПУКОП ЯАНЧАДУ | B221: янвору | C221: УДАЧНАЯ ПОКУПКА Измеритель | D221: уровня | F221: воды. Блеск для листьев. | G221: уровень | I221: gen1 | J221: Татьяна Булгакова. Цветочная «косметичка» (2003) // «Сад своими руками», 2003.01.15 | K221: Татьяна Булгакова | M221: Цветочная «косметичка» | N221: 2003 | O221: публицистика, нехудожественная | P221: статья | Q221: здоровье и медицина | R221: «Сад своими руками» | S221: 2003.01.15 | T221: газета | U221: омонимия снята | V221: УДАЧНАЯ ПОКУПКА Измеритель уровня воды. Блеск для листьев. [Татьяна Булгакова. Цветочная «косметичка» (2003) // «Сад своими руками», 2003.01.15] [омонимия снята] | W221: =RAND() -> 0.59653781976723652 | X221: =IF(RC[-13]=R[-1]C[-13]," ",1) -> 1
A222: од йоктерубат вореноиснеп либ котсордоп | B222: итремс | C222: подросток бил пенсионеров табуреткой до | D222: смерти | G222: смерть | I222: gen1 | J222: Александр Богомолов. Прирожденный убийца. 17-летний подросток бил пенсионеров табуреткой до смерти (2003) // «Известия», 2003.02.17 | K222: Александр Богомолов | M222: Прирожденный убийца. 17-летний подросток бил пенсионеров табуреткой до смерти | N222: 2003 | O222: публицистика, нехудожественная | P222: заметка | Q222: криминал | R222: «Известия» | S222: 2003.02.17 | T222: газета | U222: омонимия снята | V222: 17-летний подросток бил пенсионеров табуреткой до смерти [Александр Богомолов. Прирожденный убийца. 17-летний подросток бил пенсионеров табуреткой до смерти (2003) // «Известия», 2003.02.17] [омонимия снята] | W222: =RAND() -> 0.60310972333444224 | X222: =IF(RC[-13]=#REF!," ",1) -> #REF!
A223: огеншенын ецнок в ежу ястяотсос | B223: адог | C223: состоятся уже в конце нынешнего | D223: года | E223: . " | G223: год | I223: gen1 | J223: Александр Градов. «Медведи» залили партийный фундамент (2003) // «Аргументы и факты», 2003.01.22 | K223: Александр Градов | M223: «Медведи» залили партийный фундамент | N223: 2003 | O223: публицистика, нехудожественная | P223: интервью | Q223: политика и общественная жизнь | R223: «Аргументы и факты» | S223: 2003.01.22 | T223: газета | U223: омонимия снята | V223: ПАРЛАМЕНТСКИЕ выборы состоятся уже в конце нынешнего года. " [Александр Градов. «Медведи» залили партийный фундамент (2003) // «Аргументы и факты», 2003.01.22] [омонимия снята] | W223: =RAND() -> 0.35297763633137968 | X223: =IF(RC[-13]=R[-1]C[-13]," ",1) -> 1
A224: зИ вокалуК валсидалВ | B224: ацнок | C224: Владислав Кулаков. Из | D224: конца | F224: в конец 06. 07. 2004 | G224: конец | I224: gen1 | J224: Владислав Кулаков. Из конца в конец // «Computerworld», 2004 | K224: Владислав Кулаков | M224: Из конца в конец | N224: 2004 | O224: публицистика, нехудожественная | P224: статья | Q224: бизнес, коммерция, экономика, финансы | R224: «Computerworld» | S224: 2004 | T224: журнал | U224: омонимия снята | V224: Владислав Кулаков. Из конца в конец 06. 07. 2004 [Владислав Кулаков. Из конца в конец // «Computerworld», 2004] [омонимия снята] | W224: =RAND() -> 0.53304164463607617 | X224: =IF(RC[-13]=R[-1]C[-13]," ",1) -> 1
A225: акробс яаньлетяотсомаС | B225: вореврес | C225: Самостоятельная сборка | D225: серверов | F225: на основе Itanium 2 подходит | G225: сервер | I225: gen1 | J225: Михаил Кузьминский. Водопады Supermicro // «Computerworld», 2004 | K225: Михаил Кузьминский | M225: Водопады Supermicro | N225: 2004 | O225: публицистика, нехудожественная | P225: статья | Q225: производство | R225: «Computerworld» | S225: 2004 | T225: журнал | U225: омонимия снята | V225: Самостоятельная сборка серверов на основе Itanium 2 подходит не всем, но, по крайней мере, она становится возможной [Михаил Кузьминский. Водопады Supermicro // «Computerworld», 2004] [омонимия снята] | W225: =RAND() -> 0.46235307593554165 | X225: =IF(RC[-13]=R[-1]C[-13]," ",1) -> 1
A226: еинаминв ебес к илакелвирп адгесв | B226: йедюл | C226: всегда привлекали к себе внимание | D226: людей | F226: и как красивоцветущие растения, и | G226: люди | I226: gen1 | J226: С. А. Курганская. Акониты // «Первое сентября», 2003 | K226: С. А. Курганская | M226: Акониты | N226: 2003 | O226: учебно-научная, нехудожественная | P226: статья | Q226: наука и технологии, биология | R226: «Первое сентября» | S226: 2003 | T226: газета | U226: омонимия снята | V226: Акониты всегда привлекали к себе внимание людей и как красивоцветущие растения, и как лекарственные, содержащие сильнодействующие, а нередко и очень ядовитые вещества. [С. А. Курганская. Акониты // «Первое сентября», 2003] [омонимия снята] | W226: =RAND() -> 6.9185104284134491E-2 | X226: =IF(RC[-13]=R[-1]C[-13]," ",1) -> 1
A227: елсоп юувреп илеворп воназяР радьлЭ | B227: яинечурв | C227: Эльдар Рязанов провели первую после | D227: вручения | E227: " | F227: Золотого орла" пресс-конференцию конкурирующей структуры | G227: вручение | I227: gen1 | J227: Мария Кувшинова. «Ника» отступает, но не сдается. Старейшая киноакадемия объявила о своих планах (2003) // «Известия», 2003.02.25 | K227: Мария Кувшинова | M227: «Ника» отступает, но не сдается. Старейшая киноакадемия объявила о своих планах | N227: 2003 | O227: публицистика, нехудожественная | P227: заметка | Q227: искусство и культура | R227: «Известия» | S227: 2003.02.25 | T227: газета | U227: омонимия снята | V227: Юлий Гусман и Эльдар Рязанов провели первую после вручения "Золотого орла" пресс-конференцию конкурирующей структуры ― первой российской кинопремии "Ника". [Мария Кувшинова. «Ника» отступает, но не сдается. Старейшая киноакадемия объявила о своих планах (2003) // «Известия», 2003.02.25] [омонимия снята] | W227: =RAND() -> 0.75728357071824881 | X227: =IF(RC[-13]=#REF!," ",1) -> #REF!
A228: алокШ | B228: яинавижыв | C228: Школа | D228: выживания | F228: Ирина Мельникова, Андрей Замахин (фото | G228: выживание | I228: gen1 | J228: Ирина Мельникова. Школа выживания (2003) // «Итоги», 2003.02.11 | K228: Ирина Мельникова | M228: Школа выживания | N228: 2003 | O228: публицистика, нехудожественная | P228: статья | Q228: политика и общественная жизнь | R228: «Итоги» | S228: 2003.02.11 | T228: журнал | U228: омонимия снята | V228: Школа выживания Ирина Мельникова, Андрей Замахин (фото) [Ирина Мельникова. Школа выживания (2003) // «Итоги», 2003.02.11] [омонимия снята] | W228: =RAND() -> 0.49350751565300677 | X228: =IF(RC[-13]=R[-1]C[-13]," ",1) -> 1
A229: хыннёлиму ароП | B229: йинеджуссар | C229: Пора умилённых | D229: рассуждений | F229: об информационных технологиях в образовании | G229: рассуждение | I229: gen1 | J229: Михаил Арапов. Когда текст обретает смысл // «Знание -- сила», 2003 | K229: Михаил Арапов | L229: 1939 | M229: Когда текст обретает смысл | N229: 2003 | O229: учебно-научная, нехудожественная | P229: статья | Q229: наука и технологии, образование | R229: «Знание -- сила» | S229: 2003 | T229: журнал | U229: омонимия снята | V229: Пора умилённых рассуждений об информационных технологиях в образовании прошла безвозвратно. [Михаил Арапов. Когда текст обретает смысл // «Знание -- сила», 2003] [омонимия снята] | W229: =RAND() -> 0.44062081876385573 | X229: =IF(RC[-13]=R[-1]C[-13]," ",1) -> 1
A230: зеб яьмеС | B230: акнёбер | C230: Семья без | D230: ребёнка | F230: счастливой быть не может! | G230: ребенок | I230: gen1 | J230: Мария Давыдова. Кто в доме хозяин? (2003) // «100% здоровья», 2003.01.15 | K230: Мария Давыдова | M230: Кто в доме хозяин? | N230: 2003 | O230: публицистика, нехудожественная | P230: статья | Q230: частная жизнь | R230: «100% здоровья» | S230: 2003.01.15 | T230: журнал | U230: омонимия снята | V230: Семья без ребёнка счастливой быть не может! [Мария Давыдова. Кто в доме хозяин? (2003) // «100% здоровья», 2003.01.15] [омонимия снята] | W230: =RAND() -> 0.39445082561356515 | X230: =IF(RC[-13]=R[-1]C[-13]," ",1) -> 1
A231: огеншаречв ос отЭ огок ан | B231: янд | C231: на кого Это со вчерашнего | D231: дня | F231: статус [Герда, nick] Ааа! | G231: день | I231: gen1 | J231: Переписка в icq между agd-ardin и Герда (2008.03.17) | M231: Переписка в icq между agd-ardin и Герда | N231: 2008.03.17 | O231: электронная коммуникация , нехудожественная | P231: интернет-пейджер | Q231: частная жизнь | T231: электронный текст | U231: омонимия снята | V231: [agd-ardin, nick] Сегодня ни на кого Это со вчерашнего дня статус [Герда, nick] Ааа! [Переписка в icq между agd-ardin и Герда (2008.03.17)] [омонимия снята] | W231: =RAND() -> 6.313491986113029E-2 | X231: =IF(RC[-13]=R[-1]C[-13]," ",1) -> 1

Sheet: сравнение по годам
B3: Количество по полю Created | C3: Названия столбцов
B4: Названия строк | C4: 1769 | D4: 1790 | E4: 1792 | F4: 1800 | G4: 1811-1812 | H4: 1828 | I4: 1829 | J4: 1830-1835 | K4: 1833 | L4: 1838 | M4: 1839-1841 | N4: 1842 | O4: 1843 | P4: 1846 | Q4: 1847 | R4: 1849 | S4: 1854 | T4: 1855 | U4: 1858 | V4: 1860 | W4: 1862 | X4: 1863 | Y4: 1880 | Z4: 1881-1883 | AA4: 1891 | AB4: 1892 | AC4: 1898 | AD4: 1901 | AE4: 1905 | AF4: 1906 | AG4: 1909 | AH4: 1910 | AI4: 1910-1914 | AJ4: 1911 | AK4: 1912 | AL4: 1913 | AM4: 1915 | AN4: 1921 | AO4: 1921-1925 | AP4: 1923 | AQ4: 1923-1928 | AR4: 1924 | AS4: 1926 | AT4: 1927 | AU4: 1928 | AV4: 1930-1950 | AW4: 1932 | AX4: 1933 | AY4: 1936 | AZ4: 1939 | BA4: 1942-1943 | BB4: 1944 | BC4: 1946 | BD4: 1954-1961 | BE4: 1955-1963 | BF4: 1960 | BG4: 1962 | BH4: 1966 | BI4: 1970-1972 | BJ4: 1973 | BK4: 1974-1984 | BL4: 1975-1977 | BM4: 1976 | BN4: 1979 | BO4: 1981 | BP4: 1983 | BQ4: 1987 | BR4: 1996 | BS4: 1998 | BT4: 1999 | BU4: 2000 | BV4: 2001 | BW4: 2002 | BX4: 2003 | BY4: 2004 | BZ4: 2005 | CA4: 2006 | CB4: 2007.12.21 | CC4: 2008.03.17 | CD4: 2014 | CE4: 2015 | CF4: 2015.10.06 | CG4: 2015.10.30 | CH4: 2015.11.06 | CI4: 2015.11.09 | CJ4: (пусто) | CK4: Общий итог
B5: gen1 | BX5: 44 | BY5: 19 | BZ5: 1 | CA5: 2 | CC5: 1 | CK5: 67
B6: gen2 | C6: 1 | D6: 1 | E6: 1 | F6: 1 | G6: 1 | H6: 1 | I6: 1 | J6: 1 | K6: 1 | L6: 1 | M6: 1 | N6: 1 | O6: 1 | P6: 2 | Q6: 1 | R6: 1 | S6: 1 | T6: 1 | U6: 2 | V6: 1 | W6: 2 | X6: 1 | Y6: 1 | Z6: 1 | AA6: 2 | AB6: 1 | AC6: 1 | AD6: 2 | AE6: 1 | AF6: 1 | AG6: 2 | AH6: 1 | AI6: 1 | AJ6: 2 | AK6: 1 | AL6: 1 | AM6: 1 | AN6: 1 | AO6: 1 | AP6: 3 | AQ6: 1 | AR6: 3 | AS6: 1 | AT6: 1 | AU6: 1 | AV6: 1 | AW6: 1 | AX6: 1 | AY6: 1 | AZ6: 2 | BA6: 1 | BB6: 1 | BC6: 1 | BD6: 1 | BE6: 1 | BF6: 1 | BG6: 1 | BH6: 1 | BI6: 1 | BJ6: 1 | BK6: 1 | BL6: 2 | BM6: 2 | BN6: 1 | BO6: 1 | BP6: 1 | BQ6: 3 | BR6: 2 | BS6: 1 | BT6: 2 | BU6: 2 | BV6: 2 | BW6: 3 | BY6: 1 | CB6: 1 | CD6: 10 | CE6: 7 | CF6: 1 | CG6: 1 | CH6: 1 | CI6: 1 | CK6: 118
B7: (пусто)
B8: Общий итог | C8: 1 | D8: 1 | E8: 1 | F8: 1 | G8: 1 | H8: 1 | I8: 1 | J8: 1 | K8: 1 | L8: 1 | M8: 1 | N8: 1 | O8: 1 | P8: 2 | Q8: 1 | R8: 1 | S8: 1 | T8: 1 | U8: 2 | V8: 1 | W8: 2 | X8: 1 | Y8: 1 | Z8: 1 | AA8: 2 | AB8: 1 | AC8: 1 | AD8: 2 | AE8: 1 | AF8: 1 | AG8: 2 | AH8: 1 | AI8: 1 | AJ8: 2 | AK8: 1 | AL8: 1 | AM8: 1 | AN8: 1 | AO8: 1 | AP8: 3 | AQ8: 1 | AR8: 3 | AS8: 1 | AT8: 1 | AU8: 1 | AV8: 1 | AW8: 1 | AX8: 1 | AY8: 1 | AZ8: 2 | BA8: 1 | BB8: 1 | BC8: 1 | BD8: 1 | BE8: 1 | BF8: 1 | BG8: 1 | BH8: 1 | BI8: 1 | BJ8: 1 | BK8: 1 | BL8: 2 | BM8: 2 | BN8: 1 | BO8: 1 | BP8: 1 | BQ8: 3 | BR8: 2 | BS8: 1 | BT8: 2 | BU8: 2 | BV8: 2 | BW8: 3 | BX8: 44 | BY8: 20 | BZ8: 1 | CA8: 2 | CB8: 1 | CC8: 1 | CD8: 10 | CE8: 7 | CF8: 1 | CG8: 1 | CH8: 1 | CI8: 1 | CK8: 185

Sheet: сравнение по лексемам
A1: Количество по полю Лексема | B1: Названия столбцов
A2: Названия строк | B2: март | C2: сентябрь | D2: год | E2: CRM-система | F2: автомобиль | G2: активность | H2: барство | I2: блок | J2: бой | K2: борьба | L2: бульон | M2: верх | N2: вес | O2: вздор | P2: вид | Q2: власть | R2: вода | S2: вручение | T2: выживание | U2: выпуск | V2: глаз | W2: год | X2: год | Y2: голод | Z2: горение | AA2: город | AB2: государство | AC2: движение | AD2: день | AE2: дом | AF2: Дон | AG2: дух | AH2: жираф | AI2: завоевание | AJ2: задача | AK2: закон | AL2: заместитель | AM2: записка | AN2: зарплата | AO2: здоровье | AP2: здравоохранение | AQ2: испуг | AR2: испытание | AS2: квас | AT2: керосин | AU2: колея | AV2: Комитет | AW2: компания | AX2: конец | AY2: конфигурация | AZ2: коньяк | BA2: корм | BB2: корь | BC2: КПРФ | BD2: край | BE2: крик | BF2: кузов | BG2: кулинар | BH2: лёд | BI2: лес | BJ2: лестница | BK2: лёт | BL2: ликёр | BM2: лук | BN2: люди | BO2: мах | BP2: маятник | BQ2: мёд | BR2: мех | BS2: механизм | BT2: милиция | BU2: модель | BV2: молибден | BW2: мороз | BX2: народ | BY2: население | BZ2: начальник | CA2: НПФ | CB2: обитатель | CC2: одеколончик | CD2: олигарх | CE2: ООН | CF2: отбой | CG2: параметр | CH2: партия | CI2: пират | CJ2: плазма | CK2: пол | CL2: полк | CM2: половина | CN2: помин | CO2: порох | CP2: порше | CQ2: порядок | CR2: правительство | CS2: праздник | CT2: представитель | CU2: президент | CV2: преобразование | CW2: пресс-конференция | CX2: прием | CY2: присяжные | CZ2: программа | DA2: пространство | DB2: психология | DC2: Путин | DD2: работа | DE2: раз | DF2: развитие | DG2: рассуждение | DH2: ребенок | DI2: редактор | DJ2: решение | DK2: род | DL2: рождение | DM2: ром | DN2: РФ | DO2: сантиметр | DP2: сахар | DQ2: свет | DR2: сексолог | DS2: семья | DT2: сервер | DU2: смерть | DV2: смех | DW2: снег | DX2: совесть | DY2: сомнение | DZ2: сорт | EA2: срок | EB2: страх | EC2: суп | ED2: счёт | EE2: темп | EF2: товар | EG2: толк | EH2: тореадор | EI2: трава | EJ2: тысяча | EK2: удерж | EL2: улица | EM2: уровень | EN2: устаток | EO2: уход | EP2: ход | EQ2: холод | ER2: хранение | ES2: ценность | ET2: цепь | EU2: церковь | EV2: цирк | EW2: чай | EX2: час | EY2: число | EZ2: чифирка | FA2: шаг | FB2: штаб | FC2: шторм | FD2: яд | FE2: (пусто) | FF2: Общий итог
A3: gen1 | B3: 1 | C3: 1 | D3: 1 | E3: 1 | F3: 1 | G3: 1 | H3: 1 | I3: 1 | K3: 1 | Q3: 1 | R3: 1 | S3: 1 | T3: 1 | U3: 1 | W3: 1 | X3: 2 | Z3: 2 | AA3: 1 | AB3: 1 | AC3: 1 | AD3: 1 | AH3: 1 | AI3: 1 | AJ3: 2 | AK3: 1 | AL3: 1 | AM3: 1 | AN3: 1 | AO3: 1 | AP3: 1 | AR3: 2 | AT3: 1 | AU3: 1 | AV3: 1 | AW3: 1 | AX3: 1 | AY3: 1 | BB3: 1 | BC3: 1 | BF3: 1 | BG3: 1 | BJ3: 1 | BN3: 1 | BP3: 1 | BS3: 1 | BT3: 1 | BU3: 1 | BV3: 1 | BY3: 1 | BZ3: 2 | CA3: 1 | CB3: 1 | CD3: 1 | CE3: 1 | CG3: 1 | CH3: 2 | CI3: 1 | CJ3: 1 | CM3: 1 | CP3: 1 | CR3: 1 | CS3: 1 | CT3: 1 | CU3: 1 | CV3: 1 | CW3: 1 | CX3: 1 | CY3: 1 | CZ3: 1 | DA3: 1 | DB3: 1 | DC3: 2 | DD3: 2 | DF3: 2 | DG3: 1 | DH3: 1 | DI3: 1 | DJ3: 2 | DL3: 1 | DN3: 1 | DO3: 1 | DR3: 1 | DS3: 1 | DT3: 1 | DU3: 1 | DX3: 2 | DY3: 1 | DZ3: 1 | EH3: 1 | EI3: 1 | EJ3: 2 | EL3: 1 | EM3: 1 | EO3: 1 | ER3: 1 | ES3: 1 | ET3: 1 | EU3: 1 | EV3: 1 | EY3: 1 | FB3: 1 | FC3: 1 | FF3: 114
A4: gen2 | J4: 1 | L4: 1 | M4: 2 | N4: 1 | O4: 1 | P4: 10 | V4: 1 | W4: 12 | Y4: 1 | AE4: 4 | AF4: 1 | AG4: 1 | AQ4: 1 | AS4: 1 | AZ4: 2 | BA4: 1 | BD4: 2 | BE4: 1 | BH4: 1 | BI4: 2 | BK4: 1 | BL4: 1 | BM4: 1 | BO4: 1 | BQ4: 2 | BR4: 1 | BW4: 1 | BX4: 5 | CC4: 1 | CF4: 2 | CK4: 3 | CL4: 1 | CN4: 2 | CO4: 2 | CQ4: 1 | DE4: 7 | DK4: 3 | DM4: 1 | DP4: 2 | DQ4: 1 | DV4: 3 | DW4: 1 | EA4: 1 | EB4: 1 | EC4: 1 | ED4: 1 | EE4: 1 | EF4: 1 | EG4: 3 | EK4: 1 | EN4: 1 | EP4: 2 | EQ4: 1 | EW4: 5 | EX4: 2 | EZ4: 1 | FA4: 1 | FD4: 3 | FF4: 116
A5: (пусто)
A6: Общий итог | B6: 1 | C6: 1 | D6: 1 | E6: 1 | F6: 1 | G6: 1 | H6: 1 | I6: 1 | J6: 1 | K6: 1 | L6: 1 | M6: 2 | N6: 1 | O6: 1 | P6: 10 | Q6: 1 | R6: 1 | S6: 1 | T6: 1 | U6: 1 | V6: 1 | W6: 13 | X6: 2 | Y6: 1 | Z6: 2 | AA6: 1 | AB6: 1 | AC6: 1 | AD6: 1 | AE6: 4 | AF6: 1 | AG6: 1 | AH6: 1 | AI6: 1 | AJ6: 2 | AK6: 1 | AL6: 1 | AM6: 1 | AN6: 1 | AO6: 1 | AP6: 1 | AQ6: 1 | AR6: 2 | AS6: 1 | AT6: 1 | AU6: 1 | AV6: 1 | AW6: 1 | AX6: 1 | AY6: 1 | AZ6: 2 | BA6: 1 | BB6: 1 | BC6: 1 | BD6: 2 | BE6: 1 | BF6: 1 | BG6: 1 | BH6: 1 | BI6: 2 | BJ6: 1 | BK6: 1 | BL6: 1 | BM6: 1 | BN6: 1 | BO6: 1 | BP6: 1 | BQ6: 2 | BR6: 1 | BS6: 1 | BT6: 1 | BU6: 1 | BV6: 1 | BW6: 1 | BX6: 5 | BY6: 1 | BZ6: 2 | CA6: 1 | CB6: 1 | CC6: 1 | CD6: 1 | CE6: 1 | CF6: 2 | CG6: 1 | CH6: 2 | CI6: 1 | CJ6: 1 | CK6: 3 | CL6: 1 | CM6: 1 | CN6: 2 | CO6: 2 | CP6: 1 | CQ6: 1 | CR6: 1 | CS6: 1 | CT6: 1 | CU6: 1 | CV6: 1 | CW6: 1 | CX6: 1 | CY6: 1 | CZ6: 1 | DA6: 1 | DB6: 1 | DC6: 2 | DD6: 2 | DE6: 7 | DF6: 2 | DG6: 1 | DH6: 1 | DI6: 1 | DJ6: 2 | DK6: 3 | DL6: 1 | DM6: 1 | DN6: 1 | DO6: 1 | DP6: 2 | DQ6: 1 | DR6: 1 | DS6: 1 | DT6: 1 | DU6: 1 | DV6: 3 | DW6: 1 | DX6: 2 | DY6: 1 | DZ6: 1 | EA6: 1 | EB6: 1 | EC6: 1 | ED6: 1 | EE6: 1 | EF6: 1 | EG6: 3 | EH6: 1 | EI6: 1 | EJ6: 2 | EK6: 1 | EL6: 1 | EM6: 1 | EN6: 1 | EO6: 1 | EP6: 2 | EQ6: 1 | ER6: 1 | ES6: 1 | ET6: 1 | EU6: 1 | EV6: 1 | EW6: 5 | EX6: 2 | EY6: 1 | EZ6: 1 | FA6: 1 | FB6: 1 | FC6: 1 | FD6: 3 | FF6: 230